21:53:15.831404 IP6 NotebookLab.mdns > ff02::fb.mdns: 0 [2q] [2n] ANY (QM)? a.b.3.2.2.0.e.f.f.f.8.1.b.d.c.8.0.0.0.0.0.0.0.0.0.0.0.0.0.8.e.f.ip6.arpa. ANY (QM)? NotebookLab-19519.local. (161)
21:53:15.894360 IP6 NotebookLab > ff02::16: HBH ICMP6, multicast listener report v2, 1 group record(s), length 28
21:53:15.990410 IP6 NotebookLab > ff02::16: HBH ICMP6, multicast listener report v2, 2 group record(s), length 48
21:53:16.081422 IP6 NotebookLab.mdns > ff02::fb.mdns: 0 [2q] [2n] ANY (QM)? a.b.3.2.2.0.e.f.f.f.8.1.b.d.c.8.0.0.0.0.0.0.0.0.0.0.0.0.0.8.e.f.ip6.arpa. ANY (QM)? NotebookLab-19519.local. (161)
21:53:16.331740 IP6 NotebookLab.mdns > ff02::fb.mdns: 0 [2q] [2n] ANY (QM)? a.b.3.2.2.0.e.f.f.f.8.1.b.d.c.8.0.0.0.0.0.0.0.0.0.0.0.0.0.8.e.f.ip6.arpa. ANY (QM)? NotebookLab-19519.local. (161)
21:53:16.532288 IP6 NotebookLab.mdns > ff02::fb.mdns: 0*- [0q] 2/0/0 (Cache flush) PTR NotebookLab-19519.local., (Cache flush) AAAA fe80::8cdb:18ff:fe02:23ba (149)
21:53:16.804311 IP6 NotebookLab.mdns > ff02::fb.mdns: 0 [2q] PTR (QM)? _ipps._tcp.local. PTR (QM)? _ipp._tcp.local. (45)
21:53:17.780791 IP6 NotebookLab.mdns > ff02::fb.mdns: 0*- [0q] 2/0/0 (Cache flush) PTR NotebookLab-19519.local., (Cache flush) AAAA fe80::8cdb:18ff:fe02:23ba (149)
21:53:18.804641 IP6 NotebookLab.mdns > ff02::fb.mdns: 0 [2q] PTR (QM)? _ipps._tcp.local. PTR (QM)? _ipp._tcp.local. (45)
21:53:20.029902 IP6 NotebookLab.mdns > ff02::fb.mdns: 0*- [0q] 2/0/0 (Cache flush) PTR NotebookLab-19519.local., (Cache flush) AAAA fe80::8cdb:18ff:fe02:23ba (149)
21:53:20.118394 IP6 NotebookLab > ip6-allrouters: ICMP6, router solicitation, length 16
21:53:22.805207 IP6 NotebookLab.mdns > ff02::fb.mdns: 0 [2q] PTR (QM)? _ipps._tcp.local. PTR (QM)? _ipp._tcp.local. (45)
21:53:26.491538 IP6 NotebookLab.mdns > ff02::fb.mdns: 0*- [0q] 2/0/0 (Cache flush) PTR NotebookLab-19519.local., (Cache flush) AAAA fe80::8cdb:18ff:fe02:23ba (149)
21:53:26.491776 IP6 NotebookLab.mdns > ff02::fb.mdns: 0*- [0q] 2/0/0 (Cache flush) PTR NotebookLab-19519.local., (Cache flush) AAAA fe80::42:1bff:fe92:b8ad (149)
21:53:26.491837 IP NotebookLab.mdns > 224.0.0.251.mdns: 0*- [0q] 4/0/0 (Cache flush) PTR NotebookLab-19519.local., (Cache flush) A 10.0.1.1, (Cache flush) PTR NotebookLab-19519.local., (Cache flush) AAAA fe80::42:1bff:fe92:b8ad (196)
21:53:26.713873 IP6 NotebookLab.mdns > ff02::fb.mdns: 0 [2q] [2n] ANY (QM)? a.b.3.2.2.0.e.f.f.f.8.1.b.d.c.8.0.0.0.0.0.0.0.0.0.0.0.0.0.8.e.f.ip6.arpa. ANY (QM)? NotebookLab-19520.local. (161)
21:53:26.714083 IP6 NotebookLab.mdns > ff02::fb.mdns: 0 [2q] [2n] ANY (QM)? d.a.8.b.2.9.e.f.f.f.b.1.2.4.0.0.0.0.0.0.0.0.0.0.0.0.0.0.0.8.e.f.ip6.arpa. ANY (QM)? NotebookLab-19520.local. (161)
21:53:26.714126 IP NotebookLab.mdns > 224.0.0.251.mdns: 0 [3q] [4n] ANY (QM)? d.a.8.b.2.9.e.f.f.f.b.1.2.4.0.0.0.0.0.0.0.0.0.0.0.0.0.0.0.8.e.f.ip6.arpa. ANY (QM)? NotebookLab-19520.local. ANY (QM)? 1.1.0.10.in-addr.arpa. (214)
21:53:26.964439 IP6 NotebookLab.mdns > ff02::fb.mdns: 0 [2q] [2n] ANY (QM)? a.b.3.2.2.0.e.f.f.f.8.1.b.d.c.8.0.0.0.0.0.0.0.0.0.0.0.0.0.8.e.f.ip6.arpa. ANY (QM)? NotebookLab-19520.local. (161)
21:53:26.964659 IP6 NotebookLab.mdns > ff02::fb.mdns: 0 [2q] [2n] ANY (QM)? d.a.8.b.2.9.e.f.f.f.b.1.2.4.0.0.0.0.0.0.0.0.0.0.0.0.0.0.0.8.e.f.ip6.arpa. ANY (QM)? NotebookLab-19520.local. (161)
21:53:26.964701 IP NotebookLab.mdns > 224.0.0.251.mdns: 0 [3q] [4n] ANY (QM)? d.a.8.b.2.9.e.f.f.f.b.1.2.4.0.0.0.0.0.0.0.0.0.0.0.0.0.0.0.8.e.f.ip6.arpa. ANY (QM)? NotebookLab-19520.local. ANY (QM)? 1.1.0.10.in-addr.arpa. (214)
21:53:27.214704 IP6 NotebookLab.mdns > ff02::fb.mdns: 0 [2q] [2n] ANY (QM)? a.b.3.2.2.0.e.f.f.f.8.1.b.d.c.8.0.0.0.0.0.0.0.0.0.0.0.0.0.8.e.f.ip6.arpa. ANY (QM)? NotebookLab-19520.local. (161)
21:53:27.214902 IP6 NotebookLab.mdns > ff02::fb.mdns: 0 [2q] [2n] ANY (QM)? d.a.8.b.2.9.e.f.f.f.b.1.2.4.0.0.0.0.0.0.0.0.0.0.0.0.0.0.0.8.e.f.ip6.arpa. ANY (QM)? NotebookLab-19520.local. (161)
21:53:27.214942 IP NotebookLab.mdns > 224.0.0.251.mdns: 0 [3q] [4n] ANY (QM)? d.a.8.b.2.9.e.f.f.f.b.1.2.4.0.0.0.0.0.0.0.0.0.0.0.0.0.0.0.8.e.f.ip6.arpa. ANY (QM)? NotebookLab-19520.local. ANY (QM)? 1.1.0.10.in-addr.arpa. (214)
21:53:27.415049 IP6 NotebookLab.mdns > ff02::fb.mdns: 0*- [0q] 2/0/0 (Cache flush) PTR NotebookLab-19520.local., (Cache flush) AAAA fe80::8cdb:18ff:fe02:23ba (149)
21:53:27.415271 IP NotebookLab.mdns > 224.0.0.251.mdns: 0*- [0q] 4/0/0 (Cache flush) PTR NotebookLab-19520.local., (Cache flush) A 10.0.1.1, (Cache flush) PTR NotebookLab-19520.local., (Cache flush) AAAA fe80::42:1bff:fe92:b8ad (196)
21:53:27.415309 IP6 NotebookLab.mdns > ff02::fb.mdns: 0*- [0q] 2/0/0 (Cache flush) PTR NotebookLab-19520.local., (Cache flush) AAAA fe80::42:1bff:fe92:b8ad (149)
21:53:28.587613 IP6 NotebookLab.mdns > ff02::fb.mdns: 0*- [0q] 2/0/0 (Cache flush) PTR NotebookLab-19520.local., (Cache flush) AAAA fe80::8cdb:18ff:fe02:23ba (149)
21:53:28.587869 IP NotebookLab.mdns > 224.0.0.251.mdns: 0*- [0q] 4/0/0 (Cache flush) PTR NotebookLab-19520.local., (Cache flush) A 10.0.1.1, (Cache flush) PTR NotebookLab-19520.local., (Cache flush) AAAA fe80::42:1bff:fe92:b8ad (196)
21:53:28.587904 IP6 NotebookLab.mdns > ff02::fb.mdns: 0*- [0q] 2/0/0 (Cache flush) PTR NotebookLab-19520.local., (Cache flush) AAAA fe80::42:1bff:fe92:b8ad (149)
21:53:28.822440 IP6 NotebookLab > ip6-allrouters: ICMP6, router solicitation, length 16
21:53:30.643556 ARP, Request who-has 10.0.1.200 tell 10.0.1.2, length 28
21:53:30.643565 ARP, Reply 10.0.1.200 is-at 02:42:0a:00:01:c8 (oui Unknown), length 28
21:53:30.643606 IP 10.0.1.2.35338 > 10.0.1.200.5000: Flags [S], seq 835667899, win 64240, options [mss 1460,sackOK,TS val 3163373070 ecr 0,nop,wscale 7], length 0
21:53:30.643644 IP 10.0.1.200.5000 > 10.0.1.2.35338: Flags [S.], seq 3969224355, ack 835667900, win 65160, options [mss 1460,sackOK,TS val 3652808581 ecr 3163373070,nop,wscale 7], length 0
21:53:30.643671 IP 10.0.1.2.35338 > 10.0.1.200.5000: Flags [.], ack 1, win 502, options [nop,nop,TS val 3163373070 ecr 3652808581], length 0
21:53:30.644143 IP 10.0.1.2.35338 > 10.0.1.200.5000: Flags [P.], seq 1:675, ack 1, win 502, options [nop,nop,TS val 3163373070 ecr 3652808581], length 674
21:53:30.644158 IP 10.0.1.200.5000 > 10.0.1.2.35338: Flags [.], ack 675, win 504, options [nop,nop,TS val 3652808581 ecr 3163373070], length 0
21:53:30.674216 IP 10.0.1.200.55702 > 10.0.1.2.830: Flags [S], seq 3300690437, win 64240, options [mss 1460,sackOK,TS val 3652808611 ecr 0,nop,wscale 7], length 0
21:53:30.674309 IP 10.0.1.2.830 > 10.0.1.200.55702: Flags [S.], seq 2247001796, ack 3300690438, win 65160, options [mss 1460,sackOK,TS val 3163373101 ecr 3652808611,nop,wscale 7], length 0
21:53:30.674326 IP 10.0.1.200.55702 > 10.0.1.2.830: Flags [.], ack 1, win 502, options [nop,nop,TS val 3652808612 ecr 3163373101], length 0
21:53:30.674839 IP 10.0.1.2.830 > 10.0.1.200.55702: Flags [P.], seq 1:23, ack 1, win 510, options [nop,nop,TS val 3163373101 ecr 3652808612], length 22
21:53:30.674849 IP 10.0.1.200.55702 > 10.0.1.2.830: Flags [.], ack 23, win 502, options [nop,nop,TS val 3652808612 ecr 3163373101], length 0
21:53:30.674923 IP 10.0.1.200.55702 > 10.0.1.2.830: Flags [P.], seq 1:25, ack 23, win 502, options [nop,nop,TS val 3652808612 ecr 3163373101], length 24
21:53:30.674950 IP 10.0.1.2.830 > 10.0.1.200.55702: Flags [.], ack 25, win 510, options [nop,nop,TS val 3163373101 ecr 3652808612], length 0
21:53:30.675292 IP 10.0.1.2.830 > 10.0.1.200.55702: Flags [P.], seq 23:535, ack 25, win 510, options [nop,nop,TS val 3163373102 ecr 3652808612], length 512
21:53:30.675298 IP 10.0.1.200.55702 > 10.0.1.2.830: Flags [.], ack 535, win 501, options [nop,nop,TS val 3652808613 ecr 3163373102], length 0
21:53:30.675454 IP 10.0.1.200.55702 > 10.0.1.2.830: Flags [P.], seq 25:825, ack 535, win 501, options [nop,nop,TS val 3652808613 ecr 3163373102], length 800
21:53:30.675477 IP 10.0.1.2.830 > 10.0.1.200.55702: Flags [.], ack 825, win 504, options [nop,nop,TS val 3163373102 ecr 3652808613], length 0
21:53:30.675947 IP 10.0.1.200.55702 > 10.0.1.2.830: Flags [P.], seq 825:873, ack 535, win 501, options [nop,nop,TS val 3652808613 ecr 3163373102], length 48
21:53:30.675970 IP 10.0.1.2.830 > 10.0.1.200.55702: Flags [.], ack 873, win 504, options [nop,nop,TS val 3163373102 ecr 3652808613], length 0
21:53:30.698239 IP 10.0.1.2.830 > 10.0.1.200.55702: Flags [P.], seq 535:1655, ack 873, win 504, options [nop,nop,TS val 3163373124 ecr 3652808613], length 1120
21:53:30.698245 IP 10.0.1.200.55702 > 10.0.1.2.830: Flags [.], ack 1655, win 501, options [nop,nop,TS val 3652808635 ecr 3163373124], length 0
21:53:30.699183 IP 10.0.1.200.55702 > 10.0.1.2.830: Flags [P.], seq 873:889, ack 1655, win 501, options [nop,nop,TS val 3652808636 ecr 3163373124], length 16
21:53:30.699516 IP 10.0.1.2.830 > 10.0.1.200.55702: Flags [.], ack 889, win 504, options [nop,nop,TS val 3163373126 ecr 3652808636], length 0
21:53:30.700419 IP 10.0.1.2.830 > 10.0.1.200.55702: Flags [P.], seq 1655:1671, ack 889, win 504, options [nop,nop,TS val 3163373127 ecr 3652808636], length 16
21:53:30.700424 IP 10.0.1.200.55702 > 10.0.1.2.830: Flags [.], ack 1671, win 501, options [nop,nop,TS val 3652808638 ecr 3163373127], length 0
21:53:30.729038 IP 10.0.1.200.55702 > 10.0.1.2.830: Flags [P.], seq 889:953, ack 1671, win 501, options [nop,nop,TS val 3652808666 ecr 3163373127], length 64
21:53:30.729057 IP 10.0.1.2.830 > 10.0.1.200.55702: Flags [.], ack 953, win 504, options [nop,nop,TS val 3163373155 ecr 3652808666], length 0
21:53:30.751461 IP 10.0.1.2.830 > 10.0.1.200.55702: Flags [P.], seq 1671:1735, ack 953, win 504, options [nop,nop,TS val 3163373178 ecr 3652808666], length 64
21:53:30.751467 IP 10.0.1.200.55702 > 10.0.1.2.830: Flags [.], ack 1735, win 501, options [nop,nop,TS val 3652808689 ecr 3163373178], length 0
21:53:30.758638 IP 10.0.1.200.55702 > 10.0.1.2.830: Flags [P.], seq 953:2121, ack 1735, win 501, options [nop,nop,TS val 3652808696 ecr 3163373178], length 1168
21:53:30.758656 IP 10.0.1.2.830 > 10.0.1.200.55702: Flags [.], ack 2121, win 501, options [nop,nop,TS val 3163373185 ecr 3652808696], length 0
21:53:30.759404 IP6 NotebookLab.mdns > ff02::fb.mdns: 0*- [0q] 2/0/0 (Cache flush) PTR NotebookLab-19520.local., (Cache flush) AAAA fe80::8cdb:18ff:fe02:23ba (149)
21:53:30.759589 IP NotebookLab.mdns > 224.0.0.251.mdns: 0*- [0q] 4/0/0 (Cache flush) PTR NotebookLab-19520.local., (Cache flush) A 10.0.1.1, (Cache flush) PTR NotebookLab-19520.local., (Cache flush) AAAA fe80::42:1bff:fe92:b8ad (196)
21:53:30.759620 IP6 NotebookLab.mdns > ff02::fb.mdns: 0*- [0q] 2/0/0 (Cache flush) PTR NotebookLab-19520.local., (Cache flush) AAAA fe80::42:1bff:fe92:b8ad (149)
21:53:30.805114 IP 10.0.1.2.830 > 10.0.1.200.55702: Flags [P.], seq 1735:1783, ack 2121, win 501, options [nop,nop,TS val 3163373231 ecr 3652808696], length 48
21:53:30.805122 IP 10.0.1.200.55702 > 10.0.1.2.830: Flags [.], ack 1783, win 501, options [nop,nop,TS val 3652808742 ecr 3163373231], length 0
21:53:30.806467 IP6 NotebookLab.mdns > ff02::fb.mdns: 0 [2q] PTR (QM)? _ipps._tcp.local. PTR (QM)? _ipp._tcp.local. (45)
21:53:30.829647 IP 10.0.1.200.55702 > 10.0.1.2.830: Flags [P.], seq 2121:2201, ack 1783, win 501, options [nop,nop,TS val 3652808767 ecr 3163373231], length 80
21:53:30.855838 IP 10.0.1.2.830 > 10.0.1.200.55702: Flags [P.], seq 1783:1847, ack 2201, win 501, options [nop,nop,TS val 3163373282 ecr 3652808767], length 64
21:53:30.861650 IP 10.0.1.200.55702 > 10.0.1.2.830: Flags [P.], seq 2201:2281, ack 1847, win 501, options [nop,nop,TS val 3652808799 ecr 3163373282], length 80
21:53:30.902385 IP 10.0.1.2.830 > 10.0.1.200.55702: Flags [.], ack 2281, win 501, options [nop,nop,TS val 3163373329 ecr 3652808799], length 0
21:53:30.906212 IP 10.0.1.2.830 > 10.0.1.200.55702: Flags [P.], seq 1847:1895, ack 2281, win 501, options [nop,nop,TS val 3163373332 ecr 3652808799], length 48
21:53:30.906883 IP 10.0.1.2.830 > 10.0.1.200.55702: Flags [P.], seq 1895:4791, ack 2281, win 501, options [nop,nop,TS val 3163373333 ecr 3652808799], length 2896
21:53:30.906964 IP 10.0.1.200.55702 > 10.0.1.2.830: Flags [.], ack 4791, win 496, options [nop,nop,TS val 3652808844 ecr 3163373332], length 0
21:53:30.906985 IP 10.0.1.2.830 > 10.0.1.200.55702: Flags [P.], seq 4791:5479, ack 2281, win 501, options [nop,nop,TS val 3163373333 ecr 3652808844], length 688
21:53:30.908618 IP 10.0.1.200.55702 > 10.0.1.2.830: Flags [P.], seq 2281:3625, ack 5479, win 501, options [nop,nop,TS val 3652808846 ecr 3163373333], length 1344
21:53:30.909411 IP 10.0.1.2.830 > 10.0.1.200.55702: Flags [P.], seq 5479:5543, ack 3625, win 501, options [nop,nop,TS val 3163373336 ecr 3652808846], length 64
21:53:30.912696 IP 10.0.1.200.5000 > 10.0.1.2.35338: Flags [P.], seq 1:18, ack 675, win 504, options [nop,nop,TS val 3652808850 ecr 3163373070], length 17
21:53:30.912733 IP 10.0.1.2.35338 > 10.0.1.200.5000: Flags [.], ack 18, win 502, options [nop,nop,TS val 3163373339 ecr 3652808850], length 0
21:53:30.912821 IP 10.0.1.200.5000 > 10.0.1.2.35338: Flags [P.], seq 18:58, ack 675, win 504, options [nop,nop,TS val 3652808850 ecr 3163373339], length 40
21:53:30.912841 IP 10.0.1.2.35338 > 10.0.1.200.5000: Flags [.], ack 58, win 502, options [nop,nop,TS val 3163373339 ecr 3652808850], length 0
21:53:30.912883 IP 10.0.1.200.5000 > 10.0.1.2.35338: Flags [P.], seq 58:77, ack 675, win 504, options [nop,nop,TS val 3652808850 ecr 3163373339], length 19
21:53:30.912899 IP 10.0.1.2.35338 > 10.0.1.200.5000: Flags [.], ack 77, win 502, options [nop,nop,TS val 3163373339 ecr 3652808850], length 0
21:53:30.912958 IP 10.0.1.200.5000 > 10.0.1.2.35338: Flags [P.], seq 77:115, ack 675, win 504, options [nop,nop,TS val 3652808850 ecr 3163373339], length 38
21:53:30.912997 IP 10.0.1.2.35338 > 10.0.1.200.5000: Flags [.], ack 115, win 502, options [nop,nop,TS val 3163373339 ecr 3652808850], length 0
21:53:30.913119 IP 10.0.1.200.5000 > 10.0.1.2.35338: Flags [P.], seq 115:152, ack 675, win 504, options [nop,nop,TS val 3652808850 ecr 3163373339], length 37
21:53:30.913138 IP 10.0.1.2.35338 > 10.0.1.200.5000: Flags [.], ack 152, win 502, options [nop,nop,TS val 3163373339 ecr 3652808850], length 0
21:53:30.913193 IP 10.0.1.200.5000 > 10.0.1.2.35338: Flags [P.], seq 152:154, ack 675, win 504, options [nop,nop,TS val 3652808850 ecr 3163373339], length 2
21:53:30.913208 IP 10.0.1.2.35338 > 10.0.1.200.5000: Flags [.], ack 154, win 502, options [nop,nop,TS val 3163373339 ecr 3652808850], length 0
21:53:30.913237 IP 10.0.1.200.5000 > 10.0.1.2.35338: Flags [P.], seq 154:156, ack 675, win 504, options [nop,nop,TS val 3652808850 ecr 3163373339], length 2
21:53:30.913251 IP 10.0.1.2.35338 > 10.0.1.200.5000: Flags [.], ack 156, win 502, options [nop,nop,TS val 3163373339 ecr 3652808850], length 0
21:53:30.913308 IP 10.0.1.2.35338 > 10.0.1.200.5000: Flags [F.], seq 675, ack 156, win 502, options [nop,nop,TS val 3163373340 ecr 3652808850], length 0
21:53:30.913927 IP 10.0.1.200.5000 > 10.0.1.2.35338: Flags [F.], seq 156, ack 676, win 504, options [nop,nop,TS val 3652808851 ecr 3163373340], length 0
21:53:30.913964 IP 10.0.1.2.35338 > 10.0.1.200.5000: Flags [.], ack 157, win 502, options [nop,nop,TS val 3163373340 ecr 3652808851], length 0
21:53:30.950311 IP 10.0.1.200.55702 > 10.0.1.2.830: Flags [.], ack 5543, win 501, options [nop,nop,TS val 3652808888 ecr 3163373336], length 0
21:53:31.010115 IP 10.0.1.200.55702 > 10.0.1.2.830: Flags [P.], seq 3625:6057, ack 5543, win 501, options [nop,nop,TS val 3652808947 ecr 3163373336], length 2432
21:53:31.010863 IP 10.0.1.2.830 > 10.0.1.200.55702: Flags [.], ack 6057, win 501, options [nop,nop,TS val 3163373437 ecr 3652808947], length 0
21:53:31.017604 IP 10.0.1.2.830 > 10.0.1.200.55702: Flags [P.], seq 5543:5607, ack 6057, win 501, options [nop,nop,TS val 3163373444 ecr 3652808947], length 64
21:53:31.017742 IP 10.0.1.200.55702 > 10.0.1.2.830: Flags [.], ack 5607, win 501, options [nop,nop,TS val 3652808955 ecr 3163373444], length 0
21:53:31.018200 IP 10.0.1.2.830 > 10.0.1.200.55702: Flags [P.], seq 5607:5895, ack 6057, win 501, options [nop,nop,TS val 3163373444 ecr 3652808955], length 288
21:53:31.018251 IP 10.0.1.200.55702 > 10.0.1.2.830: Flags [.], ack 5895, win 501, options [nop,nop,TS val 3652808955 ecr 3163373444], length 0
21:53:31.018550 IP 10.0.1.2.830 > 10.0.1.200.55702: Flags [P.], seq 5895:5959, ack 6057, win 501, options [nop,nop,TS val 3163373445 ecr 3652808955], length 64
21:53:31.018614 IP 10.0.1.200.55702 > 10.0.1.2.830: Flags [.], ack 5959, win 501, options [nop,nop,TS val 3652808956 ecr 3163373445], length 0
21:53:33.820615 ARP, Request who-has 10.0.1.200 tell 10.0.1.3, length 28
21:53:33.820623 ARP, Reply 10.0.1.200 is-at 02:42:0a:00:01:c8 (oui Unknown), length 28
21:53:33.820643 IP 10.0.1.3.59112 > 10.0.1.200.5000: Flags [S], seq 1703265140, win 64240, options [mss 1460,sackOK,TS val 1896094954 ecr 0,nop,wscale 7], length 0
21:53:33.820660 IP 10.0.1.200.5000 > 10.0.1.3.59112: Flags [S.], seq 2826287579, ack 1703265141, win 65160, options [mss 1460,sackOK,TS val 3991138001 ecr 1896094954,nop,wscale 7], length 0
21:53:33.820702 IP 10.0.1.3.59112 > 10.0.1.200.5000: Flags [.], ack 1, win 502, options [nop,nop,TS val 1896094954 ecr 3991138001], length 0
21:53:33.821040 IP 10.0.1.3.59112 > 10.0.1.200.5000: Flags [P.], seq 1:675, ack 1, win 502, options [nop,nop,TS val 1896094954 ecr 3991138001], length 674
21:53:33.821049 IP 10.0.1.200.5000 > 10.0.1.3.59112: Flags [.], ack 675, win 504, options [nop,nop,TS val 3991138001 ecr 1896094954], length 0
21:53:33.850793 IP 10.0.1.200.47030 > 10.0.1.3.830: Flags [S], seq 1930599370, win 64240, options [mss 1460,sackOK,TS val 3991138031 ecr 0,nop,wscale 7], length 0
21:53:33.850841 IP 10.0.1.3.830 > 10.0.1.200.47030: Flags [S.], seq 2062891300, ack 1930599371, win 65160, options [mss 1460,sackOK,TS val 1896094984 ecr 3991138031,nop,wscale 7], length 0
21:53:33.850853 IP 10.0.1.200.47030 > 10.0.1.3.830: Flags [.], ack 1, win 502, options [nop,nop,TS val 3991138031 ecr 1896094984], length 0
21:53:33.851224 IP 10.0.1.3.830 > 10.0.1.200.47030: Flags [P.], seq 1:23, ack 1, win 510, options [nop,nop,TS val 1896094984 ecr 3991138031], length 22
21:53:33.851283 IP 10.0.1.200.47030 > 10.0.1.3.830: Flags [.], ack 23, win 502, options [nop,nop,TS val 3991138032 ecr 1896094984], length 0
21:53:33.851890 IP 10.0.1.200.47030 > 10.0.1.3.830: Flags [P.], seq 1:25, ack 23, win 502, options [nop,nop,TS val 3991138032 ecr 1896094984], length 24
21:53:33.851921 IP 10.0.1.3.830 > 10.0.1.200.47030: Flags [.], ack 25, win 510, options [nop,nop,TS val 1896094985 ecr 3991138032], length 0
21:53:33.852076 IP 10.0.1.3.830 > 10.0.1.200.47030: Flags [P.], seq 23:535, ack 25, win 510, options [nop,nop,TS val 1896094985 ecr 3991138032], length 512
21:53:33.852122 IP 10.0.1.200.47030 > 10.0.1.3.830: Flags [.], ack 535, win 498, options [nop,nop,TS val 3991138032 ecr 1896094985], length 0
21:53:33.852589 IP 10.0.1.200.47030 > 10.0.1.3.830: Flags [P.], seq 25:825, ack 535, win 501, options [nop,nop,TS val 3991138033 ecr 1896094985], length 800
21:53:33.852625 IP 10.0.1.3.830 > 10.0.1.200.47030: Flags [.], ack 825, win 504, options [nop,nop,TS val 1896094986 ecr 3991138033], length 0
21:53:33.853235 IP 10.0.1.200.47030 > 10.0.1.3.830: Flags [P.], seq 825:873, ack 535, win 501, options [nop,nop,TS val 3991138033 ecr 1896094986], length 48
21:53:33.853256 IP 10.0.1.3.830 > 10.0.1.200.47030: Flags [.], ack 873, win 504, options [nop,nop,TS val 1896094986 ecr 3991138033], length 0
21:53:33.875855 IP 10.0.1.3.830 > 10.0.1.200.47030: Flags [P.], seq 535:1655, ack 873, win 504, options [nop,nop,TS val 1896095009 ecr 3991138033], length 1120
21:53:33.875863 IP 10.0.1.200.47030 > 10.0.1.3.830: Flags [.], ack 1655, win 501, options [nop,nop,TS val 3991138056 ecr 1896095009], length 0
21:53:33.876632 IP 10.0.1.200.47030 > 10.0.1.3.830: Flags [P.], seq 873:889, ack 1655, win 501, options [nop,nop,TS val 3991138057 ecr 1896095009], length 16
21:53:33.876863 IP 10.0.1.3.830 > 10.0.1.200.47030: Flags [.], ack 889, win 504, options [nop,nop,TS val 1896095010 ecr 3991138057], length 0
21:53:33.877681 IP 10.0.1.3.830 > 10.0.1.200.47030: Flags [P.], seq 1655:1671, ack 889, win 504, options [nop,nop,TS val 1896095011 ecr 3991138057], length 16
21:53:33.877687 IP 10.0.1.200.47030 > 10.0.1.3.830: Flags [.], ack 1671, win 501, options [nop,nop,TS val 3991138058 ecr 1896095011], length 0
21:53:33.905202 IP 10.0.1.200.47030 > 10.0.1.3.830: Flags [P.], seq 889:953, ack 1671, win 501, options [nop,nop,TS val 3991138085 ecr 1896095011], length 64
21:53:33.905222 IP 10.0.1.3.830 > 10.0.1.200.47030: Flags [.], ack 953, win 504, options [nop,nop,TS val 1896095038 ecr 3991138085], length 0
21:53:33.929120 IP 10.0.1.3.830 > 10.0.1.200.47030: Flags [P.], seq 1671:1735, ack 953, win 504, options [nop,nop,TS val 1896095062 ecr 3991138085], length 64
21:53:33.929125 IP 10.0.1.200.47030 > 10.0.1.3.830: Flags [.], ack 1735, win 501, options [nop,nop,TS val 3991138109 ecr 1896095062], length 0
21:53:33.936516 IP 10.0.1.200.47030 > 10.0.1.3.830: Flags [P.], seq 953:2121, ack 1735, win 501, options [nop,nop,TS val 3991138117 ecr 1896095062], length 1168
21:53:33.936534 IP 10.0.1.3.830 > 10.0.1.200.47030: Flags [.], ack 2121, win 501, options [nop,nop,TS val 1896095070 ecr 3991138117], length 0
21:53:33.981048 IP 10.0.1.3.830 > 10.0.1.200.47030: Flags [P.], seq 1735:1783, ack 2121, win 501, options [nop,nop,TS val 1896095114 ecr 3991138117], length 48
21:53:33.981055 IP 10.0.1.200.47030 > 10.0.1.3.830: Flags [.], ack 1783, win 501, options [nop,nop,TS val 3991138161 ecr 1896095114], length 0
21:53:34.005620 IP 10.0.1.200.47030 > 10.0.1.3.830: Flags [P.], seq 2121:2201, ack 1783, win 501, options [nop,nop,TS val 3991138186 ecr 1896095114], length 80
21:53:34.005639 IP 10.0.1.3.830 > 10.0.1.200.47030: Flags [.], ack 2201, win 501, options [nop,nop,TS val 1896095139 ecr 3991138186], length 0
21:53:34.031465 IP 10.0.1.3.830 > 10.0.1.200.47030: Flags [P.], seq 1783:1847, ack 2201, win 501, options [nop,nop,TS val 1896095165 ecr 3991138186], length 64
21:53:34.037656 IP 10.0.1.200.47030 > 10.0.1.3.830: Flags [P.], seq 2201:2281, ack 1847, win 501, options [nop,nop,TS val 3991138218 ecr 1896095165], length 80
21:53:34.078408 IP 10.0.1.3.830 > 10.0.1.200.47030: Flags [.], ack 2281, win 501, options [nop,nop,TS val 1896095212 ecr 3991138218], length 0
21:53:34.082003 IP 10.0.1.3.830 > 10.0.1.200.47030: Flags [P.], seq 1847:1895, ack 2281, win 501, options [nop,nop,TS val 1896095215 ecr 3991138218], length 48
21:53:34.082860 IP 10.0.1.3.830 > 10.0.1.200.47030: Flags [P.], seq 1895:4791, ack 2281, win 501, options [nop,nop,TS val 1896095216 ecr 3991138218], length 2896
21:53:34.082943 IP 10.0.1.200.47030 > 10.0.1.3.830: Flags [.], ack 4791, win 496, options [nop,nop,TS val 3991138263 ecr 1896095215], length 0
21:53:34.082966 IP 10.0.1.3.830 > 10.0.1.200.47030: Flags [P.], seq 4791:5479, ack 2281, win 501, options [nop,nop,TS val 1896095216 ecr 3991138263], length 688
21:53:34.084670 IP 10.0.1.200.47030 > 10.0.1.3.830: Flags [P.], seq 2281:3625, ack 5479, win 501, options [nop,nop,TS val 3991138265 ecr 1896095216], length 1344
21:53:34.084813 IP 10.0.1.3.830 > 10.0.1.200.47030: Flags [P.], seq 5479:5543, ack 3625, win 501, options [nop,nop,TS val 1896095218 ecr 3991138265], length 64
21:53:34.086885 IP 10.0.1.200.5000 > 10.0.1.3.59112: Flags [P.], seq 1:18, ack 675, win 504, options [nop,nop,TS val 3991138267 ecr 1896094954], length 17
21:53:34.086945 IP 10.0.1.3.59112 > 10.0.1.200.5000: Flags [.], ack 18, win 502, options [nop,nop,TS val 1896095220 ecr 3991138267], length 0
21:53:34.087062 IP 10.0.1.200.5000 > 10.0.1.3.59112: Flags [P.], seq 18:58, ack 675, win 504, options [nop,nop,TS val 3991138267 ecr 1896095220], length 40
21:53:34.087108 IP 10.0.1.3.59112 > 10.0.1.200.5000: Flags [.], ack 58, win 502, options [nop,nop,TS val 1896095220 ecr 3991138267], length 0
21:53:34.087187 IP 10.0.1.200.5000 > 10.0.1.3.59112: Flags [P.], seq 58:77, ack 675, win 504, options [nop,nop,TS val 3991138267 ecr 1896095220], length 19
21:53:34.087206 IP 10.0.1.3.59112 > 10.0.1.200.5000: Flags [.], ack 77, win 502, options [nop,nop,TS val 1896095220 ecr 3991138267], length 0
21:53:34.087270 IP 10.0.1.200.5000 > 10.0.1.3.59112: Flags [P.], seq 77:115, ack 675, win 504, options [nop,nop,TS val 3991138268 ecr 1896095220], length 38
21:53:34.087288 IP 10.0.1.3.59112 > 10.0.1.200.5000: Flags [.], ack 115, win 502, options [nop,nop,TS val 1896095221 ecr 3991138268], length 0
21:53:34.087341 IP 10.0.1.200.5000 > 10.0.1.3.59112: Flags [P.], seq 115:152, ack 675, win 504, options [nop,nop,TS val 3991138268 ecr 1896095221], length 37
21:53:34.087358 IP 10.0.1.3.59112 > 10.0.1.200.5000: Flags [.], ack 152, win 502, options [nop,nop,TS val 1896095221 ecr 3991138268], length 0
21:53:34.087407 IP 10.0.1.200.5000 > 10.0.1.3.59112: Flags [P.], seq 152:154, ack 675, win 504, options [nop,nop,TS val 3991138268 ecr 1896095221], length 2
21:53:34.087456 IP 10.0.1.3.59112 > 10.0.1.200.5000: Flags [.], ack 154, win 502, options [nop,nop,TS val 1896095221 ecr 3991138268], length 0
21:53:34.087497 IP 10.0.1.200.5000 > 10.0.1.3.59112: Flags [P.], seq 154:156, ack 675, win 504, options [nop,nop,TS val 3991138268 ecr 1896095221], length 2
21:53:34.087512 IP 10.0.1.3.59112 > 10.0.1.200.5000: Flags [.], ack 156, win 502, options [nop,nop,TS val 1896095221 ecr 3991138268], length 0
21:53:34.087571 IP 10.0.1.3.59112 > 10.0.1.200.5000: Flags [F.], seq 675, ack 156, win 502, options [nop,nop,TS val 1896095221 ecr 3991138268], length 0
21:53:34.088129 IP 10.0.1.200.5000 > 10.0.1.3.59112: Flags [F.], seq 156, ack 676, win 504, options [nop,nop,TS val 3991138268 ecr 1896095221], length 0
21:53:34.088165 IP 10.0.1.3.59112 > 10.0.1.200.5000: Flags [.], ack 157, win 502, options [nop,nop,TS val 1896095221 ecr 3991138268], length 0
21:53:34.126350 IP 10.0.1.200.47030 > 10.0.1.3.830: Flags [.], ack 5543, win 501, options [nop,nop,TS val 3991138307 ecr 1896095218], length 0
21:53:34.185283 IP 10.0.1.200.47030 > 10.0.1.3.830: Flags [P.], seq 3625:6057, ack 5543, win 501, options [nop,nop,TS val 3991138366 ecr 1896095218], length 2432
21:53:34.186105 IP 10.0.1.3.830 > 10.0.1.200.47030: Flags [.], ack 6057, win 501, options [nop,nop,TS val 1896095319 ecr 3991138366], length 0
21:53:34.191895 IP 10.0.1.3.830 > 10.0.1.200.47030: Flags [P.], seq 5543:5607, ack 6057, win 501, options [nop,nop,TS val 1896095325 ecr 3991138366], length 64
21:53:34.191986 IP 10.0.1.200.47030 > 10.0.1.3.830: Flags [.], ack 5607, win 501, options [nop,nop,TS val 3991138372 ecr 1896095325], length 0
21:53:34.192427 IP 10.0.1.200.47030 > 10.0.1.3.830: Flags [P.], seq 6057:7849, ack 5607, win 501, options [nop,nop,TS val 3991138373 ecr 1896095325], length 1792
21:53:34.192582 IP 10.0.1.3.830 > 10.0.1.200.47030: Flags [.], ack 7849, win 501, options [nop,nop,TS val 1896095326 ecr 3991138373], length 0
21:53:34.192644 IP 10.0.1.3.830 > 10.0.1.200.47030: Flags [P.], seq 5607:5895, ack 7849, win 501, options [nop,nop,TS val 1896095326 ecr 3991138373], length 288
21:53:34.192699 IP 10.0.1.200.47030 > 10.0.1.3.830: Flags [.], ack 5895, win 501, options [nop,nop,TS val 3991138373 ecr 1896095326], length 0
21:53:34.192954 IP 10.0.1.3.830 > 10.0.1.200.47030: Flags [P.], seq 5895:5959, ack 7849, win 501, options [nop,nop,TS val 1896095326 ecr 3991138373], length 64
21:53:34.193001 IP 10.0.1.200.47030 > 10.0.1.3.830: Flags [.], ack 5959, win 501, options [nop,nop,TS val 3991138373 ecr 1896095326], length 0
21:53:34.197958 IP 10.0.1.3.830 > 10.0.1.200.47030: Flags [P.], seq 5959:6023, ack 7849, win 501, options [nop,nop,TS val 1896095331 ecr 3991138373], length 64
21:53:34.198023 IP 10.0.1.200.47030 > 10.0.1.3.830: Flags [.], ack 6023, win 501, options [nop,nop,TS val 3991138378 ecr 1896095331], length 0
21:53:34.198387 IP 10.0.1.3.830 > 10.0.1.200.47030: Flags [P.], seq 6023:6311, ack 7849, win 501, options [nop,nop,TS val 1896095332 ecr 3991138378], length 288
21:53:34.198472 IP 10.0.1.200.47030 > 10.0.1.3.830: Flags [.], ack 6311, win 501, options [nop,nop,TS val 3991138379 ecr 1896095332], length 0
21:53:34.198822 IP 10.0.1.3.830 > 10.0.1.200.47030: Flags [P.], seq 6311:6375, ack 7849, win 501, options [nop,nop,TS val 1896095332 ecr 3991138379], length 64
21:53:34.198872 IP 10.0.1.200.47030 > 10.0.1.3.830: Flags [.], ack 6375, win 501, options [nop,nop,TS val 3991138379 ecr 1896095332], length 0
