10:30:21.134643 IP6 NotebookLab > ff02::16: HBH ICMP6, multicast listener report v2, 1 group record(s), length 28
10:30:21.134654 IP6 NotebookLab > ip6-allrouters: ICMP6, router solicitation, length 16
10:30:21.146317 IP6 NotebookLab > ff02::16: HBH ICMP6, multicast listener report v2, 1 group record(s), length 28
10:30:21.235036 IP6 NotebookLab.mdns > ff02::fb.mdns: 0 [2q] PTR (QM)? _ipps._tcp.local. PTR (QM)? _ipp._tcp.local. (45)
10:30:21.236222 IP6 NotebookLab.mdns > ff02::fb.mdns: 0 [2q] [2n] ANY (QM)? 4.5.4.0.1.3.e.f.f.f.c.5.8.3.c.c.0.0.0.0.0.0.0.0.0.0.0.0.0.8.e.f.ip6.arpa. ANY (QM)? NotebookLab-8837.local. (160)
10:30:21.487076 IP6 NotebookLab.mdns > ff02::fb.mdns: 0 [2q] [2n] ANY (QM)? 4.5.4.0.1.3.e.f.f.f.c.5.8.3.c.c.0.0.0.0.0.0.0.0.0.0.0.0.0.8.e.f.ip6.arpa. ANY (QM)? NotebookLab-8837.local. (160)
10:30:21.738177 IP6 NotebookLab.mdns > ff02::fb.mdns: 0 [2q] [2n] ANY (QM)? 4.5.4.0.1.3.e.f.f.f.c.5.8.3.c.c.0.0.0.0.0.0.0.0.0.0.0.0.0.8.e.f.ip6.arpa. ANY (QM)? NotebookLab-8837.local. (160)
10:30:21.910308 IP6 NotebookLab > ff02::16: HBH ICMP6, multicast listener report v2, 1 group record(s), length 28
10:30:21.937900 IP6 NotebookLab.mdns > ff02::fb.mdns: 0*- [0q] 2/0/0 (Cache flush) PTR NotebookLab-8837.local., (Cache flush) AAAA fe80::cc38:5cff:fe31:454 (148)
10:30:22.038329 IP6 NotebookLab > ff02::16: HBH ICMP6, multicast listener report v2, 2 group record(s), length 48
10:30:22.188495 IP6 NotebookLab.mdns > ff02::fb.mdns: 0*- [0q] 2/0/0 (Cache flush) PTR NotebookLab-8837.local., (Cache flush) AAAA fe80::cc38:5cff:fe31:454 (148)
10:30:22.188634 IP6 NotebookLab.mdns > ff02::fb.mdns: 0*- [0q] 2/0/0 (Cache flush) PTR NotebookLab-8837.local., (Cache flush) AAAA fe80::42:1bff:fe92:b8ad (148)
10:30:22.188674 IP NotebookLab.mdns > 224.0.0.251.mdns: 0*- [0q] 4/0/0 (Cache flush) PTR NotebookLab-8837.local., (Cache flush) A 10.0.1.1, (Cache flush) PTR NotebookLab-8837.local., (Cache flush) AAAA fe80::42:1bff:fe92:b8ad (195)
10:30:22.236518 IP6 NotebookLab.mdns > ff02::fb.mdns: 0 [2q] PTR (QM)? _ipps._tcp.local. PTR (QM)? _ipp._tcp.local. (45)
10:30:22.289778 IP6 NotebookLab.mdns > ff02::fb.mdns: 0 [2q] [2n] ANY (QM)? 4.5.4.0.1.3.e.f.f.f.c.5.8.3.c.c.0.0.0.0.0.0.0.0.0.0.0.0.0.8.e.f.ip6.arpa. ANY (QM)? NotebookLab-8838.local. (160)
10:30:22.289967 IP6 NotebookLab.mdns > ff02::fb.mdns: 0 [2q] [2n] ANY (QM)? d.a.8.b.2.9.e.f.f.f.b.1.2.4.0.0.0.0.0.0.0.0.0.0.0.0.0.0.0.8.e.f.ip6.arpa. ANY (QM)? NotebookLab-8838.local. (160)
10:30:22.290013 IP NotebookLab.mdns > 224.0.0.251.mdns: 0 [3q] [4n] ANY (QM)? d.a.8.b.2.9.e.f.f.f.b.1.2.4.0.0.0.0.0.0.0.0.0.0.0.0.0.0.0.8.e.f.ip6.arpa. ANY (QM)? NotebookLab-8838.local. ANY (QM)? 1.1.0.10.in-addr.arpa. (213)
10:30:22.540374 IP6 NotebookLab.mdns > ff02::fb.mdns: 0 [2q] [2n] ANY (QM)? 4.5.4.0.1.3.e.f.f.f.c.5.8.3.c.c.0.0.0.0.0.0.0.0.0.0.0.0.0.8.e.f.ip6.arpa. ANY (QM)? NotebookLab-8838.local. (160)
10:30:22.540562 IP6 NotebookLab.mdns > ff02::fb.mdns: 0 [2q] [2n] ANY (QM)? d.a.8.b.2.9.e.f.f.f.b.1.2.4.0.0.0.0.0.0.0.0.0.0.0.0.0.0.0.8.e.f.ip6.arpa. ANY (QM)? NotebookLab-8838.local. (160)
10:30:22.540605 IP NotebookLab.mdns > 224.0.0.251.mdns: 0 [3q] [4n] ANY (QM)? d.a.8.b.2.9.e.f.f.f.b.1.2.4.0.0.0.0.0.0.0.0.0.0.0.0.0.0.0.8.e.f.ip6.arpa. ANY (QM)? NotebookLab-8838.local. ANY (QM)? 1.1.0.10.in-addr.arpa. (213)
10:30:22.791219 IP6 NotebookLab.mdns > ff02::fb.mdns: 0 [2q] [2n] ANY (QM)? 4.5.4.0.1.3.e.f.f.f.c.5.8.3.c.c.0.0.0.0.0.0.0.0.0.0.0.0.0.8.e.f.ip6.arpa. ANY (QM)? NotebookLab-8838.local. (160)
10:30:22.791391 IP6 NotebookLab.mdns > ff02::fb.mdns: 0 [2q] [2n] ANY (QM)? d.a.8.b.2.9.e.f.f.f.b.1.2.4.0.0.0.0.0.0.0.0.0.0.0.0.0.0.0.8.e.f.ip6.arpa. ANY (QM)? NotebookLab-8838.local. (160)
10:30:22.791437 IP NotebookLab.mdns > 224.0.0.251.mdns: 0 [3q] [4n] ANY (QM)? d.a.8.b.2.9.e.f.f.f.b.1.2.4.0.0.0.0.0.0.0.0.0.0.0.0.0.0.0.8.e.f.ip6.arpa. ANY (QM)? NotebookLab-8838.local. ANY (QM)? 1.1.0.10.in-addr.arpa. (213)
10:30:22.991622 IP6 NotebookLab.mdns > ff02::fb.mdns: 0*- [0q] 2/0/0 (Cache flush) PTR NotebookLab-8838.local., (Cache flush) AAAA fe80::cc38:5cff:fe31:454 (148)
10:30:22.991812 IP NotebookLab.mdns > 224.0.0.251.mdns: 0*- [0q] 4/0/0 (Cache flush) PTR NotebookLab-8838.local., (Cache flush) A 10.0.1.1, (Cache flush) PTR NotebookLab-8838.local., (Cache flush) AAAA fe80::42:1bff:fe92:b8ad (195)
10:30:22.991854 IP6 NotebookLab.mdns > ff02::fb.mdns: 0*- [0q] 2/0/0 (Cache flush) PTR NotebookLab-8838.local., (Cache flush) AAAA fe80::42:1bff:fe92:b8ad (148)
10:30:24.042191 IP6 NotebookLab.mdns > ff02::fb.mdns: 0*- [0q] 2/0/0 (Cache flush) PTR NotebookLab-8838.local., (Cache flush) AAAA fe80::cc38:5cff:fe31:454 (148)
10:30:24.042410 IP NotebookLab.mdns > 224.0.0.251.mdns: 0*- [0q] 4/0/0 (Cache flush) PTR NotebookLab-8838.local., (Cache flush) A 10.0.1.1, (Cache flush) PTR NotebookLab-8838.local., (Cache flush) AAAA fe80::42:1bff:fe92:b8ad (195)
10:30:24.042475 IP6 NotebookLab.mdns > ff02::fb.mdns: 0*- [0q] 2/0/0 (Cache flush) PTR NotebookLab-8838.local., (Cache flush) AAAA fe80::42:1bff:fe92:b8ad (148)
10:30:24.237161 IP6 NotebookLab.mdns > ff02::fb.mdns: 0 [2q] PTR (QM)? _ipps._tcp.local. PTR (QM)? _ipp._tcp.local. (45)
10:30:25.270365 IP6 NotebookLab > ip6-allrouters: ICMP6, router solicitation, length 16
10:30:26.093980 IP6 NotebookLab.mdns > ff02::fb.mdns: 0*- [0q] 2/0/0 (Cache flush) PTR NotebookLab-8838.local., (Cache flush) AAAA fe80::cc38:5cff:fe31:454 (148)
10:30:26.094171 IP NotebookLab.mdns > 224.0.0.251.mdns: 0*- [0q] 4/0/0 (Cache flush) PTR NotebookLab-8838.local., (Cache flush) A 10.0.1.1, (Cache flush) PTR NotebookLab-8838.local., (Cache flush) AAAA fe80::42:1bff:fe92:b8ad (195)
10:30:26.094212 IP6 NotebookLab.mdns > ff02::fb.mdns: 0*- [0q] 2/0/0 (Cache flush) PTR NotebookLab-8838.local., (Cache flush) AAAA fe80::42:1bff:fe92:b8ad (148)
10:30:28.238105 IP6 NotebookLab.mdns > ff02::fb.mdns: 0 [2q] PTR (QM)? _ipps._tcp.local. PTR (QM)? _ipp._tcp.local. (45)
10:30:33.206390 IP6 NotebookLab > ip6-allrouters: ICMP6, router solicitation, length 16
10:30:34.608048 ARP, Request who-has 10.0.1.200 tell 10.0.1.3, length 28
10:30:34.608056 ARP, Reply 10.0.1.200 is-at 02:42:0a:00:01:c8 (oui Unknown), length 28
10:30:34.608076 IP 10.0.1.3.58800 > 10.0.1.200.5000: Flags [S], seq 3866684105, win 64240, options [mss 1460,sackOK,TS val 1682315741 ecr 0,nop,wscale 7], length 0
10:30:34.608098 IP 10.0.1.200.5000 > 10.0.1.3.58800: Flags [S.], seq 3006253109, ack 3866684106, win 65160, options [mss 1460,sackOK,TS val 3777358788 ecr 1682315741,nop,wscale 7], length 0
10:30:34.608120 IP 10.0.1.3.58800 > 10.0.1.200.5000: Flags [.], ack 1, win 502, options [nop,nop,TS val 1682315741 ecr 3777358788], length 0
10:30:34.608471 IP 10.0.1.3.58800 > 10.0.1.200.5000: Flags [P.], seq 1:675, ack 1, win 502, options [nop,nop,TS val 1682315742 ecr 3777358788], length 674
10:30:34.608479 IP 10.0.1.200.5000 > 10.0.1.3.58800: Flags [.], ack 675, win 504, options [nop,nop,TS val 3777358789 ecr 1682315742], length 0
10:30:34.628565 IP 10.0.1.200.46718 > 10.0.1.3.830: Flags [S], seq 1183009963, win 64240, options [mss 1460,sackOK,TS val 3777358809 ecr 0,nop,wscale 7], length 0
10:30:34.628617 IP 10.0.1.3.830 > 10.0.1.200.46718: Flags [S.], seq 2463690318, ack 1183009964, win 65160, options [mss 1460,sackOK,TS val 1682315762 ecr 3777358809,nop,wscale 7], length 0
10:30:34.628627 IP 10.0.1.200.46718 > 10.0.1.3.830: Flags [.], ack 1, win 502, options [nop,nop,TS val 3777358809 ecr 1682315762], length 0
10:30:34.629001 IP 10.0.1.3.830 > 10.0.1.200.46718: Flags [P.], seq 1:23, ack 1, win 510, options [nop,nop,TS val 1682315762 ecr 3777358809], length 22
10:30:34.629043 IP 10.0.1.200.46718 > 10.0.1.3.830: Flags [.], ack 23, win 502, options [nop,nop,TS val 3777358809 ecr 1682315762], length 0
10:30:34.629549 IP 10.0.1.200.46718 > 10.0.1.3.830: Flags [P.], seq 1:25, ack 23, win 502, options [nop,nop,TS val 3777358810 ecr 1682315762], length 24
10:30:34.629578 IP 10.0.1.3.830 > 10.0.1.200.46718: Flags [.], ack 25, win 510, options [nop,nop,TS val 1682315763 ecr 3777358810], length 0
10:30:34.629933 IP 10.0.1.3.830 > 10.0.1.200.46718: Flags [P.], seq 23:535, ack 25, win 510, options [nop,nop,TS val 1682315763 ecr 3777358810], length 512
10:30:34.629940 IP 10.0.1.200.46718 > 10.0.1.3.830: Flags [.], ack 535, win 501, options [nop,nop,TS val 3777358810 ecr 1682315763], length 0
10:30:34.630353 IP 10.0.1.200.46718 > 10.0.1.3.830: Flags [P.], seq 25:825, ack 535, win 501, options [nop,nop,TS val 3777358811 ecr 1682315763], length 800
10:30:34.630379 IP 10.0.1.3.830 > 10.0.1.200.46718: Flags [.], ack 825, win 504, options [nop,nop,TS val 1682315764 ecr 3777358811], length 0
10:30:34.630898 IP 10.0.1.200.46718 > 10.0.1.3.830: Flags [P.], seq 825:873, ack 535, win 501, options [nop,nop,TS val 3777358811 ecr 1682315764], length 48
10:30:34.630914 IP 10.0.1.3.830 > 10.0.1.200.46718: Flags [.], ack 873, win 504, options [nop,nop,TS val 1682315764 ecr 3777358811], length 0
10:30:34.655819 IP 10.0.1.3.830 > 10.0.1.200.46718: Flags [P.], seq 535:1655, ack 873, win 504, options [nop,nop,TS val 1682315789 ecr 3777358811], length 1120
10:30:34.655831 IP 10.0.1.200.46718 > 10.0.1.3.830: Flags [.], ack 1655, win 501, options [nop,nop,TS val 3777358836 ecr 1682315789], length 0
10:30:34.656754 IP 10.0.1.200.46718 > 10.0.1.3.830: Flags [P.], seq 873:889, ack 1655, win 501, options [nop,nop,TS val 3777358837 ecr 1682315789], length 16
10:30:34.657062 IP 10.0.1.3.830 > 10.0.1.200.46718: Flags [.], ack 889, win 504, options [nop,nop,TS val 1682315790 ecr 3777358837], length 0
10:30:34.658009 IP 10.0.1.3.830 > 10.0.1.200.46718: Flags [P.], seq 1655:1671, ack 889, win 504, options [nop,nop,TS val 1682315791 ecr 3777358837], length 16
10:30:34.658015 IP 10.0.1.200.46718 > 10.0.1.3.830: Flags [.], ack 1671, win 501, options [nop,nop,TS val 3777358838 ecr 1682315791], length 0
10:30:34.683104 IP 10.0.1.200.46718 > 10.0.1.3.830: Flags [P.], seq 889:953, ack 1671, win 501, options [nop,nop,TS val 3777358863 ecr 1682315791], length 64
10:30:34.683123 IP 10.0.1.3.830 > 10.0.1.200.46718: Flags [.], ack 953, win 504, options [nop,nop,TS val 1682315816 ecr 3777358863], length 0
10:30:34.709386 IP 10.0.1.3.830 > 10.0.1.200.46718: Flags [P.], seq 1671:1735, ack 953, win 504, options [nop,nop,TS val 1682315843 ecr 3777358863], length 64
10:30:34.709392 IP 10.0.1.200.46718 > 10.0.1.3.830: Flags [.], ack 1735, win 501, options [nop,nop,TS val 3777358890 ecr 1682315843], length 0
10:30:34.716451 IP 10.0.1.200.46718 > 10.0.1.3.830: Flags [P.], seq 953:2121, ack 1735, win 501, options [nop,nop,TS val 3777358897 ecr 1682315843], length 1168
10:30:34.716468 IP 10.0.1.3.830 > 10.0.1.200.46718: Flags [.], ack 2121, win 501, options [nop,nop,TS val 1682315850 ecr 3777358897], length 0
10:30:34.760142 IP 10.0.1.3.830 > 10.0.1.200.46718: Flags [P.], seq 1735:1783, ack 2121, win 501, options [nop,nop,TS val 1682315893 ecr 3777358897], length 48
10:30:34.760148 IP 10.0.1.200.46718 > 10.0.1.3.830: Flags [.], ack 1783, win 501, options [nop,nop,TS val 3777358940 ecr 1682315893], length 0
10:30:34.783768 IP 10.0.1.200.46718 > 10.0.1.3.830: Flags [P.], seq 2121:2201, ack 1783, win 501, options [nop,nop,TS val 3777358964 ecr 1682315893], length 80
10:30:34.810681 IP 10.0.1.3.830 > 10.0.1.200.46718: Flags [P.], seq 1783:1847, ack 2201, win 501, options [nop,nop,TS val 1682315944 ecr 3777358964], length 64
10:30:34.815652 IP 10.0.1.200.46718 > 10.0.1.3.830: Flags [P.], seq 2201:2281, ack 1847, win 501, options [nop,nop,TS val 3777358996 ecr 1682315944], length 80
10:30:34.858384 IP 10.0.1.3.830 > 10.0.1.200.46718: Flags [.], ack 2281, win 501, options [nop,nop,TS val 1682315992 ecr 3777358996], length 0
10:30:34.861111 IP 10.0.1.3.830 > 10.0.1.200.46718: Flags [P.], seq 1847:1895, ack 2281, win 501, options [nop,nop,TS val 1682315994 ecr 3777358996], length 48
10:30:34.861704 IP 10.0.1.3.830 > 10.0.1.200.46718: Flags [P.], seq 1895:4791, ack 2281, win 501, options [nop,nop,TS val 1682315995 ecr 3777358996], length 2896
10:30:34.861764 IP 10.0.1.200.46718 > 10.0.1.3.830: Flags [.], ack 4791, win 491, options [nop,nop,TS val 3777359042 ecr 1682315994], length 0
10:30:34.861784 IP 10.0.1.3.830 > 10.0.1.200.46718: Flags [P.], seq 4791:5479, ack 2281, win 501, options [nop,nop,TS val 1682315995 ecr 3777359042], length 688
10:30:34.864102 IP 10.0.1.200.46718 > 10.0.1.3.830: Flags [P.], seq 2281:3625, ack 5479, win 501, options [nop,nop,TS val 3777359044 ecr 1682315995], length 1344
10:30:34.864265 IP 10.0.1.3.830 > 10.0.1.200.46718: Flags [P.], seq 5479:5543, ack 3625, win 501, options [nop,nop,TS val 1682315997 ecr 3777359044], length 64
10:30:34.865997 IP 10.0.1.200.5000 > 10.0.1.3.58800: Flags [P.], seq 1:18, ack 675, win 504, options [nop,nop,TS val 3777359046 ecr 1682315742], length 17
10:30:34.866034 IP 10.0.1.3.58800 > 10.0.1.200.5000: Flags [.], ack 18, win 502, options [nop,nop,TS val 1682315999 ecr 3777359046], length 0
10:30:34.866144 IP 10.0.1.200.5000 > 10.0.1.3.58800: Flags [P.], seq 18:58, ack 675, win 504, options [nop,nop,TS val 3777359046 ecr 1682315999], length 40
10:30:34.866168 IP 10.0.1.3.58800 > 10.0.1.200.5000: Flags [.], ack 58, win 502, options [nop,nop,TS val 1682315999 ecr 3777359046], length 0
10:30:34.866243 IP 10.0.1.200.5000 > 10.0.1.3.58800: Flags [P.], seq 58:77, ack 675, win 504, options [nop,nop,TS val 3777359046 ecr 1682315999], length 19
10:30:34.866260 IP 10.0.1.3.58800 > 10.0.1.200.5000: Flags [.], ack 77, win 502, options [nop,nop,TS val 1682315999 ecr 3777359046], length 0
10:30:34.866387 IP 10.0.1.200.5000 > 10.0.1.3.58800: Flags [P.], seq 77:115, ack 675, win 504, options [nop,nop,TS val 3777359047 ecr 1682315999], length 38
10:30:34.866406 IP 10.0.1.3.58800 > 10.0.1.200.5000: Flags [.], ack 115, win 502, options [nop,nop,TS val 1682316000 ecr 3777359047], length 0
10:30:34.866484 IP 10.0.1.200.5000 > 10.0.1.3.58800: Flags [P.], seq 115:152, ack 675, win 504, options [nop,nop,TS val 3777359047 ecr 1682316000], length 37
10:30:34.866502 IP 10.0.1.3.58800 > 10.0.1.200.5000: Flags [.], ack 152, win 502, options [nop,nop,TS val 1682316000 ecr 3777359047], length 0
10:30:34.866540 IP 10.0.1.200.5000 > 10.0.1.3.58800: Flags [P.], seq 152:154, ack 675, win 504, options [nop,nop,TS val 3777359047 ecr 1682316000], length 2
10:30:34.866555 IP 10.0.1.3.58800 > 10.0.1.200.5000: Flags [.], ack 154, win 502, options [nop,nop,TS val 1682316000 ecr 3777359047], length 0
10:30:34.866604 IP 10.0.1.200.5000 > 10.0.1.3.58800: Flags [P.], seq 154:156, ack 675, win 504, options [nop,nop,TS val 3777359047 ecr 1682316000], length 2
10:30:34.866618 IP 10.0.1.3.58800 > 10.0.1.200.5000: Flags [.], ack 156, win 502, options [nop,nop,TS val 1682316000 ecr 3777359047], length 0
10:30:34.866696 IP 10.0.1.3.58800 > 10.0.1.200.5000: Flags [F.], seq 675, ack 156, win 502, options [nop,nop,TS val 1682316000 ecr 3777359047], length 0
10:30:34.867663 IP 10.0.1.200.5000 > 10.0.1.3.58800: Flags [F.], seq 156, ack 676, win 504, options [nop,nop,TS val 3777359048 ecr 1682316000], length 0
10:30:34.867695 IP 10.0.1.3.58800 > 10.0.1.200.5000: Flags [.], ack 157, win 502, options [nop,nop,TS val 1682316001 ecr 3777359048], length 0
10:30:34.906390 IP 10.0.1.200.46718 > 10.0.1.3.830: Flags [.], ack 5543, win 501, options [nop,nop,TS val 3777359087 ecr 1682315997], length 0
10:30:34.965012 IP 10.0.1.200.46718 > 10.0.1.3.830: Flags [P.], seq 3625:5273, ack 5543, win 501, options [nop,nop,TS val 3777359145 ecr 1682315997], length 1648
10:30:34.965035 IP 10.0.1.3.830 > 10.0.1.200.46718: Flags [.], ack 5273, win 501, options [nop,nop,TS val 1682316098 ecr 3777359145], length 0
10:30:34.972219 IP 10.0.1.3.830 > 10.0.1.200.46718: Flags [P.], seq 5543:5607, ack 5273, win 501, options [nop,nop,TS val 1682316105 ecr 3777359145], length 64
10:30:34.972370 IP 10.0.1.200.46718 > 10.0.1.3.830: Flags [.], ack 5607, win 501, options [nop,nop,TS val 3777359153 ecr 1682316105], length 0
10:30:34.972842 IP 10.0.1.3.830 > 10.0.1.200.46718: Flags [P.], seq 5607:5895, ack 5273, win 501, options [nop,nop,TS val 1682316106 ecr 3777359153], length 288
10:30:34.972919 IP 10.0.1.200.46718 > 10.0.1.3.830: Flags [.], ack 5895, win 501, options [nop,nop,TS val 3777359153 ecr 1682316106], length 0
10:30:34.973211 IP 10.0.1.3.830 > 10.0.1.200.46718: Flags [P.], seq 5895:5959, ack 5273, win 501, options [nop,nop,TS val 1682316106 ecr 3777359153], length 64
10:30:34.973281 IP 10.0.1.200.46718 > 10.0.1.3.830: Flags [.], ack 5959, win 501, options [nop,nop,TS val 3777359154 ecr 1682316106], length 0
10:30:36.239633 IP6 NotebookLab.mdns > ff02::fb.mdns: 0 [2q] PTR (QM)? _ipps._tcp.local. PTR (QM)? _ipp._tcp.local. (45)
10:30:38.213386 ARP, Request who-has 10.0.1.200 tell 10.0.1.2, length 28
10:30:38.213392 ARP, Reply 10.0.1.200 is-at 02:42:0a:00:01:c8 (oui Unknown), length 28
10:30:38.213409 IP 10.0.1.2.35034 > 10.0.1.200.5000: Flags [S], seq 3180948787, win 64240, options [mss 1460,sackOK,TS val 2949600640 ecr 0,nop,wscale 7], length 0
10:30:38.213426 IP 10.0.1.200.5000 > 10.0.1.2.35034: Flags [S.], seq 81501321, ack 3180948788, win 65160, options [mss 1460,sackOK,TS val 3439036151 ecr 2949600640,nop,wscale 7], length 0
10:30:38.213477 IP 10.0.1.2.35034 > 10.0.1.200.5000: Flags [.], ack 1, win 502, options [nop,nop,TS val 2949600640 ecr 3439036151], length 0
10:30:38.213614 IP 10.0.1.2.35034 > 10.0.1.200.5000: Flags [P.], seq 1:675, ack 1, win 502, options [nop,nop,TS val 2949600640 ecr 3439036151], length 674
10:30:38.213623 IP 10.0.1.200.5000 > 10.0.1.2.35034: Flags [.], ack 675, win 504, options [nop,nop,TS val 3439036151 ecr 2949600640], length 0
10:30:38.231209 IP 10.0.1.200.55398 > 10.0.1.2.830: Flags [S], seq 2064463686, win 64240, options [mss 1460,sackOK,TS val 3439036168 ecr 0,nop,wscale 7], length 0
10:30:38.231261 IP 10.0.1.2.830 > 10.0.1.200.55398: Flags [S.], seq 3888470199, ack 2064463687, win 65160, options [mss 1460,sackOK,TS val 2949600657 ecr 3439036168,nop,wscale 7], length 0
10:30:38.231273 IP 10.0.1.200.55398 > 10.0.1.2.830: Flags [.], ack 1, win 502, options [nop,nop,TS val 3439036169 ecr 2949600657], length 0
10:30:38.231647 IP 10.0.1.2.830 > 10.0.1.200.55398: Flags [P.], seq 1:23, ack 1, win 510, options [nop,nop,TS val 2949600658 ecr 3439036169], length 22
10:30:38.231687 IP 10.0.1.200.55398 > 10.0.1.2.830: Flags [.], ack 23, win 502, options [nop,nop,TS val 3439036169 ecr 2949600658], length 0
10:30:38.232136 IP 10.0.1.200.55398 > 10.0.1.2.830: Flags [P.], seq 1:25, ack 23, win 502, options [nop,nop,TS val 3439036169 ecr 2949600658], length 24
10:30:38.232164 IP 10.0.1.2.830 > 10.0.1.200.55398: Flags [.], ack 25, win 510, options [nop,nop,TS val 2949600658 ecr 3439036169], length 0
10:30:38.232510 IP 10.0.1.2.830 > 10.0.1.200.55398: Flags [P.], seq 23:535, ack 25, win 510, options [nop,nop,TS val 2949600659 ecr 3439036169], length 512
10:30:38.232516 IP 10.0.1.200.55398 > 10.0.1.2.830: Flags [.], ack 535, win 501, options [nop,nop,TS val 3439036170 ecr 2949600659], length 0
10:30:38.232669 IP 10.0.1.200.55398 > 10.0.1.2.830: Flags [P.], seq 25:825, ack 535, win 501, options [nop,nop,TS val 3439036170 ecr 2949600659], length 800
10:30:38.232688 IP 10.0.1.2.830 > 10.0.1.200.55398: Flags [.], ack 825, win 504, options [nop,nop,TS val 2949600659 ecr 3439036170], length 0
10:30:38.233038 IP 10.0.1.200.55398 > 10.0.1.2.830: Flags [P.], seq 825:873, ack 535, win 501, options [nop,nop,TS val 3439036170 ecr 2949600659], length 48
10:30:38.233053 IP 10.0.1.2.830 > 10.0.1.200.55398: Flags [.], ack 873, win 504, options [nop,nop,TS val 2949600659 ecr 3439036170], length 0
10:30:38.255941 IP 10.0.1.2.830 > 10.0.1.200.55398: Flags [P.], seq 535:1655, ack 873, win 504, options [nop,nop,TS val 2949600682 ecr 3439036170], length 1120
10:30:38.255951 IP 10.0.1.200.55398 > 10.0.1.2.830: Flags [.], ack 1655, win 501, options [nop,nop,TS val 3439036193 ecr 2949600682], length 0
10:30:38.256813 IP 10.0.1.200.55398 > 10.0.1.2.830: Flags [P.], seq 873:889, ack 1655, win 501, options [nop,nop,TS val 3439036194 ecr 2949600682], length 16
10:30:38.257043 IP 10.0.1.2.830 > 10.0.1.200.55398: Flags [.], ack 889, win 504, options [nop,nop,TS val 2949600683 ecr 3439036194], length 0
10:30:38.257920 IP 10.0.1.2.830 > 10.0.1.200.55398: Flags [P.], seq 1655:1671, ack 889, win 504, options [nop,nop,TS val 2949600684 ecr 3439036194], length 16
10:30:38.257925 IP 10.0.1.200.55398 > 10.0.1.2.830: Flags [.], ack 1671, win 501, options [nop,nop,TS val 3439036195 ecr 2949600684], length 0
10:30:38.285451 IP 10.0.1.200.55398 > 10.0.1.2.830: Flags [P.], seq 889:953, ack 1671, win 501, options [nop,nop,TS val 3439036223 ecr 2949600684], length 64
10:30:38.285471 IP 10.0.1.2.830 > 10.0.1.200.55398: Flags [.], ack 953, win 504, options [nop,nop,TS val 2949600712 ecr 3439036223], length 0
10:30:38.309146 IP 10.0.1.2.830 > 10.0.1.200.55398: Flags [P.], seq 1671:1735, ack 953, win 504, options [nop,nop,TS val 2949600735 ecr 3439036223], length 64
10:30:38.309152 IP 10.0.1.200.55398 > 10.0.1.2.830: Flags [.], ack 1735, win 501, options [nop,nop,TS val 3439036246 ecr 2949600735], length 0
10:30:38.316165 IP 10.0.1.200.55398 > 10.0.1.2.830: Flags [P.], seq 953:2121, ack 1735, win 501, options [nop,nop,TS val 3439036253 ecr 2949600735], length 1168
10:30:38.316182 IP 10.0.1.2.830 > 10.0.1.200.55398: Flags [.], ack 2121, win 501, options [nop,nop,TS val 2949600742 ecr 3439036253], length 0
10:30:38.360077 IP 10.0.1.2.830 > 10.0.1.200.55398: Flags [P.], seq 1735:1783, ack 2121, win 501, options [nop,nop,TS val 2949600786 ecr 3439036253], length 48
10:30:38.360082 IP 10.0.1.200.55398 > 10.0.1.2.830: Flags [.], ack 1783, win 501, options [nop,nop,TS val 3439036297 ecr 2949600786], length 0
10:30:38.386009 IP 10.0.1.200.55398 > 10.0.1.2.830: Flags [P.], seq 2121:2201, ack 1783, win 501, options [nop,nop,TS val 3439036323 ecr 2949600786], length 80
10:30:38.386028 IP 10.0.1.2.830 > 10.0.1.200.55398: Flags [.], ack 2201, win 501, options [nop,nop,TS val 2949600812 ecr 3439036323], length 0
10:30:38.410478 IP 10.0.1.2.830 > 10.0.1.200.55398: Flags [P.], seq 1783:1847, ack 2201, win 501, options [nop,nop,TS val 2949600837 ecr 3439036323], length 64
10:30:38.418159 IP 10.0.1.200.55398 > 10.0.1.2.830: Flags [P.], seq 2201:2281, ack 1847, win 501, options [nop,nop,TS val 3439036355 ecr 2949600837], length 80
10:30:38.458362 IP 10.0.1.2.830 > 10.0.1.200.55398: Flags [.], ack 2281, win 501, options [nop,nop,TS val 2949600885 ecr 3439036355], length 0
10:30:38.461155 IP 10.0.1.2.830 > 10.0.1.200.55398: Flags [P.], seq 1847:1895, ack 2281, win 501, options [nop,nop,TS val 2949600887 ecr 3439036355], length 48
10:30:38.461754 IP 10.0.1.2.830 > 10.0.1.200.55398: Flags [P.], seq 1895:4791, ack 2281, win 501, options [nop,nop,TS val 2949600888 ecr 3439036355], length 2896
10:30:38.461817 IP 10.0.1.200.55398 > 10.0.1.2.830: Flags [.], ack 4791, win 491, options [nop,nop,TS val 3439036399 ecr 2949600887], length 0
10:30:38.461837 IP 10.0.1.2.830 > 10.0.1.200.55398: Flags [P.], seq 4791:5479, ack 2281, win 501, options [nop,nop,TS val 2949600888 ecr 3439036399], length 688
10:30:38.465320 IP 10.0.1.200.55398 > 10.0.1.2.830: Flags [P.], seq 2281:3625, ack 5479, win 501, options [nop,nop,TS val 3439036403 ecr 2949600888], length 1344
10:30:38.465467 IP 10.0.1.2.830 > 10.0.1.200.55398: Flags [P.], seq 5479:5543, ack 3625, win 501, options [nop,nop,TS val 2949600892 ecr 3439036403], length 64
10:30:38.468560 IP 10.0.1.200.5000 > 10.0.1.2.35034: Flags [P.], seq 1:18, ack 675, win 504, options [nop,nop,TS val 3439036406 ecr 2949600640], length 17
10:30:38.468632 IP 10.0.1.2.35034 > 10.0.1.200.5000: Flags [.], ack 18, win 502, options [nop,nop,TS val 2949600895 ecr 3439036406], length 0
10:30:38.468752 IP 10.0.1.200.5000 > 10.0.1.2.35034: Flags [P.], seq 18:58, ack 675, win 504, options [nop,nop,TS val 3439036406 ecr 2949600895], length 40
10:30:38.468789 IP 10.0.1.2.35034 > 10.0.1.200.5000: Flags [.], ack 58, win 502, options [nop,nop,TS val 2949600895 ecr 3439036406], length 0
10:30:38.468850 IP 10.0.1.200.5000 > 10.0.1.2.35034: Flags [P.], seq 58:77, ack 675, win 504, options [nop,nop,TS val 3439036406 ecr 2949600895], length 19
10:30:38.468868 IP 10.0.1.2.35034 > 10.0.1.200.5000: Flags [.], ack 77, win 502, options [nop,nop,TS val 2949600895 ecr 3439036406], length 0
10:30:38.468945 IP 10.0.1.200.5000 > 10.0.1.2.35034: Flags [P.], seq 77:115, ack 675, win 504, options [nop,nop,TS val 3439036406 ecr 2949600895], length 38
10:30:38.468966 IP 10.0.1.2.35034 > 10.0.1.200.5000: Flags [.], ack 115, win 502, options [nop,nop,TS val 2949600895 ecr 3439036406], length 0
10:30:38.469022 IP 10.0.1.200.5000 > 10.0.1.2.35034: Flags [P.], seq 115:152, ack 675, win 504, options [nop,nop,TS val 3439036406 ecr 2949600895], length 37
10:30:38.469041 IP 10.0.1.2.35034 > 10.0.1.200.5000: Flags [.], ack 152, win 502, options [nop,nop,TS val 2949600895 ecr 3439036406], length 0
10:30:38.469079 IP 10.0.1.200.5000 > 10.0.1.2.35034: Flags [P.], seq 152:154, ack 675, win 504, options [nop,nop,TS val 3439036406 ecr 2949600895], length 2
10:30:38.469096 IP 10.0.1.2.35034 > 10.0.1.200.5000: Flags [.], ack 154, win 502, options [nop,nop,TS val 2949600895 ecr 3439036406], length 0
10:30:38.469129 IP 10.0.1.200.5000 > 10.0.1.2.35034: Flags [P.], seq 154:156, ack 675, win 504, options [nop,nop,TS val 3439036406 ecr 2949600895], length 2
10:30:38.469146 IP 10.0.1.2.35034 > 10.0.1.200.5000: Flags [.], ack 156, win 502, options [nop,nop,TS val 2949600895 ecr 3439036406], length 0
10:30:38.469226 IP 10.0.1.2.35034 > 10.0.1.200.5000: Flags [F.], seq 675, ack 156, win 502, options [nop,nop,TS val 2949600895 ecr 3439036406], length 0
10:30:38.469847 IP 10.0.1.200.5000 > 10.0.1.2.35034: Flags [F.], seq 156, ack 676, win 504, options [nop,nop,TS val 3439036407 ecr 2949600895], length 0
10:30:38.469909 IP 10.0.1.2.35034 > 10.0.1.200.5000: Flags [.], ack 157, win 502, options [nop,nop,TS val 2949600896 ecr 3439036407], length 0
10:30:38.506338 IP 10.0.1.200.55398 > 10.0.1.2.830: Flags [.], ack 5543, win 501, options [nop,nop,TS val 3439036444 ecr 2949600892], length 0
10:30:38.565995 IP 10.0.1.200.55398 > 10.0.1.2.830: Flags [P.], seq 3625:5273, ack 5543, win 501, options [nop,nop,TS val 3439036503 ecr 2949600892], length 1648
10:30:38.566019 IP 10.0.1.2.830 > 10.0.1.200.55398: Flags [.], ack 5273, win 501, options [nop,nop,TS val 2949600992 ecr 3439036503], length 0
10:30:38.573832 IP 10.0.1.2.830 > 10.0.1.200.55398: Flags [P.], seq 5543:5607, ack 5273, win 501, options [nop,nop,TS val 2949601000 ecr 3439036503], length 64
10:30:38.573984 IP 10.0.1.200.55398 > 10.0.1.2.830: Flags [.], ack 5607, win 501, options [nop,nop,TS val 3439036511 ecr 2949601000], length 0
10:30:38.574597 IP 10.0.1.200.55398 > 10.0.1.2.830: Flags [P.], seq 5273:7065, ack 5607, win 501, options [nop,nop,TS val 3439036512 ecr 2949601000], length 1792
10:30:38.574724 IP 10.0.1.2.830 > 10.0.1.200.55398: Flags [.], ack 7065, win 501, options [nop,nop,TS val 2949601001 ecr 3439036512], length 0
10:30:38.574786 IP 10.0.1.2.830 > 10.0.1.200.55398: Flags [P.], seq 5607:5895, ack 7065, win 501, options [nop,nop,TS val 2949601001 ecr 3439036512], length 288
10:30:38.574840 IP 10.0.1.200.55398 > 10.0.1.2.830: Flags [.], ack 5895, win 501, options [nop,nop,TS val 3439036512 ecr 2949601001], length 0
10:30:38.575106 IP 10.0.1.2.830 > 10.0.1.200.55398: Flags [P.], seq 5895:5959, ack 7065, win 501, options [nop,nop,TS val 2949601001 ecr 3439036512], length 64
10:30:38.575156 IP 10.0.1.200.55398 > 10.0.1.2.830: Flags [.], ack 5959, win 501, options [nop,nop,TS val 3439036512 ecr 2949601001], length 0
10:30:38.580617 IP 10.0.1.2.830 > 10.0.1.200.55398: Flags [P.], seq 5959:6023, ack 7065, win 501, options [nop,nop,TS val 2949601007 ecr 3439036512], length 64
10:30:38.580686 IP 10.0.1.200.55398 > 10.0.1.2.830: Flags [.], ack 6023, win 501, options [nop,nop,TS val 3439036518 ecr 2949601007], length 0
10:30:38.581000 IP 10.0.1.2.830 > 10.0.1.200.55398: Flags [P.], seq 6023:6311, ack 7065, win 501, options [nop,nop,TS val 2949601007 ecr 3439036518], length 288
10:30:38.581091 IP 10.0.1.200.55398 > 10.0.1.2.830: Flags [.], ack 6311, win 501, options [nop,nop,TS val 3439036518 ecr 2949601007], length 0
10:30:38.581399 IP 10.0.1.2.830 > 10.0.1.200.55398: Flags [P.], seq 6311:6375, ack 7065, win 501, options [nop,nop,TS val 2949601008 ecr 3439036518], length 64
10:30:38.581454 IP 10.0.1.200.55398 > 10.0.1.2.830: Flags [.], ack 6375, win 501, options [nop,nop,TS val 3439036519 ecr 2949601008], length 0
10:30:40.911697 ARP, Request who-has 10.0.1.200 tell 10.0.1.4, length 28
10:30:40.911705 ARP, Reply 10.0.1.200 is-at 02:42:0a:00:01:c8 (oui Unknown), length 28
10:30:40.911726 IP 10.0.1.4.41570 > 10.0.1.200.5000: Flags [S], seq 1324135458, win 64240, options [mss 1460,sackOK,TS val 1710637489 ecr 0,nop,wscale 7], length 0
10:30:40.911746 IP 10.0.1.200.5000 > 10.0.1.4.41570: Flags [S.], seq 1189617740, ack 1324135459, win 65160, options [mss 1460,sackOK,TS val 3935254734 ecr 1710637489,nop,wscale 7], length 0
10:30:40.911768 IP 10.0.1.4.41570 > 10.0.1.200.5000: Flags [.], ack 1, win 502, options [nop,nop,TS val 1710637489 ecr 3935254734], length 0
10:30:40.912186 IP 10.0.1.4.41570 > 10.0.1.200.5000: Flags [P.], seq 1:675, ack 1, win 502, options [nop,nop,TS val 1710637489 ecr 3935254734], length 674
10:30:40.912196 IP 10.0.1.200.5000 > 10.0.1.4.41570: Flags [.], ack 675, win 504, options [nop,nop,TS val 3935254734 ecr 1710637489], length 0
10:30:40.930759 IP 10.0.1.200.37246 > 10.0.1.4.830: Flags [S], seq 2458310414, win 64240, options [mss 1460,sackOK,TS val 3935254753 ecr 0,nop,wscale 7], length 0
10:30:40.930788 IP 10.0.1.4.830 > 10.0.1.200.37246: Flags [S.], seq 3370411841, ack 2458310415, win 65160, options [mss 1460,sackOK,TS val 1710637508 ecr 3935254753,nop,wscale 7], length 0
10:30:40.930797 IP 10.0.1.200.37246 > 10.0.1.4.830: Flags [.], ack 1, win 502, options [nop,nop,TS val 3935254753 ecr 1710637508], length 0
10:30:40.931174 IP 10.0.1.4.830 > 10.0.1.200.37246: Flags [P.], seq 1:23, ack 1, win 510, options [nop,nop,TS val 1710637508 ecr 3935254753], length 22
10:30:40.931214 IP 10.0.1.200.37246 > 10.0.1.4.830: Flags [.], ack 23, win 502, options [nop,nop,TS val 3935254753 ecr 1710637508], length 0
10:30:40.931720 IP 10.0.1.200.37246 > 10.0.1.4.830: Flags [P.], seq 1:25, ack 23, win 502, options [nop,nop,TS val 3935254754 ecr 1710637508], length 24
10:30:40.931751 IP 10.0.1.4.830 > 10.0.1.200.37246: Flags [.], ack 25, win 510, options [nop,nop,TS val 1710637509 ecr 3935254754], length 0
10:30:40.932463 IP 10.0.1.4.830 > 10.0.1.200.37246: Flags [P.], seq 23:535, ack 25, win 510, options [nop,nop,TS val 1710637510 ecr 3935254754], length 512
10:30:40.932470 IP 10.0.1.200.37246 > 10.0.1.4.830: Flags [.], ack 535, win 501, options [nop,nop,TS val 3935254755 ecr 1710637510], length 0
10:30:40.932855 IP 10.0.1.200.37246 > 10.0.1.4.830: Flags [P.], seq 25:825, ack 535, win 501, options [nop,nop,TS val 3935254755 ecr 1710637510], length 800
10:30:40.932877 IP 10.0.1.4.830 > 10.0.1.200.37246: Flags [.], ack 825, win 504, options [nop,nop,TS val 1710637510 ecr 3935254755], length 0
10:30:40.934108 IP 10.0.1.200.37246 > 10.0.1.4.830: Flags [P.], seq 825:873, ack 535, win 501, options [nop,nop,TS val 3935254756 ecr 1710637510], length 48
10:30:40.934131 IP 10.0.1.4.830 > 10.0.1.200.37246: Flags [.], ack 873, win 504, options [nop,nop,TS val 1710637511 ecr 3935254756], length 0
10:30:40.956672 IP 10.0.1.4.830 > 10.0.1.200.37246: Flags [P.], seq 535:1655, ack 873, win 504, options [nop,nop,TS val 1710637534 ecr 3935254756], length 1120
10:30:40.956678 IP 10.0.1.200.37246 > 10.0.1.4.830: Flags [.], ack 1655, win 501, options [nop,nop,TS val 3935254779 ecr 1710637534], length 0
10:30:40.957304 IP 10.0.1.200.37246 > 10.0.1.4.830: Flags [P.], seq 873:889, ack 1655, win 501, options [nop,nop,TS val 3935254780 ecr 1710637534], length 16
10:30:40.957515 IP 10.0.1.4.830 > 10.0.1.200.37246: Flags [.], ack 889, win 504, options [nop,nop,TS val 1710637535 ecr 3935254780], length 0
10:30:40.958416 IP 10.0.1.4.830 > 10.0.1.200.37246: Flags [P.], seq 1655:1671, ack 889, win 504, options [nop,nop,TS val 1710637536 ecr 3935254780], length 16
10:30:40.958422 IP 10.0.1.200.37246 > 10.0.1.4.830: Flags [.], ack 1671, win 501, options [nop,nop,TS val 3935254781 ecr 1710637536], length 0
10:30:40.984745 IP 10.0.1.200.37246 > 10.0.1.4.830: Flags [P.], seq 889:953, ack 1671, win 501, options [nop,nop,TS val 3935254807 ecr 1710637536], length 64
10:30:40.984764 IP 10.0.1.4.830 > 10.0.1.200.37246: Flags [.], ack 953, win 504, options [nop,nop,TS val 1710637562 ecr 3935254807], length 0
10:30:41.009654 IP 10.0.1.4.830 > 10.0.1.200.37246: Flags [P.], seq 1671:1735, ack 953, win 504, options [nop,nop,TS val 1710637587 ecr 3935254807], length 64
10:30:41.009660 IP 10.0.1.200.37246 > 10.0.1.4.830: Flags [.], ack 1735, win 501, options [nop,nop,TS val 3935254832 ecr 1710637587], length 0
10:30:41.016879 IP 10.0.1.200.37246 > 10.0.1.4.830: Flags [P.], seq 953:2121, ack 1735, win 501, options [nop,nop,TS val 3935254839 ecr 1710637587], length 1168
10:30:41.016913 IP 10.0.1.4.830 > 10.0.1.200.37246: Flags [.], ack 2121, win 501, options [nop,nop,TS val 1710637594 ecr 3935254839], length 0
10:30:41.060428 IP 10.0.1.4.830 > 10.0.1.200.37246: Flags [P.], seq 1735:1783, ack 2121, win 501, options [nop,nop,TS val 1710637638 ecr 3935254839], length 48
10:30:41.085291 IP 10.0.1.200.37246 > 10.0.1.4.830: Flags [P.], seq 2121:2201, ack 1783, win 501, options [nop,nop,TS val 3935254908 ecr 1710637638], length 80
10:30:41.085324 IP 10.0.1.4.830 > 10.0.1.200.37246: Flags [.], ack 2201, win 501, options [nop,nop,TS val 1710637663 ecr 3935254908], length 0
10:30:41.110921 IP 10.0.1.4.830 > 10.0.1.200.37246: Flags [P.], seq 1783:1847, ack 2201, win 501, options [nop,nop,TS val 1710637688 ecr 3935254908], length 64
10:30:41.117420 IP 10.0.1.200.37246 > 10.0.1.4.830: Flags [P.], seq 2201:2281, ack 1847, win 501, options [nop,nop,TS val 3935254940 ecr 1710637688], length 80
10:30:41.158429 IP 10.0.1.4.830 > 10.0.1.200.37246: Flags [.], ack 2281, win 501, options [nop,nop,TS val 1710637736 ecr 3935254940], length 0
10:30:41.161780 IP 10.0.1.4.830 > 10.0.1.200.37246: Flags [P.], seq 1847:1895, ack 2281, win 501, options [nop,nop,TS val 1710637739 ecr 3935254940], length 48
10:30:41.162400 IP 10.0.1.4.830 > 10.0.1.200.37246: Flags [P.], seq 1895:4791, ack 2281, win 501, options [nop,nop,TS val 1710637740 ecr 3935254940], length 2896
10:30:41.162498 IP 10.0.1.200.37246 > 10.0.1.4.830: Flags [.], ack 4791, win 496, options [nop,nop,TS val 3935254985 ecr 1710637739], length 0
10:30:41.162537 IP 10.0.1.4.830 > 10.0.1.200.37246: Flags [P.], seq 4791:5479, ack 2281, win 501, options [nop,nop,TS val 1710637740 ecr 3935254985], length 688
10:30:41.164358 IP 10.0.1.200.37246 > 10.0.1.4.830: Flags [P.], seq 2281:3625, ack 5479, win 501, options [nop,nop,TS val 3935254987 ecr 1710637740], length 1344
10:30:41.164484 IP 10.0.1.4.830 > 10.0.1.200.37246: Flags [P.], seq 5479:5543, ack 3625, win 501, options [nop,nop,TS val 1710637742 ecr 3935254987], length 64
10:30:41.166514 IP 10.0.1.200.5000 > 10.0.1.4.41570: Flags [P.], seq 1:18, ack 675, win 504, options [nop,nop,TS val 3935254989 ecr 1710637489], length 17
10:30:41.166552 IP 10.0.1.4.41570 > 10.0.1.200.5000: Flags [.], ack 18, win 502, options [nop,nop,TS val 1710637744 ecr 3935254989], length 0
10:30:41.166704 IP 10.0.1.200.5000 > 10.0.1.4.41570: Flags [P.], seq 18:58, ack 675, win 504, options [nop,nop,TS val 3935254989 ecr 1710637744], length 40
10:30:41.166769 IP 10.0.1.4.41570 > 10.0.1.200.5000: Flags [.], ack 58, win 502, options [nop,nop,TS val 1710637744 ecr 3935254989], length 0
10:30:41.166793 IP 10.0.1.200.5000 > 10.0.1.4.41570: Flags [P.], seq 58:77, ack 675, win 504, options [nop,nop,TS val 3935254989 ecr 1710637744], length 19
10:30:41.166805 IP 10.0.1.4.41570 > 10.0.1.200.5000: Flags [.], ack 77, win 502, options [nop,nop,TS val 1710637744 ecr 3935254989], length 0
10:30:41.166843 IP 10.0.1.200.5000 > 10.0.1.4.41570: Flags [P.], seq 77:115, ack 675, win 504, options [nop,nop,TS val 3935254989 ecr 1710637744], length 38
10:30:41.166861 IP 10.0.1.4.41570 > 10.0.1.200.5000: Flags [.], ack 115, win 502, options [nop,nop,TS val 1710637744 ecr 3935254989], length 0
10:30:41.166917 IP 10.0.1.200.5000 > 10.0.1.4.41570: Flags [P.], seq 115:152, ack 675, win 504, options [nop,nop,TS val 3935254989 ecr 1710637744], length 37
10:30:41.166935 IP 10.0.1.4.41570 > 10.0.1.200.5000: Flags [.], ack 152, win 502, options [nop,nop,TS val 1710637744 ecr 3935254989], length 0
10:30:41.166971 IP 10.0.1.200.5000 > 10.0.1.4.41570: Flags [P.], seq 152:154, ack 675, win 504, options [nop,nop,TS val 3935254989 ecr 1710637744], length 2
10:30:41.166987 IP 10.0.1.4.41570 > 10.0.1.200.5000: Flags [.], ack 154, win 502, options [nop,nop,TS val 1710637744 ecr 3935254989], length 0
10:30:41.167017 IP 10.0.1.200.5000 > 10.0.1.4.41570: Flags [P.], seq 154:156, ack 675, win 504, options [nop,nop,TS val 3935254989 ecr 1710637744], length 2
10:30:41.167032 IP 10.0.1.4.41570 > 10.0.1.200.5000: Flags [.], ack 156, win 502, options [nop,nop,TS val 1710637744 ecr 3935254989], length 0
10:30:41.167107 IP 10.0.1.4.41570 > 10.0.1.200.5000: Flags [F.], seq 675, ack 156, win 502, options [nop,nop,TS val 1710637744 ecr 3935254989], length 0
10:30:41.168066 IP 10.0.1.200.5000 > 10.0.1.4.41570: Flags [F.], seq 156, ack 676, win 504, options [nop,nop,TS val 3935254990 ecr 1710637744], length 0
10:30:41.168096 IP 10.0.1.4.41570 > 10.0.1.200.5000: Flags [.], ack 157, win 502, options [nop,nop,TS val 1710637745 ecr 3935254990], length 0
10:30:41.206344 IP 10.0.1.200.37246 > 10.0.1.4.830: Flags [.], ack 5543, win 501, options [nop,nop,TS val 3935255029 ecr 1710637742], length 0
10:30:41.265020 IP 10.0.1.200.37246 > 10.0.1.4.830: Flags [P.], seq 3625:5273, ack 5543, win 501, options [nop,nop,TS val 3935255087 ecr 1710637742], length 1648
10:30:41.265043 IP 10.0.1.4.830 > 10.0.1.200.37246: Flags [.], ack 5273, win 501, options [nop,nop,TS val 1710637842 ecr 3935255087], length 0
10:30:41.270731 IP 10.0.1.4.830 > 10.0.1.200.37246: Flags [P.], seq 5543:5607, ack 5273, win 501, options [nop,nop,TS val 1710637848 ecr 3935255087], length 64
10:30:41.270944 IP 10.0.1.200.37246 > 10.0.1.4.830: Flags [.], ack 5607, win 501, options [nop,nop,TS val 3935255093 ecr 1710637848], length 0
10:30:41.270964 IP 10.0.1.4.830 > 10.0.1.200.37246: Flags [P.], seq 5607:5959, ack 5273, win 501, options [nop,nop,TS val 1710637848 ecr 3935255093], length 352
10:30:41.271214 IP 10.0.1.200.37246 > 10.0.1.4.830: Flags [.], ack 5959, win 501, options [nop,nop,TS val 3935255093 ecr 1710637848], length 0
10:30:41.271773 IP 10.0.1.200.37246 > 10.0.1.4.830: Flags [P.], seq 5273:8473, ack 5959, win 501, options [nop,nop,TS val 3935255094 ecr 1710637848], length 3200
10:30:41.290321 IP 10.0.1.200.37246 > 10.0.1.4.830: Flags [P.], seq 8169:8473, ack 5959, win 501, options [nop,nop,TS val 3935255113 ecr 1710637848], length 304
10:30:41.290350 IP 10.0.1.4.830 > 10.0.1.200.37246: Flags [.], ack 8473, win 495, options [nop,nop,TS val 1710637868 ecr 3935255094,nop,nop,sack 1 {8169:8473}], length 0
10:30:41.328673 IP 10.0.1.4.830 > 10.0.1.200.37246: Flags [P.], seq 5959:6023, ack 8473, win 501, options [nop,nop,TS val 1710637906 ecr 3935255094], length 64
10:30:41.328823 IP 10.0.1.200.37246 > 10.0.1.4.830: Flags [.], ack 6023, win 501, options [nop,nop,TS val 3935255151 ecr 1710637906], length 0
10:30:41.329116 IP 10.0.1.4.830 > 10.0.1.200.37246: Flags [P.], seq 6023:6311, ack 8473, win 501, options [nop,nop,TS val 1710637906 ecr 3935255151], length 288
10:30:41.329460 IP 10.0.1.200.37246 > 10.0.1.4.830: Flags [.], ack 6311, win 501, options [nop,nop,TS val 3935255152 ecr 1710637906], length 0
10:30:41.329478 IP 10.0.1.4.830 > 10.0.1.200.37246: Flags [P.], seq 6311:6375, ack 8473, win 501, options [nop,nop,TS val 1710637907 ecr 3935255152], length 64
10:30:41.329656 IP 10.0.1.200.37246 > 10.0.1.4.830: Flags [.], ack 6375, win 501, options [nop,nop,TS val 3935255152 ecr 1710637907], length 0
10:30:42.320930 IP6 NotebookLab.mdns > ff02::fb.mdns: 0*- [0q] 2/0/0 (Cache flush) PTR NotebookLab-8838.local., (Cache flush) AAAA fe80::cc38:5cff:fe31:454 (148)
10:30:42.321089 IP6 NotebookLab.mdns > ff02::fb.mdns: 0*- [0q] 2/0/0 (Cache flush) PTR NotebookLab-8838.local., (Cache flush) AAAA fe80::42:1bff:fe92:b8ad (148)
10:30:42.321137 IP NotebookLab.mdns > 224.0.0.251.mdns: 0*- [0q] 4/0/0 (Cache flush) PTR NotebookLab-8838.local., (Cache flush) A 10.0.1.1, (Cache flush) PTR NotebookLab-8838.local., (Cache flush) AAAA fe80::42:1bff:fe92:b8ad (195)
10:30:42.549256 IP6 NotebookLab.mdns > ff02::fb.mdns: 0 [2q] [2n] ANY (QM)? 4.5.4.0.1.3.e.f.f.f.c.5.8.3.c.c.0.0.0.0.0.0.0.0.0.0.0.0.0.8.e.f.ip6.arpa. ANY (QM)? NotebookLab-8839.local. (160)
10:30:42.549407 IP6 NotebookLab.mdns > ff02::fb.mdns: 0 [2q] [2n] ANY (QM)? d.a.8.b.2.9.e.f.f.f.b.1.2.4.0.0.0.0.0.0.0.0.0.0.0.0.0.0.0.8.e.f.ip6.arpa. ANY (QM)? NotebookLab-8839.local. (160)
10:30:42.549451 IP NotebookLab.mdns > 224.0.0.251.mdns: 0 [3q] [4n] ANY (QM)? d.a.8.b.2.9.e.f.f.f.b.1.2.4.0.0.0.0.0.0.0.0.0.0.0.0.0.0.0.8.e.f.ip6.arpa. ANY (QM)? NotebookLab-8839.local. ANY (QM)? 1.1.0.10.in-addr.arpa. (213)
10:30:42.799798 IP6 NotebookLab.mdns > ff02::fb.mdns: 0 [2q] [2n] ANY (QM)? 4.5.4.0.1.3.e.f.f.f.c.5.8.3.c.c.0.0.0.0.0.0.0.0.0.0.0.0.0.8.e.f.ip6.arpa. ANY (QM)? NotebookLab-8839.local. (160)
10:30:42.799950 IP6 NotebookLab.mdns > ff02::fb.mdns: 0 [2q] [2n] ANY (QM)? d.a.8.b.2.9.e.f.f.f.b.1.2.4.0.0.0.0.0.0.0.0.0.0.0.0.0.0.0.8.e.f.ip6.arpa. ANY (QM)? NotebookLab-8839.local. (160)
10:30:42.799993 IP NotebookLab.mdns > 224.0.0.251.mdns: 0 [3q] [4n] ANY (QM)? d.a.8.b.2.9.e.f.f.f.b.1.2.4.0.0.0.0.0.0.0.0.0.0.0.0.0.0.0.8.e.f.ip6.arpa. ANY (QM)? NotebookLab-8839.local. ANY (QM)? 1.1.0.10.in-addr.arpa. (213)
10:30:43.050471 IP6 NotebookLab.mdns > ff02::fb.mdns: 0 [2q] [2n] ANY (QM)? 4.5.4.0.1.3.e.f.f.f.c.5.8.3.c.c.0.0.0.0.0.0.0.0.0.0.0.0.0.8.e.f.ip6.arpa. ANY (QM)? NotebookLab-8839.local. (160)
10:30:43.050630 IP6 NotebookLab.mdns > ff02::fb.mdns: 0 [2q] [2n] ANY (QM)? d.a.8.b.2.9.e.f.f.f.b.1.2.4.0.0.0.0.0.0.0.0.0.0.0.0.0.0.0.8.e.f.ip6.arpa. ANY (QM)? NotebookLab-8839.local. (160)
10:30:43.050675 IP NotebookLab.mdns > 224.0.0.251.mdns: 0 [3q] [4n] ANY (QM)? d.a.8.b.2.9.e.f.f.f.b.1.2.4.0.0.0.0.0.0.0.0.0.0.0.0.0.0.0.8.e.f.ip6.arpa. ANY (QM)? NotebookLab-8839.local. ANY (QM)? 1.1.0.10.in-addr.arpa. (213)
10:30:43.250769 IP6 NotebookLab.mdns > ff02::fb.mdns: 0*- [0q] 2/0/0 (Cache flush) PTR NotebookLab-8839.local., (Cache flush) AAAA fe80::cc38:5cff:fe31:454 (148)
10:30:43.250924 IP NotebookLab.mdns > 224.0.0.251.mdns: 0*- [0q] 4/0/0 (Cache flush) PTR NotebookLab-8839.local., (Cache flush) A 10.0.1.1, (Cache flush) PTR NotebookLab-8839.local., (Cache flush) AAAA fe80::42:1bff:fe92:b8ad (195)
10:30:43.250964 IP6 NotebookLab.mdns > ff02::fb.mdns: 0*- [0q] 2/0/0 (Cache flush) PTR NotebookLab-8839.local., (Cache flush) AAAA fe80::42:1bff:fe92:b8ad (148)
10:30:44.429390 IP6 NotebookLab.mdns > ff02::fb.mdns: 0*- [0q] 2/0/0 (Cache flush) PTR NotebookLab-8839.local., (Cache flush) AAAA fe80::cc38:5cff:fe31:454 (148)
10:30:44.429558 IP NotebookLab.mdns > 224.0.0.251.mdns: 0*- [0q] 4/0/0 (Cache flush) PTR NotebookLab-8839.local., (Cache flush) A 10.0.1.1, (Cache flush) PTR NotebookLab-8839.local., (Cache flush) AAAA fe80::42:1bff:fe92:b8ad (195)
10:30:44.429598 IP6 NotebookLab.mdns > ff02::fb.mdns: 0*- [0q] 2/0/0 (Cache flush) PTR NotebookLab-8839.local., (Cache flush) AAAA fe80::42:1bff:fe92:b8ad (148)
10:30:46.609513 IP6 NotebookLab.mdns > ff02::fb.mdns: 0*- [0q] 2/0/0 (Cache flush) PTR NotebookLab-8839.local., (Cache flush) AAAA fe80::cc38:5cff:fe31:454 (148)
10:30:46.609704 IP NotebookLab.mdns > 224.0.0.251.mdns: 0*- [0q] 4/0/0 (Cache flush) PTR NotebookLab-8839.local., (Cache flush) A 10.0.1.1, (Cache flush) PTR NotebookLab-8839.local., (Cache flush) AAAA fe80::42:1bff:fe92:b8ad (195)
10:30:46.609751 IP6 NotebookLab.mdns > ff02::fb.mdns: 0*- [0q] 2/0/0 (Cache flush) PTR NotebookLab-8839.local., (Cache flush) AAAA fe80::42:1bff:fe92:b8ad (148)
10:30:48.566353 IP6 NotebookLab > ip6-allrouters: ICMP6, router solicitation, length 16
