"No.","Time","Source","Destination","Protocol","Length","Info"
"5","1.646747","192.168.123.5","192.168.123.20","TCP","74","39420  >  666 [SYN] Seq=0 Win=64240 Len=0 MSS=1460 SACK_PERM=1 TSval=910590870 TSecr=0 WS=128"
"6","1.646818","192.168.123.20","192.168.123.5","TCP","74","666  >  39420 [SYN, ACK] Seq=0 Ack=1 Win=65160 Len=0 MSS=1460 SACK_PERM=1 TSval=3139907700 TSecr=910590870 WS=128"
"7","1.646859","192.168.123.5","192.168.123.20","TCP","66","39420  >  666 [ACK] Seq=1 Ack=1 Win=64256 Len=0 TSval=910590870 TSecr=3139907700"
"8","1.647090","192.168.123.5","192.168.123.20","TLSv1.3","353","Client Hello"
"9","1.647157","192.168.123.20","192.168.123.5","TCP","66","666  >  39420 [ACK] Seq=1 Ack=288 Win=64896 Len=0 TSval=3139907700 TSecr=910590870"
"10","1.648480","192.168.123.20","192.168.123.5","TLSv1.3","1464","Server Hello, Change Cipher Spec, Application Data, Application Data, Application Data, Application Data, Application Data"
"11","1.648503","192.168.123.5","192.168.123.20","TCP","66","39420  >  666 [ACK] Seq=288 Ack=1399 Win=64128 Len=0 TSval=910590872 TSecr=3139907702"
"12","1.655832","192.168.123.5","192.168.123.20","TLSv1.3","756","Change Cipher Spec, Application Data, Application Data, Application Data"
"13","1.655852","192.168.123.20","192.168.123.5","TCP","66","666  >  39420 [ACK] Seq=1399 Ack=978 Win=64256 Len=0 TSval=3139907709 TSecr=910590879"
"14","1.656336","192.168.123.20","192.168.123.5","TLSv1.3","769","Application Data"
"15","1.656423","192.168.123.20","192.168.123.5","TLSv1.3","769","Application Data"
"16","1.656487","192.168.123.5","192.168.123.20","TCP","66","39420  >  666 [ACK] Seq=978 Ack=2102 Win=63488 Len=0 TSval=910590880 TSecr=3139907710"
"17","1.656501","192.168.123.5","192.168.123.20","TCP","66","39420  >  666 [ACK] Seq=978 Ack=2805 Win=62848 Len=0 TSval=910590880 TSecr=3139907710"
"20","1.694697","192.168.123.9","192.168.123.20","TCP","74","34986  >  666 [SYN] Seq=0 Win=64240 Len=0 MSS=1460 SACK_PERM=1 TSval=697399152 TSecr=0 WS=128"
"21","1.694751","192.168.123.20","192.168.123.9","TCP","74","666  >  34986 [SYN, ACK] Seq=0 Ack=1 Win=65160 Len=0 MSS=1460 SACK_PERM=1 TSval=481967159 TSecr=697399152 WS=128"
"22","1.694775","192.168.123.9","192.168.123.20","TCP","66","34986  >  666 [ACK] Seq=1 Ack=1 Win=64256 Len=0 TSval=697399152 TSecr=481967159"
"23","1.694993","192.168.123.9","192.168.123.20","TLSv1.3","353","Client Hello"
"24","1.695086","192.168.123.20","192.168.123.9","TCP","66","666  >  34986 [ACK] Seq=1 Ack=288 Win=64896 Len=0 TSval=481967159 TSecr=697399152"
"25","1.696805","192.168.123.20","192.168.123.9","TLSv1.3","1464","Server Hello, Change Cipher Spec, Application Data, Application Data, Application Data, Application Data, Application Data"
"26","1.696831","192.168.123.9","192.168.123.20","TCP","66","34986  >  666 [ACK] Seq=288 Ack=1399 Win=64128 Len=0 TSval=697399154 TSecr=481967161"
"27","1.701071","192.168.123.9","192.168.123.20","TLSv1.3","756","Change Cipher Spec, Application Data, Application Data, Application Data"
"28","1.701104","192.168.123.20","192.168.123.9","TCP","66","666  >  34986 [ACK] Seq=1399 Ack=978 Win=64256 Len=0 TSval=481967165 TSecr=697399158"
"29","1.701636","192.168.123.20","192.168.123.9","TLSv1.3","769","Application Data"
"30","1.701659","192.168.123.9","192.168.123.20","TCP","66","34986  >  666 [ACK] Seq=978 Ack=2102 Win=64128 Len=0 TSval=697399159 TSecr=481967166"
"31","1.701764","192.168.123.20","192.168.123.9","TLSv1.3","769","Application Data"
"32","1.701776","192.168.123.9","192.168.123.20","TCP","66","34986  >  666 [ACK] Seq=978 Ack=2805 Win=64128 Len=0 TSval=697399159 TSecr=481967166"
"35","1.702981","192.168.123.2","192.168.123.20","TCP","74","36964  >  666 [SYN] Seq=0 Win=64240 Len=0 MSS=1460 SACK_PERM=1 TSval=230784893 TSecr=0 WS=128"
"36","1.703007","192.168.123.20","192.168.123.2","TCP","74","666  >  36964 [SYN, ACK] Seq=0 Ack=1 Win=65160 Len=0 MSS=1460 SACK_PERM=1 TSval=238768327 TSecr=230784893 WS=128"
"37","1.703027","192.168.123.2","192.168.123.20","TCP","66","36964  >  666 [ACK] Seq=1 Ack=1 Win=64256 Len=0 TSval=230784893 TSecr=238768327"
"38","1.703223","192.168.123.2","192.168.123.20","TLSv1.3","353","Client Hello"
"39","1.703275","192.168.123.20","192.168.123.2","TCP","66","666  >  36964 [ACK] Seq=1 Ack=288 Win=64896 Len=0 TSval=238768328 TSecr=230784894"
"42","1.704653","192.168.123.8","192.168.123.20","TCP","74","38406  >  666 [SYN] Seq=0 Win=64240 Len=0 MSS=1460 SACK_PERM=1 TSval=2018949443 TSecr=0 WS=128"
"43","1.704685","192.168.123.20","192.168.123.8","TCP","74","666  >  38406 [SYN, ACK] Seq=0 Ack=1 Win=65160 Len=0 MSS=1460 SACK_PERM=1 TSval=2111375948 TSecr=2018949443 WS=128"
"44","1.704728","192.168.123.8","192.168.123.20","TCP","66","38406  >  666 [ACK] Seq=1 Ack=1 Win=64256 Len=0 TSval=2018949443 TSecr=2111375948"
"45","1.704803","192.168.123.20","192.168.123.2","TLSv1.3","1464","Server Hello, Change Cipher Spec, Application Data, Application Data, Application Data, Application Data, Application Data"
"46","1.704848","192.168.123.2","192.168.123.20","TCP","66","36964  >  666 [ACK] Seq=288 Ack=1399 Win=64128 Len=0 TSval=230784895 TSecr=238768329"
"47","1.705014","192.168.123.8","192.168.123.20","TLSv1.3","353","Client Hello"
"48","1.705081","192.168.123.20","192.168.123.8","TCP","66","666  >  38406 [ACK] Seq=1 Ack=288 Win=64896 Len=0 TSval=2111375948 TSecr=2018949443"
"49","1.705829","192.168.123.20","192.168.123.8","TLSv1.3","1464","Server Hello, Change Cipher Spec, Application Data, Application Data, Application Data, Application Data, Application Data"
"50","1.705856","192.168.123.8","192.168.123.20","TCP","66","38406  >  666 [ACK] Seq=288 Ack=1399 Win=64128 Len=0 TSval=2018949444 TSecr=2111375949"
"53","1.706149","192.168.123.19","192.168.123.20","TCP","74","45640  >  666 [SYN] Seq=0 Win=64240 Len=0 MSS=1460 SACK_PERM=1 TSval=2576374929 TSecr=0 WS=128"
"54","1.706172","192.168.123.20","192.168.123.19","TCP","74","666  >  45640 [SYN, ACK] Seq=0 Ack=1 Win=65160 Len=0 MSS=1460 SACK_PERM=1 TSval=2908828405 TSecr=2576374929 WS=128"
"55","1.706192","192.168.123.19","192.168.123.20","TCP","66","45640  >  666 [ACK] Seq=1 Ack=1 Win=64256 Len=0 TSval=2576374930 TSecr=2908828405"
"56","1.706389","192.168.123.19","192.168.123.20","TLSv1.3","353","Client Hello"
"57","1.706438","192.168.123.20","192.168.123.19","TCP","66","666  >  45640 [ACK] Seq=1 Ack=288 Win=64896 Len=0 TSval=2908828405 TSecr=2576374930"
"58","1.706869","192.168.123.2","192.168.123.20","TLSv1.3","756","Change Cipher Spec, Application Data, Application Data, Application Data"
"59","1.706902","192.168.123.20","192.168.123.2","TCP","66","666  >  36964 [ACK] Seq=1399 Ack=978 Win=64256 Len=0 TSval=238768331 TSecr=230784897"
"60","1.707515","192.168.123.20","192.168.123.2","TLSv1.3","769","Application Data"
"61","1.707670","192.168.123.20","192.168.123.2","TLSv1.3","769","Application Data"
"62","1.707720","192.168.123.20","192.168.123.19","TLSv1.3","1464","Server Hello, Change Cipher Spec, Application Data, Application Data, Application Data, Application Data, Application Data"
"63","1.707746","192.168.123.19","192.168.123.20","TCP","66","45640  >  666 [ACK] Seq=288 Ack=1399 Win=64128 Len=0 TSval=2576374931 TSecr=2908828406"
"64","1.707761","192.168.123.2","192.168.123.20","TCP","66","36964  >  666 [ACK] Seq=978 Ack=2102 Win=63488 Len=0 TSval=230784898 TSecr=238768332"
"65","1.707786","192.168.123.2","192.168.123.20","TCP","66","36964  >  666 [ACK] Seq=978 Ack=2805 Win=62848 Len=0 TSval=230784898 TSecr=238768332"
"66","1.710373","192.168.123.8","192.168.123.20","TLSv1.3","756","Change Cipher Spec, Application Data, Application Data, Application Data"
"67","1.710397","192.168.123.20","192.168.123.8","TCP","66","666  >  38406 [ACK] Seq=1399 Ack=978 Win=64256 Len=0 TSval=2111375954 TSecr=2018949449"
"68","1.711003","192.168.123.20","192.168.123.8","TLSv1.3","769","Application Data"
"69","1.711152","192.168.123.20","192.168.123.8","TLSv1.3","769","Application Data"
"70","1.711236","192.168.123.8","192.168.123.20","TCP","66","38406  >  666 [ACK] Seq=978 Ack=2102 Win=63488 Len=0 TSval=2018949450 TSecr=2111375954"
"71","1.711258","192.168.123.8","192.168.123.20","TCP","66","38406  >  666 [ACK] Seq=978 Ack=2805 Win=62848 Len=0 TSval=2018949450 TSecr=2111375954"
"72","1.711890","192.168.123.19","192.168.123.20","TLSv1.3","756","Change Cipher Spec, Application Data, Application Data, Application Data"
"73","1.711912","192.168.123.20","192.168.123.19","TCP","66","666  >  45640 [ACK] Seq=1399 Ack=978 Win=64256 Len=0 TSval=2908828410 TSecr=2576374935"
"74","1.712349","192.168.123.20","192.168.123.19","TLSv1.3","769","Application Data"
"75","1.712449","192.168.123.20","192.168.123.19","TLSv1.3","769","Application Data"
"76","1.712517","192.168.123.19","192.168.123.20","TCP","66","45640  >  666 [ACK] Seq=978 Ack=2102 Win=63488 Len=0 TSval=2576374936 TSecr=2908828411"
"77","1.712534","192.168.123.19","192.168.123.20","TCP","66","45640  >  666 [ACK] Seq=978 Ack=2805 Win=62848 Len=0 TSval=2576374936 TSecr=2908828411"
"80","1.715803","192.168.123.6","192.168.123.20","TCP","74","38206  >  666 [SYN] Seq=0 Win=64240 Len=0 MSS=1460 SACK_PERM=1 TSval=2012829559 TSecr=0 WS=128"
"81","1.715846","192.168.123.20","192.168.123.6","TCP","74","666  >  38206 [SYN, ACK] Seq=0 Ack=1 Win=65160 Len=0 MSS=1460 SACK_PERM=1 TSval=329806644 TSecr=2012829559 WS=128"
"82","1.715866","192.168.123.6","192.168.123.20","TCP","66","38206  >  666 [ACK] Seq=1 Ack=1 Win=64256 Len=0 TSval=2012829559 TSecr=329806644"
"83","1.716093","192.168.123.6","192.168.123.20","TLSv1.3","353","Client Hello"
"84","1.716144","192.168.123.20","192.168.123.6","TCP","66","666  >  38206 [ACK] Seq=1 Ack=288 Win=64896 Len=0 TSval=329806644 TSecr=2012829559"
"85","1.716935","192.168.123.20","192.168.123.6","TLSv1.3","1464","Server Hello, Change Cipher Spec, Application Data, Application Data, Application Data, Application Data, Application Data"
"86","1.716961","192.168.123.6","192.168.123.20","TCP","66","38206  >  666 [ACK] Seq=288 Ack=1399 Win=64128 Len=0 TSval=2012829560 TSecr=329806645"
"87","1.720486","192.168.123.6","192.168.123.20","TLSv1.3","756","Change Cipher Spec, Application Data, Application Data, Application Data"
"88","1.720514","192.168.123.20","192.168.123.6","TCP","66","666  >  38206 [ACK] Seq=1399 Ack=978 Win=64256 Len=0 TSval=329806649 TSecr=2012829564"
"89","1.721164","192.168.123.20","192.168.123.6","TLSv1.3","769","Application Data"
"90","1.721186","192.168.123.6","192.168.123.20","TCP","66","38206  >  666 [ACK] Seq=978 Ack=2102 Win=64128 Len=0 TSval=2012829565 TSecr=329806649"
"91","1.721343","192.168.123.20","192.168.123.6","TLSv1.3","769","Application Data"
"92","1.721362","192.168.123.6","192.168.123.20","TCP","66","38206  >  666 [ACK] Seq=978 Ack=2805 Win=64128 Len=0 TSval=2012829565 TSecr=329806650"
"95","1.729724","192.168.123.16","192.168.123.20","TCP","74","41502  >  666 [SYN] Seq=0 Win=64240 Len=0 MSS=1460 SACK_PERM=1 TSval=3099630685 TSecr=0 WS=128"
"96","1.729752","192.168.123.20","192.168.123.16","TCP","74","666  >  41502 [SYN, ACK] Seq=0 Ack=1 Win=65160 Len=0 MSS=1460 SACK_PERM=1 TSval=3936103607 TSecr=3099630685 WS=128"
"97","1.729774","192.168.123.16","192.168.123.20","TCP","66","41502  >  666 [ACK] Seq=1 Ack=1 Win=64256 Len=0 TSval=3099630685 TSecr=3936103607"
"98","1.729983","192.168.123.16","192.168.123.20","TLSv1.3","353","Client Hello"
"99","1.730039","192.168.123.20","192.168.123.16","TCP","66","666  >  41502 [ACK] Seq=1 Ack=288 Win=64896 Len=0 TSval=3936103607 TSecr=3099630685"
"100","1.730846","192.168.123.20","192.168.123.16","TLSv1.3","1464","Server Hello, Change Cipher Spec, Application Data, Application Data, Application Data, Application Data, Application Data"
"101","1.730870","192.168.123.16","192.168.123.20","TCP","66","41502  >  666 [ACK] Seq=288 Ack=1399 Win=64128 Len=0 TSval=3099630686 TSecr=3936103608"
"102","1.732022","192.168.123.16","192.168.123.20","TLSv1.3","756","Change Cipher Spec, Application Data, Application Data, Application Data"
"103","1.732045","192.168.123.20","192.168.123.16","TCP","66","666  >  41502 [ACK] Seq=1399 Ack=978 Win=64256 Len=0 TSval=3936103609 TSecr=3099630687"
"106","1.732504","192.168.123.18","192.168.123.20","TCP","74","57256  >  666 [SYN] Seq=0 Win=64240 Len=0 MSS=1460 SACK_PERM=1 TSval=3455228617 TSecr=0 WS=128"
"107","1.732582","192.168.123.20","192.168.123.18","TCP","74","666  >  57256 [SYN, ACK] Seq=0 Ack=1 Win=65160 Len=0 MSS=1460 SACK_PERM=1 TSval=2090015919 TSecr=3455228617 WS=128"
"108","1.732610","192.168.123.20","192.168.123.16","TLSv1.3","769","Application Data"
"109","1.732615","192.168.123.18","192.168.123.20","TCP","66","57256  >  666 [ACK] Seq=1 Ack=1 Win=64256 Len=0 TSval=3455228617 TSecr=2090015919"
"110","1.732633","192.168.123.16","192.168.123.20","TCP","66","41502  >  666 [ACK] Seq=978 Ack=2102 Win=64128 Len=0 TSval=3099630688 TSecr=3936103610"
"111","1.732752","192.168.123.20","192.168.123.16","TLSv1.3","769","Application Data"
"112","1.732765","192.168.123.16","192.168.123.20","TCP","66","41502  >  666 [ACK] Seq=978 Ack=2805 Win=64128 Len=0 TSval=3099630688 TSecr=3936103610"
"113","1.732915","192.168.123.18","192.168.123.20","TLSv1.3","353","Client Hello"
"114","1.732986","192.168.123.20","192.168.123.18","TCP","66","666  >  57256 [ACK] Seq=1 Ack=288 Win=64896 Len=0 TSval=2090015919 TSecr=3455228617"
"115","1.734553","192.168.123.20","192.168.123.18","TLSv1.3","1464","Server Hello, Change Cipher Spec, Application Data, Application Data, Application Data, Application Data, Application Data"
"116","1.734591","192.168.123.18","192.168.123.20","TCP","66","57256  >  666 [ACK] Seq=288 Ack=1399 Win=64128 Len=0 TSval=3455228619 TSecr=2090015921"
"119","1.736622","192.168.123.7","192.168.123.20","TCP","74","53866  >  666 [SYN] Seq=0 Win=64240 Len=0 MSS=1460 SACK_PERM=1 TSval=917883562 TSecr=0 WS=128"
"120","1.736680","192.168.123.20","192.168.123.7","TCP","74","666  >  53866 [SYN, ACK] Seq=0 Ack=1 Win=65160 Len=0 MSS=1460 SACK_PERM=1 TSval=184561183 TSecr=917883562 WS=128"
"121","1.736728","192.168.123.7","192.168.123.20","TCP","66","53866  >  666 [ACK] Seq=1 Ack=1 Win=64256 Len=0 TSval=917883562 TSecr=184561183"
"122","1.736735","192.168.123.18","192.168.123.20","TLSv1.3","756","Change Cipher Spec, Application Data, Application Data, Application Data"
"123","1.736762","192.168.123.20","192.168.123.18","TCP","66","666  >  57256 [ACK] Seq=1399 Ack=978 Win=64256 Len=0 TSval=2090015923 TSecr=3455228621"
"124","1.736941","192.168.123.7","192.168.123.20","TLSv1.3","353","Client Hello"
"125","1.737002","192.168.123.20","192.168.123.7","TCP","66","666  >  53866 [ACK] Seq=1 Ack=288 Win=64896 Len=0 TSval=184561183 TSecr=917883562"
"126","1.737352","192.168.123.20","192.168.123.18","TLSv1.3","769","Application Data"
"127","1.737518","192.168.123.20","192.168.123.18","TLSv1.3","769","Application Data"
"128","1.737619","192.168.123.18","192.168.123.20","TCP","66","57256  >  666 [ACK] Seq=978 Ack=2102 Win=63488 Len=0 TSval=3455228622 TSecr=2090015924"
"129","1.737649","192.168.123.18","192.168.123.20","TCP","66","57256  >  666 [ACK] Seq=978 Ack=2805 Win=62848 Len=0 TSval=3455228622 TSecr=2090015924"
"130","1.738135","192.168.123.20","192.168.123.7","TLSv1.3","1464","Server Hello, Change Cipher Spec, Application Data, Application Data, Application Data, Application Data, Application Data"
"131","1.738170","192.168.123.7","192.168.123.20","TCP","66","53866  >  666 [ACK] Seq=288 Ack=1399 Win=64128 Len=0 TSval=917883564 TSecr=184561184"
"134","1.739621","192.168.123.14","192.168.123.20","TCP","74","38862  >  666 [SYN] Seq=0 Win=64240 Len=0 MSS=1460 SACK_PERM=1 TSval=641637245 TSecr=0 WS=128"
"135","1.739646","192.168.123.20","192.168.123.14","TCP","74","666  >  38862 [SYN, ACK] Seq=0 Ack=1 Win=65160 Len=0 MSS=1460 SACK_PERM=1 TSval=1138487060 TSecr=641637245 WS=128"
"136","1.739666","192.168.123.14","192.168.123.20","TCP","66","38862  >  666 [ACK] Seq=1 Ack=1 Win=64256 Len=0 TSval=641637245 TSecr=1138487060"
"137","1.739858","192.168.123.14","192.168.123.20","TLSv1.3","353","Client Hello"
"138","1.739908","192.168.123.20","192.168.123.14","TCP","66","666  >  38862 [ACK] Seq=1 Ack=288 Win=64896 Len=0 TSval=1138487060 TSecr=641637245"
"139","1.740957","192.168.123.20","192.168.123.14","TLSv1.3","1464","Server Hello, Change Cipher Spec, Application Data, Application Data, Application Data, Application Data, Application Data"
"140","1.740994","192.168.123.14","192.168.123.20","TCP","66","38862  >  666 [ACK] Seq=288 Ack=1399 Win=64128 Len=0 TSval=641637246 TSecr=1138487061"
"141","1.742294","192.168.123.7","192.168.123.20","TLSv1.3","756","Change Cipher Spec, Application Data, Application Data, Application Data"
"142","1.742329","192.168.123.20","192.168.123.7","TCP","66","666  >  53866 [ACK] Seq=1399 Ack=978 Win=64256 Len=0 TSval=184561189 TSecr=917883568"
"143","1.742945","192.168.123.20","192.168.123.7","TLSv1.3","769","Application Data"
"144","1.743117","192.168.123.20","192.168.123.7","TLSv1.3","769","Application Data"
"146","1.743214","192.168.123.7","192.168.123.20","TCP","66","53866  >  666 [ACK] Seq=978 Ack=2102 Win=63488 Len=0 TSval=917883569 TSecr=184561189"
"147","1.743240","192.168.123.7","192.168.123.20","TCP","66","53866  >  666 [ACK] Seq=978 Ack=2805 Win=62848 Len=0 TSval=917883569 TSecr=184561189"
"149","1.743278","192.168.123.10","192.168.123.20","TCP","74","34608  >  666 [SYN] Seq=0 Win=64240 Len=0 MSS=1460 SACK_PERM=1 TSval=462448789 TSecr=0 WS=128"
"150","1.743302","192.168.123.20","192.168.123.10","TCP","74","666  >  34608 [SYN, ACK] Seq=0 Ack=1 Win=65160 Len=0 MSS=1460 SACK_PERM=1 TSval=2431916200 TSecr=462448789 WS=128"
"151","1.743321","192.168.123.10","192.168.123.20","TCP","66","34608  >  666 [ACK] Seq=1 Ack=1 Win=64256 Len=0 TSval=462448790 TSecr=2431916200"
"152","1.743541","192.168.123.10","192.168.123.20","TLSv1.3","353","Client Hello"
"153","1.743601","192.168.123.20","192.168.123.10","TCP","66","666  >  34608 [ACK] Seq=1 Ack=288 Win=64896 Len=0 TSval=2431916200 TSecr=462448790"
"154","1.744315","192.168.123.20","192.168.123.10","TLSv1.3","1464","Server Hello, Change Cipher Spec, Application Data, Application Data, Application Data, Application Data, Application Data"
"155","1.744357","192.168.123.10","192.168.123.20","TCP","66","34608  >  666 [ACK] Seq=288 Ack=1399 Win=64128 Len=0 TSval=462448791 TSecr=2431916201"
"156","1.744866","192.168.123.14","192.168.123.20","TLSv1.3","756","Change Cipher Spec, Application Data, Application Data, Application Data"
"157","1.744913","192.168.123.20","192.168.123.14","TCP","66","666  >  38862 [ACK] Seq=1399 Ack=978 Win=64256 Len=0 TSval=1138487065 TSecr=641637250"
"158","1.745395","192.168.123.20","192.168.123.14","TLSv1.3","769","Application Data"
"159","1.745484","192.168.123.14","192.168.123.20","TCP","66","38862  >  666 [ACK] Seq=978 Ack=2102 Win=63488 Len=0 TSval=641637251 TSecr=1138487066"
"160","1.745538","192.168.123.20","192.168.123.14","TLSv1.3","769","Application Data"
"161","1.745558","192.168.123.14","192.168.123.20","TCP","66","38862  >  666 [ACK] Seq=978 Ack=2805 Win=64128 Len=0 TSval=641637251 TSecr=1138487066"
"162","1.746438","192.168.123.10","192.168.123.20","TLSv1.3","756","Change Cipher Spec, Application Data, Application Data, Application Data"
"163","1.746461","192.168.123.20","192.168.123.10","TCP","66","666  >  34608 [ACK] Seq=1399 Ack=978 Win=64256 Len=0 TSval=2431916203 TSecr=462448793"
"164","1.746944","192.168.123.20","192.168.123.10","TLSv1.3","769","Application Data"
"165","1.747046","192.168.123.20","192.168.123.10","TLSv1.3","769","Application Data"
"166","1.747104","192.168.123.10","192.168.123.20","TCP","66","34608  >  666 [ACK] Seq=978 Ack=2102 Win=63488 Len=0 TSval=462448793 TSecr=2431916203"
"167","1.747119","192.168.123.10","192.168.123.20","TCP","66","34608  >  666 [ACK] Seq=978 Ack=2805 Win=62848 Len=0 TSval=462448793 TSecr=2431916203"
"170","1.751426","192.168.123.3","192.168.123.20","TCP","74","50398  >  666 [SYN] Seq=0 Win=64240 Len=0 MSS=1460 SACK_PERM=1 TSval=699427418 TSecr=0 WS=128"
"171","1.751467","192.168.123.20","192.168.123.3","TCP","74","666  >  50398 [SYN, ACK] Seq=0 Ack=1 Win=65160 Len=0 MSS=1460 SACK_PERM=1 TSval=3756814706 TSecr=699427418 WS=128"
"172","1.751487","192.168.123.3","192.168.123.20","TCP","66","50398  >  666 [ACK] Seq=1 Ack=1 Win=64256 Len=0 TSval=699427418 TSecr=3756814706"
"173","1.751710","192.168.123.3","192.168.123.20","TLSv1.3","353","Client Hello"
"174","1.751779","192.168.123.20","192.168.123.3","TCP","66","666  >  50398 [ACK] Seq=1 Ack=288 Win=64896 Len=0 TSval=3756814706 TSecr=699427418"
"175","1.753332","192.168.123.20","192.168.123.3","TLSv1.3","1464","Server Hello, Change Cipher Spec, Application Data, Application Data, Application Data, Application Data, Application Data"
"176","1.753357","192.168.123.3","192.168.123.20","TCP","66","50398  >  666 [ACK] Seq=288 Ack=1399 Win=64128 Len=0 TSval=699427420 TSecr=3756814708"
"177","1.754545","192.168.123.3","192.168.123.20","TLSv1.3","756","Change Cipher Spec, Application Data, Application Data, Application Data"
"178","1.754567","192.168.123.20","192.168.123.3","TCP","66","666  >  50398 [ACK] Seq=1399 Ack=978 Win=64256 Len=0 TSval=3756814709 TSecr=699427421"
"179","1.755316","192.168.123.20","192.168.123.3","TLSv1.3","769","Application Data"
"180","1.755336","192.168.123.3","192.168.123.20","TCP","66","50398  >  666 [ACK] Seq=978 Ack=2102 Win=64128 Len=0 TSval=699427422 TSecr=3756814710"
"181","1.755429","192.168.123.20","192.168.123.3","TLSv1.3","769","Application Data"
"182","1.755441","192.168.123.3","192.168.123.20","TCP","66","50398  >  666 [ACK] Seq=978 Ack=2805 Win=64128 Len=0 TSval=699427422 TSecr=3756814710"
"185","1.789810","192.168.123.12","192.168.123.20","TCP","74","37824  >  666 [SYN] Seq=0 Win=64240 Len=0 MSS=1460 SACK_PERM=1 TSval=610413907 TSecr=0 WS=128"
"186","1.789842","192.168.123.20","192.168.123.12","TCP","74","666  >  37824 [SYN, ACK] Seq=0 Ack=1 Win=65160 Len=0 MSS=1460 SACK_PERM=1 TSval=2023944634 TSecr=610413907 WS=128"
"187","1.789865","192.168.123.12","192.168.123.20","TCP","66","37824  >  666 [ACK] Seq=1 Ack=1 Win=64256 Len=0 TSval=610413907 TSecr=2023944634"
"188","1.790166","192.168.123.12","192.168.123.20","TLSv1.3","353","Client Hello"
"189","1.790242","192.168.123.20","192.168.123.12","TCP","66","666  >  37824 [ACK] Seq=1 Ack=288 Win=64896 Len=0 TSval=2023944635 TSecr=610413907"
"192","1.791379","192.168.123.11","192.168.123.20","TCP","74","42376  >  666 [SYN] Seq=0 Win=64240 Len=0 MSS=1460 SACK_PERM=1 TSval=81155764 TSecr=0 WS=128"
"193","1.791437","192.168.123.20","192.168.123.11","TCP","74","666  >  42376 [SYN, ACK] Seq=0 Ack=1 Win=65160 Len=0 MSS=1460 SACK_PERM=1 TSval=1797246498 TSecr=81155764 WS=128"
"194","1.791462","192.168.123.11","192.168.123.20","TCP","66","42376  >  666 [ACK] Seq=1 Ack=1 Win=64256 Len=0 TSval=81155765 TSecr=1797246498"
"195","1.791503","192.168.123.20","192.168.123.12","TLSv1.3","1464","Server Hello, Change Cipher Spec, Application Data, Application Data, Application Data, Application Data, Application Data"
"196","1.791551","192.168.123.12","192.168.123.20","TCP","66","37824  >  666 [ACK] Seq=288 Ack=1399 Win=64128 Len=0 TSval=610413909 TSecr=2023944636"
"197","1.791655","192.168.123.11","192.168.123.20","TLSv1.3","353","Client Hello"
"198","1.791715","192.168.123.20","192.168.123.11","TCP","66","666  >  42376 [ACK] Seq=1 Ack=288 Win=64896 Len=0 TSval=1797246498 TSecr=81155765"
"199","1.792519","192.168.123.20","192.168.123.11","TLSv1.3","1464","Server Hello, Change Cipher Spec, Application Data, Application Data, Application Data, Application Data, Application Data"
"200","1.792544","192.168.123.11","192.168.123.20","TCP","66","42376  >  666 [ACK] Seq=288 Ack=1399 Win=64128 Len=0 TSval=81155766 TSecr=1797246499"
"201","1.792929","192.168.123.12","192.168.123.20","TLSv1.3","756","Change Cipher Spec, Application Data, Application Data, Application Data"
"202","1.792953","192.168.123.20","192.168.123.12","TCP","66","666  >  37824 [ACK] Seq=1399 Ack=978 Win=64256 Len=0 TSval=2023944637 TSecr=610413910"
"203","1.793461","192.168.123.20","192.168.123.12","TLSv1.3","769","Application Data"
"204","1.793495","192.168.123.12","192.168.123.20","TCP","66","37824  >  666 [ACK] Seq=978 Ack=2102 Win=64128 Len=0 TSval=610413911 TSecr=2023944638"
"205","1.793681","192.168.123.20","192.168.123.12","TLSv1.3","769","Application Data"
"206","1.793695","192.168.123.12","192.168.123.20","TCP","66","37824  >  666 [ACK] Seq=978 Ack=2805 Win=64128 Len=0 TSval=610413911 TSecr=2023944638"
"207","1.794252","192.168.123.11","192.168.123.20","TLSv1.3","756","Change Cipher Spec, Application Data, Application Data, Application Data"
"208","1.794278","192.168.123.20","192.168.123.11","TCP","66","666  >  42376 [ACK] Seq=1399 Ack=978 Win=64256 Len=0 TSval=1797246501 TSecr=81155768"
"209","1.794943","192.168.123.20","192.168.123.11","TLSv1.3","769","Application Data"
"210","1.794968","192.168.123.11","192.168.123.20","TCP","66","42376  >  666 [ACK] Seq=978 Ack=2102 Win=64128 Len=0 TSval=81155768 TSecr=1797246501"
"211","1.795124","192.168.123.20","192.168.123.11","TLSv1.3","769","Application Data"
"212","1.795138","192.168.123.11","192.168.123.20","TCP","66","42376  >  666 [ACK] Seq=978 Ack=2805 Win=64128 Len=0 TSval=81155768 TSecr=1797246501"
"215","1.795360","192.168.123.4","192.168.123.20","TCP","74","43730  >  666 [SYN] Seq=0 Win=64240 Len=0 MSS=1460 SACK_PERM=1 TSval=985797595 TSecr=0 WS=128"
"216","1.795424","192.168.123.20","192.168.123.4","TCP","74","666  >  43730 [SYN, ACK] Seq=0 Ack=1 Win=65160 Len=0 MSS=1460 SACK_PERM=1 TSval=3344457062 TSecr=985797595 WS=128"
"217","1.795448","192.168.123.4","192.168.123.20","TCP","66","43730  >  666 [ACK] Seq=1 Ack=1 Win=64256 Len=0 TSval=985797595 TSecr=3344457062"
"218","1.795653","192.168.123.4","192.168.123.20","TLSv1.3","353","Client Hello"
"219","1.795706","192.168.123.20","192.168.123.4","TCP","66","666  >  43730 [ACK] Seq=1 Ack=288 Win=64896 Len=0 TSval=3344457062 TSecr=985797595"
"223","1.796640","192.168.123.15","192.168.123.20","TCP","74","45392  >  666 [SYN] Seq=0 Win=64240 Len=0 MSS=1460 SACK_PERM=1 TSval=2753465828 TSecr=0 WS=128"
"225","1.796664","192.168.123.13","192.168.123.20","TCP","74","58406  >  666 [SYN] Seq=0 Win=64240 Len=0 MSS=1460 SACK_PERM=1 TSval=1434260884 TSecr=0 WS=128"
"226","1.796664","192.168.123.20","192.168.123.15","TCP","74","666  >  45392 [SYN, ACK] Seq=0 Ack=1 Win=65160 Len=0 MSS=1460 SACK_PERM=1 TSval=2259075712 TSecr=2753465828 WS=128"
"227","1.796684","192.168.123.15","192.168.123.20","TCP","66","45392  >  666 [ACK] Seq=1 Ack=1 Win=64256 Len=0 TSval=2753465828 TSecr=2259075712"
"228","1.796688","192.168.123.20","192.168.123.13","TCP","74","666  >  58406 [SYN, ACK] Seq=0 Ack=1 Win=65160 Len=0 MSS=1460 SACK_PERM=1 TSval=4129099467 TSecr=1434260884 WS=128"
"229","1.796732","192.168.123.13","192.168.123.20","TCP","66","58406  >  666 [ACK] Seq=1 Ack=1 Win=64256 Len=0 TSval=1434260884 TSecr=4129099467"
"230","1.796747","192.168.123.20","192.168.123.4","TLSv1.3","1464","Server Hello, Change Cipher Spec, Application Data, Application Data, Application Data, Application Data, Application Data"
"231","1.796774","192.168.123.4","192.168.123.20","TCP","66","43730  >  666 [ACK] Seq=288 Ack=1399 Win=64128 Len=0 TSval=985797596 TSecr=3344457063"
"232","1.796883","192.168.123.15","192.168.123.20","TLSv1.3","353","Client Hello"
"233","1.796927","192.168.123.13","192.168.123.20","TLSv1.3","353","Client Hello"
"234","1.796933","192.168.123.20","192.168.123.15","TCP","66","666  >  45392 [ACK] Seq=1 Ack=288 Win=64896 Len=0 TSval=2259075712 TSecr=2753465828"
"235","1.796953","192.168.123.20","192.168.123.13","TCP","66","666  >  58406 [ACK] Seq=1 Ack=288 Win=64896 Len=0 TSval=4129099467 TSecr=1434260884"
"238","1.797614","192.168.123.17","192.168.123.20","TCP","74","51892  >  666 [SYN] Seq=0 Win=64240 Len=0 MSS=1460 SACK_PERM=1 TSval=3492857351 TSecr=0 WS=128"
"239","1.797680","192.168.123.20","192.168.123.17","TCP","74","666  >  51892 [SYN, ACK] Seq=0 Ack=1 Win=65160 Len=0 MSS=1460 SACK_PERM=1 TSval=2193076038 TSecr=3492857351 WS=128"
"240","1.797715","192.168.123.17","192.168.123.20","TCP","66","51892  >  666 [ACK] Seq=1 Ack=1 Win=64256 Len=0 TSval=3492857351 TSecr=2193076038"
"241","1.797912","192.168.123.17","192.168.123.20","TLSv1.3","353","Client Hello"
"242","1.798007","192.168.123.20","192.168.123.17","TCP","66","666  >  51892 [ACK] Seq=1 Ack=288 Win=64896 Len=0 TSval=2193076038 TSecr=3492857351"
"243","1.798084","192.168.123.20","192.168.123.13","TLSv1.3","1464","Server Hello, Change Cipher Spec, Application Data, Application Data, Application Data, Application Data, Application Data"
"244","1.798110","192.168.123.13","192.168.123.20","TCP","66","58406  >  666 [ACK] Seq=288 Ack=1399 Win=64128 Len=0 TSval=1434260885 TSecr=4129099468"
"245","1.798112","192.168.123.20","192.168.123.15","TLSv1.3","1464","Server Hello, Change Cipher Spec, Application Data, Application Data, Application Data, Application Data, Application Data"
"246","1.798159","192.168.123.15","192.168.123.20","TCP","66","45392  >  666 [ACK] Seq=288 Ack=1399 Win=64128 Len=0 TSval=2753465829 TSecr=2259075713"
"247","1.798829","192.168.123.20","192.168.123.17","TLSv1.3","1464","Server Hello, Change Cipher Spec, Application Data, Application Data, Application Data, Application Data, Application Data"
"248","1.798853","192.168.123.17","192.168.123.20","TCP","66","51892  >  666 [ACK] Seq=288 Ack=1399 Win=64128 Len=0 TSval=3492857352 TSecr=2193076039"
"249","1.799257","192.168.123.13","192.168.123.20","TLSv1.3","756","Change Cipher Spec, Application Data, Application Data, Application Data"
"250","1.799278","192.168.123.20","192.168.123.13","TCP","66","666  >  58406 [ACK] Seq=1399 Ack=978 Win=64256 Len=0 TSval=4129099470 TSecr=1434260887"
"253","1.799492","192.168.123.21","192.168.123.20","TCP","74","54204  >  666 [SYN] Seq=0 Win=64240 Len=0 MSS=1460 SACK_PERM=1 TSval=771289452 TSecr=0 WS=128"
"254","1.799513","192.168.123.20","192.168.123.21","TCP","74","666  >  54204 [SYN, ACK] Seq=0 Ack=1 Win=65160 Len=0 MSS=1460 SACK_PERM=1 TSval=1106779446 TSecr=771289452 WS=128"
"255","1.799532","192.168.123.21","192.168.123.20","TCP","66","54204  >  666 [ACK] Seq=1 Ack=1 Win=64256 Len=0 TSval=771289452 TSecr=1106779446"
"256","1.799745","192.168.123.21","192.168.123.20","TLSv1.3","353","Client Hello"
"257","1.799788","192.168.123.20","192.168.123.21","TCP","66","666  >  54204 [ACK] Seq=1 Ack=288 Win=64896 Len=0 TSval=1106779446 TSecr=771289452"
"258","1.799933","192.168.123.15","192.168.123.20","TLSv1.3","756","Change Cipher Spec, Application Data, Application Data, Application Data"
"259","1.799949","192.168.123.20","192.168.123.13","TLSv1.3","769","Application Data"
"260","1.799965","192.168.123.20","192.168.123.15","TCP","66","666  >  45392 [ACK] Seq=1399 Ack=978 Win=64256 Len=0 TSval=2259075715 TSecr=2753465831"
"261","1.799981","192.168.123.13","192.168.123.20","TCP","66","58406  >  666 [ACK] Seq=978 Ack=2102 Win=64128 Len=0 TSval=1434260887 TSecr=4129099470"
"262","1.800164","192.168.123.20","192.168.123.13","TLSv1.3","769","Application Data"
"263","1.800186","192.168.123.13","192.168.123.20","TCP","66","58406  >  666 [ACK] Seq=978 Ack=2805 Win=64128 Len=0 TSval=1434260888 TSecr=4129099470"
"264","1.800391","192.168.123.20","192.168.123.15","TLSv1.3","769","Application Data"
"265","1.800407","192.168.123.15","192.168.123.20","TCP","66","45392  >  666 [ACK] Seq=978 Ack=2102 Win=64128 Len=0 TSval=2753465832 TSecr=2259075716"
"266","1.800488","192.168.123.4","192.168.123.20","TLSv1.3","756","Change Cipher Spec, Application Data, Application Data, Application Data"
"267","1.800499","192.168.123.20","192.168.123.21","TLSv1.3","1464","Server Hello, Change Cipher Spec, Application Data, Application Data, Application Data, Application Data, Application Data"
"268","1.800509","192.168.123.20","192.168.123.15","TLSv1.3","769","Application Data"
"269","1.800518","192.168.123.20","192.168.123.4","TCP","66","666  >  43730 [ACK] Seq=1399 Ack=978 Win=64256 Len=0 TSval=3344457067 TSecr=985797600"
"270","1.800521","192.168.123.15","192.168.123.20","TCP","66","45392  >  666 [ACK] Seq=978 Ack=2805 Win=64128 Len=0 TSval=2753465832 TSecr=2259075716"
"271","1.800533","192.168.123.21","192.168.123.20","TCP","66","54204  >  666 [ACK] Seq=288 Ack=1399 Win=64128 Len=0 TSval=771289453 TSecr=1106779447"
"272","1.801062","192.168.123.17","192.168.123.20","TLSv1.3","756","Change Cipher Spec, Application Data, Application Data, Application Data"
"273","1.801092","192.168.123.20","192.168.123.17","TCP","66","666  >  51892 [ACK] Seq=1399 Ack=978 Win=64256 Len=0 TSval=2193076041 TSecr=3492857354"
"274","1.801144","192.168.123.20","192.168.123.4","TLSv1.3","769","Application Data"
"275","1.801279","192.168.123.4","192.168.123.20","TCP","66","43730  >  666 [ACK] Seq=978 Ack=2102 Win=63488 Len=0 TSval=985797601 TSecr=3344457067"
"276","1.801340","192.168.123.20","192.168.123.4","TLSv1.3","769","Application Data"
"277","1.801361","192.168.123.4","192.168.123.20","TCP","66","43730  >  666 [ACK] Seq=978 Ack=2805 Win=64128 Len=0 TSval=985797601 TSecr=3344457068"
"278","1.801541","192.168.123.20","192.168.123.17","TLSv1.3","769","Application Data"
"279","1.801564","192.168.123.17","192.168.123.20","TCP","66","51892  >  666 [ACK] Seq=978 Ack=2102 Win=64128 Len=0 TSval=3492857355 TSecr=2193076042"
"280","1.801706","192.168.123.20","192.168.123.17","TLSv1.3","769","Application Data"
"281","1.801723","192.168.123.17","192.168.123.20","TCP","66","51892  >  666 [ACK] Seq=978 Ack=2805 Win=64128 Len=0 TSval=3492857355 TSecr=2193076042"
"282","1.803364","192.168.123.21","192.168.123.20","TLSv1.3","756","Change Cipher Spec, Application Data, Application Data, Application Data"
"283","1.803387","192.168.123.20","192.168.123.21","TCP","66","666  >  54204 [ACK] Seq=1399 Ack=978 Win=64256 Len=0 TSval=1106779450 TSecr=771289456"
"284","1.803816","192.168.123.20","192.168.123.21","TLSv1.3","769","Application Data"
"285","1.803914","192.168.123.20","192.168.123.21","TLSv1.3","769","Application Data"
"286","1.803981","192.168.123.21","192.168.123.20","TCP","66","54204  >  666 [ACK] Seq=978 Ack=2102 Win=63488 Len=0 TSval=771289456 TSecr=1106779450"
"287","1.803997","192.168.123.21","192.168.123.20","TCP","66","54204  >  666 [ACK] Seq=978 Ack=2805 Win=62848 Len=0 TSval=771289456 TSecr=1106779450"
