"No.","Time","Source","Destination","Protocol","Length","Info"
"3","0.000237","192.168.123.3","192.168.123.20","TCP","74","37548  >  666 [SYN] Seq=0 Win=64240 Len=0 MSS=1460 SACK_PERM=1 TSval=692688310 TSecr=0 WS=128"
"4","0.000267","192.168.123.20","192.168.123.3","TCP","74","666  >  37548 [SYN, ACK] Seq=0 Ack=1 Win=65160 Len=0 MSS=1460 SACK_PERM=1 TSval=3750075598 TSecr=692688310 WS=128"
"5","0.000291","192.168.123.3","192.168.123.20","TCP","66","37548  >  666 [ACK] Seq=1 Ack=1 Win=64256 Len=0 TSval=692688310 TSecr=3750075598"
"6","0.000505","192.168.123.3","192.168.123.20","TLSv1.3","353","Client Hello"
"7","0.000559","192.168.123.20","192.168.123.3","TCP","66","666  >  37548 [ACK] Seq=1 Ack=288 Win=64896 Len=0 TSval=3750075599 TSecr=692688311"
"8","0.002119","192.168.123.20","192.168.123.3","TLSv1.3","1464","Server Hello, Change Cipher Spec, Application Data, Application Data, Application Data, Application Data, Application Data"
"9","0.002148","192.168.123.3","192.168.123.20","TCP","66","37548  >  666 [ACK] Seq=288 Ack=1399 Win=64128 Len=0 TSval=692688312 TSecr=3750075600"
"10","0.003465","192.168.123.3","192.168.123.20","TLSv1.3","756","Change Cipher Spec, Application Data, Application Data, Application Data"
"11","0.003502","192.168.123.20","192.168.123.3","TCP","66","666  >  37548 [ACK] Seq=1399 Ack=978 Win=64256 Len=0 TSval=3750075602 TSecr=692688314"
"12","0.004147","192.168.123.20","192.168.123.3","TLSv1.3","769","Application Data"
"13","0.004258","192.168.123.3","192.168.123.20","TCP","66","37548  >  666 [ACK] Seq=978 Ack=2102 Win=63488 Len=0 TSval=692688314 TSecr=3750075602"
"14","0.004327","192.168.123.20","192.168.123.3","TLSv1.3","769","Application Data"
"15","0.004353","192.168.123.3","192.168.123.20","TCP","66","37548  >  666 [ACK] Seq=978 Ack=2805 Win=64128 Len=0 TSval=692688315 TSecr=3750075602"
"18","0.064302","192.168.123.6","192.168.123.20","TCP","74","53602  >  666 [SYN] Seq=0 Win=64240 Len=0 MSS=1460 SACK_PERM=1 TSval=2006090551 TSecr=0 WS=128"
"19","0.064327","192.168.123.20","192.168.123.6","TCP","74","666  >  53602 [SYN, ACK] Seq=0 Ack=1 Win=65160 Len=0 MSS=1460 SACK_PERM=1 TSval=323067636 TSecr=2006090551 WS=128"
"20","0.064347","192.168.123.6","192.168.123.20","TCP","66","53602  >  666 [ACK] Seq=1 Ack=1 Win=64256 Len=0 TSval=2006090552 TSecr=323067636"
"21","0.064572","192.168.123.6","192.168.123.20","TLSv1.3","353","Client Hello"
"22","0.064656","192.168.123.20","192.168.123.6","TCP","66","666  >  53602 [ACK] Seq=1 Ack=288 Win=64896 Len=0 TSval=323067637 TSecr=2006090552"
"23","0.066121","192.168.123.20","192.168.123.6","TLSv1.3","1464","Server Hello, Change Cipher Spec, Application Data, Application Data, Application Data, Application Data, Application Data"
"24","0.066164","192.168.123.6","192.168.123.20","TCP","66","53602  >  666 [ACK] Seq=288 Ack=1399 Win=64128 Len=0 TSval=2006090553 TSecr=323067638"
"25","0.067557","192.168.123.6","192.168.123.20","TLSv1.3","756","Change Cipher Spec, Application Data, Application Data, Application Data"
"26","0.067582","192.168.123.20","192.168.123.6","TCP","66","666  >  53602 [ACK] Seq=1399 Ack=978 Win=64256 Len=0 TSval=323067640 TSecr=2006090555"
"27","0.067993","192.168.123.20","192.168.123.6","TLSv1.3","769","Application Data"
"28","0.068082","192.168.123.20","192.168.123.6","TLSv1.3","769","Application Data"
"29","0.068154","192.168.123.6","192.168.123.20","TCP","66","53602  >  666 [ACK] Seq=978 Ack=2102 Win=63488 Len=0 TSval=2006090555 TSecr=323067640"
"30","0.068202","192.168.123.6","192.168.123.20","TCP","66","53602  >  666 [ACK] Seq=978 Ack=2805 Win=62848 Len=0 TSval=2006090555 TSecr=323067640"
"33","0.081648","192.168.123.22","192.168.123.20","TCP","74","49426  >  666 [SYN] Seq=0 Win=64240 Len=0 MSS=1460 SACK_PERM=1 TSval=3580663260 TSecr=0 WS=128"
"34","0.081687","192.168.123.20","192.168.123.22","TCP","74","666  >  49426 [SYN, ACK] Seq=0 Ack=1 Win=65160 Len=0 MSS=1460 SACK_PERM=1 TSval=2773986266 TSecr=3580663260 WS=128"
"35","0.081712","192.168.123.22","192.168.123.20","TCP","66","49426  >  666 [ACK] Seq=1 Ack=1 Win=64256 Len=0 TSval=3580663261 TSecr=2773986266"
"36","0.081983","192.168.123.22","192.168.123.20","TLSv1.3","353","Client Hello"
"37","0.082039","192.168.123.20","192.168.123.22","TCP","66","666  >  49426 [ACK] Seq=1 Ack=288 Win=64896 Len=0 TSval=2773986266 TSecr=3580663261"
"38","0.083052","192.168.123.20","192.168.123.22","TLSv1.3","1464","Server Hello, Change Cipher Spec, Application Data, Application Data, Application Data, Application Data, Application Data"
"39","0.083102","192.168.123.22","192.168.123.20","TCP","66","49426  >  666 [ACK] Seq=288 Ack=1399 Win=64128 Len=0 TSval=3580663262 TSecr=2773986267"
"40","0.084212","192.168.123.22","192.168.123.20","TLSv1.3","756","Change Cipher Spec, Application Data, Application Data, Application Data"
"41","0.084242","192.168.123.20","192.168.123.22","TCP","66","666  >  49426 [ACK] Seq=1399 Ack=978 Win=64256 Len=0 TSval=2773986268 TSecr=3580663263"
"42","0.084655","192.168.123.20","192.168.123.22","TLSv1.3","769","Application Data"
"43","0.084682","192.168.123.22","192.168.123.20","TCP","66","49426  >  666 [ACK] Seq=978 Ack=2102 Win=64128 Len=0 TSval=3580663264 TSecr=2773986269"
"44","0.084783","192.168.123.20","192.168.123.22","TLSv1.3","769","Application Data"
"45","0.084798","192.168.123.22","192.168.123.20","TCP","66","49426  >  666 [ACK] Seq=978 Ack=2805 Win=64128 Len=0 TSval=3580663264 TSecr=2773986269"
"49","0.087423","192.168.123.4","192.168.123.20","TCP","74","59112  >  666 [SYN] Seq=0 Win=64240 Len=0 MSS=1460 SACK_PERM=1 TSval=979058530 TSecr=0 WS=128"
"50","0.087451","192.168.123.20","192.168.123.4","TCP","74","666  >  59112 [SYN, ACK] Seq=0 Ack=1 Win=65160 Len=0 MSS=1460 SACK_PERM=1 TSval=3337717998 TSecr=979058530 WS=128"
"52","0.087475","192.168.123.4","192.168.123.20","TCP","66","59112  >  666 [ACK] Seq=1 Ack=1 Win=64256 Len=0 TSval=979058531 TSecr=3337717998"
"53","0.087478","192.168.123.18","192.168.123.20","TCP","74","44422  >  666 [SYN] Seq=0 Win=64240 Len=0 MSS=1460 SACK_PERM=1 TSval=3448489615 TSecr=0 WS=128"
"54","0.087505","192.168.123.20","192.168.123.18","TCP","74","666  >  44422 [SYN, ACK] Seq=0 Ack=1 Win=65160 Len=0 MSS=1460 SACK_PERM=1 TSval=2083276918 TSecr=3448489615 WS=128"
"55","0.087527","192.168.123.18","192.168.123.20","TCP","66","44422  >  666 [ACK] Seq=1 Ack=1 Win=64256 Len=0 TSval=3448489616 TSecr=2083276918"
"56","0.087666","192.168.123.4","192.168.123.20","TLSv1.3","353","Client Hello"
"57","0.087724","192.168.123.18","192.168.123.20","TLSv1.3","353","Client Hello"
"58","0.087735","192.168.123.20","192.168.123.4","TCP","66","666  >  59112 [ACK] Seq=1 Ack=288 Win=64896 Len=0 TSval=3337717998 TSecr=979058531"
"59","0.087761","192.168.123.20","192.168.123.18","TCP","66","666  >  44422 [ACK] Seq=1 Ack=288 Win=64896 Len=0 TSval=2083276918 TSecr=3448489616"
"60","0.088760","192.168.123.20","192.168.123.4","TLSv1.3","1464","Server Hello, Change Cipher Spec, Application Data, Application Data, Application Data, Application Data, Application Data"
"61","0.088787","192.168.123.4","192.168.123.20","TCP","66","59112  >  666 [ACK] Seq=288 Ack=1399 Win=64128 Len=0 TSval=979058532 TSecr=3337717999"
"62","0.088999","192.168.123.20","192.168.123.18","TLSv1.3","1464","Server Hello, Change Cipher Spec, Application Data, Application Data, Application Data, Application Data, Application Data"
"63","0.089029","192.168.123.18","192.168.123.20","TCP","66","44422  >  666 [ACK] Seq=288 Ack=1399 Win=64128 Len=0 TSval=3448489617 TSecr=2083276919"
"64","0.090668","192.168.123.18","192.168.123.20","TLSv1.3","756","Change Cipher Spec, Application Data, Application Data, Application Data"
"65","0.090693","192.168.123.20","192.168.123.18","TCP","66","666  >  44422 [ACK] Seq=1399 Ack=978 Win=64256 Len=0 TSval=2083276921 TSecr=3448489619"
"66","0.091378","192.168.123.20","192.168.123.18","TLSv1.3","769","Application Data"
"67","0.091401","192.168.123.18","192.168.123.20","TCP","66","44422  >  666 [ACK] Seq=978 Ack=2102 Win=64128 Len=0 TSval=3448489620 TSecr=2083276922"
"68","0.091502","192.168.123.20","192.168.123.18","TLSv1.3","769","Application Data"
"69","0.091517","192.168.123.18","192.168.123.20","TCP","66","44422  >  666 [ACK] Seq=978 Ack=2805 Win=64128 Len=0 TSval=3448489620 TSecr=2083276922"
"70","0.094642","192.168.123.4","192.168.123.20","TLSv1.3","756","Change Cipher Spec, Application Data, Application Data, Application Data"
"71","0.094665","192.168.123.20","192.168.123.4","TCP","66","666  >  59112 [ACK] Seq=1399 Ack=978 Win=64256 Len=0 TSval=3337718005 TSecr=979058538"
"72","0.095131","192.168.123.20","192.168.123.4","TLSv1.3","769","Application Data"
"73","0.095240","192.168.123.20","192.168.123.4","TLSv1.3","769","Application Data"
"74","0.095316","192.168.123.4","192.168.123.20","TCP","66","59112  >  666 [ACK] Seq=978 Ack=2102 Win=63488 Len=0 TSval=979058538 TSecr=3337718005"
"75","0.095334","192.168.123.4","192.168.123.20","TCP","66","59112  >  666 [ACK] Seq=978 Ack=2805 Win=62848 Len=0 TSval=979058538 TSecr=3337718005"
"78","0.106013","192.168.123.17","192.168.123.20","TCP","74","39040  >  666 [SYN] Seq=0 Win=64240 Len=0 MSS=1460 SACK_PERM=1 TSval=3486118303 TSecr=0 WS=128"
"79","0.106043","192.168.123.20","192.168.123.17","TCP","74","666  >  39040 [SYN, ACK] Seq=0 Ack=1 Win=65160 Len=0 MSS=1460 SACK_PERM=1 TSval=2186336990 TSecr=3486118303 WS=128"
"80","0.106077","192.168.123.17","192.168.123.20","TCP","66","39040  >  666 [ACK] Seq=1 Ack=1 Win=64256 Len=0 TSval=3486118303 TSecr=2186336990"
"81","0.106343","192.168.123.17","192.168.123.20","TLSv1.3","353","Client Hello"
"82","0.106401","192.168.123.20","192.168.123.17","TCP","66","666  >  39040 [ACK] Seq=1 Ack=288 Win=64896 Len=0 TSval=2186336991 TSecr=3486118303"
"83","0.107401","192.168.123.20","192.168.123.17","TLSv1.3","1464","Server Hello, Change Cipher Spec, Application Data, Application Data, Application Data, Application Data, Application Data"
"84","0.107431","192.168.123.17","192.168.123.20","TCP","66","39040  >  666 [ACK] Seq=288 Ack=1399 Win=64128 Len=0 TSval=3486118305 TSecr=2186336992"
"85","0.108634","192.168.123.17","192.168.123.20","TLSv1.3","756","Change Cipher Spec, Application Data, Application Data, Application Data"
"86","0.108659","192.168.123.20","192.168.123.17","TCP","66","666  >  39040 [ACK] Seq=1399 Ack=978 Win=64256 Len=0 TSval=2186336993 TSecr=3486118306"
"87","0.109227","192.168.123.20","192.168.123.17","TLSv1.3","769","Application Data"
"88","0.109252","192.168.123.17","192.168.123.20","TCP","66","39040  >  666 [ACK] Seq=978 Ack=2102 Win=64128 Len=0 TSval=3486118306 TSecr=2186336993"
"89","0.109397","192.168.123.20","192.168.123.17","TLSv1.3","769","Application Data"
"90","0.109420","192.168.123.17","192.168.123.20","TCP","66","39040  >  666 [ACK] Seq=978 Ack=2805 Win=64128 Len=0 TSval=3486118307 TSecr=2186336994"
"93","0.115880","192.168.123.27","192.168.123.20","TCP","74","49300  >  666 [SYN] Seq=0 Win=64240 Len=0 MSS=1460 SACK_PERM=1 TSval=1257217163 TSecr=0 WS=128"
"94","0.115944","192.168.123.20","192.168.123.27","TCP","74","666  >  49300 [SYN, ACK] Seq=0 Ack=1 Win=65160 Len=0 MSS=1460 SACK_PERM=1 TSval=15687178 TSecr=1257217163 WS=128"
"95","0.115969","192.168.123.27","192.168.123.20","TCP","66","49300  >  666 [ACK] Seq=1 Ack=1 Win=64256 Len=0 TSval=1257217163 TSecr=15687178"
"96","0.116193","192.168.123.27","192.168.123.20","TLSv1.3","353","Client Hello"
"97","0.116254","192.168.123.20","192.168.123.27","TCP","66","666  >  49300 [ACK] Seq=1 Ack=288 Win=64896 Len=0 TSval=15687178 TSecr=1257217163"
"100","0.116773","192.168.123.29","192.168.123.20","TCP","74","41196  >  666 [SYN] Seq=0 Win=64240 Len=0 MSS=1460 SACK_PERM=1 TSval=4056525738 TSecr=0 WS=128"
"101","0.116798","192.168.123.20","192.168.123.29","TCP","74","666  >  41196 [SYN, ACK] Seq=0 Ack=1 Win=65160 Len=0 MSS=1460 SACK_PERM=1 TSval=855515166 TSecr=4056525738 WS=128"
"102","0.116821","192.168.123.29","192.168.123.20","TCP","66","41196  >  666 [ACK] Seq=1 Ack=1 Win=64256 Len=0 TSval=4056525738 TSecr=855515166"
"103","0.117035","192.168.123.20","192.168.123.27","TLSv1.3","1464","Server Hello, Change Cipher Spec, Application Data, Application Data, Application Data, Application Data, Application Data"
"104","0.117065","192.168.123.27","192.168.123.20","TCP","66","49300  >  666 [ACK] Seq=288 Ack=1399 Win=64128 Len=0 TSval=1257217164 TSecr=15687179"
"105","0.117262","192.168.123.29","192.168.123.20","TLSv1.3","353","Client Hello"
"106","0.117322","192.168.123.20","192.168.123.29","TCP","66","666  >  41196 [ACK] Seq=1 Ack=288 Win=64896 Len=0 TSval=855515166 TSecr=4056525738"
"107","0.118111","192.168.123.20","192.168.123.29","TLSv1.3","1464","Server Hello, Change Cipher Spec, Application Data, Application Data, Application Data, Application Data, Application Data"
"108","0.118139","192.168.123.29","192.168.123.20","TCP","66","41196  >  666 [ACK] Seq=288 Ack=1399 Win=64128 Len=0 TSval=4056525739 TSecr=855515167"
"109","0.118782","192.168.123.27","192.168.123.20","TLSv1.3","756","Change Cipher Spec, Application Data, Application Data, Application Data"
"110","0.118821","192.168.123.20","192.168.123.27","TCP","66","666  >  49300 [ACK] Seq=1399 Ack=978 Win=64256 Len=0 TSval=15687181 TSecr=1257217166"
"111","0.119377","192.168.123.29","192.168.123.20","TLSv1.3","756","Change Cipher Spec, Application Data, Application Data, Application Data"
"112","0.119400","192.168.123.20","192.168.123.29","TCP","66","666  >  41196 [ACK] Seq=1399 Ack=978 Win=64256 Len=0 TSval=855515169 TSecr=4056525741"
"113","0.119444","192.168.123.20","192.168.123.27","TLSv1.3","769","Application Data"
"114","0.119637","192.168.123.20","192.168.123.27","TLSv1.3","769","Application Data"
"115","0.119731","192.168.123.27","192.168.123.20","TCP","66","49300  >  666 [ACK] Seq=978 Ack=2102 Win=63488 Len=0 TSval=1257217167 TSecr=15687182"
"116","0.119759","192.168.123.27","192.168.123.20","TCP","66","49300  >  666 [ACK] Seq=978 Ack=2805 Win=62848 Len=0 TSval=1257217167 TSecr=15687182"
"117","0.119968","192.168.123.20","192.168.123.29","TLSv1.3","769","Application Data"
"118","0.119998","192.168.123.29","192.168.123.20","TCP","66","41196  >  666 [ACK] Seq=978 Ack=2102 Win=64128 Len=0 TSval=4056525741 TSecr=855515169"
"119","0.120157","192.168.123.20","192.168.123.29","TLSv1.3","769","Application Data"
"120","0.120198","192.168.123.29","192.168.123.20","TCP","66","41196  >  666 [ACK] Seq=978 Ack=2805 Win=64128 Len=0 TSval=4056525741 TSecr=855515169"
"123","0.124409","192.168.123.24","192.168.123.20","TCP","74","60498  >  666 [SYN] Seq=0 Win=64240 Len=0 MSS=1460 SACK_PERM=1 TSval=4019910602 TSecr=0 WS=128"
"124","0.124447","192.168.123.20","192.168.123.24","TCP","74","666  >  60498 [SYN, ACK] Seq=0 Ack=1 Win=65160 Len=0 MSS=1460 SACK_PERM=1 TSval=1037271560 TSecr=4019910602 WS=128"
"125","0.124480","192.168.123.24","192.168.123.20","TCP","66","60498  >  666 [ACK] Seq=1 Ack=1 Win=64256 Len=0 TSval=4019910603 TSecr=1037271560"
"126","0.124696","192.168.123.24","192.168.123.20","TLSv1.3","353","Client Hello"
"127","0.124759","192.168.123.20","192.168.123.24","TCP","66","666  >  60498 [ACK] Seq=1 Ack=288 Win=64896 Len=0 TSval=1037271560 TSecr=4019910603"
"128","0.125831","192.168.123.20","192.168.123.24","TLSv1.3","1464","Server Hello, Change Cipher Spec, Application Data, Application Data, Application Data, Application Data, Application Data"
"129","0.125873","192.168.123.24","192.168.123.20","TCP","66","60498  >  666 [ACK] Seq=288 Ack=1399 Win=64128 Len=0 TSval=4019910604 TSecr=1037271561"
"132","0.126515","192.168.123.19","192.168.123.20","TCP","74","32822  >  666 [SYN] Seq=0 Win=64240 Len=0 MSS=1460 SACK_PERM=1 TSval=2569635993 TSecr=0 WS=128"
"133","0.126541","192.168.123.20","192.168.123.19","TCP","74","666  >  32822 [SYN, ACK] Seq=0 Ack=1 Win=65160 Len=0 MSS=1460 SACK_PERM=1 TSval=2902089469 TSecr=2569635993 WS=128"
"134","0.126564","192.168.123.19","192.168.123.20","TCP","66","32822  >  666 [ACK] Seq=1 Ack=1 Win=64256 Len=0 TSval=2569635994 TSecr=2902089469"
"135","0.126745","192.168.123.19","192.168.123.20","TLSv1.3","353","Client Hello"
"136","0.126797","192.168.123.20","192.168.123.19","TCP","66","666  >  32822 [ACK] Seq=1 Ack=288 Win=64896 Len=0 TSval=2902089469 TSecr=2569635994"
"137","0.128456","192.168.123.20","192.168.123.19","TLSv1.3","1464","Server Hello, Change Cipher Spec, Application Data, Application Data, Application Data, Application Data, Application Data"
"138","0.128487","192.168.123.19","192.168.123.20","TCP","66","32822  >  666 [ACK] Seq=288 Ack=1399 Win=64128 Len=0 TSval=2569635996 TSecr=2902089471"
"139","0.129191","192.168.123.24","192.168.123.20","TLSv1.3","756","Change Cipher Spec, Application Data, Application Data, Application Data"
"140","0.129216","192.168.123.20","192.168.123.24","TCP","66","666  >  60498 [ACK] Seq=1399 Ack=978 Win=64256 Len=0 TSval=1037271564 TSecr=4019910607"
"141","0.129839","192.168.123.20","192.168.123.24","TLSv1.3","769","Application Data"
"142","0.129877","192.168.123.24","192.168.123.20","TCP","66","60498  >  666 [ACK] Seq=978 Ack=2102 Win=63488 Len=0 TSval=4019910608 TSecr=1037271565"
"143","0.130015","192.168.123.20","192.168.123.24","TLSv1.3","769","Application Data"
"144","0.130042","192.168.123.24","192.168.123.20","TCP","66","60498  >  666 [ACK] Seq=978 Ack=2805 Win=64128 Len=0 TSval=4019910608 TSecr=1037271565"
"145","0.130378","192.168.123.19","192.168.123.20","TLSv1.3","756","Change Cipher Spec, Application Data, Application Data, Application Data"
"146","0.130415","192.168.123.20","192.168.123.19","TCP","66","666  >  32822 [ACK] Seq=1399 Ack=978 Win=64256 Len=0 TSval=2902089473 TSecr=2569635998"
"147","0.131196","192.168.123.20","192.168.123.19","TLSv1.3","769","Application Data"
"148","0.131231","192.168.123.19","192.168.123.20","TCP","66","32822  >  666 [ACK] Seq=978 Ack=2102 Win=64128 Len=0 TSval=2569635998 TSecr=2902089473"
"149","0.131401","192.168.123.20","192.168.123.19","TLSv1.3","769","Application Data"
"150","0.131435","192.168.123.19","192.168.123.20","TCP","66","32822  >  666 [ACK] Seq=978 Ack=2805 Win=64128 Len=0 TSval=2569635999 TSecr=2902089474"
"153","0.131703","192.168.123.31","192.168.123.20","TCP","74","48450  >  666 [SYN] Seq=0 Win=64240 Len=0 MSS=1460 SACK_PERM=1 TSval=3820478075 TSecr=0 WS=128"
"154","0.131728","192.168.123.20","192.168.123.31","TCP","74","666  >  48450 [SYN, ACK] Seq=0 Ack=1 Win=65160 Len=0 MSS=1460 SACK_PERM=1 TSval=557185905 TSecr=3820478075 WS=128"
"155","0.131750","192.168.123.31","192.168.123.20","TCP","66","48450  >  666 [ACK] Seq=1 Ack=1 Win=64256 Len=0 TSval=3820478075 TSecr=557185905"
"156","0.131931","192.168.123.31","192.168.123.20","TLSv1.3","353","Client Hello"
"157","0.132002","192.168.123.20","192.168.123.31","TCP","66","666  >  48450 [ACK] Seq=1 Ack=288 Win=64896 Len=0 TSval=557185905 TSecr=3820478075"
"158","0.132749","192.168.123.20","192.168.123.31","TLSv1.3","1464","Server Hello, Change Cipher Spec, Application Data, Application Data, Application Data, Application Data, Application Data"
"159","0.132796","192.168.123.31","192.168.123.20","TCP","66","48450  >  666 [ACK] Seq=288 Ack=1399 Win=64128 Len=0 TSval=3820478076 TSecr=557185906"
"162","0.133314","192.168.123.36","192.168.123.20","TCP","74","59172  >  666 [SYN] Seq=0 Win=64240 Len=0 MSS=1460 SACK_PERM=1 TSval=250884440 TSecr=0 WS=128"
"163","0.133339","192.168.123.20","192.168.123.36","TCP","74","666  >  59172 [SYN, ACK] Seq=0 Ack=1 Win=65160 Len=0 MSS=1460 SACK_PERM=1 TSval=3619706065 TSecr=250884440 WS=128"
"164","0.133362","192.168.123.36","192.168.123.20","TCP","66","59172  >  666 [ACK] Seq=1 Ack=1 Win=64256 Len=0 TSval=250884441 TSecr=3619706065"
"165","0.133547","192.168.123.36","192.168.123.20","TLSv1.3","353","Client Hello"
"166","0.133601","192.168.123.20","192.168.123.36","TCP","66","666  >  59172 [ACK] Seq=1 Ack=288 Win=64896 Len=0 TSval=3619706066 TSecr=250884441"
"167","0.134379","192.168.123.20","192.168.123.36","TLSv1.3","1464","Server Hello, Change Cipher Spec, Application Data, Application Data, Application Data, Application Data, Application Data"
"168","0.134424","192.168.123.36","192.168.123.20","TCP","66","59172  >  666 [ACK] Seq=288 Ack=1399 Win=64128 Len=0 TSval=250884442 TSecr=3619706067"
"169","0.138615","192.168.123.36","192.168.123.20","TLSv1.3","756","Change Cipher Spec, Application Data, Application Data, Application Data"
"170","0.138616","192.168.123.31","192.168.123.20","TLSv1.3","756","Change Cipher Spec, Application Data, Application Data, Application Data"
"171","0.138638","192.168.123.20","192.168.123.36","TCP","66","666  >  59172 [ACK] Seq=1399 Ack=978 Win=64256 Len=0 TSval=3619706071 TSecr=250884446"
"172","0.138642","192.168.123.20","192.168.123.31","TCP","66","666  >  48450 [ACK] Seq=1399 Ack=978 Win=64256 Len=0 TSval=557185912 TSecr=3820478082"
"173","0.139042","192.168.123.20","192.168.123.36","TLSv1.3","769","Application Data"
"174","0.139095","192.168.123.20","192.168.123.31","TLSv1.3","769","Application Data"
"175","0.139154","192.168.123.20","192.168.123.36","TLSv1.3","769","Application Data"
"176","0.139226","192.168.123.20","192.168.123.31","TLSv1.3","769","Application Data"
"177","0.139250","192.168.123.36","192.168.123.20","TCP","66","59172  >  666 [ACK] Seq=978 Ack=2102 Win=63488 Len=0 TSval=250884446 TSecr=3619706071"
"178","0.139268","192.168.123.36","192.168.123.20","TCP","66","59172  >  666 [ACK] Seq=978 Ack=2805 Win=62848 Len=0 TSval=250884446 TSecr=3619706071"
"179","0.139310","192.168.123.31","192.168.123.20","TCP","66","48450  >  666 [ACK] Seq=978 Ack=2102 Win=63488 Len=0 TSval=3820478082 TSecr=557185912"
"180","0.139346","192.168.123.31","192.168.123.20","TCP","66","48450  >  666 [ACK] Seq=978 Ack=2805 Win=62848 Len=0 TSval=3820478083 TSecr=557185912"
"183","0.153086","192.168.123.25","192.168.123.20","TCP","74","54870  >  666 [SYN] Seq=0 Win=64240 Len=0 MSS=1460 SACK_PERM=1 TSval=2639184353 TSecr=0 WS=128"
"185","0.153128","192.168.123.20","192.168.123.25","TCP","74","666  >  54870 [SYN, ACK] Seq=0 Ack=1 Win=65160 Len=0 MSS=1460 SACK_PERM=1 TSval=4146328089 TSecr=2639184353 WS=128"
"186","0.153161","192.168.123.25","192.168.123.20","TCP","66","54870  >  666 [ACK] Seq=1 Ack=1 Win=64256 Len=0 TSval=2639184353 TSecr=4146328089"
"188","0.153292","192.168.123.2","192.168.123.20","TCP","74","52390  >  666 [SYN] Seq=0 Win=64240 Len=0 MSS=1460 SACK_PERM=1 TSval=224045987 TSecr=0 WS=128"
"189","0.153324","192.168.123.20","192.168.123.2","TCP","74","666  >  52390 [SYN, ACK] Seq=0 Ack=1 Win=65160 Len=0 MSS=1460 SACK_PERM=1 TSval=232029421 TSecr=224045987 WS=128"
"190","0.153355","192.168.123.2","192.168.123.20","TCP","66","52390  >  666 [ACK] Seq=1 Ack=1 Win=64256 Len=0 TSval=224045988 TSecr=232029421"
"191","0.153470","192.168.123.25","192.168.123.20","TLSv1.3","353","Client Hello"
"192","0.153551","192.168.123.20","192.168.123.25","TCP","66","666  >  54870 [ACK] Seq=1 Ack=288 Win=64896 Len=0 TSval=4146328090 TSecr=2639184354"
"193","0.153636","192.168.123.2","192.168.123.20","TLSv1.3","353","Client Hello"
"194","0.153699","192.168.123.20","192.168.123.2","TCP","66","666  >  52390 [ACK] Seq=1 Ack=288 Win=64896 Len=0 TSval=232029422 TSecr=224045988"
"195","0.154741","192.168.123.20","192.168.123.25","TLSv1.3","1464","Server Hello, Change Cipher Spec, Application Data, Application Data, Application Data, Application Data, Application Data"
"196","0.154754","192.168.123.20","192.168.123.2","TLSv1.3","1464","Server Hello, Change Cipher Spec, Application Data, Application Data, Application Data, Application Data, Application Data"
"197","0.154788","192.168.123.25","192.168.123.20","TCP","66","54870  >  666 [ACK] Seq=288 Ack=1399 Win=64128 Len=0 TSval=2639184355 TSecr=4146328091"
"198","0.154801","192.168.123.2","192.168.123.20","TCP","66","52390  >  666 [ACK] Seq=288 Ack=1399 Win=64128 Len=0 TSval=224045989 TSecr=232029423"
"201","0.155891","192.168.123.26","192.168.123.20","TCP","74","50416  >  666 [SYN] Seq=0 Win=64240 Len=0 MSS=1460 SACK_PERM=1 TSval=1053509040 TSecr=0 WS=128"
"202","0.155915","192.168.123.20","192.168.123.26","TCP","74","666  >  50416 [SYN, ACK] Seq=0 Ack=1 Win=65160 Len=0 MSS=1460 SACK_PERM=1 TSval=2328259422 TSecr=1053509040 WS=128"
"203","0.155938","192.168.123.26","192.168.123.20","TCP","66","50416  >  666 [ACK] Seq=1 Ack=1 Win=64256 Len=0 TSval=1053509040 TSecr=2328259422"
"204","0.156121","192.168.123.26","192.168.123.20","TLSv1.3","353","Client Hello"
"205","0.156205","192.168.123.20","192.168.123.26","TCP","66","666  >  50416 [ACK] Seq=1 Ack=288 Win=64896 Len=0 TSval=2328259422 TSecr=1053509040"
"206","0.156894","192.168.123.2","192.168.123.20","TLSv1.3","756","Change Cipher Spec, Application Data, Application Data, Application Data"
"207","0.156932","192.168.123.20","192.168.123.2","TCP","66","666  >  52390 [ACK] Seq=1399 Ack=978 Win=64256 Len=0 TSval=232029425 TSecr=224045991"
"208","0.156987","192.168.123.20","192.168.123.26","TLSv1.3","1464","Server Hello, Change Cipher Spec, Application Data, Application Data, Application Data, Application Data, Application Data"
"209","0.157046","192.168.123.26","192.168.123.20","TCP","66","50416  >  666 [ACK] Seq=288 Ack=1399 Win=64128 Len=0 TSval=1053509041 TSecr=2328259423"
"210","0.157615","192.168.123.20","192.168.123.2","TLSv1.3","769","Application Data"
"211","0.157789","192.168.123.20","192.168.123.2","TLSv1.3","769","Application Data"
"212","0.157890","192.168.123.2","192.168.123.20","TCP","66","52390  >  666 [ACK] Seq=978 Ack=2102 Win=63488 Len=0 TSval=224045992 TSecr=232029426"
"213","0.157924","192.168.123.2","192.168.123.20","TCP","66","52390  >  666 [ACK] Seq=978 Ack=2805 Win=62848 Len=0 TSval=224045992 TSecr=232029426"
"214","0.158395","192.168.123.26","192.168.123.20","TLSv1.3","756","Change Cipher Spec, Application Data, Application Data, Application Data"
"215","0.158422","192.168.123.20","192.168.123.26","TCP","66","666  >  50416 [ACK] Seq=1399 Ack=978 Win=64256 Len=0 TSval=2328259425 TSecr=1053509043"
"216","0.158775","192.168.123.25","192.168.123.20","TLSv1.3","756","Change Cipher Spec, Application Data, Application Data, Application Data"
"217","0.158803","192.168.123.20","192.168.123.25","TCP","66","666  >  54870 [ACK] Seq=1399 Ack=978 Win=64256 Len=0 TSval=4146328095 TSecr=2639184359"
"218","0.158875","192.168.123.20","192.168.123.26","TLSv1.3","769","Application Data"
"219","0.158976","192.168.123.20","192.168.123.26","TLSv1.3","769","Application Data"
"220","0.159044","192.168.123.26","192.168.123.20","TCP","66","50416  >  666 [ACK] Seq=978 Ack=2102 Win=63488 Len=0 TSval=1053509043 TSecr=2328259425"
"221","0.159063","192.168.123.26","192.168.123.20","TCP","66","50416  >  666 [ACK] Seq=978 Ack=2805 Win=62848 Len=0 TSval=1053509043 TSecr=2328259425"
"222","0.159265","192.168.123.20","192.168.123.25","TLSv1.3","769","Application Data"
"223","0.159429","192.168.123.20","192.168.123.25","TLSv1.3","769","Application Data"
"224","0.159522","192.168.123.25","192.168.123.20","TCP","66","54870  >  666 [ACK] Seq=978 Ack=2102 Win=63488 Len=0 TSval=2639184360 TSecr=4146328095"
"225","0.159552","192.168.123.25","192.168.123.20","TCP","66","54870  >  666 [ACK] Seq=978 Ack=2805 Win=62848 Len=0 TSval=2639184360 TSecr=4146328096"
"228","0.164182","192.168.123.15","192.168.123.20","TCP","74","60796  >  666 [SYN] Seq=0 Win=64240 Len=0 MSS=1460 SACK_PERM=1 TSval=2746726839 TSecr=0 WS=128"
"229","0.164223","192.168.123.20","192.168.123.15","TCP","74","666  >  60796 [SYN, ACK] Seq=0 Ack=1 Win=65160 Len=0 MSS=1460 SACK_PERM=1 TSval=2252336723 TSecr=2746726839 WS=128"
"230","0.164248","192.168.123.15","192.168.123.20","TCP","66","60796  >  666 [ACK] Seq=1 Ack=1 Win=64256 Len=0 TSval=2746726839 TSecr=2252336723"
"231","0.164434","192.168.123.15","192.168.123.20","TLSv1.3","353","Client Hello"
"232","0.164502","192.168.123.20","192.168.123.15","TCP","66","666  >  60796 [ACK] Seq=1 Ack=288 Win=64896 Len=0 TSval=2252336724 TSecr=2746726840"
"233","0.165196","192.168.123.20","192.168.123.15","TLSv1.3","1464","Server Hello, Change Cipher Spec, Application Data, Application Data, Application Data, Application Data, Application Data"
"234","0.165232","192.168.123.15","192.168.123.20","TCP","66","60796  >  666 [ACK] Seq=288 Ack=1399 Win=64128 Len=0 TSval=2746726840 TSecr=2252336724"
"235","0.166630","192.168.123.15","192.168.123.20","TLSv1.3","756","Change Cipher Spec, Application Data, Application Data, Application Data"
"236","0.166656","192.168.123.20","192.168.123.15","TCP","66","666  >  60796 [ACK] Seq=1399 Ack=978 Win=64256 Len=0 TSval=2252336726 TSecr=2746726842"
"237","0.167090","192.168.123.20","192.168.123.15","TLSv1.3","769","Application Data"
"238","0.167189","192.168.123.20","192.168.123.15","TLSv1.3","769","Application Data"
"239","0.167255","192.168.123.15","192.168.123.20","TCP","66","60796  >  666 [ACK] Seq=978 Ack=2102 Win=63488 Len=0 TSval=2746726842 TSecr=2252336726"
"240","0.167288","192.168.123.15","192.168.123.20","TCP","66","60796  >  666 [ACK] Seq=978 Ack=2805 Win=62848 Len=0 TSval=2746726842 TSecr=2252336726"
"243","0.167542","192.168.123.14","192.168.123.20","TCP","74","54280  >  666 [SYN] Seq=0 Win=64240 Len=0 MSS=1460 SACK_PERM=1 TSval=634898316 TSecr=0 WS=128"
"244","0.167568","192.168.123.20","192.168.123.14","TCP","74","666  >  54280 [SYN, ACK] Seq=0 Ack=1 Win=65160 Len=0 MSS=1460 SACK_PERM=1 TSval=1131748132 TSecr=634898316 WS=128"
"245","0.167592","192.168.123.14","192.168.123.20","TCP","66","54280  >  666 [ACK] Seq=1 Ack=1 Win=64256 Len=0 TSval=634898317 TSecr=1131748132"
"246","0.167843","192.168.123.14","192.168.123.20","TLSv1.3","353","Client Hello"
"247","0.167899","192.168.123.20","192.168.123.14","TCP","66","666  >  54280 [ACK] Seq=1 Ack=288 Win=64896 Len=0 TSval=1131748132 TSecr=634898317"
"248","0.168944","192.168.123.20","192.168.123.14","TLSv1.3","1464","Server Hello, Change Cipher Spec, Application Data, Application Data, Application Data, Application Data, Application Data"
"249","0.168972","192.168.123.14","192.168.123.20","TCP","66","54280  >  666 [ACK] Seq=288 Ack=1399 Win=64128 Len=0 TSval=634898318 TSecr=1131748133"
"250","0.170818","192.168.123.14","192.168.123.20","TLSv1.3","756","Change Cipher Spec, Application Data, Application Data, Application Data"
"251","0.170848","192.168.123.20","192.168.123.14","TCP","66","666  >  54280 [ACK] Seq=1399 Ack=978 Win=64256 Len=0 TSval=1131748135 TSecr=634898320"
"252","0.171312","192.168.123.20","192.168.123.14","TLSv1.3","769","Application Data"
"253","0.171342","192.168.123.14","192.168.123.20","TCP","66","54280  >  666 [ACK] Seq=978 Ack=2102 Win=64128 Len=0 TSval=634898320 TSecr=1131748135"
"254","0.171449","192.168.123.20","192.168.123.14","TLSv1.3","769","Application Data"
"255","0.171464","192.168.123.14","192.168.123.20","TCP","66","54280  >  666 [ACK] Seq=978 Ack=2805 Win=64128 Len=0 TSval=634898321 TSecr=1131748136"
"258","0.173748","192.168.123.16","192.168.123.20","TCP","74","56928  >  666 [SYN] Seq=0 Win=64240 Len=0 MSS=1460 SACK_PERM=1 TSval=3092891773 TSecr=0 WS=128"
"259","0.173805","192.168.123.20","192.168.123.16","TCP","74","666  >  56928 [SYN, ACK] Seq=0 Ack=1 Win=65160 Len=0 MSS=1460 SACK_PERM=1 TSval=3929364695 TSecr=3092891773 WS=128"
"260","0.173841","192.168.123.16","192.168.123.20","TCP","66","56928  >  666 [ACK] Seq=1 Ack=1 Win=64256 Len=0 TSval=3092891773 TSecr=3929364695"
"261","0.174075","192.168.123.16","192.168.123.20","TLSv1.3","353","Client Hello"
"262","0.174131","192.168.123.20","192.168.123.16","TCP","66","666  >  56928 [ACK] Seq=1 Ack=288 Win=64896 Len=0 TSval=3929364695 TSecr=3092891773"
"265","0.174367","192.168.123.35","192.168.123.20","TCP","74","33840  >  666 [SYN] Seq=0 Win=64240 Len=0 MSS=1460 SACK_PERM=1 TSval=835697787 TSecr=0 WS=128"
"266","0.174392","192.168.123.20","192.168.123.35","TCP","74","666  >  33840 [SYN, ACK] Seq=0 Ack=1 Win=65160 Len=0 MSS=1460 SACK_PERM=1 TSval=1698929927 TSecr=835697787 WS=128"
"267","0.174415","192.168.123.35","192.168.123.20","TCP","66","33840  >  666 [ACK] Seq=1 Ack=1 Win=64256 Len=0 TSval=835697788 TSecr=1698929927"
"268","0.174638","192.168.123.35","192.168.123.20","TLSv1.3","353","Client Hello"
"269","0.174721","192.168.123.20","192.168.123.35","TCP","66","666  >  33840 [ACK] Seq=1 Ack=288 Win=64896 Len=0 TSval=1698929927 TSecr=835697788"
"270","0.175001","192.168.123.20","192.168.123.16","TLSv1.3","1464","Server Hello, Change Cipher Spec, Application Data, Application Data, Application Data, Application Data, Application Data"
"271","0.175030","192.168.123.16","192.168.123.20","TCP","66","56928  >  666 [ACK] Seq=288 Ack=1399 Win=64128 Len=0 TSval=3092891774 TSecr=3929364696"
"272","0.175549","192.168.123.20","192.168.123.35","TLSv1.3","1464","Server Hello, Change Cipher Spec, Application Data, Application Data, Application Data, Application Data, Application Data"
"273","0.175597","192.168.123.35","192.168.123.20","TCP","66","33840  >  666 [ACK] Seq=288 Ack=1399 Win=64128 Len=0 TSval=835697789 TSecr=1698929928"
"274","0.176312","192.168.123.16","192.168.123.20","TLSv1.3","756","Change Cipher Spec, Application Data, Application Data, Application Data"
"275","0.176335","192.168.123.20","192.168.123.16","TCP","66","666  >  56928 [ACK] Seq=1399 Ack=978 Win=64256 Len=0 TSval=3929364697 TSecr=3092891775"
"276","0.176827","192.168.123.20","192.168.123.16","TLSv1.3","769","Application Data"
"277","0.176858","192.168.123.16","192.168.123.20","TCP","66","56928  >  666 [ACK] Seq=978 Ack=2102 Win=64128 Len=0 TSval=3092891776 TSecr=3929364698"
"278","0.177008","192.168.123.20","192.168.123.16","TLSv1.3","769","Application Data"
"279","0.177023","192.168.123.16","192.168.123.20","TCP","66","56928  >  666 [ACK] Seq=978 Ack=2805 Win=64128 Len=0 TSval=3092891776 TSecr=3929364698"
"280","0.180471","192.168.123.35","192.168.123.20","TLSv1.3","756","Change Cipher Spec, Application Data, Application Data, Application Data"
"281","0.180497","192.168.123.20","192.168.123.35","TCP","66","666  >  33840 [ACK] Seq=1399 Ack=978 Win=64256 Len=0 TSval=1698929933 TSecr=835697794"
"282","0.181051","192.168.123.20","192.168.123.35","TLSv1.3","769","Application Data"
"283","0.181074","192.168.123.35","192.168.123.20","TCP","66","33840  >  666 [ACK] Seq=978 Ack=2102 Win=64128 Len=0 TSval=835697794 TSecr=1698929933"
"284","0.181172","192.168.123.20","192.168.123.35","TLSv1.3","769","Application Data"
"285","0.181187","192.168.123.35","192.168.123.20","TCP","66","33840  >  666 [ACK] Seq=978 Ack=2805 Win=64128 Len=0 TSval=835697794 TSecr=1698929933"
"288","0.182226","192.168.123.32","192.168.123.20","TCP","74","49698  >  666 [SYN] Seq=0 Win=64240 Len=0 MSS=1460 SACK_PERM=1 TSval=3872150197 TSecr=0 WS=128"
"289","0.182253","192.168.123.20","192.168.123.32","TCP","74","666  >  49698 [SYN, ACK] Seq=0 Ack=1 Win=65160 Len=0 MSS=1460 SACK_PERM=1 TSval=3556052545 TSecr=3872150197 WS=128"
"290","0.182276","192.168.123.32","192.168.123.20","TCP","66","49698  >  666 [ACK] Seq=1 Ack=1 Win=64256 Len=0 TSval=3872150197 TSecr=3556052545"
"291","0.182536","192.168.123.32","192.168.123.20","TLSv1.3","353","Client Hello"
"292","0.182650","192.168.123.20","192.168.123.32","TCP","66","666  >  49698 [ACK] Seq=1 Ack=288 Win=64896 Len=0 TSval=3556052546 TSecr=3872150198"
"293","0.183393","192.168.123.20","192.168.123.32","TLSv1.3","1464","Server Hello, Change Cipher Spec, Application Data, Application Data, Application Data, Application Data, Application Data"
"294","0.183423","192.168.123.32","192.168.123.20","TCP","66","49698  >  666 [ACK] Seq=288 Ack=1399 Win=64128 Len=0 TSval=3872150199 TSecr=3556052547"
"297","0.186557","192.168.123.28","192.168.123.20","TCP","74","37042  >  666 [SYN] Seq=0 Win=64240 Len=0 MSS=1460 SACK_PERM=1 TSval=2133773915 TSecr=0 WS=128"
"298","0.186582","192.168.123.20","192.168.123.28","TCP","74","666  >  37042 [SYN, ACK] Seq=0 Ack=1 Win=65160 Len=0 MSS=1460 SACK_PERM=1 TSval=1495561845 TSecr=2133773915 WS=128"
"299","0.186605","192.168.123.28","192.168.123.20","TCP","66","37042  >  666 [ACK] Seq=1 Ack=1 Win=64256 Len=0 TSval=2133773916 TSecr=1495561845"
"300","0.186789","192.168.123.28","192.168.123.20","TLSv1.3","353","Client Hello"
"301","0.186839","192.168.123.20","192.168.123.28","TCP","66","666  >  37042 [ACK] Seq=1 Ack=288 Win=64896 Len=0 TSval=1495561845 TSecr=2133773916"
"302","0.187915","192.168.123.20","192.168.123.28","TLSv1.3","1464","Server Hello, Change Cipher Spec, Application Data, Application Data, Application Data, Application Data, Application Data"
"303","0.187954","192.168.123.28","192.168.123.20","TCP","66","37042  >  666 [ACK] Seq=288 Ack=1399 Win=64128 Len=0 TSval=2133773917 TSecr=1495561846"
"304","0.189476","192.168.123.32","192.168.123.20","TLSv1.3","756","Change Cipher Spec, Application Data, Application Data, Application Data"
"305","0.189535","192.168.123.20","192.168.123.32","TCP","66","666  >  49698 [ACK] Seq=1399 Ack=978 Win=64256 Len=0 TSval=3556052553 TSecr=3872150205"
"306","0.189951","192.168.123.20","192.168.123.32","TLSv1.3","769","Application Data"
"307","0.190083","192.168.123.20","192.168.123.32","TLSv1.3","769","Application Data"
"308","0.190151","192.168.123.32","192.168.123.20","TCP","66","49698  >  666 [ACK] Seq=978 Ack=2102 Win=63488 Len=0 TSval=3872150205 TSecr=3556052553"
"309","0.190169","192.168.123.32","192.168.123.20","TCP","66","49698  >  666 [ACK] Seq=978 Ack=2805 Win=62848 Len=0 TSval=3872150205 TSecr=3556052553"
"310","0.191170","192.168.123.28","192.168.123.20","TLSv1.3","756","Change Cipher Spec, Application Data, Application Data, Application Data"
"311","0.191221","192.168.123.20","192.168.123.28","TCP","66","666  >  37042 [ACK] Seq=1399 Ack=978 Win=64256 Len=0 TSval=1495561849 TSecr=2133773920"
"312","0.191922","192.168.123.20","192.168.123.28","TLSv1.3","769","Application Data"
"313","0.191991","192.168.123.28","192.168.123.20","TCP","66","37042  >  666 [ACK] Seq=978 Ack=2102 Win=64128 Len=0 TSval=2133773921 TSecr=1495561850"
"314","0.192178","192.168.123.20","192.168.123.28","TLSv1.3","769","Application Data"
"315","0.192202","192.168.123.28","192.168.123.20","TCP","66","37042  >  666 [ACK] Seq=978 Ack=2805 Win=64128 Len=0 TSval=2133773921 TSecr=1495561850"
"318","0.197417","192.168.123.11","192.168.123.20","TCP","74","57796  >  666 [SYN] Seq=0 Win=64240 Len=0 MSS=1460 SACK_PERM=1 TSval=74416814 TSecr=0 WS=128"
"319","0.197444","192.168.123.20","192.168.123.11","TCP","74","666  >  57796 [SYN, ACK] Seq=0 Ack=1 Win=65160 Len=0 MSS=1460 SACK_PERM=1 TSval=1790507548 TSecr=74416814 WS=128"
"320","0.197466","192.168.123.11","192.168.123.20","TCP","66","57796  >  666 [ACK] Seq=1 Ack=1 Win=64256 Len=0 TSval=74416815 TSecr=1790507548"
"321","0.197694","192.168.123.11","192.168.123.20","TLSv1.3","353","Client Hello"
"322","0.197766","192.168.123.20","192.168.123.11","TCP","66","666  >  57796 [ACK] Seq=1 Ack=288 Win=64896 Len=0 TSval=1790507548 TSecr=74416815"
"324","0.198669","192.168.123.20","192.168.123.11","TLSv1.3","1464","Server Hello, Change Cipher Spec, Application Data, Application Data, Application Data, Application Data, Application Data"
"326","0.198691","192.168.123.12","192.168.123.20","TCP","74","53248  >  666 [SYN] Seq=0 Win=64240 Len=0 MSS=1460 SACK_PERM=1 TSval=603674960 TSecr=0 WS=128"
"327","0.198717","192.168.123.11","192.168.123.20","TCP","66","57796  >  666 [ACK] Seq=288 Ack=1399 Win=64128 Len=0 TSval=74416816 TSecr=1790507549"
"328","0.198735","192.168.123.20","192.168.123.12","TCP","74","666  >  53248 [SYN, ACK] Seq=0 Ack=1 Win=65160 Len=0 MSS=1460 SACK_PERM=1 TSval=2017205687 TSecr=603674960 WS=128"
"329","0.198773","192.168.123.12","192.168.123.20","TCP","66","53248  >  666 [ACK] Seq=1 Ack=1 Win=64256 Len=0 TSval=603674960 TSecr=2017205687"
"330","0.198966","192.168.123.12","192.168.123.20","TLSv1.3","353","Client Hello"
"331","0.199023","192.168.123.20","192.168.123.12","TCP","66","666  >  53248 [ACK] Seq=1 Ack=288 Win=64896 Len=0 TSval=2017205687 TSecr=603674960"
"332","0.199844","192.168.123.20","192.168.123.12","TLSv1.3","1464","Server Hello, Change Cipher Spec, Application Data, Application Data, Application Data, Application Data, Application Data"
"333","0.199891","192.168.123.12","192.168.123.20","TCP","66","53248  >  666 [ACK] Seq=288 Ack=1399 Win=64128 Len=0 TSval=603674961 TSecr=2017205688"
"336","0.201555","192.168.123.34","192.168.123.20","TCP","74","40102  >  666 [SYN] Seq=0 Win=64240 Len=0 MSS=1460 SACK_PERM=1 TSval=2114520544 TSecr=0 WS=128"
"337","0.201594","192.168.123.20","192.168.123.34","TCP","74","666  >  40102 [SYN, ACK] Seq=0 Ack=1 Win=65160 Len=0 MSS=1460 SACK_PERM=1 TSval=1810720442 TSecr=2114520544 WS=128"
"338","0.201617","192.168.123.34","192.168.123.20","TCP","66","40102  >  666 [ACK] Seq=1 Ack=1 Win=64256 Len=0 TSval=2114520545 TSecr=1810720442"
"339","0.201697","192.168.123.12","192.168.123.20","TLSv1.3","756","Change Cipher Spec, Application Data, Application Data, Application Data"
"340","0.201749","192.168.123.20","192.168.123.12","TCP","66","666  >  53248 [ACK] Seq=1399 Ack=978 Win=64256 Len=0 TSval=2017205690 TSecr=603674963"
"341","0.201903","192.168.123.34","192.168.123.20","TLSv1.3","353","Client Hello"
"342","0.201968","192.168.123.20","192.168.123.34","TCP","66","666  >  40102 [ACK] Seq=1 Ack=288 Win=64896 Len=0 TSval=1810720442 TSecr=2114520545"
"343","0.202422","192.168.123.20","192.168.123.12","TLSv1.3","769","Application Data"
"344","0.202599","192.168.123.20","192.168.123.12","TLSv1.3","769","Application Data"
"345","0.202691","192.168.123.20","192.168.123.34","TLSv1.3","1464","Server Hello, Change Cipher Spec, Application Data, Application Data, Application Data, Application Data, Application Data"
"346","0.202694","192.168.123.12","192.168.123.20","TCP","66","53248  >  666 [ACK] Seq=978 Ack=2102 Win=63488 Len=0 TSval=603674964 TSecr=2017205691"
"347","0.202717","192.168.123.34","192.168.123.20","TCP","66","40102  >  666 [ACK] Seq=288 Ack=1399 Win=64128 Len=0 TSval=2114520546 TSecr=1810720443"
"348","0.202721","192.168.123.12","192.168.123.20","TCP","66","53248  >  666 [ACK] Seq=978 Ack=2805 Win=62848 Len=0 TSval=603674964 TSecr=2017205691"
"349","0.203918","192.168.123.34","192.168.123.20","TLSv1.3","756","Change Cipher Spec, Application Data, Application Data, Application Data"
"350","0.203943","192.168.123.20","192.168.123.34","TCP","66","666  >  40102 [ACK] Seq=1399 Ack=978 Win=64256 Len=0 TSval=1810720444 TSecr=2114520547"
"351","0.204535","192.168.123.20","192.168.123.34","TLSv1.3","769","Application Data"
"352","0.204578","192.168.123.34","192.168.123.20","TCP","66","40102  >  666 [ACK] Seq=978 Ack=2102 Win=64128 Len=0 TSval=2114520548 TSecr=1810720445"
"353","0.204672","192.168.123.20","192.168.123.34","TLSv1.3","769","Application Data"
"354","0.204700","192.168.123.34","192.168.123.20","TCP","66","40102  >  666 [ACK] Seq=978 Ack=2805 Win=64128 Len=0 TSval=2114520548 TSecr=1810720445"
"355","0.206583","192.168.123.11","192.168.123.20","TLSv1.3","756","Change Cipher Spec, Application Data, Application Data, Application Data"
"356","0.206604","192.168.123.20","192.168.123.11","TCP","66","666  >  57796 [ACK] Seq=1399 Ack=978 Win=64256 Len=0 TSval=1790507557 TSecr=74416824"
"357","0.207122","192.168.123.20","192.168.123.11","TLSv1.3","769","Application Data"
"358","0.207224","192.168.123.20","192.168.123.11","TLSv1.3","769","Application Data"
"359","0.207291","192.168.123.11","192.168.123.20","TCP","66","57796  >  666 [ACK] Seq=978 Ack=2102 Win=63488 Len=0 TSval=74416824 TSecr=1790507557"
"360","0.207309","192.168.123.11","192.168.123.20","TCP","66","57796  >  666 [ACK] Seq=978 Ack=2805 Win=62848 Len=0 TSval=74416824 TSecr=1790507557"
"363","0.712404","192.168.123.30","192.168.123.20","TCP","74","37526  >  666 [SYN] Seq=0 Win=64240 Len=0 MSS=1460 SACK_PERM=1 TSval=4255342195 TSecr=0 WS=128"
"364","0.712435","192.168.123.20","192.168.123.30","TCP","74","666  >  37526 [SYN, ACK] Seq=0 Ack=1 Win=65160 Len=0 MSS=1460 SACK_PERM=1 TSval=3962855697 TSecr=4255342195 WS=128"
"365","0.712459","192.168.123.30","192.168.123.20","TCP","66","37526  >  666 [ACK] Seq=1 Ack=1 Win=64256 Len=0 TSval=4255342196 TSecr=3962855697"
"366","0.712716","192.168.123.30","192.168.123.20","TLSv1.3","353","Client Hello"
"367","0.712774","192.168.123.20","192.168.123.30","TCP","66","666  >  37526 [ACK] Seq=1 Ack=288 Win=64896 Len=0 TSval=3962855697 TSecr=4255342196"
"368","0.713934","192.168.123.20","192.168.123.30","TLSv1.3","1464","Server Hello, Change Cipher Spec, Application Data, Application Data, Application Data, Application Data, Application Data"
"369","0.713979","192.168.123.30","192.168.123.20","TCP","66","37526  >  666 [ACK] Seq=288 Ack=1399 Win=64128 Len=0 TSval=4255342197 TSecr=3962855698"
"370","0.718474","192.168.123.30","192.168.123.20","TLSv1.3","756","Change Cipher Spec, Application Data, Application Data, Application Data"
"371","0.718500","192.168.123.20","192.168.123.30","TCP","66","666  >  37526 [ACK] Seq=1399 Ack=978 Win=64256 Len=0 TSval=3962855703 TSecr=4255342202"
"372","0.718946","192.168.123.20","192.168.123.30","TLSv1.3","769","Application Data"
"373","0.719040","192.168.123.20","192.168.123.30","TLSv1.3","769","Application Data"
"374","0.719125","192.168.123.30","192.168.123.20","TCP","66","37526  >  666 [ACK] Seq=978 Ack=2102 Win=63488 Len=0 TSval=4255342202 TSecr=3962855703"
"375","0.719143","192.168.123.30","192.168.123.20","TCP","66","37526  >  666 [ACK] Seq=978 Ack=2805 Win=62848 Len=0 TSval=4255342202 TSecr=3962855703"
"378","0.779258","192.168.123.13","192.168.123.20","TCP","74","45614  >  666 [SYN] Seq=0 Win=64240 Len=0 MSS=1460 SACK_PERM=1 TSval=1427522510 TSecr=0 WS=128"
"379","0.779287","192.168.123.20","192.168.123.13","TCP","74","666  >  45614 [SYN, ACK] Seq=0 Ack=1 Win=65160 Len=0 MSS=1460 SACK_PERM=1 TSval=4122361093 TSecr=1427522510 WS=128"
"380","0.779311","192.168.123.13","192.168.123.20","TCP","66","45614  >  666 [ACK] Seq=1 Ack=1 Win=64256 Len=0 TSval=1427522510 TSecr=4122361093"
"381","0.779551","192.168.123.13","192.168.123.20","TLSv1.3","353","Client Hello"
"382","0.779627","192.168.123.20","192.168.123.13","TCP","66","666  >  45614 [ACK] Seq=1 Ack=288 Win=64896 Len=0 TSval=4122361094 TSecr=1427522511"
"383","0.780429","192.168.123.20","192.168.123.13","TLSv1.3","1464","Server Hello, Change Cipher Spec, Application Data, Application Data, Application Data, Application Data, Application Data"
"384","0.780464","192.168.123.13","192.168.123.20","TCP","66","45614  >  666 [ACK] Seq=288 Ack=1399 Win=64128 Len=0 TSval=1427522512 TSecr=4122361095"
"385","0.784456","192.168.123.13","192.168.123.20","TLSv1.3","756","Change Cipher Spec, Application Data, Application Data, Application Data"
"386","0.784481","192.168.123.20","192.168.123.13","TCP","66","666  >  45614 [ACK] Seq=1399 Ack=978 Win=64256 Len=0 TSval=4122361099 TSecr=1427522516"
"387","0.784874","192.168.123.20","192.168.123.13","TLSv1.3","769","Application Data"
"388","0.784964","192.168.123.20","192.168.123.13","TLSv1.3","769","Application Data"
"389","0.785043","192.168.123.13","192.168.123.20","TCP","66","45614  >  666 [ACK] Seq=978 Ack=2102 Win=63488 Len=0 TSval=1427522516 TSecr=4122361099"
"390","0.785061","192.168.123.13","192.168.123.20","TCP","66","45614  >  666 [ACK] Seq=978 Ack=2805 Win=62848 Len=0 TSval=1427522516 TSecr=4122361099"
"393","0.939391","192.168.123.23","192.168.123.20","TCP","74","47528  >  666 [SYN] Seq=0 Win=64240 Len=0 MSS=1460 SACK_PERM=1 TSval=756254670 TSecr=0 WS=128"
"394","0.939432","192.168.123.20","192.168.123.23","TCP","74","666  >  47528 [SYN, ACK] Seq=0 Ack=1 Win=65160 Len=0 MSS=1460 SACK_PERM=1 TSval=3856123068 TSecr=756254670 WS=128"
"395","0.939454","192.168.123.23","192.168.123.20","TCP","66","47528  >  666 [ACK] Seq=1 Ack=1 Win=64256 Len=0 TSval=756254671 TSecr=3856123068"
"396","0.939644","192.168.123.23","192.168.123.20","TLSv1.3","353","Client Hello"
"397","0.939715","192.168.123.20","192.168.123.23","TCP","66","666  >  47528 [ACK] Seq=1 Ack=288 Win=64896 Len=0 TSval=3856123068 TSecr=756254671"
"398","0.940658","192.168.123.20","192.168.123.23","TLSv1.3","1464","Server Hello, Change Cipher Spec, Application Data, Application Data, Application Data, Application Data, Application Data"
"399","0.940682","192.168.123.23","192.168.123.20","TCP","66","47528  >  666 [ACK] Seq=288 Ack=1399 Win=64128 Len=0 TSval=756254672 TSecr=3856123069"
"400","0.942773","192.168.123.23","192.168.123.20","TLSv1.3","756","Change Cipher Spec, Application Data, Application Data, Application Data"
"401","0.942797","192.168.123.20","192.168.123.23","TCP","66","666  >  47528 [ACK] Seq=1399 Ack=978 Win=64256 Len=0 TSval=3856123071 TSecr=756254674"
"402","0.943240","192.168.123.20","192.168.123.23","TLSv1.3","769","Application Data"
"403","0.943369","192.168.123.20","192.168.123.23","TLSv1.3","769","Application Data"
"404","0.943451","192.168.123.23","192.168.123.20","TCP","66","47528  >  666 [ACK] Seq=978 Ack=2102 Win=63488 Len=0 TSval=756254675 TSecr=3856123071"
"405","0.943468","192.168.123.23","192.168.123.20","TCP","66","47528  >  666 [ACK] Seq=978 Ack=2805 Win=62848 Len=0 TSval=756254675 TSecr=3856123072"
"408","0.966571","192.168.123.8","192.168.123.20","TCP","74","53876  >  666 [SYN] Seq=0 Win=64240 Len=0 MSS=1460 SACK_PERM=1 TSval=2012211348 TSecr=0 WS=128"
"409","0.966597","192.168.123.20","192.168.123.8","TCP","74","666  >  53876 [SYN, ACK] Seq=0 Ack=1 Win=65160 Len=0 MSS=1460 SACK_PERM=1 TSval=2104637854 TSecr=2012211348 WS=128"
"410","0.966619","192.168.123.8","192.168.123.20","TCP","66","53876  >  666 [ACK] Seq=1 Ack=1 Win=64256 Len=0 TSval=2012211349 TSecr=2104637854"
"411","0.966806","192.168.123.8","192.168.123.20","TLSv1.3","353","Client Hello"
"412","0.966856","192.168.123.20","192.168.123.8","TCP","66","666  >  53876 [ACK] Seq=1 Ack=288 Win=64896 Len=0 TSval=2104637854 TSecr=2012211349"
"413","0.967576","192.168.123.20","192.168.123.8","TLSv1.3","1464","Server Hello, Change Cipher Spec, Application Data, Application Data, Application Data, Application Data, Application Data"
"414","0.967607","192.168.123.8","192.168.123.20","TCP","66","53876  >  666 [ACK] Seq=288 Ack=1399 Win=64128 Len=0 TSval=2012211350 TSecr=2104637855"
"415","0.970050","192.168.123.8","192.168.123.20","TLSv1.3","756","Change Cipher Spec, Application Data, Application Data, Application Data"
"416","0.970076","192.168.123.20","192.168.123.8","TCP","66","666  >  53876 [ACK] Seq=1399 Ack=978 Win=64256 Len=0 TSval=2104637857 TSecr=2012211352"
"417","0.970531","192.168.123.20","192.168.123.8","TLSv1.3","769","Application Data"
"418","0.970621","192.168.123.20","192.168.123.8","TLSv1.3","769","Application Data"
"419","0.971653","192.168.123.8","192.168.123.20","TCP","66","53876  >  666 [ACK] Seq=978 Ack=2102 Win=63488 Len=0 TSval=2012211354 TSecr=2104637858"
"420","0.971674","192.168.123.8","192.168.123.20","TCP","66","53876  >  666 [ACK] Seq=978 Ack=2805 Win=62848 Len=0 TSval=2012211354 TSecr=2104637858"
"423","0.980379","192.168.123.10","192.168.123.20","TCP","74","50066  >  666 [SYN] Seq=0 Win=64240 Len=0 MSS=1460 SACK_PERM=1 TSval=455710670 TSecr=0 WS=128"
"424","0.980408","192.168.123.20","192.168.123.10","TCP","74","666  >  50066 [SYN, ACK] Seq=0 Ack=1 Win=65160 Len=0 MSS=1460 SACK_PERM=1 TSval=2425178081 TSecr=455710670 WS=128"
"425","0.980431","192.168.123.10","192.168.123.20","TCP","66","50066  >  666 [ACK] Seq=1 Ack=1 Win=64256 Len=0 TSval=455710671 TSecr=2425178081"
"426","0.980629","192.168.123.10","192.168.123.20","TLSv1.3","353","Client Hello"
"427","0.980685","192.168.123.20","192.168.123.10","TCP","66","666  >  50066 [ACK] Seq=1 Ack=288 Win=64896 Len=0 TSval=2425178081 TSecr=455710671"
"430","0.980874","192.168.123.33","192.168.123.20","TCP","74","37678  >  666 [SYN] Seq=0 Win=64240 Len=0 MSS=1460 SACK_PERM=1 TSval=2516960649 TSecr=0 WS=128"
"431","0.980899","192.168.123.20","192.168.123.33","TCP","74","666  >  37678 [SYN, ACK] Seq=0 Ack=1 Win=65160 Len=0 MSS=1460 SACK_PERM=1 TSval=57028496 TSecr=2516960649 WS=128"
"432","0.980922","192.168.123.33","192.168.123.20","TCP","66","37678  >  666 [ACK] Seq=1 Ack=1 Win=64256 Len=0 TSval=2516960649 TSecr=57028496"
"433","0.981147","192.168.123.33","192.168.123.20","TLSv1.3","353","Client Hello"
"434","0.981209","192.168.123.20","192.168.123.33","TCP","66","666  >  37678 [ACK] Seq=1 Ack=288 Win=64896 Len=0 TSval=57028496 TSecr=2516960649"
"435","0.981923","192.168.123.20","192.168.123.10","TLSv1.3","1464","Server Hello, Change Cipher Spec, Application Data, Application Data, Application Data, Application Data, Application Data"
"436","0.981968","192.168.123.10","192.168.123.20","TCP","66","50066  >  666 [ACK] Seq=288 Ack=1399 Win=64128 Len=0 TSval=455710672 TSecr=2425178082"
"437","0.981985","192.168.123.20","192.168.123.33","TLSv1.3","1464","Server Hello, Change Cipher Spec, Application Data, Application Data, Application Data, Application Data, Application Data"
"438","0.982013","192.168.123.33","192.168.123.20","TCP","66","37678  >  666 [ACK] Seq=288 Ack=1399 Win=64128 Len=0 TSval=2516960650 TSecr=57028497"
"439","0.983176","192.168.123.10","192.168.123.20","TLSv1.3","756","Change Cipher Spec, Application Data, Application Data, Application Data"
"440","0.983229","192.168.123.20","192.168.123.10","TCP","66","666  >  50066 [ACK] Seq=1399 Ack=978 Win=64256 Len=0 TSval=2425178083 TSecr=455710673"
"441","0.983659","192.168.123.20","192.168.123.10","TLSv1.3","769","Application Data"
"442","0.983686","192.168.123.10","192.168.123.20","TCP","66","50066  >  666 [ACK] Seq=978 Ack=2102 Win=64128 Len=0 TSval=455710674 TSecr=2425178084"
"443","0.983788","192.168.123.20","192.168.123.10","TLSv1.3","769","Application Data"
"444","0.983805","192.168.123.10","192.168.123.20","TCP","66","50066  >  666 [ACK] Seq=978 Ack=2805 Win=64128 Len=0 TSval=455710674 TSecr=2425178084"
"445","0.986994","192.168.123.33","192.168.123.20","TLSv1.3","756","Change Cipher Spec, Application Data, Application Data, Application Data"
"446","0.987046","192.168.123.20","192.168.123.33","TCP","66","666  >  37678 [ACK] Seq=1399 Ack=978 Win=64256 Len=0 TSval=57028502 TSecr=2516960655"
"447","0.987606","192.168.123.20","192.168.123.33","TLSv1.3","769","Application Data"
"448","0.987633","192.168.123.33","192.168.123.20","TCP","66","37678  >  666 [ACK] Seq=978 Ack=2102 Win=64128 Len=0 TSval=2516960656 TSecr=57028503"
"449","0.987736","192.168.123.20","192.168.123.33","TLSv1.3","769","Application Data"
"450","0.987752","192.168.123.33","192.168.123.20","TCP","66","37678  >  666 [ACK] Seq=978 Ack=2805 Win=64128 Len=0 TSval=2516960656 TSecr=57028503"
"453","1.008575","192.168.123.5","192.168.123.20","TCP","74","54902  >  666 [SYN] Seq=0 Win=64240 Len=0 MSS=1460 SACK_PERM=1 TSval=903852875 TSecr=0 WS=128"
"454","1.008619","192.168.123.20","192.168.123.5","TCP","74","666  >  54902 [SYN, ACK] Seq=0 Ack=1 Win=65160 Len=0 MSS=1460 SACK_PERM=1 TSval=3133169706 TSecr=903852875 WS=128"
"455","1.008644","192.168.123.5","192.168.123.20","TCP","66","54902  >  666 [ACK] Seq=1 Ack=1 Win=64256 Len=0 TSval=903852876 TSecr=3133169706"
"456","1.008872","192.168.123.5","192.168.123.20","TLSv1.3","353","Client Hello"
"457","1.008937","192.168.123.20","192.168.123.5","TCP","66","666  >  54902 [ACK] Seq=1 Ack=288 Win=64896 Len=0 TSval=3133169706 TSecr=903852876"
"460","1.009302","192.168.123.21","192.168.123.20","TCP","74","41420  >  666 [SYN] Seq=0 Win=64240 Len=0 MSS=1460 SACK_PERM=1 TSval=764551305 TSecr=0 WS=128"
"461","1.009327","192.168.123.20","192.168.123.21","TCP","74","666  >  41420 [SYN, ACK] Seq=0 Ack=1 Win=65160 Len=0 MSS=1460 SACK_PERM=1 TSval=1100041299 TSecr=764551305 WS=128"
"462","1.009350","192.168.123.21","192.168.123.20","TCP","66","41420  >  666 [ACK] Seq=1 Ack=1 Win=64256 Len=0 TSval=764551306 TSecr=1100041299"
"463","1.009537","192.168.123.21","192.168.123.20","TLSv1.3","353","Client Hello"
"464","1.009604","192.168.123.20","192.168.123.21","TCP","66","666  >  41420 [ACK] Seq=1 Ack=288 Win=64896 Len=0 TSval=1100041300 TSecr=764551306"
"465","1.009808","192.168.123.20","192.168.123.5","TLSv1.3","1464","Server Hello, Change Cipher Spec, Application Data, Application Data, Application Data, Application Data, Application Data"
"466","1.009845","192.168.123.5","192.168.123.20","TCP","66","54902  >  666 [ACK] Seq=288 Ack=1399 Win=64128 Len=0 TSval=903852877 TSecr=3133169707"
"467","1.011200","192.168.123.20","192.168.123.21","TLSv1.3","1464","Server Hello, Change Cipher Spec, Application Data, Application Data, Application Data, Application Data, Application Data"
"468","1.011244","192.168.123.21","192.168.123.20","TCP","66","41420  >  666 [ACK] Seq=288 Ack=1399 Win=64128 Len=0 TSval=764551307 TSecr=1100041301"
"469","1.012707","192.168.123.21","192.168.123.20","TLSv1.3","756","Change Cipher Spec, Application Data, Application Data, Application Data"
"470","1.012732","192.168.123.20","192.168.123.21","TCP","66","666  >  41420 [ACK] Seq=1399 Ack=978 Win=64256 Len=0 TSval=1100041303 TSecr=764551309"
"471","1.013301","192.168.123.20","192.168.123.21","TLSv1.3","769","Application Data"
"472","1.013324","192.168.123.21","192.168.123.20","TCP","66","41420  >  666 [ACK] Seq=978 Ack=2102 Win=64128 Len=0 TSval=764551309 TSecr=1100041303"
"473","1.013424","192.168.123.20","192.168.123.21","TLSv1.3","769","Application Data"
"474","1.013439","192.168.123.21","192.168.123.20","TCP","66","41420  >  666 [ACK] Seq=978 Ack=2805 Win=64128 Len=0 TSval=764551310 TSecr=1100041304"
"475","1.014524","192.168.123.5","192.168.123.20","TLSv1.3","756","Change Cipher Spec, Application Data, Application Data, Application Data"
"476","1.014551","192.168.123.20","192.168.123.5","TCP","66","666  >  54902 [ACK] Seq=1399 Ack=978 Win=64256 Len=0 TSval=3133169712 TSecr=903852882"
"477","1.015039","192.168.123.20","192.168.123.5","TLSv1.3","769","Application Data"
"478","1.015057","192.168.123.5","192.168.123.20","TCP","66","54902  >  666 [ACK] Seq=978 Ack=2102 Win=64128 Len=0 TSval=903852882 TSecr=3133169712"
"479","1.015173","192.168.123.20","192.168.123.5","TLSv1.3","769","Application Data"
"480","1.015188","192.168.123.5","192.168.123.20","TCP","66","54902  >  666 [ACK] Seq=978 Ack=2805 Win=64128 Len=0 TSval=903852882 TSecr=3133169712"
"483","1.018138","192.168.123.7","192.168.123.20","TCP","74","41104  >  666 [SYN] Seq=0 Win=64240 Len=0 MSS=1460 SACK_PERM=1 TSval=911145487 TSecr=0 WS=128"
"484","1.018165","192.168.123.20","192.168.123.7","TCP","74","666  >  41104 [SYN, ACK] Seq=0 Ack=1 Win=65160 Len=0 MSS=1460 SACK_PERM=1 TSval=177823108 TSecr=911145487 WS=128"
"485","1.018190","192.168.123.7","192.168.123.20","TCP","66","41104  >  666 [ACK] Seq=1 Ack=1 Win=64256 Len=0 TSval=911145487 TSecr=177823108"
"486","1.018392","192.168.123.7","192.168.123.20","TLSv1.3","353","Client Hello"
"487","1.018466","192.168.123.20","192.168.123.7","TCP","66","666  >  41104 [ACK] Seq=1 Ack=288 Win=64896 Len=0 TSval=177823109 TSecr=911145488"
"488","1.019186","192.168.123.20","192.168.123.7","TLSv1.3","1464","Server Hello, Change Cipher Spec, Application Data, Application Data, Application Data, Application Data, Application Data"
"489","1.019212","192.168.123.7","192.168.123.20","TCP","66","41104  >  666 [ACK] Seq=288 Ack=1399 Win=64128 Len=0 TSval=911145488 TSecr=177823109"
"490","1.021271","192.168.123.7","192.168.123.20","TLSv1.3","756","Change Cipher Spec, Application Data, Application Data, Application Data"
"491","1.021312","192.168.123.20","192.168.123.7","TCP","66","666  >  41104 [ACK] Seq=1399 Ack=978 Win=64256 Len=0 TSval=177823111 TSecr=911145490"
"492","1.021945","192.168.123.20","192.168.123.7","TLSv1.3","769","Application Data"
"493","1.021968","192.168.123.7","192.168.123.20","TCP","66","41104  >  666 [ACK] Seq=978 Ack=2102 Win=64128 Len=0 TSval=911145491 TSecr=177823112"
"494","1.022121","192.168.123.20","192.168.123.7","TLSv1.3","769","Application Data"
"495","1.022153","192.168.123.7","192.168.123.20","TCP","66","41104  >  666 [ACK] Seq=978 Ack=2805 Win=64128 Len=0 TSval=911145491 TSecr=177823112"
