"No.","Time","Source","Destination","Protocol","Length","Info"
"15","2.699445","192.168.123.22","192.168.123.24","TCP","74","55334  >  666 [SYN] Seq=0 Win=64240 Len=0 MSS=1460 SACK_PERM=1 TSval=431599341 TSecr=0 WS=128"
"16","2.699488","192.168.123.24","192.168.123.22","TCP","74","666  >  55334 [SYN, ACK] Seq=0 Ack=1 Win=65160 Len=0 MSS=1460 SACK_PERM=1 TSval=3711903222 TSecr=431599341 WS=128"
"17","2.699521","192.168.123.22","192.168.123.24","TCP","66","55334  >  666 [ACK] Seq=1 Ack=1 Win=64256 Len=0 TSval=431599342 TSecr=3711903222"
"18","2.699764","192.168.123.22","192.168.123.24","TLSv1.3","353","Client Hello"
"19","2.699813","192.168.123.24","192.168.123.22","TCP","66","666  >  55334 [ACK] Seq=1 Ack=288 Win=64896 Len=0 TSval=3711903222 TSecr=431599342"
"20","2.701848","192.168.123.24","192.168.123.22","TLSv1.3","1464","Server Hello, Change Cipher Spec, Application Data, Application Data, Application Data, Application Data, Application Data"
"21","2.701889","192.168.123.22","192.168.123.24","TCP","66","55334  >  666 [ACK] Seq=288 Ack=1399 Win=64128 Len=0 TSval=431599344 TSecr=3711903224"
"24","2.702631","192.168.123.35","192.168.123.24","TCP","74","44348  >  666 [SYN] Seq=0 Win=64240 Len=0 MSS=1460 SACK_PERM=1 TSval=3046778537 TSecr=0 WS=128"
"25","2.702659","192.168.123.24","192.168.123.35","TCP","74","666  >  44348 [SYN, ACK] Seq=0 Ack=1 Win=65160 Len=0 MSS=1460 SACK_PERM=1 TSval=1689024861 TSecr=3046778537 WS=128"
"26","2.702684","192.168.123.35","192.168.123.24","TCP","66","44348  >  666 [ACK] Seq=1 Ack=1 Win=64256 Len=0 TSval=3046778537 TSecr=1689024861"
"28","2.702879","192.168.123.35","192.168.123.24","TLSv1.3","353","Client Hello"
"29","2.702935","192.168.123.24","192.168.123.35","TCP","66","666  >  44348 [ACK] Seq=1 Ack=288 Win=64896 Len=0 TSval=1689024861 TSecr=3046778537"
"31","2.703102","192.168.123.27","192.168.123.24","TCP","74","34358  >  666 [SYN] Seq=0 Win=64240 Len=0 MSS=1460 SACK_PERM=1 TSval=1027802471 TSecr=0 WS=128"
"32","2.703143","192.168.123.24","192.168.123.27","TCP","74","666  >  34358 [SYN, ACK] Seq=0 Ack=1 Win=65160 Len=0 MSS=1460 SACK_PERM=1 TSval=2495846511 TSecr=1027802471 WS=128"
"33","2.703180","192.168.123.27","192.168.123.24","TCP","66","34358  >  666 [ACK] Seq=1 Ack=1 Win=64256 Len=0 TSval=1027802472 TSecr=2495846511"
"34","2.703467","192.168.123.27","192.168.123.24","TLSv1.3","353","Client Hello"
"35","2.703545","192.168.123.24","192.168.123.27","TCP","66","666  >  34358 [ACK] Seq=1 Ack=288 Win=64896 Len=0 TSval=2495846511 TSecr=1027802472"
"36","2.704491","192.168.123.24","192.168.123.35","TLSv1.3","1464","Server Hello, Change Cipher Spec, Application Data, Application Data, Application Data, Application Data, Application Data"
"37","2.704525","192.168.123.35","192.168.123.24","TCP","66","44348  >  666 [ACK] Seq=288 Ack=1399 Win=64128 Len=0 TSval=3046778539 TSecr=1689024863"
"38","2.704905","192.168.123.24","192.168.123.27","TLSv1.3","1464","Server Hello, Change Cipher Spec, Application Data, Application Data, Application Data, Application Data, Application Data"
"39","2.704943","192.168.123.27","192.168.123.24","TCP","66","34358  >  666 [ACK] Seq=288 Ack=1399 Win=64128 Len=0 TSval=1027802473 TSecr=2495846512"
"42","2.706521","192.168.123.6","192.168.123.24","TCP","74","42300  >  666 [SYN] Seq=0 Win=64240 Len=0 MSS=1460 SACK_PERM=1 TSval=2005386489 TSecr=0 WS=128"
"43","2.706547","192.168.123.24","192.168.123.6","TCP","74","666  >  42300 [SYN, ACK] Seq=0 Ack=1 Win=65160 Len=0 MSS=1460 SACK_PERM=1 TSval=1107680724 TSecr=2005386489 WS=128"
"44","2.706571","192.168.123.6","192.168.123.24","TCP","66","42300  >  666 [ACK] Seq=1 Ack=1 Win=64256 Len=0 TSval=2005386489 TSecr=1107680724"
"45","2.706779","192.168.123.6","192.168.123.24","TLSv1.3","353","Client Hello"
"46","2.706830","192.168.123.24","192.168.123.6","TCP","66","666  >  42300 [ACK] Seq=1 Ack=288 Win=64896 Len=0 TSval=1107680724 TSecr=2005386489"
"47","2.707702","192.168.123.35","192.168.123.24","TLSv1.3","756","Change Cipher Spec, Application Data, Application Data, Application Data"
"48","2.707742","192.168.123.24","192.168.123.35","TCP","66","666  >  44348 [ACK] Seq=1399 Ack=978 Win=64256 Len=0 TSval=1689024866 TSecr=3046778542"
"49","2.708038","192.168.123.27","192.168.123.24","TLSv1.3","756","Change Cipher Spec, Application Data, Application Data, Application Data"
"50","2.708077","192.168.123.24","192.168.123.27","TCP","66","666  >  34358 [ACK] Seq=1399 Ack=978 Win=64256 Len=0 TSval=2495846516 TSecr=1027802476"
"51","2.708421","192.168.123.24","192.168.123.6","TLSv1.3","1464","Server Hello, Change Cipher Spec, Application Data, Application Data, Application Data, Application Data, Application Data"
"52","2.708426","192.168.123.24","192.168.123.35","TLSv1.3","769","Application Data"
"53","2.708488","192.168.123.6","192.168.123.24","TCP","66","42300  >  666 [ACK] Seq=288 Ack=1399 Win=64128 Len=0 TSval=2005386491 TSecr=1107680726"
"54","2.708621","192.168.123.24","192.168.123.35","TLSv1.3","769","Application Data"
"55","2.708731","192.168.123.35","192.168.123.24","TCP","66","44348  >  666 [ACK] Seq=978 Ack=2102 Win=63488 Len=0 TSval=3046778543 TSecr=1689024867"
"56","2.708732","192.168.123.24","192.168.123.27","TLSv1.3","769","Application Data"
"57","2.708764","192.168.123.35","192.168.123.24","TCP","66","44348  >  666 [ACK] Seq=978 Ack=2805 Win=62848 Len=0 TSval=3046778543 TSecr=1689024867"
"58","2.708892","192.168.123.24","192.168.123.27","TLSv1.3","769","Application Data"
"59","2.708992","192.168.123.27","192.168.123.24","TCP","66","34358  >  666 [ACK] Seq=978 Ack=2102 Win=63488 Len=0 TSval=1027802477 TSecr=2495846516"
"60","2.709021","192.168.123.27","192.168.123.24","TCP","66","34358  >  666 [ACK] Seq=978 Ack=2805 Win=62848 Len=0 TSval=1027802477 TSecr=2495846516"
"61","2.709568","192.168.123.6","192.168.123.24","TLSv1.3","756","Change Cipher Spec, Application Data, Application Data, Application Data"
"62","2.709596","192.168.123.24","192.168.123.6","TCP","66","666  >  42300 [ACK] Seq=1399 Ack=978 Win=64256 Len=0 TSval=1107680727 TSecr=2005386492"
"63","2.710018","192.168.123.24","192.168.123.6","TLSv1.3","769","Application Data"
"64","2.710152","192.168.123.24","192.168.123.6","TLSv1.3","769","Application Data"
"65","2.710157","192.168.123.6","192.168.123.24","TCP","66","42300  >  666 [ACK] Seq=978 Ack=2102 Win=63488 Len=0 TSval=2005386493 TSecr=1107680727"
"66","2.710191","192.168.123.6","192.168.123.24","TCP","66","42300  >  666 [ACK] Seq=978 Ack=2805 Win=62848 Len=0 TSval=2005386493 TSecr=1107680728"
"67","2.711667","192.168.123.22","192.168.123.24","TLSv1.3","756","Change Cipher Spec, Application Data, Application Data, Application Data"
"68","2.711695","192.168.123.24","192.168.123.22","TCP","66","666  >  55334 [ACK] Seq=1399 Ack=978 Win=64256 Len=0 TSval=3711903234 TSecr=431599354"
"69","2.712125","192.168.123.24","192.168.123.22","TLSv1.3","769","Application Data"
"70","2.712224","192.168.123.24","192.168.123.22","TLSv1.3","769","Application Data"
"71","2.712297","192.168.123.22","192.168.123.24","TCP","66","55334  >  666 [ACK] Seq=978 Ack=2102 Win=63488 Len=0 TSval=431599355 TSecr=3711903235"
"72","2.712316","192.168.123.22","192.168.123.24","TCP","66","55334  >  666 [ACK] Seq=978 Ack=2805 Win=62848 Len=0 TSval=431599355 TSecr=3711903235"
"75","2.714450","192.168.123.3","192.168.123.24","TCP","74","35436  >  666 [SYN] Seq=0 Win=64240 Len=0 MSS=1460 SACK_PERM=1 TSval=1857831996 TSecr=0 WS=128"
"76","2.714489","192.168.123.24","192.168.123.3","TCP","74","666  >  35436 [SYN, ACK] Seq=0 Ack=1 Win=65160 Len=0 MSS=1460 SACK_PERM=1 TSval=145157069 TSecr=1857831996 WS=128"
"77","2.714521","192.168.123.3","192.168.123.24","TCP","66","35436  >  666 [ACK] Seq=1 Ack=1 Win=64256 Len=0 TSval=1857831996 TSecr=145157069"
"78","2.714800","192.168.123.3","192.168.123.24","TLSv1.3","353","Client Hello"
"79","2.714870","192.168.123.24","192.168.123.3","TCP","66","666  >  35436 [ACK] Seq=1 Ack=288 Win=64896 Len=0 TSval=145157069 TSecr=1857831996"
"80","2.715913","192.168.123.24","192.168.123.3","TLSv1.3","1464","Server Hello, Change Cipher Spec, Application Data, Application Data, Application Data, Application Data, Application Data"
"81","2.715951","192.168.123.3","192.168.123.24","TCP","66","35436  >  666 [ACK] Seq=288 Ack=1399 Win=64128 Len=0 TSval=1857831997 TSecr=145157070"
"84","2.717542","192.168.123.33","192.168.123.24","TCP","74","57544  >  666 [SYN] Seq=0 Win=64240 Len=0 MSS=1460 SACK_PERM=1 TSval=2740484281 TSecr=0 WS=128"
"85","2.717581","192.168.123.24","192.168.123.33","TCP","74","666  >  57544 [SYN, ACK] Seq=0 Ack=1 Win=65160 Len=0 MSS=1460 SACK_PERM=1 TSval=3709207672 TSecr=2740484281 WS=128"
"86","2.717616","192.168.123.33","192.168.123.24","TCP","66","57544  >  666 [ACK] Seq=1 Ack=1 Win=64256 Len=0 TSval=2740484281 TSecr=3709207672"
"87","2.717875","192.168.123.33","192.168.123.24","TLSv1.3","353","Client Hello"
"88","2.717943","192.168.123.24","192.168.123.33","TCP","66","666  >  57544 [ACK] Seq=1 Ack=288 Win=64896 Len=0 TSval=3709207672 TSecr=2740484281"
"89","2.719020","192.168.123.24","192.168.123.33","TLSv1.3","1464","Server Hello, Change Cipher Spec, Application Data, Application Data, Application Data, Application Data, Application Data"
"90","2.719063","192.168.123.33","192.168.123.24","TCP","66","57544  >  666 [ACK] Seq=288 Ack=1399 Win=64128 Len=0 TSval=2740484283 TSecr=3709207673"
"91","2.719109","192.168.123.3","192.168.123.24","TLSv1.3","756","Change Cipher Spec, Application Data, Application Data, Application Data"
"92","2.719143","192.168.123.24","192.168.123.3","TCP","66","666  >  35436 [ACK] Seq=1399 Ack=978 Win=64256 Len=0 TSval=145157074 TSecr=1857832001"
"93","2.719567","192.168.123.24","192.168.123.3","TLSv1.3","769","Application Data"
"94","2.719592","192.168.123.3","192.168.123.24","TCP","66","35436  >  666 [ACK] Seq=978 Ack=2102 Win=64128 Len=0 TSval=1857832001 TSecr=145157074"
"95","2.719694","192.168.123.24","192.168.123.3","TLSv1.3","769","Application Data"
"96","2.719710","192.168.123.3","192.168.123.24","TCP","66","35436  >  666 [ACK] Seq=978 Ack=2805 Win=64128 Len=0 TSval=1857832001 TSecr=145157074"
"97","2.720842","192.168.123.33","192.168.123.24","TLSv1.3","756","Change Cipher Spec, Application Data, Application Data, Application Data"
"98","2.720877","192.168.123.24","192.168.123.33","TCP","66","666  >  57544 [ACK] Seq=1399 Ack=978 Win=64256 Len=0 TSval=3709207675 TSecr=2740484284"
"99","2.721447","192.168.123.24","192.168.123.33","TLSv1.3","769","Application Data"
"100","2.721591","192.168.123.24","192.168.123.33","TLSv1.3","769","Application Data"
"101","2.721674","192.168.123.33","192.168.123.24","TCP","66","57544  >  666 [ACK] Seq=978 Ack=2102 Win=63488 Len=0 TSval=2740484285 TSecr=3709207676"
"102","2.721700","192.168.123.33","192.168.123.24","TCP","66","57544  >  666 [ACK] Seq=978 Ack=2805 Win=62848 Len=0 TSval=2740484285 TSecr=3709207676"
"105","2.723320","192.168.123.11","192.168.123.24","TCP","74","34400  >  666 [SYN] Seq=0 Win=64240 Len=0 MSS=1460 SACK_PERM=1 TSval=1267948628 TSecr=0 WS=128"
"106","2.723348","192.168.123.24","192.168.123.11","TCP","74","666  >  34400 [SYN, ACK] Seq=0 Ack=1 Win=65160 Len=0 MSS=1460 SACK_PERM=1 TSval=2469001553 TSecr=1267948628 WS=128"
"107","2.723373","192.168.123.11","192.168.123.24","TCP","66","34400  >  666 [ACK] Seq=1 Ack=1 Win=64256 Len=0 TSval=1267948629 TSecr=2469001553"
"108","2.723560","192.168.123.11","192.168.123.24","TLSv1.3","353","Client Hello"
"109","2.723609","192.168.123.24","192.168.123.11","TCP","66","666  >  34400 [ACK] Seq=1 Ack=288 Win=64896 Len=0 TSval=2469001553 TSecr=1267948629"
"112","2.724051","192.168.123.26","192.168.123.24","TCP","74","49730  >  666 [SYN] Seq=0 Win=64240 Len=0 MSS=1460 SACK_PERM=1 TSval=2950974842 TSecr=0 WS=128"
"113","2.724077","192.168.123.24","192.168.123.26","TCP","74","666  >  49730 [SYN, ACK] Seq=0 Ack=1 Win=65160 Len=0 MSS=1460 SACK_PERM=1 TSval=1805201322 TSecr=2950974842 WS=128"
"114","2.724101","192.168.123.26","192.168.123.24","TCP","66","49730  >  666 [ACK] Seq=1 Ack=1 Win=64256 Len=0 TSval=2950974843 TSecr=1805201322"
"115","2.724319","192.168.123.26","192.168.123.24","TLSv1.3","353","Client Hello"
"116","2.724374","192.168.123.24","192.168.123.26","TCP","66","666  >  49730 [ACK] Seq=1 Ack=288 Win=64896 Len=0 TSval=1805201322 TSecr=2950974843"
"117","2.724649","192.168.123.24","192.168.123.11","TLSv1.3","1464","Server Hello, Change Cipher Spec, Application Data, Application Data, Application Data, Application Data, Application Data"
"118","2.724678","192.168.123.11","192.168.123.24","TCP","66","34400  >  666 [ACK] Seq=288 Ack=1399 Win=64128 Len=0 TSval=1267948630 TSecr=2469001554"
"119","2.725095","192.168.123.24","192.168.123.26","TLSv1.3","1464","Server Hello, Change Cipher Spec, Application Data, Application Data, Application Data, Application Data, Application Data"
"120","2.725126","192.168.123.26","192.168.123.24","TCP","66","49730  >  666 [ACK] Seq=288 Ack=1399 Win=64128 Len=0 TSval=2950974844 TSecr=1805201323"
"121","2.726193","192.168.123.26","192.168.123.24","TLSv1.3","756","Change Cipher Spec, Application Data, Application Data, Application Data"
"122","2.726227","192.168.123.24","192.168.123.26","TCP","66","666  >  49730 [ACK] Seq=1399 Ack=978 Win=64256 Len=0 TSval=1805201324 TSecr=2950974845"
"123","2.726687","192.168.123.24","192.168.123.26","TLSv1.3","769","Application Data"
"124","2.726729","192.168.123.26","192.168.123.24","TCP","66","49730  >  666 [ACK] Seq=978 Ack=2102 Win=64128 Len=0 TSval=2950974845 TSecr=1805201324"
"125","2.726904","192.168.123.24","192.168.123.26","TLSv1.3","769","Application Data"
"126","2.726930","192.168.123.26","192.168.123.24","TCP","66","49730  >  666 [ACK] Seq=978 Ack=2805 Win=64128 Len=0 TSval=2950974845 TSecr=1805201324"
"127","2.728190","192.168.123.11","192.168.123.24","TLSv1.3","756","Change Cipher Spec, Application Data, Application Data, Application Data"
"128","2.728215","192.168.123.24","192.168.123.11","TCP","66","666  >  34400 [ACK] Seq=1399 Ack=978 Win=64256 Len=0 TSval=2469001558 TSecr=1267948634"
"129","2.728715","192.168.123.24","192.168.123.11","TLSv1.3","769","Application Data"
"130","2.728816","192.168.123.24","192.168.123.11","TLSv1.3","769","Application Data"
"131","2.728826","192.168.123.11","192.168.123.24","TCP","66","34400  >  666 [ACK] Seq=978 Ack=2102 Win=63488 Len=0 TSval=1267948634 TSecr=2469001558"
"132","2.728860","192.168.123.11","192.168.123.24","TCP","66","34400  >  666 [ACK] Seq=978 Ack=2805 Win=62848 Len=0 TSval=1267948634 TSecr=2469001558"
"135","2.753741","192.168.123.20","192.168.123.24","TCP","74","51306  >  666 [SYN] Seq=0 Win=64240 Len=0 MSS=1460 SACK_PERM=1 TSval=1037363978 TSecr=0 WS=128"
"136","2.753773","192.168.123.24","192.168.123.20","TCP","74","666  >  51306 [SYN, ACK] Seq=0 Ack=1 Win=65160 Len=0 MSS=1460 SACK_PERM=1 TSval=4020003021 TSecr=1037363978 WS=128"
"137","2.753799","192.168.123.20","192.168.123.24","TCP","66","51306  >  666 [ACK] Seq=1 Ack=1 Win=64256 Len=0 TSval=1037363978 TSecr=4020003021"
"139","2.754017","192.168.123.20","192.168.123.24","TLSv1.3","353","Client Hello"
"140","2.754070","192.168.123.24","192.168.123.20","TCP","66","666  >  51306 [ACK] Seq=1 Ack=288 Win=64896 Len=0 TSval=4020003022 TSecr=1037363978"
"142","2.754152","192.168.123.25","192.168.123.24","TCP","74","60030  >  666 [SYN] Seq=0 Win=64240 Len=0 MSS=1460 SACK_PERM=1 TSval=154760197 TSecr=0 WS=128"
"143","2.754179","192.168.123.24","192.168.123.25","TCP","74","666  >  60030 [SYN, ACK] Seq=0 Ack=1 Win=65160 Len=0 MSS=1460 SACK_PERM=1 TSval=1828727296 TSecr=154760197 WS=128"
"144","2.754203","192.168.123.25","192.168.123.24","TCP","66","60030  >  666 [ACK] Seq=1 Ack=1 Win=64256 Len=0 TSval=154760198 TSecr=1828727296"
"145","2.754425","192.168.123.25","192.168.123.24","TLSv1.3","353","Client Hello"
"146","2.754478","192.168.123.24","192.168.123.25","TCP","66","666  >  60030 [ACK] Seq=1 Ack=288 Win=64896 Len=0 TSval=1828727296 TSecr=154760198"
"147","2.754898","192.168.123.24","192.168.123.20","TLSv1.3","1464","Server Hello, Change Cipher Spec, Application Data, Application Data, Application Data, Application Data, Application Data"
"148","2.754928","192.168.123.20","192.168.123.24","TCP","66","51306  >  666 [ACK] Seq=288 Ack=1399 Win=64128 Len=0 TSval=1037363979 TSecr=4020003022"
"149","2.755254","192.168.123.24","192.168.123.25","TLSv1.3","1464","Server Hello, Change Cipher Spec, Application Data, Application Data, Application Data, Application Data, Application Data"
"150","2.755294","192.168.123.25","192.168.123.24","TCP","66","60030  >  666 [ACK] Seq=288 Ack=1399 Win=64128 Len=0 TSval=154760199 TSecr=1828727297"
"151","2.757101","192.168.123.25","192.168.123.24","TLSv1.3","756","Change Cipher Spec, Application Data, Application Data, Application Data"
"152","2.757131","192.168.123.24","192.168.123.25","TCP","66","666  >  60030 [ACK] Seq=1399 Ack=978 Win=64256 Len=0 TSval=1828727299 TSecr=154760201"
"154","2.757581","192.168.123.24","192.168.123.25","TLSv1.3","769","Application Data"
"155","2.757681","192.168.123.24","192.168.123.25","TLSv1.3","769","Application Data"
"157","2.757709","192.168.123.14","192.168.123.24","TCP","74","42208  >  666 [SYN] Seq=0 Win=64240 Len=0 MSS=1460 SACK_PERM=1 TSval=1009262380 TSecr=0 WS=128"
"158","2.757740","192.168.123.24","192.168.123.14","TCP","74","666  >  42208 [SYN, ACK] Seq=0 Ack=1 Win=65160 Len=0 MSS=1460 SACK_PERM=1 TSval=2791862095 TSecr=1009262380 WS=128"
"159","2.757754","192.168.123.25","192.168.123.24","TCP","66","60030  >  666 [ACK] Seq=978 Ack=2102 Win=63488 Len=0 TSval=154760201 TSecr=1828727299"
"160","2.757766","192.168.123.14","192.168.123.24","TCP","66","42208  >  666 [ACK] Seq=1 Ack=1 Win=64256 Len=0 TSval=1009262380 TSecr=2791862095"
"161","2.757774","192.168.123.25","192.168.123.24","TCP","66","60030  >  666 [ACK] Seq=978 Ack=2805 Win=62848 Len=0 TSval=154760201 TSecr=1828727299"
"162","2.757984","192.168.123.14","192.168.123.24","TLSv1.3","353","Client Hello"
"163","2.758045","192.168.123.24","192.168.123.14","TCP","66","666  >  42208 [ACK] Seq=1 Ack=288 Win=64896 Len=0 TSval=2791862095 TSecr=1009262380"
"164","2.759156","192.168.123.24","192.168.123.14","TLSv1.3","1464","Server Hello, Change Cipher Spec, Application Data, Application Data, Application Data, Application Data, Application Data"
"165","2.759198","192.168.123.14","192.168.123.24","TCP","66","42208  >  666 [ACK] Seq=288 Ack=1399 Win=64128 Len=0 TSval=1009262382 TSecr=2791862097"
"168","2.759693","192.168.123.4","192.168.123.24","TCP","74","35802  >  666 [SYN] Seq=0 Win=64240 Len=0 MSS=1460 SACK_PERM=1 TSval=1211596058 TSecr=0 WS=128"
"169","2.759723","192.168.123.24","192.168.123.4","TCP","74","666  >  35802 [SYN, ACK] Seq=0 Ack=1 Win=65160 Len=0 MSS=1460 SACK_PERM=1 TSval=1709679779 TSecr=1211596058 WS=128"
"170","2.759758","192.168.123.4","192.168.123.24","TCP","66","35802  >  666 [ACK] Seq=1 Ack=1 Win=64256 Len=0 TSval=1211596058 TSecr=1709679779"
"171","2.759998","192.168.123.4","192.168.123.24","TLSv1.3","353","Client Hello"
"172","2.760050","192.168.123.24","192.168.123.4","TCP","66","666  >  35802 [ACK] Seq=1 Ack=288 Win=64896 Len=0 TSval=1709679780 TSecr=1211596058"
"173","2.761247","192.168.123.24","192.168.123.4","TLSv1.3","1464","Server Hello, Change Cipher Spec, Application Data, Application Data, Application Data, Application Data, Application Data"
"174","2.761289","192.168.123.4","192.168.123.24","TCP","66","35802  >  666 [ACK] Seq=288 Ack=1399 Win=64128 Len=0 TSval=1211596060 TSecr=1709679781"
"175","2.761530","192.168.123.20","192.168.123.24","TLSv1.3","756","Change Cipher Spec, Application Data, Application Data, Application Data"
"176","2.761559","192.168.123.24","192.168.123.20","TCP","66","666  >  51306 [ACK] Seq=1399 Ack=978 Win=64256 Len=0 TSval=4020003029 TSecr=1037363986"
"177","2.762181","192.168.123.24","192.168.123.20","TLSv1.3","769","Application Data"
"178","2.762246","192.168.123.14","192.168.123.24","TLSv1.3","756","Change Cipher Spec, Application Data, Application Data, Application Data"
"179","2.762248","192.168.123.20","192.168.123.24","TCP","66","51306  >  666 [ACK] Seq=978 Ack=2102 Win=63488 Len=0 TSval=1037363987 TSecr=4020003030"
"180","2.762275","192.168.123.24","192.168.123.14","TCP","66","666  >  42208 [ACK] Seq=1399 Ack=978 Win=64256 Len=0 TSval=2791862100 TSecr=1009262385"
"181","2.762368","192.168.123.24","192.168.123.20","TLSv1.3","769","Application Data"
"182","2.762395","192.168.123.20","192.168.123.24","TCP","66","51306  >  666 [ACK] Seq=978 Ack=2805 Win=64128 Len=0 TSval=1037363987 TSecr=4020003030"
"183","2.762585","192.168.123.4","192.168.123.24","TLSv1.3","756","Change Cipher Spec, Application Data, Application Data, Application Data"
"184","2.762618","192.168.123.24","192.168.123.4","TCP","66","666  >  35802 [ACK] Seq=1399 Ack=978 Win=64256 Len=0 TSval=1709679782 TSecr=1211596061"
"185","2.762718","192.168.123.24","192.168.123.14","TLSv1.3","769","Application Data"
"186","2.762817","192.168.123.24","192.168.123.14","TLSv1.3","769","Application Data"
"187","2.762885","192.168.123.14","192.168.123.24","TCP","66","42208  >  666 [ACK] Seq=978 Ack=2102 Win=63488 Len=0 TSval=1009262385 TSecr=2791862100"
"188","2.762904","192.168.123.14","192.168.123.24","TCP","66","42208  >  666 [ACK] Seq=978 Ack=2805 Win=62848 Len=0 TSval=1009262385 TSecr=2791862100"
"189","2.763002","192.168.123.24","192.168.123.4","TLSv1.3","769","Application Data"
"190","2.763027","192.168.123.4","192.168.123.24","TCP","66","35802  >  666 [ACK] Seq=978 Ack=2102 Win=64128 Len=0 TSval=1211596061 TSecr=1709679782"
"191","2.763128","192.168.123.24","192.168.123.4","TLSv1.3","769","Application Data"
"192","2.763160","192.168.123.4","192.168.123.24","TCP","66","35802  >  666 [ACK] Seq=978 Ack=2805 Win=63616 Len=0 TSval=1211596062 TSecr=1709679783"
"195","2.768002","192.168.123.15","192.168.123.24","TCP","74","40318  >  666 [SYN] Seq=0 Win=64240 Len=0 MSS=1460 SACK_PERM=1 TSval=2708079251 TSecr=0 WS=128"
"196","2.768029","192.168.123.24","192.168.123.15","TCP","74","666  >  40318 [SYN, ACK] Seq=0 Ack=1 Win=65160 Len=0 MSS=1460 SACK_PERM=1 TSval=82215952 TSecr=2708079251 WS=128"
"197","2.768066","192.168.123.15","192.168.123.24","TCP","66","40318  >  666 [ACK] Seq=1 Ack=1 Win=64256 Len=0 TSval=2708079252 TSecr=82215952"
"198","2.768347","192.168.123.15","192.168.123.24","TLSv1.3","353","Client Hello"
"199","2.768460","192.168.123.24","192.168.123.15","TCP","66","666  >  40318 [ACK] Seq=1 Ack=288 Win=64896 Len=0 TSval=82215952 TSecr=2708079252"
"200","2.769281","192.168.123.24","192.168.123.15","TLSv1.3","1464","Server Hello, Change Cipher Spec, Application Data, Application Data, Application Data, Application Data, Application Data"
"201","2.769310","192.168.123.15","192.168.123.24","TCP","66","40318  >  666 [ACK] Seq=288 Ack=1399 Win=64128 Len=0 TSval=2708079253 TSecr=82215953"
"202","2.773308","192.168.123.15","192.168.123.24","TLSv1.3","756","Change Cipher Spec, Application Data, Application Data, Application Data"
"203","2.773334","192.168.123.24","192.168.123.15","TCP","66","666  >  40318 [ACK] Seq=1399 Ack=978 Win=64256 Len=0 TSval=82215957 TSecr=2708079257"
"204","2.773777","192.168.123.24","192.168.123.15","TLSv1.3","769","Application Data"
"205","2.773888","192.168.123.24","192.168.123.15","TLSv1.3","769","Application Data"
"206","2.773965","192.168.123.15","192.168.123.24","TCP","66","40318  >  666 [ACK] Seq=978 Ack=2102 Win=63488 Len=0 TSval=2708079257 TSecr=82215957"
"207","2.773998","192.168.123.15","192.168.123.24","TCP","66","40318  >  666 [ACK] Seq=978 Ack=2805 Win=62848 Len=0 TSval=2708079257 TSecr=82215957"
"210","2.789928","192.168.123.10","192.168.123.24","TCP","74","45444  >  666 [SYN] Seq=0 Win=64240 Len=0 MSS=1460 SACK_PERM=1 TSval=1848907766 TSecr=0 WS=128"
"211","2.789960","192.168.123.24","192.168.123.10","TCP","74","666  >  45444 [SYN, ACK] Seq=0 Ack=1 Win=65160 Len=0 MSS=1460 SACK_PERM=1 TSval=226128100 TSecr=1848907766 WS=128"
"212","2.789985","192.168.123.10","192.168.123.24","TCP","66","45444  >  666 [ACK] Seq=1 Ack=1 Win=64256 Len=0 TSval=1848907766 TSecr=226128100"
"213","2.790231","192.168.123.10","192.168.123.24","TLSv1.3","353","Client Hello"
"214","2.790287","192.168.123.24","192.168.123.10","TCP","66","666  >  45444 [ACK] Seq=1 Ack=288 Win=64896 Len=0 TSval=226128101 TSecr=1848907767"
"215","2.791053","192.168.123.24","192.168.123.10","TLSv1.3","1464","Server Hello, Change Cipher Spec, Application Data, Application Data, Application Data, Application Data, Application Data"
"216","2.791084","192.168.123.10","192.168.123.24","TCP","66","45444  >  666 [ACK] Seq=288 Ack=1399 Win=64128 Len=0 TSval=1848907768 TSecr=226128102"
"219","2.792222","192.168.123.9","192.168.123.24","TCP","74","60516  >  666 [SYN] Seq=0 Win=64240 Len=0 MSS=1460 SACK_PERM=1 TSval=2802013918 TSecr=0 WS=128"
"220","2.792249","192.168.123.24","192.168.123.9","TCP","74","666  >  60516 [SYN, ACK] Seq=0 Ack=1 Win=65160 Len=0 MSS=1460 SACK_PERM=1 TSval=1399657566 TSecr=2802013918 WS=128"
"221","2.792271","192.168.123.9","192.168.123.24","TCP","66","60516  >  666 [ACK] Seq=1 Ack=1 Win=64256 Len=0 TSval=2802013919 TSecr=1399657566"
"222","2.792482","192.168.123.10","192.168.123.24","TLSv1.3","756","Change Cipher Spec, Application Data, Application Data, Application Data"
"223","2.792514","192.168.123.24","192.168.123.10","TCP","66","666  >  45444 [ACK] Seq=1399 Ack=978 Win=64256 Len=0 TSval=226128103 TSecr=1848907769"
"224","2.792535","192.168.123.9","192.168.123.24","TLSv1.3","353","Client Hello"
"225","2.792599","192.168.123.24","192.168.123.9","TCP","66","666  >  60516 [ACK] Seq=1 Ack=288 Win=64896 Len=0 TSval=1399657566 TSecr=2802013919"
"226","2.792988","192.168.123.24","192.168.123.10","TLSv1.3","769","Application Data"
"227","2.793021","192.168.123.10","192.168.123.24","TCP","66","45444  >  666 [ACK] Seq=978 Ack=2102 Win=64128 Len=0 TSval=1848907769 TSecr=226128103"
"228","2.793200","192.168.123.24","192.168.123.10","TLSv1.3","769","Application Data"
"229","2.793223","192.168.123.10","192.168.123.24","TCP","66","45444  >  666 [ACK] Seq=978 Ack=2805 Win=64128 Len=0 TSval=1848907770 TSecr=226128104"
"230","2.793717","192.168.123.24","192.168.123.9","TLSv1.3","1464","Server Hello, Change Cipher Spec, Application Data, Application Data, Application Data, Application Data, Application Data"
"231","2.793787","192.168.123.9","192.168.123.24","TCP","66","60516  >  666 [ACK] Seq=288 Ack=1399 Win=64128 Len=0 TSval=2802013920 TSecr=1399657567"
"234","2.794513","192.168.123.21","192.168.123.24","TCP","74","58696  >  666 [SYN] Seq=0 Win=64240 Len=0 MSS=1460 SACK_PERM=1 TSval=1479378815 TSecr=0 WS=128"
"235","2.794541","192.168.123.24","192.168.123.21","TCP","74","666  >  58696 [SYN, ACK] Seq=0 Ack=1 Win=65160 Len=0 MSS=1460 SACK_PERM=1 TSval=832640210 TSecr=1479378815 WS=128"
"236","2.794565","192.168.123.21","192.168.123.24","TCP","66","58696  >  666 [ACK] Seq=1 Ack=1 Win=64256 Len=0 TSval=1479378815 TSecr=832640210"
"237","2.794779","192.168.123.21","192.168.123.24","TLSv1.3","353","Client Hello"
"238","2.794832","192.168.123.24","192.168.123.21","TCP","66","666  >  58696 [ACK] Seq=1 Ack=288 Win=64896 Len=0 TSval=832640210 TSecr=1479378815"
"239","2.795557","192.168.123.24","192.168.123.21","TLSv1.3","1464","Server Hello, Change Cipher Spec, Application Data, Application Data, Application Data, Application Data, Application Data"
"240","2.795587","192.168.123.21","192.168.123.24","TCP","66","58696  >  666 [ACK] Seq=288 Ack=1399 Win=64128 Len=0 TSval=1479378816 TSecr=832640211"
"241","2.795593","192.168.123.9","192.168.123.24","TLSv1.3","756","Change Cipher Spec, Application Data, Application Data, Application Data"
"242","2.795634","192.168.123.24","192.168.123.9","TCP","66","666  >  60516 [ACK] Seq=1399 Ack=978 Win=64256 Len=0 TSval=1399657569 TSecr=2802013922"
"243","2.796047","192.168.123.24","192.168.123.9","TLSv1.3","769","Application Data"
"244","2.796073","192.168.123.9","192.168.123.24","TCP","66","60516  >  666 [ACK] Seq=978 Ack=2102 Win=64128 Len=0 TSval=2802013923 TSecr=1399657570"
"245","2.796177","192.168.123.24","192.168.123.9","TLSv1.3","769","Application Data"
"246","2.796194","192.168.123.9","192.168.123.24","TCP","66","60516  >  666 [ACK] Seq=978 Ack=2805 Win=64128 Len=0 TSval=2802013923 TSecr=1399657570"
"247","2.797591","192.168.123.21","192.168.123.24","TLSv1.3","756","Change Cipher Spec, Application Data, Application Data, Application Data"
"248","2.797616","192.168.123.24","192.168.123.21","TCP","66","666  >  58696 [ACK] Seq=1399 Ack=978 Win=64256 Len=0 TSval=832640213 TSecr=1479378818"
"249","2.798156","192.168.123.24","192.168.123.21","TLSv1.3","769","Application Data"
"250","2.798185","192.168.123.21","192.168.123.24","TCP","66","58696  >  666 [ACK] Seq=978 Ack=2102 Win=64128 Len=0 TSval=1479378819 TSecr=832640214"
"251","2.798370","192.168.123.24","192.168.123.21","TLSv1.3","769","Application Data"
"252","2.798395","192.168.123.21","192.168.123.24","TCP","66","58696  >  666 [ACK] Seq=978 Ack=2805 Win=64128 Len=0 TSval=1479378819 TSecr=832640214"
"257","2.800423","192.168.123.12","192.168.123.24","TCP","74","46222  >  666 [SYN] Seq=0 Win=64240 Len=0 MSS=1460 SACK_PERM=1 TSval=4233922272 TSecr=0 WS=128"
"258","2.800428","192.168.123.5","192.168.123.24","TCP","74","57520  >  666 [SYN] Seq=0 Win=64240 Len=0 MSS=1460 SACK_PERM=1 TSval=3053153146 TSecr=0 WS=128"
"259","2.800485","192.168.123.24","192.168.123.12","TCP","74","666  >  46222 [SYN, ACK] Seq=0 Ack=1 Win=65160 Len=0 MSS=1460 SACK_PERM=1 TSval=1907703492 TSecr=4233922272 WS=128"
"260","2.800490","192.168.123.24","192.168.123.5","TCP","74","666  >  57520 [SYN, ACK] Seq=0 Ack=1 Win=65160 Len=0 MSS=1460 SACK_PERM=1 TSval=4148643040 TSecr=3053153146 WS=128"
"261","2.800527","192.168.123.12","192.168.123.24","TCP","66","46222  >  666 [ACK] Seq=1 Ack=1 Win=64256 Len=0 TSval=4233922273 TSecr=1907703492"
"262","2.800540","192.168.123.5","192.168.123.24","TCP","66","57520  >  666 [ACK] Seq=1 Ack=1 Win=64256 Len=0 TSval=3053153147 TSecr=4148643040"
"263","2.800823","192.168.123.12","192.168.123.24","TLSv1.3","353","Client Hello"
"264","2.800848","192.168.123.5","192.168.123.24","TLSv1.3","353","Client Hello"
"265","2.800889","192.168.123.24","192.168.123.12","TCP","66","666  >  46222 [ACK] Seq=1 Ack=288 Win=64896 Len=0 TSval=1907703492 TSecr=4233922273"
"266","2.800893","192.168.123.24","192.168.123.5","TCP","66","666  >  57520 [ACK] Seq=1 Ack=288 Win=64896 Len=0 TSval=4148643040 TSecr=3053153147"
"267","2.801811","192.168.123.24","192.168.123.5","TLSv1.3","1464","Server Hello, Change Cipher Spec, Application Data, Application Data, Application Data, Application Data, Application Data"
"268","2.801840","192.168.123.5","192.168.123.24","TCP","66","57520  >  666 [ACK] Seq=288 Ack=1399 Win=64128 Len=0 TSval=3053153148 TSecr=4148643041"
"269","2.802092","192.168.123.24","192.168.123.12","TLSv1.3","1464","Server Hello, Change Cipher Spec, Application Data, Application Data, Application Data, Application Data, Application Data"
"270","2.802141","192.168.123.12","192.168.123.24","TCP","66","46222  >  666 [ACK] Seq=288 Ack=1399 Win=64128 Len=0 TSval=4233922275 TSecr=1907703494"
"271","2.806088","192.168.123.12","192.168.123.24","TLSv1.3","756","Change Cipher Spec, Application Data, Application Data, Application Data"
"272","2.806119","192.168.123.24","192.168.123.12","TCP","66","666  >  46222 [ACK] Seq=1399 Ack=978 Win=64256 Len=0 TSval=1907703498 TSecr=4233922279"
"273","2.806637","192.168.123.24","192.168.123.12","TLSv1.3","769","Application Data"
"274","2.806740","192.168.123.24","192.168.123.12","TLSv1.3","769","Application Data"
"275","2.806817","192.168.123.12","192.168.123.24","TCP","66","46222  >  666 [ACK] Seq=978 Ack=2102 Win=63488 Len=0 TSval=4233922279 TSecr=1907703498"
"276","2.806836","192.168.123.12","192.168.123.24","TCP","66","46222  >  666 [ACK] Seq=978 Ack=2805 Win=62848 Len=0 TSval=4233922279 TSecr=1907703498"
"277","2.807973","192.168.123.5","192.168.123.24","TLSv1.3","756","Change Cipher Spec, Application Data, Application Data, Application Data"
"278","2.808003","192.168.123.24","192.168.123.5","TCP","66","666  >  57520 [ACK] Seq=1399 Ack=978 Win=64256 Len=0 TSval=4148643047 TSecr=3053153154"
"282","2.808370","192.168.123.2","192.168.123.24","TCP","74","45744  >  666 [SYN] Seq=0 Win=64240 Len=0 MSS=1460 SACK_PERM=1 TSval=259447890 TSecr=0 WS=128"
"283","2.808414","192.168.123.24","192.168.123.2","TCP","74","666  >  45744 [SYN, ACK] Seq=0 Ack=1 Win=65160 Len=0 MSS=1460 SACK_PERM=1 TSval=2214992643 TSecr=259447890 WS=128"
"285","2.808482","192.168.123.2","192.168.123.24","TCP","66","45744  >  666 [ACK] Seq=1 Ack=1 Win=64256 Len=0 TSval=259447891 TSecr=2214992643"
"286","2.808498","192.168.123.7","192.168.123.24","TCP","74","53088  >  666 [SYN] Seq=0 Win=64240 Len=0 MSS=1460 SACK_PERM=1 TSval=2813834241 TSecr=0 WS=128"
"287","2.808529","192.168.123.24","192.168.123.7","TCP","74","666  >  53088 [SYN, ACK] Seq=0 Ack=1 Win=65160 Len=0 MSS=1460 SACK_PERM=1 TSval=265417999 TSecr=2813834241 WS=128"
"288","2.808572","192.168.123.24","192.168.123.5","TLSv1.3","769","Application Data"
"289","2.808573","192.168.123.7","192.168.123.24","TCP","66","53088  >  666 [ACK] Seq=1 Ack=1 Win=64256 Len=0 TSval=2813834241 TSecr=265417999"
"290","2.808591","192.168.123.5","192.168.123.24","TCP","66","57520  >  666 [ACK] Seq=978 Ack=2102 Win=64128 Len=0 TSval=3053153155 TSecr=4148643048"
"291","2.808746","192.168.123.24","192.168.123.5","TLSv1.3","769","Application Data"
"292","2.808779","192.168.123.5","192.168.123.24","TCP","66","57520  >  666 [ACK] Seq=978 Ack=2805 Win=64128 Len=0 TSval=3053153155 TSecr=4148643048"
"293","2.808823","192.168.123.7","192.168.123.24","TLSv1.3","353","Client Hello"
"294","2.808885","192.168.123.24","192.168.123.7","TCP","66","666  >  53088 [ACK] Seq=1 Ack=288 Win=64896 Len=0 TSval=265417999 TSecr=2813834241"
"295","2.808886","192.168.123.2","192.168.123.24","TLSv1.3","353","Client Hello"
"296","2.808931","192.168.123.24","192.168.123.2","TCP","66","666  >  45744 [ACK] Seq=1 Ack=288 Win=64896 Len=0 TSval=2214992643 TSecr=259447891"
"297","2.809704","192.168.123.24","192.168.123.2","TLSv1.3","1464","Server Hello, Change Cipher Spec, Application Data, Application Data, Application Data, Application Data, Application Data"
"298","2.809734","192.168.123.2","192.168.123.24","TCP","66","45744  >  666 [ACK] Seq=288 Ack=1399 Win=64128 Len=0 TSval=259447892 TSecr=2214992644"
"299","2.809952","192.168.123.24","192.168.123.7","TLSv1.3","1464","Server Hello, Change Cipher Spec, Application Data, Application Data, Application Data, Application Data, Application Data"
"300","2.809982","192.168.123.7","192.168.123.24","TCP","66","53088  >  666 [ACK] Seq=288 Ack=1399 Win=64128 Len=0 TSval=2813834242 TSecr=265418000"
"301","2.811967","192.168.123.2","192.168.123.24","TLSv1.3","756","Change Cipher Spec, Application Data, Application Data, Application Data"
"302","2.811995","192.168.123.24","192.168.123.2","TCP","66","666  >  45744 [ACK] Seq=1399 Ack=978 Win=64256 Len=0 TSval=2214992646 TSecr=259447894"
"303","2.812038","192.168.123.7","192.168.123.24","TLSv1.3","756","Change Cipher Spec, Application Data, Application Data, Application Data"
"304","2.812077","192.168.123.24","192.168.123.7","TCP","66","666  >  53088 [ACK] Seq=1399 Ack=978 Win=64256 Len=0 TSval=265418003 TSecr=2813834244"
"305","2.812662","192.168.123.24","192.168.123.2","TLSv1.3","769","Application Data"
"306","2.812664","192.168.123.24","192.168.123.7","TLSv1.3","769","Application Data"
"307","2.812695","192.168.123.7","192.168.123.24","TCP","66","53088  >  666 [ACK] Seq=978 Ack=2102 Win=64128 Len=0 TSval=2813834245 TSecr=265418003"
"308","2.812710","192.168.123.2","192.168.123.24","TCP","66","45744  >  666 [ACK] Seq=978 Ack=2102 Win=64128 Len=0 TSval=259447895 TSecr=2214992647"
"309","2.812822","192.168.123.24","192.168.123.7","TLSv1.3","769","Application Data"
"310","2.812840","192.168.123.7","192.168.123.24","TCP","66","53088  >  666 [ACK] Seq=978 Ack=2805 Win=64128 Len=0 TSval=2813834245 TSecr=265418003"
"311","2.812880","192.168.123.24","192.168.123.2","TLSv1.3","769","Application Data"
"312","2.812905","192.168.123.2","192.168.123.24","TCP","66","45744  >  666 [ACK] Seq=978 Ack=2805 Win=64128 Len=0 TSval=259447895 TSecr=2214992647"
"315","2.814379","192.168.123.16","192.168.123.24","TCP","74","44766  >  666 [SYN] Seq=0 Win=64240 Len=0 MSS=1460 SACK_PERM=1 TSval=4285783252 TSecr=0 WS=128"
"316","2.814408","192.168.123.24","192.168.123.16","TCP","74","666  >  44766 [SYN, ACK] Seq=0 Ack=1 Win=65160 Len=0 MSS=1460 SACK_PERM=1 TSval=1083793795 TSecr=4285783252 WS=128"
"317","2.814433","192.168.123.16","192.168.123.24","TCP","66","44766  >  666 [ACK] Seq=1 Ack=1 Win=64256 Len=0 TSval=4285783253 TSecr=1083793795"
"318","2.814649","192.168.123.16","192.168.123.24","TLSv1.3","353","Client Hello"
"319","2.814716","192.168.123.24","192.168.123.16","TCP","66","666  >  44766 [ACK] Seq=1 Ack=288 Win=64896 Len=0 TSval=1083793795 TSecr=4285783253"
"320","2.815467","192.168.123.24","192.168.123.16","TLSv1.3","1464","Server Hello, Change Cipher Spec, Application Data, Application Data, Application Data, Application Data, Application Data"
"321","2.815497","192.168.123.16","192.168.123.24","TCP","66","44766  >  666 [ACK] Seq=288 Ack=1399 Win=64128 Len=0 TSval=4285783254 TSecr=1083793796"
"322","2.817269","192.168.123.16","192.168.123.24","TLSv1.3","756","Change Cipher Spec, Application Data, Application Data, Application Data"
"323","2.817304","192.168.123.24","192.168.123.16","TCP","66","666  >  44766 [ACK] Seq=1399 Ack=978 Win=64256 Len=0 TSval=1083793798 TSecr=4285783256"
"324","2.818043","192.168.123.24","192.168.123.16","TLSv1.3","769","Application Data"
"325","2.818067","192.168.123.16","192.168.123.24","TCP","66","44766  >  666 [ACK] Seq=978 Ack=2102 Win=64128 Len=0 TSval=4285783257 TSecr=1083793799"
"326","2.818171","192.168.123.24","192.168.123.16","TLSv1.3","769","Application Data"
"327","2.818187","192.168.123.16","192.168.123.24","TCP","66","44766  >  666 [ACK] Seq=978 Ack=2805 Win=64128 Len=0 TSval=4285783257 TSecr=1083793799"
"330","2.821597","192.168.123.34","192.168.123.24","TCP","74","48412  >  666 [SYN] Seq=0 Win=64240 Len=0 MSS=1460 SACK_PERM=1 TSval=4056187198 TSecr=0 WS=128"
"331","2.821639","192.168.123.24","192.168.123.34","TCP","74","666  >  48412 [SYN, ACK] Seq=0 Ack=1 Win=65160 Len=0 MSS=1460 SACK_PERM=1 TSval=1686262679 TSecr=4056187198 WS=128"
"332","2.821674","192.168.123.34","192.168.123.24","TCP","66","48412  >  666 [ACK] Seq=1 Ack=1 Win=64256 Len=0 TSval=4056187198 TSecr=1686262679"
"333","2.821992","192.168.123.34","192.168.123.24","TLSv1.3","353","Client Hello"
"334","2.822067","192.168.123.24","192.168.123.34","TCP","66","666  >  48412 [ACK] Seq=1 Ack=288 Win=64896 Len=0 TSval=1686262680 TSecr=4056187198"
"335","2.822848","192.168.123.24","192.168.123.34","TLSv1.3","1464","Server Hello, Change Cipher Spec, Application Data, Application Data, Application Data, Application Data, Application Data"
"336","2.822880","192.168.123.34","192.168.123.24","TCP","66","48412  >  666 [ACK] Seq=288 Ack=1399 Win=64128 Len=0 TSval=4056187199 TSecr=1686262680"
"337","2.825081","192.168.123.34","192.168.123.24","TLSv1.3","756","Change Cipher Spec, Application Data, Application Data, Application Data"
"338","2.825117","192.168.123.24","192.168.123.34","TCP","66","666  >  48412 [ACK] Seq=1399 Ack=978 Win=64256 Len=0 TSval=1686262683 TSecr=4056187202"
"339","2.825720","192.168.123.24","192.168.123.34","TLSv1.3","769","Application Data"
"340","2.825750","192.168.123.34","192.168.123.24","TCP","66","48412  >  666 [ACK] Seq=978 Ack=2102 Win=64128 Len=0 TSval=4056187202 TSecr=1686262683"
"341","2.825894","192.168.123.24","192.168.123.34","TLSv1.3","769","Application Data"
"342","2.825921","192.168.123.34","192.168.123.24","TCP","66","48412  >  666 [ACK] Seq=978 Ack=2805 Win=64128 Len=0 TSval=4056187202 TSecr=1686262683"
"345","3.694877","192.168.123.30","192.168.123.24","TCP","74","40400  >  666 [SYN] Seq=0 Win=64240 Len=0 MSS=1460 SACK_PERM=1 TSval=564190995 TSecr=0 WS=128"
"346","3.694908","192.168.123.24","192.168.123.30","TCP","74","666  >  40400 [SYN, ACK] Seq=0 Ack=1 Win=65160 Len=0 MSS=1460 SACK_PERM=1 TSval=2438815 TSecr=564190995 WS=128"
"347","3.694933","192.168.123.30","192.168.123.24","TCP","66","40400  >  666 [ACK] Seq=1 Ack=1 Win=64256 Len=0 TSval=564190995 TSecr=2438815"
"348","3.695161","192.168.123.30","192.168.123.24","TLSv1.3","353","Client Hello"
"349","3.695230","192.168.123.24","192.168.123.30","TCP","66","666  >  40400 [ACK] Seq=1 Ack=288 Win=64896 Len=0 TSval=2438816 TSecr=564190996"
"350","3.696311","192.168.123.24","192.168.123.30","TLSv1.3","1464","Server Hello, Change Cipher Spec, Application Data, Application Data, Application Data, Application Data, Application Data"
"351","3.696344","192.168.123.30","192.168.123.24","TCP","66","40400  >  666 [ACK] Seq=288 Ack=1399 Win=64128 Len=0 TSval=564190997 TSecr=2438817"
"352","3.698366","192.168.123.30","192.168.123.24","TLSv1.3","756","Change Cipher Spec, Application Data, Application Data, Application Data"
"353","3.698394","192.168.123.24","192.168.123.30","TCP","66","666  >  40400 [ACK] Seq=1399 Ack=978 Win=64256 Len=0 TSval=2438819 TSecr=564190999"
"354","3.698869","192.168.123.24","192.168.123.30","TLSv1.3","769","Application Data"
"355","3.698981","192.168.123.24","192.168.123.30","TLSv1.3","769","Application Data"
"356","3.699051","192.168.123.30","192.168.123.24","TCP","66","40400  >  666 [ACK] Seq=978 Ack=2102 Win=63488 Len=0 TSval=564191000 TSecr=2438819"
"357","3.699070","192.168.123.30","192.168.123.24","TCP","66","40400  >  666 [ACK] Seq=978 Ack=2805 Win=62848 Len=0 TSval=564191000 TSecr=2438819"
"360","3.774655","192.168.123.28","192.168.123.24","TCP","74","37754  >  666 [SYN] Seq=0 Win=64240 Len=0 MSS=1460 SACK_PERM=1 TSval=917584410 TSecr=0 WS=128"
"361","3.774686","192.168.123.24","192.168.123.28","TCP","74","666  >  37754 [SYN, ACK] Seq=0 Ack=1 Win=65160 Len=0 MSS=1460 SACK_PERM=1 TSval=2093952864 TSecr=917584410 WS=128"
"362","3.774726","192.168.123.28","192.168.123.24","TCP","66","37754  >  666 [ACK] Seq=1 Ack=1 Win=64256 Len=0 TSval=917584410 TSecr=2093952864"
"363","3.774960","192.168.123.28","192.168.123.24","TLSv1.3","353","Client Hello"
"364","3.775056","192.168.123.24","192.168.123.28","TCP","66","666  >  37754 [ACK] Seq=1 Ack=288 Win=64896 Len=0 TSval=2093952864 TSecr=917584410"
"365","3.775989","192.168.123.24","192.168.123.28","TLSv1.3","1464","Server Hello, Change Cipher Spec, Application Data, Application Data, Application Data, Application Data, Application Data"
"366","3.776030","192.168.123.28","192.168.123.24","TCP","66","37754  >  666 [ACK] Seq=288 Ack=1399 Win=64128 Len=0 TSval=917584411 TSecr=2093952865"
"367","3.778401","192.168.123.28","192.168.123.24","TLSv1.3","756","Change Cipher Spec, Application Data, Application Data, Application Data"
"368","3.778427","192.168.123.24","192.168.123.28","TCP","66","666  >  37754 [ACK] Seq=1399 Ack=978 Win=64256 Len=0 TSval=2093952868 TSecr=917584414"
"369","3.778871","192.168.123.24","192.168.123.28","TLSv1.3","769","Application Data"
"370","3.778997","192.168.123.24","192.168.123.28","TLSv1.3","769","Application Data"
"371","3.779064","192.168.123.28","192.168.123.24","TCP","66","37754  >  666 [ACK] Seq=978 Ack=2102 Win=63488 Len=0 TSval=917584415 TSecr=2093952868"
"372","3.779082","192.168.123.28","192.168.123.24","TCP","66","37754  >  666 [ACK] Seq=978 Ack=2805 Win=62848 Len=0 TSval=917584415 TSecr=2093952868"
"375","3.785619","192.168.123.41","192.168.123.24","TCP","74","36628  >  666 [SYN] Seq=0 Win=64240 Len=0 MSS=1460 SACK_PERM=1 TSval=3261962898 TSecr=0 WS=128"
"376","3.785643","192.168.123.24","192.168.123.41","TCP","74","666  >  36628 [SYN, ACK] Seq=0 Ack=1 Win=65160 Len=0 MSS=1460 SACK_PERM=1 TSval=3379195382 TSecr=3261962898 WS=128"
"377","3.785664","192.168.123.41","192.168.123.24","TCP","66","36628  >  666 [ACK] Seq=1 Ack=1 Win=64256 Len=0 TSval=3261962898 TSecr=3379195382"
"378","3.785898","192.168.123.41","192.168.123.24","TLSv1.3","353","Client Hello"
"379","3.785974","192.168.123.24","192.168.123.41","TCP","66","666  >  36628 [ACK] Seq=1 Ack=288 Win=64896 Len=0 TSval=3379195382 TSecr=3261962898"
"380","3.787304","192.168.123.24","192.168.123.41","TLSv1.3","1464","Server Hello, Change Cipher Spec, Application Data, Application Data, Application Data, Application Data, Application Data"
"381","3.787332","192.168.123.41","192.168.123.24","TCP","66","36628  >  666 [ACK] Seq=288 Ack=1399 Win=64128 Len=0 TSval=3261962900 TSecr=3379195384"
"382","3.793638","192.168.123.41","192.168.123.24","TLSv1.3","756","Change Cipher Spec, Application Data, Application Data, Application Data"
"383","3.793672","192.168.123.24","192.168.123.41","TCP","66","666  >  36628 [ACK] Seq=1399 Ack=978 Win=64256 Len=0 TSval=3379195390 TSecr=3261962906"
"384","3.794270","192.168.123.24","192.168.123.41","TLSv1.3","769","Application Data"
"385","3.794360","192.168.123.41","192.168.123.24","TCP","66","36628  >  666 [ACK] Seq=978 Ack=2102 Win=63488 Len=0 TSval=3261962907 TSecr=3379195391"
"386","3.794388","192.168.123.24","192.168.123.41","TLSv1.3","769","Application Data"
"387","3.794406","192.168.123.41","192.168.123.24","TCP","66","36628  >  666 [ACK] Seq=978 Ack=2805 Win=64128 Len=0 TSval=3261962907 TSecr=3379195391"
"390","3.798887","192.168.123.13","192.168.123.24","TCP","74","33484  >  666 [SYN] Seq=0 Win=64240 Len=0 MSS=1460 SACK_PERM=1 TSval=3009107737 TSecr=0 WS=128"
"391","3.798930","192.168.123.24","192.168.123.13","TCP","74","666  >  33484 [SYN, ACK] Seq=0 Ack=1 Win=65160 Len=0 MSS=1460 SACK_PERM=1 TSval=1052228198 TSecr=3009107737 WS=128"
"392","3.798967","192.168.123.13","192.168.123.24","TCP","66","33484  >  666 [ACK] Seq=1 Ack=1 Win=64256 Len=0 TSval=3009107737 TSecr=1052228198"
"393","3.799321","192.168.123.13","192.168.123.24","TLSv1.3","353","Client Hello"
"394","3.799406","192.168.123.24","192.168.123.13","TCP","66","666  >  33484 [ACK] Seq=1 Ack=288 Win=64896 Len=0 TSval=1052228199 TSecr=3009107738"
"395","3.800356","192.168.123.24","192.168.123.13","TLSv1.3","1464","Server Hello, Change Cipher Spec, Application Data, Application Data, Application Data, Application Data, Application Data"
"396","3.800387","192.168.123.13","192.168.123.24","TCP","66","33484  >  666 [ACK] Seq=288 Ack=1399 Win=64128 Len=0 TSval=3009107739 TSecr=1052228200"
"397","3.801516","192.168.123.13","192.168.123.24","TLSv1.3","756","Change Cipher Spec, Application Data, Application Data, Application Data"
"398","3.801543","192.168.123.24","192.168.123.13","TCP","66","666  >  33484 [ACK] Seq=1399 Ack=978 Win=64256 Len=0 TSval=1052228201 TSecr=3009107740"
"399","3.802179","192.168.123.24","192.168.123.13","TLSv1.3","769","Application Data"
"400","3.802215","192.168.123.13","192.168.123.24","TCP","66","33484  >  666 [ACK] Seq=978 Ack=2102 Win=64128 Len=0 TSval=3009107741 TSecr=1052228202"
"401","3.802390","192.168.123.24","192.168.123.13","TLSv1.3","769","Application Data"
"402","3.802414","192.168.123.13","192.168.123.24","TCP","66","33484  >  666 [ACK] Seq=978 Ack=2805 Win=64128 Len=0 TSval=3009107741 TSecr=1052228202"
"405","3.804122","192.168.123.32","192.168.123.24","TCP","74","59878  >  666 [SYN] Seq=0 Win=64240 Len=0 MSS=1460 SACK_PERM=1 TSval=347979635 TSecr=0 WS=128"
"406","3.804152","192.168.123.24","192.168.123.32","TCP","74","666  >  59878 [SYN, ACK] Seq=0 Ack=1 Win=65160 Len=0 MSS=1460 SACK_PERM=1 TSval=4271713941 TSecr=347979635 WS=128"
"407","3.804177","192.168.123.32","192.168.123.24","TCP","66","59878  >  666 [ACK] Seq=1 Ack=1 Win=64256 Len=0 TSval=347979636 TSecr=4271713941"
"408","3.804395","192.168.123.32","192.168.123.24","TLSv1.3","353","Client Hello"
"409","3.804478","192.168.123.24","192.168.123.32","TCP","66","666  >  59878 [ACK] Seq=1 Ack=288 Win=64896 Len=0 TSval=4271713941 TSecr=347979636"
"410","3.805265","192.168.123.24","192.168.123.32","TLSv1.3","1464","Server Hello, Change Cipher Spec, Application Data, Application Data, Application Data, Application Data, Application Data"
"411","3.805295","192.168.123.32","192.168.123.24","TCP","66","59878  >  666 [ACK] Seq=288 Ack=1399 Win=64128 Len=0 TSval=347979637 TSecr=4271713942"
"414","3.806874","192.168.123.40","192.168.123.24","TCP","74","59022  >  666 [SYN] Seq=0 Win=64240 Len=0 MSS=1460 SACK_PERM=1 TSval=1341744085 TSecr=0 WS=128"
"415","3.806901","192.168.123.24","192.168.123.40","TCP","74","666  >  59022 [SYN, ACK] Seq=0 Ack=1 Win=65160 Len=0 MSS=1460 SACK_PERM=1 TSval=1747358998 TSecr=1341744085 WS=128"
"416","3.806925","192.168.123.40","192.168.123.24","TCP","66","59022  >  666 [ACK] Seq=1 Ack=1 Win=64256 Len=0 TSval=1341744085 TSecr=1747358998"
"417","3.807180","192.168.123.40","192.168.123.24","TLSv1.3","353","Client Hello"
"418","3.807269","192.168.123.24","192.168.123.40","TCP","66","666  >  59022 [ACK] Seq=1 Ack=288 Win=64896 Len=0 TSval=1747358999 TSecr=1341744086"
"419","3.808071","192.168.123.24","192.168.123.40","TLSv1.3","1464","Server Hello, Change Cipher Spec, Application Data, Application Data, Application Data, Application Data, Application Data"
"420","3.808097","192.168.123.40","192.168.123.24","TCP","66","59022  >  666 [ACK] Seq=288 Ack=1399 Win=64128 Len=0 TSval=1341744087 TSecr=1747359000"
"421","3.809401","192.168.123.32","192.168.123.24","TLSv1.3","756","Change Cipher Spec, Application Data, Application Data, Application Data"
"422","3.809442","192.168.123.24","192.168.123.32","TCP","66","666  >  59878 [ACK] Seq=1399 Ack=978 Win=64256 Len=0 TSval=4271713946 TSecr=347979641"
"423","3.809811","192.168.123.40","192.168.123.24","TLSv1.3","756","Change Cipher Spec, Application Data, Application Data, Application Data"
"424","3.809859","192.168.123.24","192.168.123.40","TCP","66","666  >  59022 [ACK] Seq=1399 Ack=978 Win=64256 Len=0 TSval=1747359001 TSecr=1341744088"
"425","3.810079","192.168.123.24","192.168.123.32","TLSv1.3","769","Application Data"
"426","3.810230","192.168.123.24","192.168.123.32","TLSv1.3","769","Application Data"
"427","3.810354","192.168.123.32","192.168.123.24","TCP","66","59878  >  666 [ACK] Seq=978 Ack=2102 Win=63488 Len=0 TSval=347979642 TSecr=4271713947"
"428","3.810384","192.168.123.32","192.168.123.24","TCP","66","59878  >  666 [ACK] Seq=978 Ack=2805 Win=62848 Len=0 TSval=347979642 TSecr=4271713947"
"429","3.810441","192.168.123.24","192.168.123.40","TLSv1.3","769","Application Data"
"430","3.810605","192.168.123.24","192.168.123.40","TLSv1.3","769","Application Data"
"431","3.810865","192.168.123.40","192.168.123.24","TCP","66","59022  >  666 [ACK] Seq=978 Ack=2102 Win=63488 Len=0 TSval=1341744089 TSecr=1747359002"
"432","3.810888","192.168.123.40","192.168.123.24","TCP","66","59022  >  666 [ACK] Seq=978 Ack=2805 Win=62848 Len=0 TSval=1341744089 TSecr=1747359002"
"435","3.815386","192.168.123.19","192.168.123.24","TCP","74","37290  >  666 [SYN] Seq=0 Win=64240 Len=0 MSS=1460 SACK_PERM=1 TSval=2973157122 TSecr=0 WS=128"
"436","3.815417","192.168.123.24","192.168.123.19","TCP","74","666  >  37290 [SYN, ACK] Seq=0 Ack=1 Win=65160 Len=0 MSS=1460 SACK_PERM=1 TSval=2038862520 TSecr=2973157122 WS=128"
"437","3.815443","192.168.123.19","192.168.123.24","TCP","66","37290  >  666 [ACK] Seq=1 Ack=1 Win=64256 Len=0 TSval=2973157123 TSecr=2038862520"
"438","3.815678","192.168.123.19","192.168.123.24","TLSv1.3","353","Client Hello"
"439","3.815744","192.168.123.24","192.168.123.19","TCP","66","666  >  37290 [ACK] Seq=1 Ack=288 Win=64896 Len=0 TSval=2038862520 TSecr=2973157123"
"440","3.816837","192.168.123.24","192.168.123.19","TLSv1.3","1464","Server Hello, Change Cipher Spec, Application Data, Application Data, Application Data, Application Data, Application Data"
"441","3.816868","192.168.123.19","192.168.123.24","TCP","66","37290  >  666 [ACK] Seq=288 Ack=1399 Win=64128 Len=0 TSval=2973157124 TSecr=2038862521"
"442","3.818818","192.168.123.19","192.168.123.24","TLSv1.3","756","Change Cipher Spec, Application Data, Application Data, Application Data"
"443","3.818849","192.168.123.24","192.168.123.19","TCP","66","666  >  37290 [ACK] Seq=1399 Ack=978 Win=64256 Len=0 TSval=2038862523 TSecr=2973157126"
"444","3.819442","192.168.123.24","192.168.123.19","TLSv1.3","769","Application Data"
"445","3.819468","192.168.123.19","192.168.123.24","TCP","66","37290  >  666 [ACK] Seq=978 Ack=2102 Win=64128 Len=0 TSval=2973157127 TSecr=2038862524"
"446","3.819571","192.168.123.24","192.168.123.19","TLSv1.3","769","Application Data"
"447","3.819588","192.168.123.19","192.168.123.24","TCP","66","37290  >  666 [ACK] Seq=978 Ack=2805 Win=64128 Len=0 TSval=2973157127 TSecr=2038862524"
"450","3.820133","192.168.123.23","192.168.123.24","TCP","74","60242  >  666 [SYN] Seq=0 Win=64240 Len=0 MSS=1460 SACK_PERM=1 TSval=939459042 TSecr=0 WS=128"
"451","3.820160","192.168.123.24","192.168.123.23","TCP","74","666  >  60242 [SYN, ACK] Seq=0 Ack=1 Win=65160 Len=0 MSS=1460 SACK_PERM=1 TSval=3041355779 TSecr=939459042 WS=128"
"452","3.820184","192.168.123.23","192.168.123.24","TCP","66","60242  >  666 [ACK] Seq=1 Ack=1 Win=64256 Len=0 TSval=939459043 TSecr=3041355779"
"453","3.820418","192.168.123.23","192.168.123.24","TLSv1.3","353","Client Hello"
"454","3.820514","192.168.123.24","192.168.123.23","TCP","66","666  >  60242 [ACK] Seq=1 Ack=288 Win=64896 Len=0 TSval=3041355779 TSecr=939459043"
"455","3.821278","192.168.123.24","192.168.123.23","TLSv1.3","1464","Server Hello, Change Cipher Spec, Application Data, Application Data, Application Data, Application Data, Application Data"
"456","3.821323","192.168.123.23","192.168.123.24","TCP","66","60242  >  666 [ACK] Seq=288 Ack=1399 Win=64128 Len=0 TSval=939459044 TSecr=3041355780"
"457","3.824240","192.168.123.23","192.168.123.24","TLSv1.3","756","Change Cipher Spec, Application Data, Application Data, Application Data"
"458","3.824268","192.168.123.24","192.168.123.23","TCP","66","666  >  60242 [ACK] Seq=1399 Ack=978 Win=64256 Len=0 TSval=3041355783 TSecr=939459047"
"459","3.824781","192.168.123.24","192.168.123.23","TLSv1.3","769","Application Data"
"460","3.824883","192.168.123.24","192.168.123.23","TLSv1.3","769","Application Data"
"461","3.824957","192.168.123.23","192.168.123.24","TCP","66","60242  >  666 [ACK] Seq=978 Ack=2102 Win=63488 Len=0 TSval=939459047 TSecr=3041355783"
"462","3.824993","192.168.123.23","192.168.123.24","TCP","66","60242  >  666 [ACK] Seq=978 Ack=2805 Win=62848 Len=0 TSval=939459047 TSecr=3041355783"
"465","3.827226","192.168.123.17","192.168.123.24","TCP","74","41238  >  666 [SYN] Seq=0 Win=64240 Len=0 MSS=1460 SACK_PERM=1 TSval=3004517339 TSecr=0 WS=128"
"466","3.827257","192.168.123.24","192.168.123.17","TCP","74","666  >  41238 [SYN, ACK] Seq=0 Ack=1 Win=65160 Len=0 MSS=1460 SACK_PERM=1 TSval=2211941645 TSecr=3004517339 WS=128"
"467","3.827284","192.168.123.17","192.168.123.24","TCP","66","41238  >  666 [ACK] Seq=1 Ack=1 Win=64256 Len=0 TSval=3004517340 TSecr=2211941645"
"468","3.827524","192.168.123.17","192.168.123.24","TLSv1.3","353","Client Hello"
"469","3.827641","192.168.123.24","192.168.123.17","TCP","66","666  >  41238 [ACK] Seq=1 Ack=288 Win=64896 Len=0 TSval=2211941645 TSecr=3004517340"
"472","3.828514","192.168.123.24","192.168.123.17","TLSv1.3","1464","Server Hello, Change Cipher Spec, Application Data, Application Data, Application Data, Application Data, Application Data"
"473","3.828560","192.168.123.17","192.168.123.24","TCP","66","41238  >  666 [ACK] Seq=288 Ack=1399 Win=64128 Len=0 TSval=3004517341 TSecr=2211941646"
"475","3.830290","192.168.123.17","192.168.123.24","TLSv1.3","756","Change Cipher Spec, Application Data, Application Data, Application Data"
"476","3.830349","192.168.123.24","192.168.123.17","TCP","66","666  >  41238 [ACK] Seq=1399 Ack=978 Win=64256 Len=0 TSval=2211941648 TSecr=3004517343"
"478","3.830421","192.168.123.8","192.168.123.24","TCP","74","54274  >  666 [SYN] Seq=0 Win=64240 Len=0 MSS=1460 SACK_PERM=1 TSval=3692535952 TSecr=0 WS=128"
"479","3.830459","192.168.123.24","192.168.123.8","TCP","74","666  >  54274 [SYN, ACK] Seq=0 Ack=1 Win=65160 Len=0 MSS=1460 SACK_PERM=1 TSval=3877894535 TSecr=3692535952 WS=128"
"480","3.830492","192.168.123.8","192.168.123.24","TCP","66","54274  >  666 [ACK] Seq=1 Ack=1 Win=64256 Len=0 TSval=3692535953 TSecr=3877894535"
"481","3.830797","192.168.123.24","192.168.123.17","TLSv1.3","769","Application Data"
"482","3.830835","192.168.123.8","192.168.123.24","TLSv1.3","353","Client Hello"
"483","3.830906","192.168.123.24","192.168.123.17","TLSv1.3","769","Application Data"
"484","3.830946","192.168.123.24","192.168.123.8","TCP","66","666  >  54274 [ACK] Seq=1 Ack=288 Win=64896 Len=0 TSval=3877894535 TSecr=3692535953"
"485","3.831011","192.168.123.17","192.168.123.24","TCP","66","41238  >  666 [ACK] Seq=978 Ack=2102 Win=63488 Len=0 TSval=3004517343 TSecr=2211941648"
"486","3.831033","192.168.123.17","192.168.123.24","TCP","66","41238  >  666 [ACK] Seq=978 Ack=2805 Win=62848 Len=0 TSval=3004517344 TSecr=2211941648"
"487","3.831717","192.168.123.24","192.168.123.8","TLSv1.3","1464","Server Hello, Change Cipher Spec, Application Data, Application Data, Application Data, Application Data, Application Data"
"488","3.831747","192.168.123.8","192.168.123.24","TCP","66","54274  >  666 [ACK] Seq=288 Ack=1399 Win=64128 Len=0 TSval=3692535954 TSecr=3877894536"
"489","3.833294","192.168.123.8","192.168.123.24","TLSv1.3","756","Change Cipher Spec, Application Data, Application Data, Application Data"
"490","3.833321","192.168.123.24","192.168.123.8","TCP","66","666  >  54274 [ACK] Seq=1399 Ack=978 Win=64256 Len=0 TSval=3877894538 TSecr=3692535956"
"491","3.833752","192.168.123.24","192.168.123.8","TLSv1.3","769","Application Data"
"492","3.833862","192.168.123.24","192.168.123.8","TLSv1.3","769","Application Data"
"493","3.833924","192.168.123.8","192.168.123.24","TCP","66","54274  >  666 [ACK] Seq=978 Ack=2102 Win=63488 Len=0 TSval=3692535956 TSecr=3877894538"
"494","3.833941","192.168.123.8","192.168.123.24","TCP","66","54274  >  666 [ACK] Seq=978 Ack=2805 Win=62848 Len=0 TSval=3692535956 TSecr=3877894538"
"497","3.866763","192.168.123.36","192.168.123.24","TCP","74","39654  >  666 [SYN] Seq=0 Win=64240 Len=0 MSS=1460 SACK_PERM=1 TSval=3405598231 TSecr=0 WS=128"
"498","3.866794","192.168.123.24","192.168.123.36","TCP","74","666  >  39654 [SYN, ACK] Seq=0 Ack=1 Win=65160 Len=0 MSS=1460 SACK_PERM=1 TSval=3192596768 TSecr=3405598231 WS=128"
"499","3.866819","192.168.123.36","192.168.123.24","TCP","66","39654  >  666 [ACK] Seq=1 Ack=1 Win=64256 Len=0 TSval=3405598231 TSecr=3192596768"
"500","3.867068","192.168.123.36","192.168.123.24","TLSv1.3","353","Client Hello"
"501","3.867132","192.168.123.24","192.168.123.36","TCP","66","666  >  39654 [ACK] Seq=1 Ack=288 Win=64896 Len=0 TSval=3192596769 TSecr=3405598232"
"502","3.868348","192.168.123.24","192.168.123.36","TLSv1.3","1464","Server Hello, Change Cipher Spec, Application Data, Application Data, Application Data, Application Data, Application Data"
"503","3.868389","192.168.123.36","192.168.123.24","TCP","66","39654  >  666 [ACK] Seq=288 Ack=1399 Win=64128 Len=0 TSval=3405598233 TSecr=3192596770"
"504","3.869544","192.168.123.36","192.168.123.24","TLSv1.3","756","Change Cipher Spec, Application Data, Application Data, Application Data"
"505","3.869573","192.168.123.24","192.168.123.36","TCP","66","666  >  39654 [ACK] Seq=1399 Ack=978 Win=64256 Len=0 TSval=3192596771 TSecr=3405598234"
"506","3.870159","192.168.123.24","192.168.123.36","TLSv1.3","769","Application Data"
"507","3.870183","192.168.123.36","192.168.123.24","TCP","66","39654  >  666 [ACK] Seq=978 Ack=2102 Win=64128 Len=0 TSval=3405598235 TSecr=3192596772"
"508","3.870287","192.168.123.24","192.168.123.36","TLSv1.3","769","Application Data"
"509","3.870325","192.168.123.36","192.168.123.24","TCP","66","39654  >  666 [ACK] Seq=978 Ack=2805 Win=64128 Len=0 TSval=3405598235 TSecr=3192596772"
"512","3.872772","192.168.123.39","192.168.123.24","TCP","74","33866  >  666 [SYN] Seq=0 Win=64240 Len=0 MSS=1460 SACK_PERM=1 TSval=1306907934 TSecr=0 WS=128"
"513","3.872801","192.168.123.24","192.168.123.39","TCP","74","666  >  33866 [SYN, ACK] Seq=0 Ack=1 Win=65160 Len=0 MSS=1460 SACK_PERM=1 TSval=3497487630 TSecr=1306907934 WS=128"
"514","3.872848","192.168.123.39","192.168.123.24","TCP","66","33866  >  666 [ACK] Seq=1 Ack=1 Win=64256 Len=0 TSval=1306907934 TSecr=3497487630"
"515","3.873115","192.168.123.39","192.168.123.24","TLSv1.3","353","Client Hello"
"516","3.873200","192.168.123.24","192.168.123.39","TCP","66","666  >  33866 [ACK] Seq=1 Ack=288 Win=64896 Len=0 TSval=3497487631 TSecr=1306907935"
"517","3.873925","192.168.123.24","192.168.123.39","TLSv1.3","1464","Server Hello, Change Cipher Spec, Application Data, Application Data, Application Data, Application Data, Application Data"
"518","3.873954","192.168.123.39","192.168.123.24","TCP","66","33866  >  666 [ACK] Seq=288 Ack=1399 Win=64128 Len=0 TSval=1306907935 TSecr=3497487631"
"520","3.875090","192.168.123.39","192.168.123.24","TLSv1.3","756","Change Cipher Spec, Application Data, Application Data, Application Data"
"521","3.875117","192.168.123.24","192.168.123.39","TCP","66","666  >  33866 [ACK] Seq=1399 Ack=978 Win=64256 Len=0 TSval=3497487633 TSecr=1306907937"
"523","3.875189","192.168.123.38","192.168.123.24","TCP","74","59700  >  666 [SYN] Seq=0 Win=64240 Len=0 MSS=1460 SACK_PERM=1 TSval=3285804425 TSecr=0 WS=128"
"524","3.875215","192.168.123.24","192.168.123.38","TCP","74","666  >  59700 [SYN, ACK] Seq=0 Ack=1 Win=65160 Len=0 MSS=1460 SACK_PERM=1 TSval=2146997853 TSecr=3285804425 WS=128"
"525","3.875239","192.168.123.38","192.168.123.24","TCP","66","59700  >  666 [ACK] Seq=1 Ack=1 Win=64256 Len=0 TSval=3285804426 TSecr=2146997853"
"526","3.875422","192.168.123.38","192.168.123.24","TLSv1.3","353","Client Hello"
"527","3.875482","192.168.123.24","192.168.123.38","TCP","66","666  >  59700 [ACK] Seq=1 Ack=288 Win=64896 Len=0 TSval=2146997853 TSecr=3285804426"
"528","3.875640","192.168.123.24","192.168.123.39","TLSv1.3","769","Application Data"
"529","3.875665","192.168.123.39","192.168.123.24","TCP","66","33866  >  666 [ACK] Seq=978 Ack=2102 Win=64128 Len=0 TSval=1306907937 TSecr=3497487633"
"530","3.875806","192.168.123.24","192.168.123.39","TLSv1.3","769","Application Data"
"531","3.875832","192.168.123.39","192.168.123.24","TCP","66","33866  >  666 [ACK] Seq=978 Ack=2805 Win=64128 Len=0 TSval=1306907937 TSecr=3497487633"
"532","3.876189","192.168.123.24","192.168.123.38","TLSv1.3","1464","Server Hello, Change Cipher Spec, Application Data, Application Data, Application Data, Application Data, Application Data"
"533","3.876227","192.168.123.38","192.168.123.24","TCP","66","59700  >  666 [ACK] Seq=288 Ack=1399 Win=64128 Len=0 TSval=3285804427 TSecr=2146997854"
"534","3.877396","192.168.123.38","192.168.123.24","TLSv1.3","756","Change Cipher Spec, Application Data, Application Data, Application Data"
"535","3.877420","192.168.123.24","192.168.123.38","TCP","66","666  >  59700 [ACK] Seq=1399 Ack=978 Win=64256 Len=0 TSval=2146997855 TSecr=3285804428"
"536","3.877935","192.168.123.24","192.168.123.38","TLSv1.3","769","Application Data"
"537","3.877984","192.168.123.38","192.168.123.24","TCP","66","59700  >  666 [ACK] Seq=978 Ack=2102 Win=64128 Len=0 TSval=3285804428 TSecr=2146997855"
"538","3.878140","192.168.123.24","192.168.123.38","TLSv1.3","769","Application Data"
"539","3.878157","192.168.123.38","192.168.123.24","TCP","66","59700  >  666 [ACK] Seq=978 Ack=2805 Win=64128 Len=0 TSval=3285804429 TSecr=2146997856"
"542","3.878357","192.168.123.37","192.168.123.24","TCP","74","33328  >  666 [SYN] Seq=0 Win=64240 Len=0 MSS=1460 SACK_PERM=1 TSval=410955605 TSecr=0 WS=128"
"543","3.878414","192.168.123.24","192.168.123.37","TCP","74","666  >  33328 [SYN, ACK] Seq=0 Ack=1 Win=65160 Len=0 MSS=1460 SACK_PERM=1 TSval=2281761655 TSecr=410955605 WS=128"
"544","3.878453","192.168.123.37","192.168.123.24","TCP","66","33328  >  666 [ACK] Seq=1 Ack=1 Win=64256 Len=0 TSval=410955605 TSecr=2281761655"
"545","3.878664","192.168.123.37","192.168.123.24","TLSv1.3","353","Client Hello"
"546","3.878751","192.168.123.24","192.168.123.37","TCP","66","666  >  33328 [ACK] Seq=1 Ack=288 Win=64896 Len=0 TSval=2281761655 TSecr=410955605"
"547","3.879498","192.168.123.24","192.168.123.37","TLSv1.3","1464","Server Hello, Change Cipher Spec, Application Data, Application Data, Application Data, Application Data, Application Data"
"548","3.879527","192.168.123.37","192.168.123.24","TCP","66","33328  >  666 [ACK] Seq=288 Ack=1399 Win=64128 Len=0 TSval=410955606 TSecr=2281761656"
"549","3.880937","192.168.123.37","192.168.123.24","TLSv1.3","756","Change Cipher Spec, Application Data, Application Data, Application Data"
"550","3.880961","192.168.123.24","192.168.123.37","TCP","66","666  >  33328 [ACK] Seq=1399 Ack=978 Win=64256 Len=0 TSval=2281761657 TSecr=410955607"
"551","3.881626","192.168.123.24","192.168.123.37","TLSv1.3","769","Application Data"
"552","3.881660","192.168.123.37","192.168.123.24","TCP","66","33328  >  666 [ACK] Seq=978 Ack=2102 Win=64128 Len=0 TSval=410955608 TSecr=2281761658"
"553","3.881861","192.168.123.24","192.168.123.37","TLSv1.3","769","Application Data"
"554","3.881882","192.168.123.37","192.168.123.24","TCP","66","33328  >  666 [ACK] Seq=978 Ack=2805 Win=64128 Len=0 TSval=410955608 TSecr=2281761658"
