"No.","Time","Source","Destination","Protocol","Length","Info"
"13","1.125789","192.168.123.17","192.168.123.9","TCP","74","53538  >  666 [SYN] Seq=0 Win=64240 Len=0 MSS=1460 SACK_PERM=1 TSval=2515672471 TSecr=0 WS=128"
"14","1.125822","192.168.123.9","192.168.123.17","TCP","74","666  >  53538 [SYN, ACK] Seq=0 Ack=1 Win=65160 Len=0 MSS=1460 SACK_PERM=1 TSval=2763000499 TSecr=2515672471 WS=128"
"15","1.125857","192.168.123.17","192.168.123.9","TCP","66","53538  >  666 [ACK] Seq=1 Ack=1 Win=64256 Len=0 TSval=2515672471 TSecr=2763000499"
"16","1.126101","192.168.123.17","192.168.123.9","TLSv1.3","353","Client Hello"
"17","1.126167","192.168.123.9","192.168.123.17","TCP","66","666  >  53538 [ACK] Seq=1 Ack=288 Win=64896 Len=0 TSval=2763000500 TSecr=2515672472"
"18","1.127557","192.168.123.9","192.168.123.17","TLSv1.3","1464","Server Hello, Change Cipher Spec, Application Data, Application Data, Application Data, Application Data, Application Data"
"19","1.127597","192.168.123.17","192.168.123.9","TCP","66","53538  >  666 [ACK] Seq=288 Ack=1399 Win=64128 Len=0 TSval=2515672473 TSecr=2763000501"
"20","1.129669","192.168.123.17","192.168.123.9","TLSv1.3","756","Change Cipher Spec, Application Data, Application Data, Application Data"
"21","1.129697","192.168.123.9","192.168.123.17","TCP","66","666  >  53538 [ACK] Seq=1399 Ack=978 Win=64256 Len=0 TSval=2763000503 TSecr=2515672475"
"22","1.130187","192.168.123.9","192.168.123.17","TLSv1.3","769","Application Data"
"23","1.130313","192.168.123.17","192.168.123.9","TCP","66","53538  >  666 [ACK] Seq=978 Ack=2102 Win=63488 Len=0 TSval=2515672476 TSecr=2763000504"
"24","1.130351","192.168.123.9","192.168.123.17","TLSv1.3","769","Application Data"
"25","1.130371","192.168.123.17","192.168.123.9","TCP","66","53538  >  666 [ACK] Seq=978 Ack=2805 Win=64128 Len=0 TSval=2515672476 TSecr=2763000504"
"28","1.153807","192.168.123.30","192.168.123.9","TCP","74","44210  >  666 [SYN] Seq=0 Win=64240 Len=0 MSS=1460 SACK_PERM=1 TSval=3523738021 TSecr=0 WS=128"
"29","1.153840","192.168.123.9","192.168.123.30","TCP","74","666  >  44210 [SYN, ACK] Seq=0 Ack=1 Win=65160 Len=0 MSS=1460 SACK_PERM=1 TSval=1986099537 TSecr=3523738021 WS=128"
"30","1.153876","192.168.123.30","192.168.123.9","TCP","66","44210  >  666 [ACK] Seq=1 Ack=1 Win=64256 Len=0 TSval=3523738021 TSecr=1986099537"
"31","1.154179","192.168.123.30","192.168.123.9","TLSv1.3","353","Client Hello"
"32","1.154251","192.168.123.9","192.168.123.30","TCP","66","666  >  44210 [ACK] Seq=1 Ack=288 Win=64896 Len=0 TSval=1986099538 TSecr=3523738022"
"33","1.155707","192.168.123.9","192.168.123.30","TLSv1.3","1464","Server Hello, Change Cipher Spec, Application Data, Application Data, Application Data, Application Data, Application Data"
"34","1.155739","192.168.123.30","192.168.123.9","TCP","66","44210  >  666 [ACK] Seq=288 Ack=1399 Win=64128 Len=0 TSval=3523738023 TSecr=1986099539"
"35","1.158100","192.168.123.30","192.168.123.9","TLSv1.3","756","Change Cipher Spec, Application Data, Application Data, Application Data"
"36","1.158127","192.168.123.9","192.168.123.30","TCP","66","666  >  44210 [ACK] Seq=1399 Ack=978 Win=64256 Len=0 TSval=1986099542 TSecr=3523738026"
"37","1.158600","192.168.123.9","192.168.123.30","TLSv1.3","769","Application Data"
"38","1.158724","192.168.123.9","192.168.123.30","TLSv1.3","769","Application Data"
"39","1.158805","192.168.123.30","192.168.123.9","TCP","66","44210  >  666 [ACK] Seq=978 Ack=2102 Win=63488 Len=0 TSval=3523738026 TSecr=1986099542"
"40","1.158837","192.168.123.30","192.168.123.9","TCP","66","44210  >  666 [ACK] Seq=978 Ack=2805 Win=62848 Len=0 TSval=3523738026 TSecr=1986099542"
"43","1.202981","192.168.123.35","192.168.123.9","TCP","74","36118  >  666 [SYN] Seq=0 Win=64240 Len=0 MSS=1460 SACK_PERM=1 TSval=3486157006 TSecr=0 WS=128"
"44","1.203020","192.168.123.9","192.168.123.35","TCP","74","666  >  36118 [SYN, ACK] Seq=0 Ack=1 Win=65160 Len=0 MSS=1460 SACK_PERM=1 TSval=4132985944 TSecr=3486157006 WS=128"
"45","1.203049","192.168.123.35","192.168.123.9","TCP","66","36118  >  666 [ACK] Seq=1 Ack=1 Win=64256 Len=0 TSval=3486157007 TSecr=4132985944"
"46","1.203310","192.168.123.35","192.168.123.9","TLSv1.3","353","Client Hello"
"47","1.203384","192.168.123.9","192.168.123.35","TCP","66","666  >  36118 [ACK] Seq=1 Ack=288 Win=64896 Len=0 TSval=4132985944 TSecr=3486157007"
"48","1.204821","192.168.123.9","192.168.123.35","TLSv1.3","1464","Server Hello, Change Cipher Spec, Application Data, Application Data, Application Data, Application Data, Application Data"
"49","1.204855","192.168.123.35","192.168.123.9","TCP","66","36118  >  666 [ACK] Seq=288 Ack=1399 Win=64128 Len=0 TSval=3486157008 TSecr=4132985945"
"50","1.206128","192.168.123.35","192.168.123.9","TLSv1.3","756","Change Cipher Spec, Application Data, Application Data, Application Data"
"51","1.206152","192.168.123.9","192.168.123.35","TCP","66","666  >  36118 [ACK] Seq=1399 Ack=978 Win=64256 Len=0 TSval=4132985947 TSecr=3486157010"
"52","1.206934","192.168.123.9","192.168.123.35","TLSv1.3","769","Application Data"
"53","1.206952","192.168.123.35","192.168.123.9","TCP","66","36118  >  666 [ACK] Seq=978 Ack=2102 Win=64128 Len=0 TSval=3486157010 TSecr=4132985947"
"54","1.207059","192.168.123.9","192.168.123.35","TLSv1.3","769","Application Data"
"55","1.207090","192.168.123.35","192.168.123.9","TCP","66","36118  >  666 [ACK] Seq=978 Ack=2805 Win=64128 Len=0 TSval=3486157011 TSecr=4132985948"
"58","1.213730","192.168.123.36","192.168.123.9","TCP","74","57682  >  666 [SYN] Seq=0 Win=64240 Len=0 MSS=1460 SACK_PERM=1 TSval=3817717592 TSecr=0 WS=128"
"59","1.213765","192.168.123.9","192.168.123.36","TCP","74","666  >  57682 [SYN, ACK] Seq=0 Ack=1 Win=65160 Len=0 MSS=1460 SACK_PERM=1 TSval=1127427270 TSecr=3817717592 WS=128"
"60","1.213829","192.168.123.36","192.168.123.9","TCP","66","57682  >  666 [ACK] Seq=1 Ack=1 Win=64256 Len=0 TSval=3817717592 TSecr=1127427270"
"61","1.214109","192.168.123.36","192.168.123.9","TLSv1.3","353","Client Hello"
"62","1.214161","192.168.123.9","192.168.123.36","TCP","66","666  >  57682 [ACK] Seq=1 Ack=288 Win=64896 Len=0 TSval=1127427271 TSecr=3817717593"
"63","1.215298","192.168.123.9","192.168.123.36","TLSv1.3","1464","Server Hello, Change Cipher Spec, Application Data, Application Data, Application Data, Application Data, Application Data"
"64","1.215327","192.168.123.36","192.168.123.9","TCP","66","57682  >  666 [ACK] Seq=288 Ack=1399 Win=64128 Len=0 TSval=3817717594 TSecr=1127427272"
"65","1.218435","192.168.123.36","192.168.123.9","TLSv1.3","756","Change Cipher Spec, Application Data, Application Data, Application Data"
"66","1.218464","192.168.123.9","192.168.123.36","TCP","66","666  >  57682 [ACK] Seq=1399 Ack=978 Win=64256 Len=0 TSval=1127427275 TSecr=3817717597"
"69","1.218783","192.168.123.29","192.168.123.9","TCP","74","44032  >  666 [SYN] Seq=0 Win=64240 Len=0 MSS=1460 SACK_PERM=1 TSval=1757120634 TSecr=0 WS=128"
"70","1.218813","192.168.123.9","192.168.123.29","TCP","74","666  >  44032 [SYN, ACK] Seq=0 Ack=1 Win=65160 Len=0 MSS=1460 SACK_PERM=1 TSval=1130303078 TSecr=1757120634 WS=128"
"71","1.218843","192.168.123.29","192.168.123.9","TCP","66","44032  >  666 [ACK] Seq=1 Ack=1 Win=64256 Len=0 TSval=1757120634 TSecr=1130303078"
"72","1.219012","192.168.123.9","192.168.123.36","TLSv1.3","769","Application Data"
"73","1.219103","192.168.123.29","192.168.123.9","TLSv1.3","353","Client Hello"
"74","1.219148","192.168.123.9","192.168.123.36","TLSv1.3","769","Application Data"
"75","1.219156","192.168.123.9","192.168.123.29","TCP","66","666  >  44032 [ACK] Seq=1 Ack=288 Win=64896 Len=0 TSval=1130303079 TSecr=1757120635"
"76","1.219227","192.168.123.36","192.168.123.9","TCP","66","57682  >  666 [ACK] Seq=978 Ack=2102 Win=63488 Len=0 TSval=3817717598 TSecr=1127427276"
"77","1.219247","192.168.123.36","192.168.123.9","TCP","66","57682  >  666 [ACK] Seq=978 Ack=2805 Win=62848 Len=0 TSval=3817717598 TSecr=1127427276"
"78","1.220082","192.168.123.9","192.168.123.29","TLSv1.3","1464","Server Hello, Change Cipher Spec, Application Data, Application Data, Application Data, Application Data, Application Data"
"79","1.220117","192.168.123.29","192.168.123.9","TCP","66","44032  >  666 [ACK] Seq=288 Ack=1399 Win=64128 Len=0 TSval=1757120636 TSecr=1130303080"
"80","1.221346","192.168.123.29","192.168.123.9","TLSv1.3","756","Change Cipher Spec, Application Data, Application Data, Application Data"
"81","1.221380","192.168.123.9","192.168.123.29","TCP","66","666  >  44032 [ACK] Seq=1399 Ack=978 Win=64256 Len=0 TSval=1130303081 TSecr=1757120637"
"82","1.221892","192.168.123.9","192.168.123.29","TLSv1.3","769","Application Data"
"83","1.221921","192.168.123.29","192.168.123.9","TCP","66","44032  >  666 [ACK] Seq=978 Ack=2102 Win=64128 Len=0 TSval=1757120637 TSecr=1130303081"
"84","1.222029","192.168.123.9","192.168.123.29","TLSv1.3","769","Application Data"
"85","1.222046","192.168.123.29","192.168.123.9","TCP","66","44032  >  666 [ACK] Seq=978 Ack=2805 Win=64128 Len=0 TSval=1757120638 TSecr=1130303082"
"88","1.225856","192.168.123.39","192.168.123.9","TCP","74","45546  >  666 [SYN] Seq=0 Win=64240 Len=0 MSS=1460 SACK_PERM=1 TSval=1597004905 TSecr=0 WS=128"
"89","1.225899","192.168.123.9","192.168.123.39","TCP","74","666  >  45546 [SYN, ACK] Seq=0 Ack=1 Win=65160 Len=0 MSS=1460 SACK_PERM=1 TSval=1929977724 TSecr=1597004905 WS=128"
"90","1.225947","192.168.123.39","192.168.123.9","TCP","66","45546  >  666 [ACK] Seq=1 Ack=1 Win=64256 Len=0 TSval=1597004905 TSecr=1929977724"
"91","1.226321","192.168.123.39","192.168.123.9","TLSv1.3","353","Client Hello"
"92","1.226402","192.168.123.9","192.168.123.39","TCP","66","666  >  45546 [ACK] Seq=1 Ack=288 Win=64896 Len=0 TSval=1929977725 TSecr=1597004906"
"95","1.227287","192.168.123.2","192.168.123.9","TCP","74","52952  >  666 [SYN] Seq=0 Win=64240 Len=0 MSS=1460 SACK_PERM=1 TSval=619256880 TSecr=0 WS=128"
"96","1.227315","192.168.123.9","192.168.123.2","TCP","74","666  >  52952 [SYN, ACK] Seq=0 Ack=1 Win=65160 Len=0 MSS=1460 SACK_PERM=1 TSval=2835616890 TSecr=619256880 WS=128"
"97","1.227341","192.168.123.2","192.168.123.9","TCP","66","52952  >  666 [ACK] Seq=1 Ack=1 Win=64256 Len=0 TSval=619256881 TSecr=2835616890"
"98","1.227581","192.168.123.2","192.168.123.9","TLSv1.3","353","Client Hello"
"99","1.227602","192.168.123.9","192.168.123.39","TLSv1.3","1464","Server Hello, Change Cipher Spec, Application Data, Application Data, Application Data, Application Data, Application Data"
"100","1.227632","192.168.123.9","192.168.123.2","TCP","66","666  >  52952 [ACK] Seq=1 Ack=288 Win=64896 Len=0 TSval=2835616890 TSecr=619256881"
"101","1.227635","192.168.123.39","192.168.123.9","TCP","66","45546  >  666 [ACK] Seq=288 Ack=1399 Win=64128 Len=0 TSval=1597004907 TSecr=1929977726"
"102","1.228966","192.168.123.9","192.168.123.2","TLSv1.3","1464","Server Hello, Change Cipher Spec, Application Data, Application Data, Application Data, Application Data, Application Data"
"103","1.229022","192.168.123.2","192.168.123.9","TCP","66","52952  >  666 [ACK] Seq=288 Ack=1399 Win=64128 Len=0 TSval=619256883 TSecr=2835616891"
"104","1.229639","192.168.123.39","192.168.123.9","TLSv1.3","756","Change Cipher Spec, Application Data, Application Data, Application Data"
"105","1.229675","192.168.123.9","192.168.123.39","TCP","66","666  >  45546 [ACK] Seq=1399 Ack=978 Win=64256 Len=0 TSval=1929977728 TSecr=1597004909"
"106","1.230442","192.168.123.9","192.168.123.39","TLSv1.3","769","Application Data"
"107","1.230469","192.168.123.39","192.168.123.9","TCP","66","45546  >  666 [ACK] Seq=978 Ack=2102 Win=64128 Len=0 TSval=1597004910 TSecr=1929977729"
"108","1.230574","192.168.123.9","192.168.123.39","TLSv1.3","769","Application Data"
"109","1.230591","192.168.123.39","192.168.123.9","TCP","66","45546  >  666 [ACK] Seq=978 Ack=2805 Win=64128 Len=0 TSval=1597004910 TSecr=1929977729"
"110","1.232195","192.168.123.2","192.168.123.9","TLSv1.3","756","Change Cipher Spec, Application Data, Application Data, Application Data"
"111","1.232226","192.168.123.9","192.168.123.2","TCP","66","666  >  52952 [ACK] Seq=1399 Ack=978 Win=64256 Len=0 TSval=2835616895 TSecr=619256886"
"112","1.232649","192.168.123.9","192.168.123.2","TLSv1.3","769","Application Data"
"113","1.232678","192.168.123.2","192.168.123.9","TCP","66","52952  >  666 [ACK] Seq=978 Ack=2102 Win=64128 Len=0 TSval=619256886 TSecr=2835616895"
"114","1.232784","192.168.123.9","192.168.123.2","TLSv1.3","769","Application Data"
"115","1.232801","192.168.123.2","192.168.123.9","TCP","66","52952  >  666 [ACK] Seq=978 Ack=2805 Win=64128 Len=0 TSval=619256886 TSecr=2835616895"
"118","1.236084","192.168.123.26","192.168.123.9","TCP","74","44402  >  666 [SYN] Seq=0 Win=64240 Len=0 MSS=1460 SACK_PERM=1 TSval=506339308 TSecr=0 WS=128"
"119","1.236121","192.168.123.9","192.168.123.26","TCP","74","666  >  44402 [SYN, ACK] Seq=0 Ack=1 Win=65160 Len=0 MSS=1460 SACK_PERM=1 TSval=594202956 TSecr=506339308 WS=128"
"120","1.236153","192.168.123.26","192.168.123.9","TCP","66","44402  >  666 [ACK] Seq=1 Ack=1 Win=64256 Len=0 TSval=506339309 TSecr=594202956"
"121","1.236493","192.168.123.26","192.168.123.9","TLSv1.3","353","Client Hello"
"122","1.236550","192.168.123.9","192.168.123.26","TCP","66","666  >  44402 [ACK] Seq=1 Ack=288 Win=64896 Len=0 TSval=594202956 TSecr=506339309"
"123","1.237860","192.168.123.9","192.168.123.26","TLSv1.3","1464","Server Hello, Change Cipher Spec, Application Data, Application Data, Application Data, Application Data, Application Data"
"124","1.237905","192.168.123.26","192.168.123.9","TCP","66","44402  >  666 [ACK] Seq=288 Ack=1399 Win=64128 Len=0 TSval=506339310 TSecr=594202957"
"125","1.239251","192.168.123.26","192.168.123.9","TLSv1.3","756","Change Cipher Spec, Application Data, Application Data, Application Data"
"126","1.239279","192.168.123.9","192.168.123.26","TCP","66","666  >  44402 [ACK] Seq=1399 Ack=978 Win=64256 Len=0 TSval=594202959 TSecr=506339312"
"127","1.239973","192.168.123.9","192.168.123.26","TLSv1.3","769","Application Data"
"128","1.240014","192.168.123.26","192.168.123.9","TCP","66","44402  >  666 [ACK] Seq=978 Ack=2102 Win=64128 Len=0 TSval=506339313 TSecr=594202959"
"129","1.240184","192.168.123.9","192.168.123.26","TLSv1.3","769","Application Data"
"130","1.240211","192.168.123.26","192.168.123.9","TCP","66","44402  >  666 [ACK] Seq=978 Ack=2805 Win=64128 Len=0 TSval=506339313 TSecr=594202960"
"133","1.242411","192.168.123.20","192.168.123.9","TCP","74","39940  >  666 [SYN] Seq=0 Win=64240 Len=0 MSS=1460 SACK_PERM=1 TSval=475419338 TSecr=0 WS=128"
"134","1.242441","192.168.123.9","192.168.123.20","TCP","74","666  >  39940 [SYN, ACK] Seq=0 Ack=1 Win=65160 Len=0 MSS=1460 SACK_PERM=1 TSval=690851332 TSecr=475419338 WS=128"
"135","1.242467","192.168.123.20","192.168.123.9","TCP","66","39940  >  666 [ACK] Seq=1 Ack=1 Win=64256 Len=0 TSval=475419339 TSecr=690851332"
"136","1.242693","192.168.123.20","192.168.123.9","TLSv1.3","353","Client Hello"
"137","1.242749","192.168.123.9","192.168.123.20","TCP","66","666  >  39940 [ACK] Seq=1 Ack=288 Win=64896 Len=0 TSval=690851332 TSecr=475419339"
"138","1.243527","192.168.123.9","192.168.123.20","TLSv1.3","1464","Server Hello, Change Cipher Spec, Application Data, Application Data, Application Data, Application Data, Application Data"
"139","1.243559","192.168.123.20","192.168.123.9","TCP","66","39940  >  666 [ACK] Seq=288 Ack=1399 Win=64128 Len=0 TSval=475419340 TSecr=690851333"
"142","1.243822","192.168.123.4","192.168.123.9","TCP","74","38148  >  666 [SYN] Seq=0 Win=64240 Len=0 MSS=1460 SACK_PERM=1 TSval=1629254908 TSecr=0 WS=128"
"143","1.243850","192.168.123.9","192.168.123.4","TCP","74","666  >  38148 [SYN, ACK] Seq=0 Ack=1 Win=65160 Len=0 MSS=1460 SACK_PERM=1 TSval=281341795 TSecr=1629254908 WS=128"
"144","1.243874","192.168.123.4","192.168.123.9","TCP","66","38148  >  666 [ACK] Seq=1 Ack=1 Win=64256 Len=0 TSval=1629254908 TSecr=281341795"
"145","1.244118","192.168.123.4","192.168.123.9","TLSv1.3","353","Client Hello"
"146","1.244170","192.168.123.9","192.168.123.4","TCP","66","666  >  38148 [ACK] Seq=1 Ack=288 Win=64896 Len=0 TSval=281341796 TSecr=1629254909"
"147","1.245105","192.168.123.20","192.168.123.9","TLSv1.3","756","Change Cipher Spec, Application Data, Application Data, Application Data"
"148","1.245135","192.168.123.9","192.168.123.20","TCP","66","666  >  39940 [ACK] Seq=1399 Ack=978 Win=64256 Len=0 TSval=690851335 TSecr=475419342"
"149","1.245243","192.168.123.9","192.168.123.4","TLSv1.3","1464","Server Hello, Change Cipher Spec, Application Data, Application Data, Application Data, Application Data, Application Data"
"150","1.245275","192.168.123.4","192.168.123.9","TCP","66","38148  >  666 [ACK] Seq=288 Ack=1399 Win=64128 Len=0 TSval=1629254910 TSecr=281341797"
"151","1.245773","192.168.123.9","192.168.123.20","TLSv1.3","769","Application Data"
"152","1.245799","192.168.123.20","192.168.123.9","TCP","66","39940  >  666 [ACK] Seq=978 Ack=2102 Win=64128 Len=0 TSval=475419342 TSecr=690851335"
"153","1.245984","192.168.123.9","192.168.123.20","TLSv1.3","769","Application Data"
"154","1.246003","192.168.123.20","192.168.123.9","TCP","66","39940  >  666 [ACK] Seq=978 Ack=2805 Win=64128 Len=0 TSval=475419343 TSecr=690851335"
"155","1.249440","192.168.123.4","192.168.123.9","TLSv1.3","756","Change Cipher Spec, Application Data, Application Data, Application Data"
"156","1.249487","192.168.123.9","192.168.123.4","TCP","66","666  >  38148 [ACK] Seq=1399 Ack=978 Win=64256 Len=0 TSval=281341801 TSecr=1629254914"
"157","1.249959","192.168.123.9","192.168.123.4","TLSv1.3","769","Application Data"
"158","1.249988","192.168.123.4","192.168.123.9","TCP","66","38148  >  666 [ACK] Seq=978 Ack=2102 Win=64128 Len=0 TSval=1629254914 TSecr=281341801"
"159","1.250096","192.168.123.9","192.168.123.4","TLSv1.3","769","Application Data"
"160","1.250114","192.168.123.4","192.168.123.9","TCP","66","38148  >  666 [ACK] Seq=978 Ack=2805 Win=64128 Len=0 TSval=1629254915 TSecr=281341802"
"163","1.277215","192.168.123.28","192.168.123.9","TCP","74","43298  >  666 [SYN] Seq=0 Win=64240 Len=0 MSS=1460 SACK_PERM=1 TSval=2993582590 TSecr=0 WS=128"
"164","1.277245","192.168.123.9","192.168.123.28","TCP","74","666  >  43298 [SYN, ACK] Seq=0 Ack=1 Win=65160 Len=0 MSS=1460 SACK_PERM=1 TSval=2854065550 TSecr=2993582590 WS=128"
"165","1.277270","192.168.123.28","192.168.123.9","TCP","66","43298  >  666 [ACK] Seq=1 Ack=1 Win=64256 Len=0 TSval=2993582591 TSecr=2854065550"
"166","1.277540","192.168.123.28","192.168.123.9","TLSv1.3","353","Client Hello"
"167","1.277600","192.168.123.9","192.168.123.28","TCP","66","666  >  43298 [ACK] Seq=1 Ack=288 Win=64896 Len=0 TSval=2854065550 TSecr=2993582591"
"168","1.278454","192.168.123.9","192.168.123.28","TLSv1.3","1464","Server Hello, Change Cipher Spec, Application Data, Application Data, Application Data, Application Data, Application Data"
"169","1.278484","192.168.123.28","192.168.123.9","TCP","66","43298  >  666 [ACK] Seq=288 Ack=1399 Win=64128 Len=0 TSval=2993582592 TSecr=2854065551"
"170","1.279690","192.168.123.28","192.168.123.9","TLSv1.3","756","Change Cipher Spec, Application Data, Application Data, Application Data"
"171","1.279718","192.168.123.9","192.168.123.28","TCP","66","666  >  43298 [ACK] Seq=1399 Ack=978 Win=64256 Len=0 TSval=2854065552 TSecr=2993582593"
"172","1.280304","192.168.123.9","192.168.123.28","TLSv1.3","769","Application Data"
"173","1.280338","192.168.123.28","192.168.123.9","TCP","66","43298  >  666 [ACK] Seq=978 Ack=2102 Win=64128 Len=0 TSval=2993582594 TSecr=2854065553"
"174","1.280446","192.168.123.9","192.168.123.28","TLSv1.3","769","Application Data"
"175","1.280462","192.168.123.28","192.168.123.9","TCP","66","43298  >  666 [ACK] Seq=978 Ack=2805 Win=64128 Len=0 TSval=2993582594 TSecr=2854065553"
"178","1.284731","192.168.123.7","192.168.123.9","TCP","74","41656  >  666 [SYN] Seq=0 Win=64240 Len=0 MSS=1460 SACK_PERM=1 TSval=977823488 TSecr=0 WS=128"
"179","1.284815","192.168.123.9","192.168.123.7","TCP","74","666  >  41656 [SYN, ACK] Seq=0 Ack=1 Win=65160 Len=0 MSS=1460 SACK_PERM=1 TSval=2834952955 TSecr=977823488 WS=128"
"180","1.284861","192.168.123.7","192.168.123.9","TCP","66","41656  >  666 [ACK] Seq=1 Ack=1 Win=64256 Len=0 TSval=977823489 TSecr=2834952955"
"181","1.285369","192.168.123.7","192.168.123.9","TLSv1.3","353","Client Hello"
"182","1.285486","192.168.123.9","192.168.123.7","TCP","66","666  >  41656 [ACK] Seq=1 Ack=288 Win=64896 Len=0 TSval=2834952956 TSecr=977823490"
"183","1.286863","192.168.123.9","192.168.123.7","TLSv1.3","1464","Server Hello, Change Cipher Spec, Application Data, Application Data, Application Data, Application Data, Application Data"
"184","1.286896","192.168.123.7","192.168.123.9","TCP","66","41656  >  666 [ACK] Seq=288 Ack=1399 Win=64128 Len=0 TSval=977823491 TSecr=2834952957"
"185","1.289784","192.168.123.7","192.168.123.9","TLSv1.3","756","Change Cipher Spec, Application Data, Application Data, Application Data"
"186","1.289832","192.168.123.9","192.168.123.7","TCP","66","666  >  41656 [ACK] Seq=1399 Ack=978 Win=64256 Len=0 TSval=2834952960 TSecr=977823494"
"187","1.290745","192.168.123.9","192.168.123.7","TLSv1.3","769","Application Data"
"188","1.290772","192.168.123.7","192.168.123.9","TCP","66","41656  >  666 [ACK] Seq=978 Ack=2102 Win=64128 Len=0 TSval=977823495 TSecr=2834952961"
"189","1.290950","192.168.123.9","192.168.123.7","TLSv1.3","769","Application Data"
"190","1.290981","192.168.123.7","192.168.123.9","TCP","66","41656  >  666 [ACK] Seq=978 Ack=2805 Win=64128 Len=0 TSval=977823495 TSecr=2834952961"
"193","1.292623","192.168.123.25","192.168.123.9","TCP","74","52204  >  666 [SYN] Seq=0 Win=64240 Len=0 MSS=1460 SACK_PERM=1 TSval=1525358479 TSecr=0 WS=128"
"194","1.292666","192.168.123.9","192.168.123.25","TCP","74","666  >  52204 [SYN, ACK] Seq=0 Ack=1 Win=65160 Len=0 MSS=1460 SACK_PERM=1 TSval=2221401332 TSecr=1525358479 WS=128"
"195","1.292703","192.168.123.25","192.168.123.9","TCP","66","52204  >  666 [ACK] Seq=1 Ack=1 Win=64256 Len=0 TSval=1525358479 TSecr=2221401332"
"196","1.292997","192.168.123.25","192.168.123.9","TLSv1.3","353","Client Hello"
"197","1.293100","192.168.123.9","192.168.123.25","TCP","66","666  >  52204 [ACK] Seq=1 Ack=288 Win=64896 Len=0 TSval=2221401333 TSecr=1525358479"
"200","1.293687","192.168.123.31","192.168.123.9","TCP","74","43978  >  666 [SYN] Seq=0 Win=64240 Len=0 MSS=1460 SACK_PERM=1 TSval=902937803 TSecr=0 WS=128"
"201","1.293728","192.168.123.9","192.168.123.31","TCP","74","666  >  43978 [SYN, ACK] Seq=0 Ack=1 Win=65160 Len=0 MSS=1460 SACK_PERM=1 TSval=2411261321 TSecr=902937803 WS=128"
"202","1.293790","192.168.123.31","192.168.123.9","TCP","66","43978  >  666 [ACK] Seq=1 Ack=1 Win=64256 Len=0 TSval=902937803 TSecr=2411261321"
"203","1.294052","192.168.123.9","192.168.123.25","TLSv1.3","1464","Server Hello, Change Cipher Spec, Application Data, Application Data, Application Data, Application Data, Application Data"
"204","1.294085","192.168.123.25","192.168.123.9","TCP","66","52204  >  666 [ACK] Seq=288 Ack=1399 Win=64128 Len=0 TSval=1525358481 TSecr=2221401334"
"206","1.294253","192.168.123.31","192.168.123.9","TLSv1.3","353","Client Hello"
"207","1.294336","192.168.123.9","192.168.123.31","TCP","66","666  >  43978 [ACK] Seq=1 Ack=288 Win=64896 Len=0 TSval=2411261322 TSecr=902937804"
"209","1.294511","192.168.123.10","192.168.123.9","TCP","74","40774  >  666 [SYN] Seq=0 Win=64240 Len=0 MSS=1460 SACK_PERM=1 TSval=2256092651 TSecr=0 WS=128"
"210","1.294559","192.168.123.9","192.168.123.10","TCP","74","666  >  40774 [SYN, ACK] Seq=0 Ack=1 Win=65160 Len=0 MSS=1460 SACK_PERM=1 TSval=461582422 TSecr=2256092651 WS=128"
"211","1.294639","192.168.123.10","192.168.123.9","TCP","66","40774  >  666 [ACK] Seq=1 Ack=1 Win=64256 Len=0 TSval=2256092651 TSecr=461582422"
"214","1.294906","192.168.123.37","192.168.123.9","TCP","74","41672  >  666 [SYN] Seq=0 Win=64240 Len=0 MSS=1460 SACK_PERM=1 TSval=2957396122 TSecr=0 WS=128"
"215","1.294934","192.168.123.9","192.168.123.37","TCP","74","666  >  41672 [SYN, ACK] Seq=0 Ack=1 Win=65160 Len=0 MSS=1460 SACK_PERM=1 TSval=1413344971 TSecr=2957396122 WS=128"
"216","1.294940","192.168.123.10","192.168.123.9","TLSv1.3","353","Client Hello"
"217","1.294959","192.168.123.37","192.168.123.9","TCP","66","41672  >  666 [ACK] Seq=1 Ack=1 Win=64256 Len=0 TSval=2957396122 TSecr=1413344971"
"218","1.294989","192.168.123.9","192.168.123.10","TCP","66","666  >  40774 [ACK] Seq=1 Ack=288 Win=64896 Len=0 TSval=461582422 TSecr=2256092651"
"219","1.295198","192.168.123.37","192.168.123.9","TLSv1.3","353","Client Hello"
"220","1.295248","192.168.123.9","192.168.123.37","TCP","66","666  >  41672 [ACK] Seq=1 Ack=288 Win=64896 Len=0 TSval=1413344972 TSecr=2957396123"
"221","1.295574","192.168.123.9","192.168.123.31","TLSv1.3","1464","Server Hello, Change Cipher Spec, Application Data, Application Data, Application Data, Application Data, Application Data"
"222","1.295632","192.168.123.31","192.168.123.9","TCP","66","43978  >  666 [ACK] Seq=288 Ack=1399 Win=64128 Len=0 TSval=902937805 TSecr=2411261323"
"223","1.296289","192.168.123.9","192.168.123.10","TLSv1.3","1464","Server Hello, Change Cipher Spec, Application Data, Application Data, Application Data, Application Data, Application Data"
"224","1.296345","192.168.123.10","192.168.123.9","TCP","66","40774  >  666 [ACK] Seq=288 Ack=1399 Win=64128 Len=0 TSval=2256092653 TSecr=461582424"
"225","1.296360","192.168.123.9","192.168.123.37","TLSv1.3","1464","Server Hello, Change Cipher Spec, Application Data, Application Data, Application Data, Application Data, Application Data"
"226","1.296400","192.168.123.37","192.168.123.9","TCP","66","41672  >  666 [ACK] Seq=288 Ack=1399 Win=64128 Len=0 TSval=2957396124 TSecr=1413344973"
"230","1.296957","192.168.123.14","192.168.123.9","TCP","74","38772  >  666 [SYN] Seq=0 Win=64240 Len=0 MSS=1460 SACK_PERM=1 TSval=1325400852 TSecr=0 WS=128"
"231","1.296965","192.168.123.25","192.168.123.9","TLSv1.3","756","Change Cipher Spec, Application Data, Application Data, Application Data"
"232","1.296993","192.168.123.9","192.168.123.25","TCP","66","666  >  52204 [ACK] Seq=1399 Ack=978 Win=64256 Len=0 TSval=2221401337 TSecr=1525358483"
"233","1.296999","192.168.123.9","192.168.123.14","TCP","74","666  >  38772 [SYN, ACK] Seq=0 Ack=1 Win=65160 Len=0 MSS=1460 SACK_PERM=1 TSval=3720616816 TSecr=1325400852 WS=128"
"234","1.297035","192.168.123.14","192.168.123.9","TCP","66","38772  >  666 [ACK] Seq=1 Ack=1 Win=64256 Len=0 TSval=1325400853 TSecr=3720616816"
"236","1.297087","192.168.123.15","192.168.123.9","TCP","74","55854  >  666 [SYN] Seq=0 Win=64240 Len=0 MSS=1460 SACK_PERM=1 TSval=1741196953 TSecr=0 WS=128"
"237","1.297114","192.168.123.9","192.168.123.15","TCP","74","666  >  55854 [SYN, ACK] Seq=0 Ack=1 Win=65160 Len=0 MSS=1460 SACK_PERM=1 TSval=1012782071 TSecr=1741196953 WS=128"
"238","1.297139","192.168.123.15","192.168.123.9","TCP","66","55854  >  666 [ACK] Seq=1 Ack=1 Win=64256 Len=0 TSval=1741196954 TSecr=1012782071"
"239","1.297428","192.168.123.15","192.168.123.9","TLSv1.3","353","Client Hello"
"240","1.297433","192.168.123.14","192.168.123.9","TLSv1.3","353","Client Hello"
"241","1.297504","192.168.123.9","192.168.123.15","TCP","66","666  >  55854 [ACK] Seq=1 Ack=288 Win=64896 Len=0 TSval=1012782071 TSecr=1741196954"
"242","1.297506","192.168.123.9","192.168.123.14","TCP","66","666  >  38772 [ACK] Seq=1 Ack=288 Win=64896 Len=0 TSval=3720616816 TSecr=1325400853"
"243","1.297713","192.168.123.9","192.168.123.25","TLSv1.3","769","Application Data"
"244","1.297749","192.168.123.25","192.168.123.9","TCP","66","52204  >  666 [ACK] Seq=978 Ack=2102 Win=64128 Len=0 TSval=1525358484 TSecr=2221401337"
"245","1.297870","192.168.123.9","192.168.123.25","TLSv1.3","769","Application Data"
"246","1.297887","192.168.123.25","192.168.123.9","TCP","66","52204  >  666 [ACK] Seq=978 Ack=2805 Win=64128 Len=0 TSval=1525358484 TSecr=2221401337"
"247","1.298229","192.168.123.10","192.168.123.9","TLSv1.3","756","Change Cipher Spec, Application Data, Application Data, Application Data"
"248","1.298294","192.168.123.9","192.168.123.10","TCP","66","666  >  40774 [ACK] Seq=1399 Ack=978 Win=64256 Len=0 TSval=461582426 TSecr=2256092655"
"249","1.298457","192.168.123.9","192.168.123.15","TLSv1.3","1464","Server Hello, Change Cipher Spec, Application Data, Application Data, Application Data, Application Data, Application Data"
"250","1.298499","192.168.123.15","192.168.123.9","TCP","66","55854  >  666 [ACK] Seq=288 Ack=1399 Win=64128 Len=0 TSval=1741196955 TSecr=1012782072"
"251","1.298608","192.168.123.9","192.168.123.14","TLSv1.3","1464","Server Hello, Change Cipher Spec, Application Data, Application Data, Application Data, Application Data, Application Data"
"252","1.298638","192.168.123.14","192.168.123.9","TCP","66","38772  >  666 [ACK] Seq=288 Ack=1399 Win=64128 Len=0 TSval=1325400854 TSecr=3720616817"
"253","1.298762","192.168.123.31","192.168.123.9","TLSv1.3","756","Change Cipher Spec, Application Data, Application Data, Application Data"
"254","1.298796","192.168.123.9","192.168.123.31","TCP","66","666  >  43978 [ACK] Seq=1399 Ack=978 Win=64256 Len=0 TSval=2411261326 TSecr=902937808"
"256","1.299025","192.168.123.9","192.168.123.10","TLSv1.3","769","Application Data"
"257","1.299068","192.168.123.10","192.168.123.9","TCP","66","40774  >  666 [ACK] Seq=978 Ack=2102 Win=64128 Len=0 TSval=2256092656 TSecr=461582427"
"259","1.299181","192.168.123.8","192.168.123.9","TCP","74","47126  >  666 [SYN] Seq=0 Win=64240 Len=0 MSS=1460 SACK_PERM=1 TSval=265607760 TSecr=0 WS=128"
"260","1.299220","192.168.123.9","192.168.123.8","TCP","74","666  >  47126 [SYN, ACK] Seq=0 Ack=1 Win=65160 Len=0 MSS=1460 SACK_PERM=1 TSval=1901572784 TSecr=265607760 WS=128"
"261","1.299227","192.168.123.9","192.168.123.31","TLSv1.3","769","Application Data"
"262","1.299246","192.168.123.9","192.168.123.10","TLSv1.3","769","Application Data"
"263","1.299255","192.168.123.8","192.168.123.9","TCP","66","47126  >  666 [ACK] Seq=1 Ack=1 Win=64256 Len=0 TSval=265607761 TSecr=1901572784"
"264","1.299274","192.168.123.10","192.168.123.9","TCP","66","40774  >  666 [ACK] Seq=978 Ack=2805 Win=64128 Len=0 TSval=2256092656 TSecr=461582427"
"265","1.299331","192.168.123.9","192.168.123.31","TLSv1.3","769","Application Data"
"266","1.299403","192.168.123.31","192.168.123.9","TCP","66","43978  >  666 [ACK] Seq=978 Ack=2102 Win=63488 Len=0 TSval=902937809 TSecr=2411261327"
"267","1.299405","192.168.123.37","192.168.123.9","TLSv1.3","756","Change Cipher Spec, Application Data, Application Data, Application Data"
"268","1.299443","192.168.123.31","192.168.123.9","TCP","66","43978  >  666 [ACK] Seq=978 Ack=2805 Win=62848 Len=0 TSval=902937809 TSecr=2411261327"
"269","1.299453","192.168.123.9","192.168.123.37","TCP","66","666  >  41672 [ACK] Seq=1399 Ack=978 Win=64256 Len=0 TSval=1413344976 TSecr=2957396127"
"270","1.299683","192.168.123.8","192.168.123.9","TLSv1.3","353","Client Hello"
"271","1.299756","192.168.123.9","192.168.123.8","TCP","66","666  >  47126 [ACK] Seq=1 Ack=288 Win=64896 Len=0 TSval=1901572784 TSecr=265607761"
"272","1.300095","192.168.123.9","192.168.123.37","TLSv1.3","769","Application Data"
"273","1.300140","192.168.123.37","192.168.123.9","TCP","66","41672  >  666 [ACK] Seq=978 Ack=2102 Win=64128 Len=0 TSval=2957396128 TSecr=1413344977"
"274","1.300303","192.168.123.9","192.168.123.37","TLSv1.3","769","Application Data"
"275","1.300328","192.168.123.37","192.168.123.9","TCP","66","41672  >  666 [ACK] Seq=978 Ack=2805 Win=64128 Len=0 TSval=2957396128 TSecr=1413344977"
"276","1.300990","192.168.123.9","192.168.123.8","TLSv1.3","1464","Server Hello, Change Cipher Spec, Application Data, Application Data, Application Data, Application Data, Application Data"
"277","1.301034","192.168.123.8","192.168.123.9","TCP","66","47126  >  666 [ACK] Seq=288 Ack=1399 Win=64128 Len=0 TSval=265607763 TSecr=1901572785"
"278","1.301161","192.168.123.14","192.168.123.9","TLSv1.3","756","Change Cipher Spec, Application Data, Application Data, Application Data"
"279","1.301188","192.168.123.9","192.168.123.14","TCP","66","666  >  38772 [ACK] Seq=1399 Ack=978 Win=64256 Len=0 TSval=3720616820 TSecr=1325400857"
"280","1.301761","192.168.123.9","192.168.123.14","TLSv1.3","769","Application Data"
"281","1.301787","192.168.123.14","192.168.123.9","TCP","66","38772  >  666 [ACK] Seq=978 Ack=2102 Win=64128 Len=0 TSval=1325400857 TSecr=3720616820"
"282","1.301892","192.168.123.9","192.168.123.14","TLSv1.3","769","Application Data"
"283","1.301893","192.168.123.15","192.168.123.9","TLSv1.3","756","Change Cipher Spec, Application Data, Application Data, Application Data"
"284","1.301909","192.168.123.14","192.168.123.9","TCP","66","38772  >  666 [ACK] Seq=978 Ack=2805 Win=64128 Len=0 TSval=1325400857 TSecr=3720616820"
"285","1.301937","192.168.123.9","192.168.123.15","TCP","66","666  >  55854 [ACK] Seq=1399 Ack=978 Win=64256 Len=0 TSval=1012782075 TSecr=1741196958"
"286","1.302594","192.168.123.9","192.168.123.15","TLSv1.3","769","Application Data"
"287","1.302631","192.168.123.15","192.168.123.9","TCP","66","55854  >  666 [ACK] Seq=978 Ack=2102 Win=64128 Len=0 TSval=1741196959 TSecr=1012782076"
"288","1.302678","192.168.123.8","192.168.123.9","TLSv1.3","756","Change Cipher Spec, Application Data, Application Data, Application Data"
"289","1.302728","192.168.123.9","192.168.123.8","TCP","66","666  >  47126 [ACK] Seq=1399 Ack=978 Win=64256 Len=0 TSval=1901572787 TSecr=265607764"
"290","1.302836","192.168.123.9","192.168.123.15","TLSv1.3","769","Application Data"
"291","1.302864","192.168.123.15","192.168.123.9","TCP","66","55854  >  666 [ACK] Seq=978 Ack=2805 Win=64128 Len=0 TSval=1741196959 TSecr=1012782076"
"294","1.303242","192.168.123.16","192.168.123.9","TCP","74","56214  >  666 [SYN] Seq=0 Win=64240 Len=0 MSS=1460 SACK_PERM=1 TSval=3449487589 TSecr=0 WS=128"
"295","1.303282","192.168.123.9","192.168.123.16","TCP","74","666  >  56214 [SYN, ACK] Seq=0 Ack=1 Win=65160 Len=0 MSS=1460 SACK_PERM=1 TSval=1453290650 TSecr=3449487589 WS=128"
"296","1.303316","192.168.123.16","192.168.123.9","TCP","66","56214  >  666 [ACK] Seq=1 Ack=1 Win=64256 Len=0 TSval=3449487590 TSecr=1453290650"
"297","1.303331","192.168.123.9","192.168.123.8","TLSv1.3","769","Application Data"
"298","1.303384","192.168.123.8","192.168.123.9","TCP","66","47126  >  666 [ACK] Seq=978 Ack=2102 Win=64128 Len=0 TSval=265607765 TSecr=1901572788"
"299","1.303594","192.168.123.9","192.168.123.8","TLSv1.3","769","Application Data"
"300","1.303611","192.168.123.16","192.168.123.9","TLSv1.3","353","Client Hello"
"301","1.303622","192.168.123.8","192.168.123.9","TCP","66","47126  >  666 [ACK] Seq=978 Ack=2805 Win=64128 Len=0 TSval=265607765 TSecr=1901572788"
"302","1.303667","192.168.123.9","192.168.123.16","TCP","66","666  >  56214 [ACK] Seq=1 Ack=288 Win=64896 Len=0 TSval=1453290650 TSecr=3449487590"
"305","1.303983","192.168.123.23","192.168.123.9","TCP","74","56334  >  666 [SYN] Seq=0 Win=64240 Len=0 MSS=1460 SACK_PERM=1 TSval=1819723781 TSecr=0 WS=128"
"306","1.304009","192.168.123.9","192.168.123.23","TCP","74","666  >  56334 [SYN, ACK] Seq=0 Ack=1 Win=65160 Len=0 MSS=1460 SACK_PERM=1 TSval=2258444220 TSecr=1819723781 WS=128"
"307","1.304034","192.168.123.23","192.168.123.9","TCP","66","56334  >  666 [ACK] Seq=1 Ack=1 Win=64256 Len=0 TSval=1819723782 TSecr=2258444220"
"308","1.304249","192.168.123.23","192.168.123.9","TLSv1.3","353","Client Hello"
"309","1.304297","192.168.123.9","192.168.123.23","TCP","66","666  >  56334 [ACK] Seq=1 Ack=288 Win=64896 Len=0 TSval=2258444220 TSecr=1819723782"
"310","1.304540","192.168.123.9","192.168.123.16","TLSv1.3","1464","Server Hello, Change Cipher Spec, Application Data, Application Data, Application Data, Application Data, Application Data"
"311","1.304571","192.168.123.16","192.168.123.9","TCP","66","56214  >  666 [ACK] Seq=288 Ack=1399 Win=64128 Len=0 TSval=3449487591 TSecr=1453290651"
"312","1.305002","192.168.123.9","192.168.123.23","TLSv1.3","1464","Server Hello, Change Cipher Spec, Application Data, Application Data, Application Data, Application Data, Application Data"
"313","1.305031","192.168.123.23","192.168.123.9","TCP","66","56334  >  666 [ACK] Seq=288 Ack=1399 Win=64128 Len=0 TSval=1819723783 TSecr=2258444221"
"314","1.306178","192.168.123.23","192.168.123.9","TLSv1.3","756","Change Cipher Spec, Application Data, Application Data, Application Data"
"315","1.306201","192.168.123.16","192.168.123.9","TLSv1.3","756","Change Cipher Spec, Application Data, Application Data, Application Data"
"316","1.306214","192.168.123.9","192.168.123.23","TCP","66","666  >  56334 [ACK] Seq=1399 Ack=978 Win=64256 Len=0 TSval=2258444222 TSecr=1819723784"
"317","1.306230","192.168.123.9","192.168.123.16","TCP","66","666  >  56214 [ACK] Seq=1399 Ack=978 Win=64256 Len=0 TSval=1453290653 TSecr=3449487593"
"318","1.306713","192.168.123.9","192.168.123.16","TLSv1.3","769","Application Data"
"319","1.306737","192.168.123.9","192.168.123.23","TLSv1.3","769","Application Data"
"320","1.306785","192.168.123.23","192.168.123.9","TCP","66","56334  >  666 [ACK] Seq=978 Ack=2102 Win=64128 Len=0 TSval=1819723784 TSecr=2258444222"
"321","1.306850","192.168.123.9","192.168.123.16","TLSv1.3","769","Application Data"
"322","1.306921","192.168.123.9","192.168.123.23","TLSv1.3","769","Application Data"
"323","1.306925","192.168.123.16","192.168.123.9","TCP","66","56214  >  666 [ACK] Seq=978 Ack=2102 Win=63488 Len=0 TSval=3449487593 TSecr=1453290653"
"324","1.306938","192.168.123.23","192.168.123.9","TCP","66","56334  >  666 [ACK] Seq=978 Ack=2805 Win=64128 Len=0 TSval=1819723784 TSecr=2258444222"
"325","1.306946","192.168.123.16","192.168.123.9","TCP","66","56214  >  666 [ACK] Seq=978 Ack=2805 Win=62848 Len=0 TSval=3449487593 TSecr=1453290653"
"328","1.312813","192.168.123.33","192.168.123.9","TCP","74","45120  >  666 [SYN] Seq=0 Win=64240 Len=0 MSS=1460 SACK_PERM=1 TSval=566567830 TSecr=0 WS=128"
"329","1.312843","192.168.123.9","192.168.123.33","TCP","74","666  >  45120 [SYN, ACK] Seq=0 Ack=1 Win=65160 Len=0 MSS=1460 SACK_PERM=1 TSval=1267739760 TSecr=566567830 WS=128"
"330","1.312868","192.168.123.33","192.168.123.9","TCP","66","45120  >  666 [ACK] Seq=1 Ack=1 Win=64256 Len=0 TSval=566567830 TSecr=1267739760"
"331","1.313085","192.168.123.33","192.168.123.9","TLSv1.3","353","Client Hello"
"332","1.313144","192.168.123.9","192.168.123.33","TCP","66","666  >  45120 [ACK] Seq=1 Ack=288 Win=64896 Len=0 TSval=1267739761 TSecr=566567831"
"333","1.314106","192.168.123.9","192.168.123.33","TLSv1.3","1464","Server Hello, Change Cipher Spec, Application Data, Application Data, Application Data, Application Data, Application Data"
"334","1.314140","192.168.123.33","192.168.123.9","TCP","66","45120  >  666 [ACK] Seq=288 Ack=1399 Win=64128 Len=0 TSval=566567832 TSecr=1267739762"
"335","1.315603","192.168.123.33","192.168.123.9","TLSv1.3","756","Change Cipher Spec, Application Data, Application Data, Application Data"
"336","1.315631","192.168.123.9","192.168.123.33","TCP","66","666  >  45120 [ACK] Seq=1399 Ack=978 Win=64256 Len=0 TSval=1267739763 TSecr=566567833"
"337","1.316299","192.168.123.9","192.168.123.33","TLSv1.3","769","Application Data"
"338","1.316331","192.168.123.33","192.168.123.9","TCP","66","45120  >  666 [ACK] Seq=978 Ack=2102 Win=64128 Len=0 TSval=566567834 TSecr=1267739764"
"339","1.316511","192.168.123.9","192.168.123.33","TLSv1.3","769","Application Data"
"340","1.316531","192.168.123.33","192.168.123.9","TCP","66","45120  >  666 [ACK] Seq=978 Ack=2805 Win=64128 Len=0 TSval=566567834 TSecr=1267739764"
"343","1.321813","192.168.123.12","192.168.123.9","TCP","74","40306  >  666 [SYN] Seq=0 Win=64240 Len=0 MSS=1460 SACK_PERM=1 TSval=2863092342 TSecr=0 WS=128"
"344","1.321842","192.168.123.9","192.168.123.12","TCP","74","666  >  40306 [SYN, ACK] Seq=0 Ack=1 Win=65160 Len=0 MSS=1460 SACK_PERM=1 TSval=3867665207 TSecr=2863092342 WS=128"
"345","1.321878","192.168.123.12","192.168.123.9","TCP","66","40306  >  666 [ACK] Seq=1 Ack=1 Win=64256 Len=0 TSval=2863092342 TSecr=3867665207"
"346","1.322129","192.168.123.12","192.168.123.9","TLSv1.3","353","Client Hello"
"347","1.322188","192.168.123.9","192.168.123.12","TCP","66","666  >  40306 [ACK] Seq=1 Ack=288 Win=64896 Len=0 TSval=3867665208 TSecr=2863092343"
"348","1.323173","192.168.123.9","192.168.123.12","TLSv1.3","1464","Server Hello, Change Cipher Spec, Application Data, Application Data, Application Data, Application Data, Application Data"
"349","1.323226","192.168.123.12","192.168.123.9","TCP","66","40306  >  666 [ACK] Seq=288 Ack=1399 Win=64128 Len=0 TSval=2863092344 TSecr=3867665209"
"350","1.325858","192.168.123.12","192.168.123.9","TLSv1.3","756","Change Cipher Spec, Application Data, Application Data, Application Data"
"351","1.325905","192.168.123.9","192.168.123.12","TCP","66","666  >  40306 [ACK] Seq=1399 Ack=978 Win=64256 Len=0 TSval=3867665211 TSecr=2863092346"
"352","1.326361","192.168.123.9","192.168.123.12","TLSv1.3","769","Application Data"
"353","1.326454","192.168.123.9","192.168.123.12","TLSv1.3","769","Application Data"
"354","1.326523","192.168.123.12","192.168.123.9","TCP","66","40306  >  666 [ACK] Seq=978 Ack=2102 Win=63488 Len=0 TSval=2863092347 TSecr=3867665212"
"356","1.326541","192.168.123.12","192.168.123.9","TCP","66","40306  >  666 [ACK] Seq=978 Ack=2805 Win=62848 Len=0 TSval=2863092347 TSecr=3867665212"
"358","1.326891","192.168.123.41","192.168.123.9","TCP","74","60796  >  666 [SYN] Seq=0 Win=64240 Len=0 MSS=1460 SACK_PERM=1 TSval=3486533579 TSecr=0 WS=128"
"359","1.326920","192.168.123.9","192.168.123.41","TCP","74","666  >  60796 [SYN, ACK] Seq=0 Ack=1 Win=65160 Len=0 MSS=1460 SACK_PERM=1 TSval=3062823498 TSecr=3486533579 WS=128"
"360","1.326945","192.168.123.41","192.168.123.9","TCP","66","60796  >  666 [ACK] Seq=1 Ack=1 Win=64256 Len=0 TSval=3486533579 TSecr=3062823498"
"361","1.327235","192.168.123.41","192.168.123.9","TLSv1.3","353","Client Hello"
"362","1.327334","192.168.123.9","192.168.123.41","TCP","66","666  >  60796 [ACK] Seq=1 Ack=288 Win=64896 Len=0 TSval=3062823499 TSecr=3486533580"
"363","1.329027","192.168.123.9","192.168.123.41","TLSv1.3","1464","Server Hello, Change Cipher Spec, Application Data, Application Data, Application Data, Application Data, Application Data"
"364","1.329073","192.168.123.41","192.168.123.9","TCP","66","60796  >  666 [ACK] Seq=288 Ack=1399 Win=64128 Len=0 TSval=3486533582 TSecr=3062823501"
"365","1.332858","192.168.123.41","192.168.123.9","TLSv1.3","756","Change Cipher Spec, Application Data, Application Data, Application Data"
"366","1.332905","192.168.123.9","192.168.123.41","TCP","66","666  >  60796 [ACK] Seq=1399 Ack=978 Win=64256 Len=0 TSval=3062823504 TSecr=3486533585"
"367","1.333501","192.168.123.9","192.168.123.41","TLSv1.3","769","Application Data"
"368","1.333534","192.168.123.41","192.168.123.9","TCP","66","60796  >  666 [ACK] Seq=978 Ack=2102 Win=64128 Len=0 TSval=3486533586 TSecr=3062823505"
"369","1.333657","192.168.123.9","192.168.123.41","TLSv1.3","769","Application Data"
"370","1.333675","192.168.123.41","192.168.123.9","TCP","66","60796  >  666 [ACK] Seq=978 Ack=2805 Win=64128 Len=0 TSval=3486533586 TSecr=3062823505"
"373","1.350916","192.168.123.21","192.168.123.9","TCP","74","45198  >  666 [SYN] Seq=0 Win=64240 Len=0 MSS=1460 SACK_PERM=1 TSval=2850045281 TSecr=0 WS=128"
"374","1.350963","192.168.123.9","192.168.123.21","TCP","74","666  >  45198 [SYN, ACK] Seq=0 Ack=1 Win=65160 Len=0 MSS=1460 SACK_PERM=1 TSval=3872849828 TSecr=2850045281 WS=128"
"375","1.350989","192.168.123.21","192.168.123.9","TCP","66","45198  >  666 [ACK] Seq=1 Ack=1 Win=64256 Len=0 TSval=2850045282 TSecr=3872849828"
"376","1.351201","192.168.123.21","192.168.123.9","TLSv1.3","353","Client Hello"
"377","1.351251","192.168.123.9","192.168.123.21","TCP","66","666  >  45198 [ACK] Seq=1 Ack=288 Win=64896 Len=0 TSval=3872849829 TSecr=2850045282"
"378","1.352098","192.168.123.9","192.168.123.21","TLSv1.3","1464","Server Hello, Change Cipher Spec, Application Data, Application Data, Application Data, Application Data, Application Data"
"379","1.352128","192.168.123.21","192.168.123.9","TCP","66","45198  >  666 [ACK] Seq=288 Ack=1399 Win=64128 Len=0 TSval=2850045283 TSecr=3872849830"
"380","1.354372","192.168.123.21","192.168.123.9","TLSv1.3","756","Change Cipher Spec, Application Data, Application Data, Application Data"
"381","1.354413","192.168.123.9","192.168.123.21","TCP","66","666  >  45198 [ACK] Seq=1399 Ack=978 Win=64256 Len=0 TSval=3872849832 TSecr=2850045285"
"382","1.354975","192.168.123.9","192.168.123.21","TLSv1.3","769","Application Data"
"383","1.355000","192.168.123.21","192.168.123.9","TCP","66","45198  >  666 [ACK] Seq=978 Ack=2102 Win=64128 Len=0 TSval=2850045286 TSecr=3872849832"
"384","1.355097","192.168.123.9","192.168.123.21","TLSv1.3","769","Application Data"
"385","1.355113","192.168.123.21","192.168.123.9","TCP","66","45198  >  666 [ACK] Seq=978 Ack=2805 Win=64128 Len=0 TSval=2850045286 TSecr=3872849833"
"388","2.093755","192.168.123.24","192.168.123.9","TCP","74","34688  >  666 [SYN] Seq=0 Win=64240 Len=0 MSS=1460 SACK_PERM=1 TSval=1399757066 TSecr=0 WS=128"
"389","2.093799","192.168.123.9","192.168.123.24","TCP","74","666  >  34688 [SYN, ACK] Seq=0 Ack=1 Win=65160 Len=0 MSS=1460 SACK_PERM=1 TSval=2802113419 TSecr=1399757066 WS=128"
"390","2.093845","192.168.123.24","192.168.123.9","TCP","66","34688  >  666 [ACK] Seq=1 Ack=1 Win=64256 Len=0 TSval=1399757066 TSecr=2802113419"
"391","2.094171","192.168.123.24","192.168.123.9","TLSv1.3","353","Client Hello"
"392","2.094250","192.168.123.9","192.168.123.24","TCP","66","666  >  34688 [ACK] Seq=1 Ack=288 Win=64896 Len=0 TSval=2802113420 TSecr=1399757067"
"393","2.095093","192.168.123.9","192.168.123.24","TLSv1.3","1464","Server Hello, Change Cipher Spec, Application Data, Application Data, Application Data, Application Data, Application Data"
"394","2.095127","192.168.123.24","192.168.123.9","TCP","66","34688  >  666 [ACK] Seq=288 Ack=1399 Win=64128 Len=0 TSval=1399757068 TSecr=2802113421"
"395","2.098847","192.168.123.24","192.168.123.9","TLSv1.3","756","Change Cipher Spec, Application Data, Application Data, Application Data"
"396","2.098883","192.168.123.9","192.168.123.24","TCP","66","666  >  34688 [ACK] Seq=1399 Ack=978 Win=64256 Len=0 TSval=2802113424 TSecr=1399757071"
"397","2.099424","192.168.123.9","192.168.123.24","TLSv1.3","769","Application Data"
"398","2.099452","192.168.123.24","192.168.123.9","TCP","66","34688  >  666 [ACK] Seq=978 Ack=2102 Win=64128 Len=0 TSval=1399757072 TSecr=2802113425"
"399","2.099573","192.168.123.9","192.168.123.24","TLSv1.3","769","Application Data"
"400","2.099598","192.168.123.24","192.168.123.9","TCP","66","34688  >  666 [ACK] Seq=978 Ack=2805 Win=64128 Len=0 TSval=1399757072 TSecr=2802113425"
"405","2.328832","192.168.123.18","192.168.123.9","TCP","74","57638  >  666 [SYN] Seq=0 Win=64240 Len=0 MSS=1460 SACK_PERM=1 TSval=1124232009 TSecr=0 WS=128"
"406","2.328878","192.168.123.9","192.168.123.18","TCP","74","666  >  57638 [SYN, ACK] Seq=0 Ack=1 Win=65160 Len=0 MSS=1460 SACK_PERM=1 TSval=1313064040 TSecr=1124232009 WS=128"
"407","2.328911","192.168.123.18","192.168.123.9","TCP","66","57638  >  666 [ACK] Seq=1 Ack=1 Win=64256 Len=0 TSval=1124232009 TSecr=1313064040"
"408","2.329249","192.168.123.18","192.168.123.9","TLSv1.3","353","Client Hello"
"409","2.329333","192.168.123.9","192.168.123.18","TCP","66","666  >  57638 [ACK] Seq=1 Ack=288 Win=64896 Len=0 TSval=1313064041 TSecr=1124232010"
"410","2.330727","192.168.123.9","192.168.123.18","TLSv1.3","1464","Server Hello, Change Cipher Spec, Application Data, Application Data, Application Data, Application Data, Application Data"
"411","2.330758","192.168.123.18","192.168.123.9","TCP","66","57638  >  666 [ACK] Seq=288 Ack=1399 Win=64128 Len=0 TSval=1124232011 TSecr=1313064042"
"412","2.332673","192.168.123.18","192.168.123.9","TLSv1.3","756","Change Cipher Spec, Application Data, Application Data, Application Data"
"413","2.332699","192.168.123.9","192.168.123.18","TCP","66","666  >  57638 [ACK] Seq=1399 Ack=978 Win=64256 Len=0 TSval=1313064044 TSecr=1124232013"
"414","2.333201","192.168.123.9","192.168.123.18","TLSv1.3","769","Application Data"
"415","2.333227","192.168.123.18","192.168.123.9","TCP","66","57638  >  666 [ACK] Seq=978 Ack=2102 Win=64128 Len=0 TSval=1124232014 TSecr=1313064045"
"416","2.333332","192.168.123.9","192.168.123.18","TLSv1.3","769","Application Data"
"417","2.333350","192.168.123.18","192.168.123.9","TCP","66","57638  >  666 [ACK] Seq=978 Ack=2805 Win=64128 Len=0 TSval=1124232014 TSecr=1313064045"
"420","2.465630","192.168.123.5","192.168.123.9","TCP","74","46706  >  666 [SYN] Seq=0 Win=64240 Len=0 MSS=1460 SACK_PERM=1 TSval=2853263829 TSecr=0 WS=128"
"421","2.465662","192.168.123.9","192.168.123.5","TCP","74","666  >  46706 [SYN, ACK] Seq=0 Ack=1 Win=65160 Len=0 MSS=1460 SACK_PERM=1 TSval=1609393266 TSecr=2853263829 WS=128"
"422","2.465697","192.168.123.5","192.168.123.9","TCP","66","46706  >  666 [ACK] Seq=1 Ack=1 Win=64256 Len=0 TSval=2853263830 TSecr=1609393266"
"423","2.465955","192.168.123.5","192.168.123.9","TLSv1.3","353","Client Hello"
"424","2.466044","192.168.123.9","192.168.123.5","TCP","66","666  >  46706 [ACK] Seq=1 Ack=288 Win=64896 Len=0 TSval=1609393266 TSecr=2853263830"
"425","2.466986","192.168.123.9","192.168.123.5","TLSv1.3","1464","Server Hello, Change Cipher Spec, Application Data, Application Data, Application Data, Application Data, Application Data"
"426","2.467011","192.168.123.5","192.168.123.9","TCP","66","46706  >  666 [ACK] Seq=288 Ack=1399 Win=64128 Len=0 TSval=2853263832 TSecr=1609393267"
"427","2.470578","192.168.123.5","192.168.123.9","TLSv1.3","756","Change Cipher Spec, Application Data, Application Data, Application Data"
"428","2.470603","192.168.123.9","192.168.123.5","TCP","66","666  >  46706 [ACK] Seq=1399 Ack=978 Win=64256 Len=0 TSval=1609393271 TSecr=2853263835"
"429","2.471053","192.168.123.9","192.168.123.5","TLSv1.3","769","Application Data"
"430","2.471081","192.168.123.5","192.168.123.9","TCP","66","46706  >  666 [ACK] Seq=978 Ack=2102 Win=64128 Len=0 TSval=2853263836 TSecr=1609393272"
"431","2.471189","192.168.123.9","192.168.123.5","TLSv1.3","769","Application Data"
"432","2.471205","192.168.123.5","192.168.123.9","TCP","66","46706  >  666 [ACK] Seq=978 Ack=2805 Win=64128 Len=0 TSval=2853263836 TSecr=1609393272"
"435","2.473967","192.168.123.19","192.168.123.9","TCP","74","47736  >  666 [SYN] Seq=0 Win=64240 Len=0 MSS=1460 SACK_PERM=1 TSval=3809407587 TSecr=0 WS=128"
"436","2.473993","192.168.123.9","192.168.123.19","TCP","74","666  >  47736 [SYN, ACK] Seq=0 Ack=1 Win=65160 Len=0 MSS=1460 SACK_PERM=1 TSval=2793272282 TSecr=3809407587 WS=128"
"437","2.474016","192.168.123.19","192.168.123.9","TCP","66","47736  >  666 [ACK] Seq=1 Ack=1 Win=64256 Len=0 TSval=3809407588 TSecr=2793272282"
"438","2.474269","192.168.123.19","192.168.123.9","TLSv1.3","353","Client Hello"
"439","2.474344","192.168.123.9","192.168.123.19","TCP","66","666  >  47736 [ACK] Seq=1 Ack=288 Win=64896 Len=0 TSval=2793272282 TSecr=3809407588"
"440","2.475761","192.168.123.9","192.168.123.19","TLSv1.3","1464","Server Hello, Change Cipher Spec, Application Data, Application Data, Application Data, Application Data, Application Data"
"441","2.475799","192.168.123.19","192.168.123.9","TCP","66","47736  >  666 [ACK] Seq=288 Ack=1399 Win=64128 Len=0 TSval=3809407589 TSecr=2793272283"
"442","2.477972","192.168.123.19","192.168.123.9","TLSv1.3","756","Change Cipher Spec, Application Data, Application Data, Application Data"
"443","2.477996","192.168.123.9","192.168.123.19","TCP","66","666  >  47736 [ACK] Seq=1399 Ack=978 Win=64256 Len=0 TSval=2793272286 TSecr=3809407591"
"444","2.478371","192.168.123.9","192.168.123.19","TLSv1.3","769","Application Data"
"445","2.478464","192.168.123.9","192.168.123.19","TLSv1.3","769","Application Data"
"446","2.478527","192.168.123.19","192.168.123.9","TCP","66","47736  >  666 [ACK] Seq=978 Ack=2102 Win=63488 Len=0 TSval=3809407592 TSecr=2793272286"
"447","2.478545","192.168.123.19","192.168.123.9","TCP","66","47736  >  666 [ACK] Seq=978 Ack=2805 Win=62848 Len=0 TSval=3809407592 TSecr=2793272286"
"450","2.510905","192.168.123.11","192.168.123.9","TCP","74","49358  >  666 [SYN] Seq=0 Win=64240 Len=0 MSS=1460 SACK_PERM=1 TSval=3174347256 TSecr=0 WS=128"
"451","2.510939","192.168.123.9","192.168.123.11","TCP","74","666  >  49358 [SYN, ACK] Seq=0 Ack=1 Win=65160 Len=0 MSS=1460 SACK_PERM=1 TSval=785323623 TSecr=3174347256 WS=128"
"452","2.510965","192.168.123.11","192.168.123.9","TCP","66","49358  >  666 [ACK] Seq=1 Ack=1 Win=64256 Len=0 TSval=3174347256 TSecr=785323623"
"453","2.511182","192.168.123.11","192.168.123.9","TLSv1.3","353","Client Hello"
"454","2.511271","192.168.123.9","192.168.123.11","TCP","66","666  >  49358 [ACK] Seq=1 Ack=288 Win=64896 Len=0 TSval=785323624 TSecr=3174347257"
"455","2.512414","192.168.123.9","192.168.123.11","TLSv1.3","1464","Server Hello, Change Cipher Spec, Application Data, Application Data, Application Data, Application Data, Application Data"
"456","2.512456","192.168.123.11","192.168.123.9","TCP","66","49358  >  666 [ACK] Seq=288 Ack=1399 Win=64128 Len=0 TSval=3174347258 TSecr=785323625"
"457","2.513730","192.168.123.11","192.168.123.9","TLSv1.3","756","Change Cipher Spec, Application Data, Application Data, Application Data"
"458","2.513771","192.168.123.9","192.168.123.11","TCP","66","666  >  49358 [ACK] Seq=1399 Ack=978 Win=64256 Len=0 TSval=785323626 TSecr=3174347259"
"459","2.514438","192.168.123.9","192.168.123.11","TLSv1.3","769","Application Data"
"460","2.514507","192.168.123.11","192.168.123.9","TCP","66","49358  >  666 [ACK] Seq=978 Ack=2102 Win=64128 Len=0 TSval=3174347260 TSecr=785323627"
"461","2.514614","192.168.123.9","192.168.123.11","TLSv1.3","769","Application Data"
"462","2.514630","192.168.123.11","192.168.123.9","TCP","66","49358  >  666 [ACK] Seq=978 Ack=2805 Win=64128 Len=0 TSval=3174347260 TSecr=785323627"
"465","2.515836","192.168.123.27","192.168.123.9","TCP","74","36630  >  666 [SYN] Seq=0 Win=64240 Len=0 MSS=1460 SACK_PERM=1 TSval=204523478 TSecr=0 WS=128"
"466","2.515860","192.168.123.9","192.168.123.27","TCP","74","666  >  36630 [SYN, ACK] Seq=0 Ack=1 Win=65160 Len=0 MSS=1460 SACK_PERM=1 TSval=2629839917 TSecr=204523478 WS=128"
"467","2.515882","192.168.123.27","192.168.123.9","TCP","66","36630  >  666 [ACK] Seq=1 Ack=1 Win=64256 Len=0 TSval=204523478 TSecr=2629839917"
"468","2.516064","192.168.123.27","192.168.123.9","TLSv1.3","353","Client Hello"
"469","2.516133","192.168.123.9","192.168.123.27","TCP","66","666  >  36630 [ACK] Seq=1 Ack=288 Win=64896 Len=0 TSval=2629839918 TSecr=204523479"
"470","2.516898","192.168.123.9","192.168.123.27","TLSv1.3","1464","Server Hello, Change Cipher Spec, Application Data, Application Data, Application Data, Application Data, Application Data"
"471","2.516925","192.168.123.27","192.168.123.9","TCP","66","36630  >  666 [ACK] Seq=288 Ack=1399 Win=64128 Len=0 TSval=204523479 TSecr=2629839918"
"472","2.524072","192.168.123.27","192.168.123.9","TLSv1.3","756","Change Cipher Spec, Application Data, Application Data, Application Data"
"473","2.524099","192.168.123.9","192.168.123.27","TCP","66","666  >  36630 [ACK] Seq=1399 Ack=978 Win=64256 Len=0 TSval=2629839926 TSecr=204523487"
"474","2.524512","192.168.123.9","192.168.123.27","TLSv1.3","769","Application Data"
"475","2.524614","192.168.123.9","192.168.123.27","TLSv1.3","769","Application Data"
"476","2.524682","192.168.123.27","192.168.123.9","TCP","66","36630  >  666 [ACK] Seq=978 Ack=2102 Win=63488 Len=0 TSval=204523487 TSecr=2629839926"
"477","2.524703","192.168.123.27","192.168.123.9","TCP","66","36630  >  666 [ACK] Seq=978 Ack=2805 Win=62848 Len=0 TSval=204523487 TSecr=2629839926"
"480","2.529378","192.168.123.13","192.168.123.9","TCP","74","47884  >  666 [SYN] Seq=0 Win=64240 Len=0 MSS=1460 SACK_PERM=1 TSval=852810887 TSecr=0 WS=128"
"481","2.529446","192.168.123.9","192.168.123.13","TCP","74","666  >  47884 [SYN, ACK] Seq=0 Ack=1 Win=65160 Len=0 MSS=1460 SACK_PERM=1 TSval=382199485 TSecr=852810887 WS=128"
"482","2.529479","192.168.123.13","192.168.123.9","TCP","66","47884  >  666 [ACK] Seq=1 Ack=1 Win=64256 Len=0 TSval=852810887 TSecr=382199485"
"483","2.529679","192.168.123.13","192.168.123.9","TLSv1.3","353","Client Hello"
"484","2.529740","192.168.123.9","192.168.123.13","TCP","66","666  >  47884 [ACK] Seq=1 Ack=288 Win=64896 Len=0 TSval=382199485 TSecr=852810887"
"485","2.530448","192.168.123.9","192.168.123.13","TLSv1.3","1464","Server Hello, Change Cipher Spec, Application Data, Application Data, Application Data, Application Data, Application Data"
"486","2.530492","192.168.123.13","192.168.123.9","TCP","66","47884  >  666 [ACK] Seq=288 Ack=1399 Win=64128 Len=0 TSval=852810888 TSecr=382199486"
"487","2.534289","192.168.123.13","192.168.123.9","TLSv1.3","756","Change Cipher Spec, Application Data, Application Data, Application Data"
"488","2.534313","192.168.123.9","192.168.123.13","TCP","66","666  >  47884 [ACK] Seq=1399 Ack=978 Win=64256 Len=0 TSval=382199490 TSecr=852810892"
"489","2.534777","192.168.123.9","192.168.123.13","TLSv1.3","769","Application Data"
"490","2.534890","192.168.123.9","192.168.123.13","TLSv1.3","769","Application Data"
"491","2.534973","192.168.123.13","192.168.123.9","TCP","66","47884  >  666 [ACK] Seq=978 Ack=2102 Win=63488 Len=0 TSval=852810892 TSecr=382199490"
"492","2.535010","192.168.123.13","192.168.123.9","TCP","66","47884  >  666 [ACK] Seq=978 Ack=2805 Win=62848 Len=0 TSval=852810893 TSecr=382199490"
"495","2.547743","192.168.123.22","192.168.123.9","TCP","74","47340  >  666 [SYN] Seq=0 Win=64240 Len=0 MSS=1460 SACK_PERM=1 TSval=2324969918 TSecr=0 WS=128"
"496","2.547772","192.168.123.9","192.168.123.22","TCP","74","666  >  47340 [SYN, ACK] Seq=0 Ack=1 Win=65160 Len=0 MSS=1460 SACK_PERM=1 TSval=3005119491 TSecr=2324969918 WS=128"
"497","2.547812","192.168.123.22","192.168.123.9","TCP","66","47340  >  666 [ACK] Seq=1 Ack=1 Win=64256 Len=0 TSval=2324969918 TSecr=3005119491"
"498","2.548028","192.168.123.22","192.168.123.9","TLSv1.3","353","Client Hello"
"499","2.548136","192.168.123.9","192.168.123.22","TCP","66","666  >  47340 [ACK] Seq=1 Ack=288 Win=64896 Len=0 TSval=3005119492 TSecr=2324969919"
"500","2.548981","192.168.123.9","192.168.123.22","TLSv1.3","1464","Server Hello, Change Cipher Spec, Application Data, Application Data, Application Data, Application Data, Application Data"
"501","2.549010","192.168.123.22","192.168.123.9","TCP","66","47340  >  666 [ACK] Seq=288 Ack=1399 Win=64128 Len=0 TSval=2324969920 TSecr=3005119492"
"504","2.549767","192.168.123.32","192.168.123.9","TCP","74","35356  >  666 [SYN] Seq=0 Win=64240 Len=0 MSS=1460 SACK_PERM=1 TSval=3475752409 TSecr=0 WS=128"
"505","2.549810","192.168.123.9","192.168.123.32","TCP","74","666  >  35356 [SYN, ACK] Seq=0 Ack=1 Win=65160 Len=0 MSS=1460 SACK_PERM=1 TSval=2164984249 TSecr=3475752409 WS=128"
"506","2.549843","192.168.123.32","192.168.123.9","TCP","66","35356  >  666 [ACK] Seq=1 Ack=1 Win=64256 Len=0 TSval=3475752409 TSecr=2164984249"
"507","2.550091","192.168.123.32","192.168.123.9","TLSv1.3","353","Client Hello"
"508","2.550164","192.168.123.9","192.168.123.32","TCP","66","666  >  35356 [ACK] Seq=1 Ack=288 Win=64896 Len=0 TSval=2164984250 TSecr=3475752410"
"509","2.550920","192.168.123.9","192.168.123.32","TLSv1.3","1464","Server Hello, Change Cipher Spec, Application Data, Application Data, Application Data, Application Data, Application Data"
"510","2.550950","192.168.123.32","192.168.123.9","TCP","66","35356  >  666 [ACK] Seq=288 Ack=1399 Win=64128 Len=0 TSval=3475752410 TSecr=2164984250"
"511","2.554226","192.168.123.22","192.168.123.9","TLSv1.3","756","Change Cipher Spec, Application Data, Application Data, Application Data"
"512","2.554255","192.168.123.9","192.168.123.22","TCP","66","666  >  47340 [ACK] Seq=1399 Ack=978 Win=64256 Len=0 TSval=3005119498 TSecr=2324969925"
"513","2.554337","192.168.123.32","192.168.123.9","TLSv1.3","756","Change Cipher Spec, Application Data, Application Data, Application Data"
"514","2.554363","192.168.123.9","192.168.123.32","TCP","66","666  >  35356 [ACK] Seq=1399 Ack=978 Win=64256 Len=0 TSval=2164984254 TSecr=3475752414"
"515","2.554868","192.168.123.9","192.168.123.32","TLSv1.3","769","Application Data"
"516","2.554928","192.168.123.9","192.168.123.22","TLSv1.3","769","Application Data"
"517","2.554951","192.168.123.22","192.168.123.9","TCP","66","47340  >  666 [ACK] Seq=978 Ack=2102 Win=64128 Len=0 TSval=2324969925 TSecr=3005119498"
"518","2.554973","192.168.123.9","192.168.123.32","TLSv1.3","769","Application Data"
"519","2.555036","192.168.123.32","192.168.123.9","TCP","66","35356  >  666 [ACK] Seq=978 Ack=2102 Win=63488 Len=0 TSval=3475752415 TSecr=2164984254"
"520","2.555043","192.168.123.9","192.168.123.22","TLSv1.3","769","Application Data"
"521","2.555054","192.168.123.32","192.168.123.9","TCP","66","35356  >  666 [ACK] Seq=978 Ack=2805 Win=62848 Len=0 TSval=3475752415 TSecr=2164984254"
"522","2.555059","192.168.123.22","192.168.123.9","TCP","66","47340  >  666 [ACK] Seq=978 Ack=2805 Win=64128 Len=0 TSval=2324969926 TSecr=3005119499"
"525","2.564918","192.168.123.6","192.168.123.9","TCP","74","44402  >  666 [SYN] Seq=0 Win=64240 Len=0 MSS=1460 SACK_PERM=1 TSval=2201563240 TSecr=0 WS=128"
"526","2.564947","192.168.123.9","192.168.123.6","TCP","74","666  >  44402 [SYN, ACK] Seq=0 Ack=1 Win=65160 Len=0 MSS=1460 SACK_PERM=1 TSval=3427730354 TSecr=2201563240 WS=128"
"527","2.564971","192.168.123.6","192.168.123.9","TCP","66","44402  >  666 [ACK] Seq=1 Ack=1 Win=64256 Len=0 TSval=2201563240 TSecr=3427730354"
"528","2.565212","192.168.123.6","192.168.123.9","TLSv1.3","353","Client Hello"
"529","2.565301","192.168.123.9","192.168.123.6","TCP","66","666  >  44402 [ACK] Seq=1 Ack=288 Win=64896 Len=0 TSval=3427730355 TSecr=2201563241"
"530","2.566278","192.168.123.9","192.168.123.6","TLSv1.3","1464","Server Hello, Change Cipher Spec, Application Data, Application Data, Application Data, Application Data, Application Data"
"531","2.566315","192.168.123.6","192.168.123.9","TCP","66","44402  >  666 [ACK] Seq=288 Ack=1399 Win=64128 Len=0 TSval=2201563242 TSecr=3427730356"
"532","2.567602","192.168.123.6","192.168.123.9","TLSv1.3","756","Change Cipher Spec, Application Data, Application Data, Application Data"
"533","2.567626","192.168.123.9","192.168.123.6","TCP","66","666  >  44402 [ACK] Seq=1399 Ack=978 Win=64256 Len=0 TSval=3427730357 TSecr=2201563243"
"534","2.568006","192.168.123.9","192.168.123.6","TLSv1.3","769","Application Data"
"535","2.568092","192.168.123.9","192.168.123.6","TLSv1.3","769","Application Data"
"536","2.568152","192.168.123.6","192.168.123.9","TCP","66","44402  >  666 [ACK] Seq=978 Ack=2102 Win=63488 Len=0 TSval=2201563244 TSecr=3427730358"
"537","2.568169","192.168.123.6","192.168.123.9","TCP","66","44402  >  666 [ACK] Seq=978 Ack=2805 Win=62848 Len=0 TSval=2201563244 TSecr=3427730358"
"540","2.588215","192.168.123.44","192.168.123.9","TCP","74","36584  >  666 [SYN] Seq=0 Win=64240 Len=0 MSS=1460 SACK_PERM=1 TSval=2963616545 TSecr=0 WS=128"
"541","2.588242","192.168.123.9","192.168.123.44","TCP","74","666  >  36584 [SYN, ACK] Seq=0 Ack=1 Win=65160 Len=0 MSS=1460 SACK_PERM=1 TSval=3510938085 TSecr=2963616545 WS=128"
"542","2.588265","192.168.123.44","192.168.123.9","TCP","66","36584  >  666 [ACK] Seq=1 Ack=1 Win=64256 Len=0 TSval=2963616546 TSecr=3510938085"
"543","2.588527","192.168.123.44","192.168.123.9","TLSv1.3","353","Client Hello"
"544","2.588594","192.168.123.9","192.168.123.44","TCP","66","666  >  36584 [ACK] Seq=1 Ack=288 Win=64896 Len=0 TSval=3510938085 TSecr=2963616546"
"545","2.589624","192.168.123.9","192.168.123.44","TLSv1.3","1464","Server Hello, Change Cipher Spec, Application Data, Application Data, Application Data, Application Data, Application Data"
"546","2.589657","192.168.123.44","192.168.123.9","TCP","66","36584  >  666 [ACK] Seq=288 Ack=1399 Win=64128 Len=0 TSval=2963616547 TSecr=3510938086"
"549","2.591990","192.168.123.40","192.168.123.9","TCP","74","58584  >  666 [SYN] Seq=0 Win=64240 Len=0 MSS=1460 SACK_PERM=1 TSval=2101216987 TSecr=0 WS=128"
"550","2.592018","192.168.123.9","192.168.123.40","TCP","74","666  >  58584 [SYN, ACK] Seq=0 Ack=1 Win=65160 Len=0 MSS=1460 SACK_PERM=1 TSval=870663330 TSecr=2101216987 WS=128"
"551","2.592042","192.168.123.40","192.168.123.9","TCP","66","58584  >  666 [ACK] Seq=1 Ack=1 Win=64256 Len=0 TSval=2101216988 TSecr=870663330"
"552","2.592306","192.168.123.40","192.168.123.9","TLSv1.3","353","Client Hello"
"553","2.592396","192.168.123.9","192.168.123.40","TCP","66","666  >  58584 [ACK] Seq=1 Ack=288 Win=64896 Len=0 TSval=870663330 TSecr=2101216988"
"554","2.593250","192.168.123.9","192.168.123.40","TLSv1.3","1464","Server Hello, Change Cipher Spec, Application Data, Application Data, Application Data, Application Data, Application Data"
"555","2.593278","192.168.123.40","192.168.123.9","TCP","66","58584  >  666 [ACK] Seq=288 Ack=1399 Win=64128 Len=0 TSval=2101216989 TSecr=870663331"
"556","2.594470","192.168.123.40","192.168.123.9","TLSv1.3","756","Change Cipher Spec, Application Data, Application Data, Application Data"
"557","2.594494","192.168.123.9","192.168.123.40","TCP","66","666  >  58584 [ACK] Seq=1399 Ack=978 Win=64256 Len=0 TSval=870663332 TSecr=2101216990"
"558","2.595063","192.168.123.9","192.168.123.40","TLSv1.3","769","Application Data"
"559","2.595086","192.168.123.40","192.168.123.9","TCP","66","58584  >  666 [ACK] Seq=978 Ack=2102 Win=64128 Len=0 TSval=2101216991 TSecr=870663333"
"560","2.595180","192.168.123.9","192.168.123.40","TLSv1.3","769","Application Data"
"561","2.595195","192.168.123.40","192.168.123.9","TCP","66","58584  >  666 [ACK] Seq=978 Ack=2805 Win=64128 Len=0 TSval=2101216991 TSecr=870663333"
"562","2.597173","192.168.123.44","192.168.123.9","TLSv1.3","756","Change Cipher Spec, Application Data, Application Data, Application Data"
"563","2.597198","192.168.123.9","192.168.123.44","TCP","66","666  >  36584 [ACK] Seq=1399 Ack=978 Win=64256 Len=0 TSval=3510938094 TSecr=2963616555"
"564","2.597694","192.168.123.9","192.168.123.44","TLSv1.3","769","Application Data"
"565","2.597758","192.168.123.44","192.168.123.9","TCP","66","36584  >  666 [ACK] Seq=978 Ack=2102 Win=63488 Len=0 TSval=2963616555 TSecr=3510938094"
"566","2.597803","192.168.123.9","192.168.123.44","TLSv1.3","769","Application Data"
"567","2.597822","192.168.123.44","192.168.123.9","TCP","66","36584  >  666 [ACK] Seq=978 Ack=2805 Win=64128 Len=0 TSval=2963616555 TSecr=3510938094"
"570","2.614620","192.168.123.34","192.168.123.9","TCP","74","54710  >  666 [SYN] Seq=0 Win=64240 Len=0 MSS=1460 SACK_PERM=1 TSval=660211848 TSecr=0 WS=128"
"571","2.614683","192.168.123.9","192.168.123.34","TCP","74","666  >  54710 [SYN, ACK] Seq=0 Ack=1 Win=65160 Len=0 MSS=1460 SACK_PERM=1 TSval=2421404252 TSecr=660211848 WS=128"
"572","2.614721","192.168.123.34","192.168.123.9","TCP","66","54710  >  666 [ACK] Seq=1 Ack=1 Win=64256 Len=0 TSval=660211849 TSecr=2421404252"
"573","2.615053","192.168.123.34","192.168.123.9","TLSv1.3","353","Client Hello"
"574","2.615151","192.168.123.9","192.168.123.34","TCP","66","666  >  54710 [ACK] Seq=1 Ack=288 Win=64896 Len=0 TSval=2421404253 TSecr=660211850"
"575","2.616039","192.168.123.9","192.168.123.34","TLSv1.3","1464","Server Hello, Change Cipher Spec, Application Data, Application Data, Application Data, Application Data, Application Data"
"576","2.616087","192.168.123.34","192.168.123.9","TCP","66","54710  >  666 [ACK] Seq=288 Ack=1399 Win=64128 Len=0 TSval=660211851 TSecr=2421404254"
"577","2.617732","192.168.123.34","192.168.123.9","TLSv1.3","756","Change Cipher Spec, Application Data, Application Data, Application Data"
"578","2.617759","192.168.123.9","192.168.123.34","TCP","66","666  >  54710 [ACK] Seq=1399 Ack=978 Win=64256 Len=0 TSval=2421404255 TSecr=660211852"
"579","2.618222","192.168.123.9","192.168.123.34","TLSv1.3","769","Application Data"
"580","2.618319","192.168.123.9","192.168.123.34","TLSv1.3","769","Application Data"
"581","2.618385","192.168.123.34","192.168.123.9","TCP","66","54710  >  666 [ACK] Seq=978 Ack=2102 Win=63488 Len=0 TSval=660211853 TSecr=2421404256"
"582","2.618405","192.168.123.34","192.168.123.9","TCP","66","54710  >  666 [ACK] Seq=978 Ack=2805 Win=62848 Len=0 TSval=660211853 TSecr=2421404256"
"585","2.619738","192.168.123.45","192.168.123.9","TCP","74","56558  >  666 [SYN] Seq=0 Win=64240 Len=0 MSS=1460 SACK_PERM=1 TSval=2645361451 TSecr=0 WS=128"
"586","2.619769","192.168.123.9","192.168.123.45","TCP","74","666  >  56558 [SYN, ACK] Seq=0 Ack=1 Win=65160 Len=0 MSS=1460 SACK_PERM=1 TSval=802374309 TSecr=2645361451 WS=128"
"587","2.619793","192.168.123.45","192.168.123.9","TCP","66","56558  >  666 [ACK] Seq=1 Ack=1 Win=64256 Len=0 TSval=2645361451 TSecr=802374309"
"588","2.620021","192.168.123.45","192.168.123.9","TLSv1.3","353","Client Hello"
"589","2.620083","192.168.123.9","192.168.123.45","TCP","66","666  >  56558 [ACK] Seq=1 Ack=288 Win=64896 Len=0 TSval=802374310 TSecr=2645361452"
"590","2.620807","192.168.123.9","192.168.123.45","TLSv1.3","1464","Server Hello, Change Cipher Spec, Application Data, Application Data, Application Data, Application Data, Application Data"
"591","2.620849","192.168.123.45","192.168.123.9","TCP","66","56558  >  666 [ACK] Seq=288 Ack=1399 Win=64128 Len=0 TSval=2645361452 TSecr=802374310"
"592","2.626227","192.168.123.45","192.168.123.9","TLSv1.3","756","Change Cipher Spec, Application Data, Application Data, Application Data"
"593","2.626252","192.168.123.9","192.168.123.45","TCP","66","666  >  56558 [ACK] Seq=1399 Ack=978 Win=64256 Len=0 TSval=802374316 TSecr=2645361458"
"594","2.626733","192.168.123.9","192.168.123.45","TLSv1.3","769","Application Data"
"595","2.626837","192.168.123.9","192.168.123.45","TLSv1.3","769","Application Data"
"596","2.626908","192.168.123.45","192.168.123.9","TCP","66","56558  >  666 [ACK] Seq=978 Ack=2102 Win=63488 Len=0 TSval=2645361458 TSecr=802374316"
"597","2.626928","192.168.123.45","192.168.123.9","TCP","66","56558  >  666 [ACK] Seq=978 Ack=2805 Win=62848 Len=0 TSval=2645361458 TSecr=802374316"
"600","2.648437","192.168.123.38","192.168.123.9","TCP","74","37018  >  666 [SYN] Seq=0 Win=64240 Len=0 MSS=1460 SACK_PERM=1 TSval=3879703620 TSecr=0 WS=128"
"601","2.648469","192.168.123.9","192.168.123.38","TCP","74","666  >  37018 [SYN, ACK] Seq=0 Ack=1 Win=65160 Len=0 MSS=1460 SACK_PERM=1 TSval=3891688469 TSecr=3879703620 WS=128"
"602","2.648495","192.168.123.38","192.168.123.9","TCP","66","37018  >  666 [ACK] Seq=1 Ack=1 Win=64256 Len=0 TSval=3879703621 TSecr=3891688469"
"603","2.648888","192.168.123.38","192.168.123.9","TLSv1.3","353","Client Hello"
"604","2.648988","192.168.123.9","192.168.123.38","TCP","66","666  >  37018 [ACK] Seq=1 Ack=288 Win=64896 Len=0 TSval=3891688469 TSecr=3879703621"
"605","2.650555","192.168.123.9","192.168.123.38","TLSv1.3","1464","Server Hello, Change Cipher Spec, Application Data, Application Data, Application Data, Application Data, Application Data"
"606","2.650623","192.168.123.38","192.168.123.9","TCP","66","37018  >  666 [ACK] Seq=288 Ack=1399 Win=64128 Len=0 TSval=3879703623 TSecr=3891688471"
"609","2.652674","192.168.123.42","192.168.123.9","TCP","74","52984  >  666 [SYN] Seq=0 Win=64240 Len=0 MSS=1460 SACK_PERM=1 TSval=3230091393 TSecr=0 WS=128"
"610","2.652714","192.168.123.9","192.168.123.42","TCP","74","666  >  52984 [SYN, ACK] Seq=0 Ack=1 Win=65160 Len=0 MSS=1460 SACK_PERM=1 TSval=2520185330 TSecr=3230091393 WS=128"
"611","2.652749","192.168.123.42","192.168.123.9","TCP","66","52984  >  666 [ACK] Seq=1 Ack=1 Win=64256 Len=0 TSval=3230091393 TSecr=2520185330"
"612","2.653071","192.168.123.42","192.168.123.9","TLSv1.3","353","Client Hello"
"613","2.653154","192.168.123.9","192.168.123.42","TCP","66","666  >  52984 [ACK] Seq=1 Ack=288 Win=64896 Len=0 TSval=2520185331 TSecr=3230091394"
"614","2.654207","192.168.123.38","192.168.123.9","TLSv1.3","756","Change Cipher Spec, Application Data, Application Data, Application Data"
"615","2.654236","192.168.123.9","192.168.123.38","TCP","66","666  >  37018 [ACK] Seq=1399 Ack=978 Win=64256 Len=0 TSval=3891688475 TSecr=3879703627"
"616","2.654268","192.168.123.9","192.168.123.42","TLSv1.3","1464","Server Hello, Change Cipher Spec, Application Data, Application Data, Application Data, Application Data, Application Data"
"617","2.654310","192.168.123.42","192.168.123.9","TCP","66","52984  >  666 [ACK] Seq=288 Ack=1399 Win=64128 Len=0 TSval=3230091395 TSecr=2520185332"
"618","2.654684","192.168.123.9","192.168.123.38","TLSv1.3","769","Application Data"
"619","2.654816","192.168.123.9","192.168.123.38","TLSv1.3","769","Application Data"
"620","2.654889","192.168.123.38","192.168.123.9","TCP","66","37018  >  666 [ACK] Seq=978 Ack=2102 Win=63488 Len=0 TSval=3879703627 TSecr=3891688475"
"621","2.654909","192.168.123.38","192.168.123.9","TCP","66","37018  >  666 [ACK] Seq=978 Ack=2805 Win=62848 Len=0 TSval=3879703627 TSecr=3891688475"
"624","2.656983","192.168.123.3","192.168.123.9","TCP","74","52772  >  666 [SYN] Seq=0 Win=64240 Len=0 MSS=1460 SACK_PERM=1 TSval=1538972551 TSecr=0 WS=128"
"625","2.657012","192.168.123.9","192.168.123.3","TCP","74","666  >  52772 [SYN, ACK] Seq=0 Ack=1 Win=65160 Len=0 MSS=1460 SACK_PERM=1 TSval=3703588089 TSecr=1538972551 WS=128"
"626","2.657037","192.168.123.3","192.168.123.9","TCP","66","52772  >  666 [ACK] Seq=1 Ack=1 Win=64256 Len=0 TSval=1538972552 TSecr=3703588089"
"627","2.657293","192.168.123.3","192.168.123.9","TLSv1.3","353","Client Hello"
"628","2.657355","192.168.123.9","192.168.123.3","TCP","66","666  >  52772 [ACK] Seq=1 Ack=288 Win=64896 Len=0 TSval=3703588089 TSecr=1538972552"
"629","2.658259","192.168.123.9","192.168.123.3","TLSv1.3","1464","Server Hello, Change Cipher Spec, Application Data, Application Data, Application Data, Application Data, Application Data"
"630","2.658292","192.168.123.3","192.168.123.9","TCP","66","52772  >  666 [ACK] Seq=288 Ack=1399 Win=64128 Len=0 TSval=1538972553 TSecr=3703588090"
"631","2.658643","192.168.123.42","192.168.123.9","TLSv1.3","756","Change Cipher Spec, Application Data, Application Data, Application Data"
"632","2.658697","192.168.123.9","192.168.123.42","TCP","66","666  >  52984 [ACK] Seq=1399 Ack=978 Win=64256 Len=0 TSval=2520185336 TSecr=3230091399"
"633","2.659122","192.168.123.9","192.168.123.42","TLSv1.3","769","Application Data"
"634","2.659157","192.168.123.42","192.168.123.9","TCP","66","52984  >  666 [ACK] Seq=978 Ack=2102 Win=64128 Len=0 TSval=3230091400 TSecr=2520185337"
"635","2.659264","192.168.123.9","192.168.123.42","TLSv1.3","769","Application Data"
"636","2.659281","192.168.123.42","192.168.123.9","TCP","66","52984  >  666 [ACK] Seq=978 Ack=2805 Win=64128 Len=0 TSval=3230091400 TSecr=2520185337"
"637","2.660189","192.168.123.3","192.168.123.9","TLSv1.3","756","Change Cipher Spec, Application Data, Application Data, Application Data"
"638","2.660218","192.168.123.9","192.168.123.3","TCP","66","666  >  52772 [ACK] Seq=1399 Ack=978 Win=64256 Len=0 TSval=3703588092 TSecr=1538972555"
"639","2.660634","192.168.123.9","192.168.123.3","TLSv1.3","769","Application Data"
"640","2.660737","192.168.123.9","192.168.123.3","TLSv1.3","769","Application Data"
"641","2.660808","192.168.123.3","192.168.123.9","TCP","66","52772  >  666 [ACK] Seq=978 Ack=2102 Win=63488 Len=0 TSval=1538972555 TSecr=3703588092"
"642","2.660829","192.168.123.3","192.168.123.9","TCP","66","52772  >  666 [ACK] Seq=978 Ack=2805 Win=62848 Len=0 TSval=1538972555 TSecr=3703588092"
"645","2.661658","192.168.123.46","192.168.123.9","TCP","74","49802  >  666 [SYN] Seq=0 Win=64240 Len=0 MSS=1460 SACK_PERM=1 TSval=3085562811 TSecr=0 WS=128"
"646","2.661712","192.168.123.9","192.168.123.46","TCP","74","666  >  49802 [SYN, ACK] Seq=0 Ack=1 Win=65160 Len=0 MSS=1460 SACK_PERM=1 TSval=213522130 TSecr=3085562811 WS=128"
"647","2.661764","192.168.123.46","192.168.123.9","TCP","66","49802  >  666 [ACK] Seq=1 Ack=1 Win=64256 Len=0 TSval=3085562811 TSecr=213522130"
"648","2.662176","192.168.123.46","192.168.123.9","TLSv1.3","353","Client Hello"
"649","2.662274","192.168.123.9","192.168.123.46","TCP","66","666  >  49802 [ACK] Seq=1 Ack=288 Win=64896 Len=0 TSval=213522131 TSecr=3085562812"
"650","2.663097","192.168.123.9","192.168.123.46","TLSv1.3","1464","Server Hello, Change Cipher Spec, Application Data, Application Data, Application Data, Application Data, Application Data"
"651","2.663129","192.168.123.46","192.168.123.9","TCP","66","49802  >  666 [ACK] Seq=288 Ack=1399 Win=64128 Len=0 TSval=3085562813 TSecr=213522132"
"654","2.666143","192.168.123.43","192.168.123.9","TCP","74","51324  >  666 [SYN] Seq=0 Win=64240 Len=0 MSS=1460 SACK_PERM=1 TSval=3723822027 TSecr=0 WS=128"
"655","2.666189","192.168.123.9","192.168.123.43","TCP","74","666  >  51324 [SYN, ACK] Seq=0 Ack=1 Win=65160 Len=0 MSS=1460 SACK_PERM=1 TSval=3591638017 TSecr=3723822027 WS=128"
"656","2.666213","192.168.123.43","192.168.123.9","TCP","66","51324  >  666 [ACK] Seq=1 Ack=1 Win=64256 Len=0 TSval=3723822028 TSecr=3591638017"
"657","2.666426","192.168.123.43","192.168.123.9","TLSv1.3","353","Client Hello"
"658","2.666488","192.168.123.9","192.168.123.43","TCP","66","666  >  51324 [ACK] Seq=1 Ack=288 Win=64896 Len=0 TSval=3591638017 TSecr=3723822028"
"659","2.667313","192.168.123.9","192.168.123.43","TLSv1.3","1464","Server Hello, Change Cipher Spec, Application Data, Application Data, Application Data, Application Data, Application Data"
"660","2.667351","192.168.123.43","192.168.123.9","TCP","66","51324  >  666 [ACK] Seq=288 Ack=1399 Win=64128 Len=0 TSval=3723822029 TSecr=3591638018"
"661","2.668743","192.168.123.43","192.168.123.9","TLSv1.3","756","Change Cipher Spec, Application Data, Application Data, Application Data"
"662","2.668768","192.168.123.9","192.168.123.43","TCP","66","666  >  51324 [ACK] Seq=1399 Ack=978 Win=64256 Len=0 TSval=3591638019 TSecr=3723822030"
"663","2.669208","192.168.123.9","192.168.123.43","TLSv1.3","769","Application Data"
"664","2.669312","192.168.123.9","192.168.123.43","TLSv1.3","769","Application Data"
"665","2.669387","192.168.123.43","192.168.123.9","TCP","66","51324  >  666 [ACK] Seq=978 Ack=2102 Win=63488 Len=0 TSval=3723822031 TSecr=3591638020"
"666","2.669488","192.168.123.43","192.168.123.9","TCP","66","51324  >  666 [ACK] Seq=978 Ack=2805 Win=62848 Len=0 TSval=3723822031 TSecr=3591638020"
"667","2.671250","192.168.123.46","192.168.123.9","TLSv1.3","756","Change Cipher Spec, Application Data, Application Data, Application Data"
"668","2.671283","192.168.123.9","192.168.123.46","TCP","66","666  >  49802 [ACK] Seq=1399 Ack=978 Win=64256 Len=0 TSval=213522140 TSecr=3085562821"
"669","2.671823","192.168.123.9","192.168.123.46","TLSv1.3","769","Application Data"
"670","2.671986","192.168.123.9","192.168.123.46","TLSv1.3","769","Application Data"
"671","2.672058","192.168.123.46","192.168.123.9","TCP","66","49802  >  666 [ACK] Seq=978 Ack=2102 Win=63488 Len=0 TSval=3085562822 TSecr=213522140"
"672","2.672097","192.168.123.46","192.168.123.9","TCP","66","49802  >  666 [ACK] Seq=978 Ack=2805 Win=62848 Len=0 TSval=3085562822 TSecr=213522140"
