"No.","Time","Source","Destination","Protocol","Length","Info"
"3","0.000432","192.168.123.43","192.168.123.23","TCP","74","57838  >  666 [SYN] Seq=0 Win=64240 Len=0 MSS=1460 SACK_PERM=1 TSval=2451475353 TSecr=0 WS=128"
"4","0.000481","192.168.123.23","192.168.123.43","TCP","74","666  >  57838 [SYN, ACK] Seq=0 Ack=1 Win=65160 Len=0 MSS=1460 SACK_PERM=1 TSval=3120115143 TSecr=2451475353 WS=128"
"5","0.000521","192.168.123.43","192.168.123.23","TCP","66","57838  >  666 [ACK] Seq=1 Ack=1 Win=64256 Len=0 TSval=2451475354 TSecr=3120115143"
"6","0.000874","192.168.123.43","192.168.123.23","TLSv1.3","353","Client Hello"
"7","0.000974","192.168.123.23","192.168.123.43","TCP","66","666  >  57838 [ACK] Seq=1 Ack=288 Win=64896 Len=0 TSval=3120115143 TSecr=2451475354"
"8","0.003062","192.168.123.23","192.168.123.43","TLSv1.3","1464","Server Hello, Change Cipher Spec, Application Data, Application Data, Application Data, Application Data, Application Data"
"9","0.003110","192.168.123.43","192.168.123.23","TCP","66","57838  >  666 [ACK] Seq=288 Ack=1399 Win=64128 Len=0 TSval=2451475356 TSecr=3120115145"
"10","0.004918","192.168.123.43","192.168.123.23","TLSv1.3","756","Change Cipher Spec, Application Data, Application Data, Application Data"
"11","0.004956","192.168.123.23","192.168.123.43","TCP","66","666  >  57838 [ACK] Seq=1399 Ack=978 Win=64256 Len=0 TSval=3120115147 TSecr=2451475358"
"12","0.005876","192.168.123.23","192.168.123.43","TLSv1.3","769","Application Data"
"13","0.005914","192.168.123.43","192.168.123.23","TCP","66","57838  >  666 [ACK] Seq=978 Ack=2102 Win=64128 Len=0 TSval=2451475359 TSecr=3120115148"
"14","0.006088","192.168.123.23","192.168.123.43","TLSv1.3","769","Application Data"
"15","0.006115","192.168.123.43","192.168.123.23","TCP","66","57838  >  666 [ACK] Seq=978 Ack=2805 Win=64128 Len=0 TSval=2451475359 TSecr=3120115148"
"18","0.088518","192.168.123.36","192.168.123.23","TCP","74","44074  >  666 [SYN] Seq=0 Win=64240 Len=0 MSS=1460 SACK_PERM=1 TSval=2491873900 TSecr=0 WS=128"
"19","0.088549","192.168.123.23","192.168.123.36","TCP","74","666  >  44074 [SYN, ACK] Seq=0 Ack=1 Win=65160 Len=0 MSS=1460 SACK_PERM=1 TSval=2354025945 TSecr=2491873900 WS=128"
"20","0.088575","192.168.123.36","192.168.123.23","TCP","66","44074  >  666 [ACK] Seq=1 Ack=1 Win=64256 Len=0 TSval=2491873901 TSecr=2354025945"
"21","0.088801","192.168.123.36","192.168.123.23","TLSv1.3","353","Client Hello"
"22","0.088866","192.168.123.23","192.168.123.36","TCP","66","666  >  44074 [ACK] Seq=1 Ack=288 Win=64896 Len=0 TSval=2354025945 TSecr=2491873901"
"23","0.090293","192.168.123.23","192.168.123.36","TLSv1.3","1464","Server Hello, Change Cipher Spec, Application Data, Application Data, Application Data, Application Data, Application Data"
"24","0.090320","192.168.123.36","192.168.123.23","TCP","66","44074  >  666 [ACK] Seq=288 Ack=1399 Win=64128 Len=0 TSval=2491873903 TSecr=2354025947"
"25","0.091800","192.168.123.36","192.168.123.23","TLSv1.3","756","Change Cipher Spec, Application Data, Application Data, Application Data"
"26","0.091837","192.168.123.23","192.168.123.36","TCP","66","666  >  44074 [ACK] Seq=1399 Ack=978 Win=64256 Len=0 TSval=2354025948 TSecr=2491873904"
"27","0.092413","192.168.123.23","192.168.123.36","TLSv1.3","769","Application Data"
"28","0.092448","192.168.123.36","192.168.123.23","TCP","66","44074  >  666 [ACK] Seq=978 Ack=2102 Win=64128 Len=0 TSval=2491873905 TSecr=2354025949"
"29","0.092563","192.168.123.23","192.168.123.36","TLSv1.3","769","Application Data"
"30","0.092579","192.168.123.36","192.168.123.23","TCP","66","44074  >  666 [ACK] Seq=978 Ack=2805 Win=64128 Len=0 TSval=2491873905 TSecr=2354025949"
"33","0.104543","192.168.123.15","192.168.123.23","TCP","74","46906  >  666 [SYN] Seq=0 Win=64240 Len=0 MSS=1460 SACK_PERM=1 TSval=1677134111 TSecr=0 WS=128"
"34","0.104572","192.168.123.23","192.168.123.15","TCP","74","666  >  46906 [SYN, ACK] Seq=0 Ack=1 Win=65160 Len=0 MSS=1460 SACK_PERM=1 TSval=3155546106 TSecr=1677134111 WS=128"
"35","0.104597","192.168.123.15","192.168.123.23","TCP","66","46906  >  666 [ACK] Seq=1 Ack=1 Win=64256 Len=0 TSval=1677134112 TSecr=3155546106"
"36","0.104788","192.168.123.15","192.168.123.23","TLSv1.3","353","Client Hello"
"37","0.104845","192.168.123.23","192.168.123.15","TCP","66","666  >  46906 [ACK] Seq=1 Ack=288 Win=64896 Len=0 TSval=3155546106 TSecr=1677134112"
"38","0.106308","192.168.123.23","192.168.123.15","TLSv1.3","1464","Server Hello, Change Cipher Spec, Application Data, Application Data, Application Data, Application Data, Application Data"
"39","0.106338","192.168.123.15","192.168.123.23","TCP","66","46906  >  666 [ACK] Seq=288 Ack=1399 Win=64128 Len=0 TSval=1677134114 TSecr=3155546108"
"40","0.110393","192.168.123.15","192.168.123.23","TLSv1.3","756","Change Cipher Spec, Application Data, Application Data, Application Data"
"41","0.110430","192.168.123.23","192.168.123.15","TCP","66","666  >  46906 [ACK] Seq=1399 Ack=978 Win=64256 Len=0 TSval=3155546112 TSecr=1677134118"
"42","0.110946","192.168.123.23","192.168.123.15","TLSv1.3","769","Application Data"
"43","0.110966","192.168.123.15","192.168.123.23","TCP","66","46906  >  666 [ACK] Seq=978 Ack=2102 Win=64128 Len=0 TSval=1677134118 TSecr=3155546112"
"44","0.111119","192.168.123.23","192.168.123.15","TLSv1.3","769","Application Data"
"45","0.111136","192.168.123.15","192.168.123.23","TCP","66","46906  >  666 [ACK] Seq=978 Ack=2805 Win=64128 Len=0 TSval=1677134118 TSecr=3155546112"
"48","0.117295","192.168.123.11","192.168.123.23","TCP","74","48220  >  666 [SYN] Seq=0 Win=64240 Len=0 MSS=1460 SACK_PERM=1 TSval=1502584797 TSecr=0 WS=128"
"49","0.117329","192.168.123.23","192.168.123.11","TCP","74","666  >  48220 [SYN, ACK] Seq=0 Ack=1 Win=65160 Len=0 MSS=1460 SACK_PERM=1 TSval=519226586 TSecr=1502584797 WS=128"
"50","0.117356","192.168.123.11","192.168.123.23","TCP","66","48220  >  666 [ACK] Seq=1 Ack=1 Win=64256 Len=0 TSval=1502584798 TSecr=519226586"
"51","0.117595","192.168.123.11","192.168.123.23","TLSv1.3","353","Client Hello"
"52","0.117671","192.168.123.23","192.168.123.11","TCP","66","666  >  48220 [ACK] Seq=1 Ack=288 Win=64896 Len=0 TSval=519226586 TSecr=1502584798"
"53","0.118740","192.168.123.23","192.168.123.11","TLSv1.3","1464","Server Hello, Change Cipher Spec, Application Data, Application Data, Application Data, Application Data, Application Data"
"54","0.118773","192.168.123.11","192.168.123.23","TCP","66","48220  >  666 [ACK] Seq=288 Ack=1399 Win=64128 Len=0 TSval=1502584799 TSecr=519226587"
"55","0.122854","192.168.123.11","192.168.123.23","TLSv1.3","756","Change Cipher Spec, Application Data, Application Data, Application Data"
"56","0.122902","192.168.123.23","192.168.123.11","TCP","66","666  >  48220 [ACK] Seq=1399 Ack=978 Win=64256 Len=0 TSval=519226591 TSecr=1502584803"
"57","0.123603","192.168.123.23","192.168.123.11","TLSv1.3","769","Application Data"
"58","0.123651","192.168.123.11","192.168.123.23","TCP","66","48220  >  666 [ACK] Seq=978 Ack=2102 Win=63488 Len=0 TSval=1502584804 TSecr=519226592"
"59","0.123778","192.168.123.23","192.168.123.11","TLSv1.3","769","Application Data"
"60","0.123808","192.168.123.11","192.168.123.23","TCP","66","48220  >  666 [ACK] Seq=978 Ack=2805 Win=64128 Len=0 TSval=1502584804 TSecr=519226592"
"63","0.128928","192.168.123.17","192.168.123.23","TCP","74","43848  >  666 [SYN] Seq=0 Win=64240 Len=0 MSS=1460 SACK_PERM=1 TSval=2443221593 TSecr=0 WS=128"
"64","0.128965","192.168.123.23","192.168.123.17","TCP","74","666  >  43848 [SYN, ACK] Seq=0 Ack=1 Win=65160 Len=0 MSS=1460 SACK_PERM=1 TSval=2251998253 TSecr=2443221593 WS=128"
"65","0.128997","192.168.123.17","192.168.123.23","TCP","66","43848  >  666 [ACK] Seq=1 Ack=1 Win=64256 Len=0 TSval=2443221593 TSecr=2251998253"
"66","0.129292","192.168.123.17","192.168.123.23","TLSv1.3","353","Client Hello"
"67","0.129385","192.168.123.23","192.168.123.17","TCP","66","666  >  43848 [ACK] Seq=1 Ack=288 Win=64896 Len=0 TSval=2251998254 TSecr=2443221594"
"68","0.130575","192.168.123.23","192.168.123.17","TLSv1.3","1464","Server Hello, Change Cipher Spec, Application Data, Application Data, Application Data, Application Data, Application Data"
"69","0.130621","192.168.123.17","192.168.123.23","TCP","66","43848  >  666 [ACK] Seq=288 Ack=1399 Win=64128 Len=0 TSval=2443221595 TSecr=2251998255"
"72","0.133709","192.168.123.38","192.168.123.23","TCP","74","38642  >  666 [SYN] Seq=0 Win=64240 Len=0 MSS=1460 SACK_PERM=1 TSval=2223718493 TSecr=0 WS=128"
"73","0.133758","192.168.123.23","192.168.123.38","TCP","74","666  >  38642 [SYN, ACK] Seq=0 Ack=1 Win=65160 Len=0 MSS=1460 SACK_PERM=1 TSval=131422179 TSecr=2223718493 WS=128"
"74","0.133811","192.168.123.38","192.168.123.23","TCP","66","38642  >  666 [ACK] Seq=1 Ack=1 Win=64256 Len=0 TSval=2223718494 TSecr=131422179"
"75","0.134153","192.168.123.17","192.168.123.23","TLSv1.3","756","Change Cipher Spec, Application Data, Application Data, Application Data"
"76","0.134173","192.168.123.38","192.168.123.23","TLSv1.3","353","Client Hello"
"77","0.134197","192.168.123.23","192.168.123.17","TCP","66","666  >  43848 [ACK] Seq=1399 Ack=978 Win=64256 Len=0 TSval=2251998259 TSecr=2443221598"
"78","0.134255","192.168.123.23","192.168.123.38","TCP","66","666  >  38642 [ACK] Seq=1 Ack=288 Win=64896 Len=0 TSval=131422180 TSecr=2223718494"
"79","0.134892","192.168.123.23","192.168.123.17","TLSv1.3","769","Application Data"
"80","0.134979","192.168.123.17","192.168.123.23","TCP","66","43848  >  666 [ACK] Seq=978 Ack=2102 Win=63488 Len=0 TSval=2443221599 TSecr=2251998259"
"81","0.135066","192.168.123.23","192.168.123.17","TLSv1.3","769","Application Data"
"82","0.135093","192.168.123.17","192.168.123.23","TCP","66","43848  >  666 [ACK] Seq=978 Ack=2805 Win=64128 Len=0 TSval=2443221599 TSecr=2251998259"
"83","0.135125","192.168.123.23","192.168.123.38","TLSv1.3","1464","Server Hello, Change Cipher Spec, Application Data, Application Data, Application Data, Application Data, Application Data"
"84","0.135157","192.168.123.38","192.168.123.23","TCP","66","38642  >  666 [ACK] Seq=288 Ack=1399 Win=64128 Len=0 TSval=2223718495 TSecr=131422180"
"85","0.138632","192.168.123.38","192.168.123.23","TLSv1.3","756","Change Cipher Spec, Application Data, Application Data, Application Data"
"86","0.138705","192.168.123.23","192.168.123.38","TCP","66","666  >  38642 [ACK] Seq=1399 Ack=978 Win=64256 Len=0 TSval=131422184 TSecr=2223718499"
"87","0.139328","192.168.123.23","192.168.123.38","TLSv1.3","769","Application Data"
"88","0.139494","192.168.123.23","192.168.123.38","TLSv1.3","769","Application Data"
"89","0.139619","192.168.123.38","192.168.123.23","TCP","66","38642  >  666 [ACK] Seq=978 Ack=2102 Win=63488 Len=0 TSval=2223718500 TSecr=131422185"
"90","0.139648","192.168.123.38","192.168.123.23","TCP","66","38642  >  666 [ACK] Seq=978 Ack=2805 Win=62848 Len=0 TSval=2223718500 TSecr=131422185"
"93","0.147514","192.168.123.33","192.168.123.23","TCP","74","33278  >  666 [SYN] Seq=0 Win=64240 Len=0 MSS=1460 SACK_PERM=1 TSval=3499726027 TSecr=0 WS=128"
"94","0.147550","192.168.123.23","192.168.123.33","TCP","74","666  >  33278 [SYN, ACK] Seq=0 Ack=1 Win=65160 Len=0 MSS=1460 SACK_PERM=1 TSval=148708595 TSecr=3499726027 WS=128"
"95","0.147579","192.168.123.33","192.168.123.23","TCP","66","33278  >  666 [ACK] Seq=1 Ack=1 Win=64256 Len=0 TSval=3499726028 TSecr=148708595"
"96","0.147874","192.168.123.33","192.168.123.23","TLSv1.3","353","Client Hello"
"97","0.147940","192.168.123.23","192.168.123.33","TCP","66","666  >  33278 [ACK] Seq=1 Ack=288 Win=64896 Len=0 TSval=148708595 TSecr=3499726028"
"98","0.149505","192.168.123.23","192.168.123.33","TLSv1.3","1464","Server Hello, Change Cipher Spec, Application Data, Application Data, Application Data, Application Data, Application Data"
"99","0.149551","192.168.123.33","192.168.123.23","TCP","66","33278  >  666 [ACK] Seq=288 Ack=1399 Win=64128 Len=0 TSval=3499726030 TSecr=148708597"
"102","0.150636","192.168.123.45","192.168.123.23","TCP","74","59762  >  666 [SYN] Seq=0 Win=64240 Len=0 MSS=1460 SACK_PERM=1 TSval=1577771076 TSecr=0 WS=128"
"103","0.150690","192.168.123.23","192.168.123.45","TCP","74","666  >  59762 [SYN, ACK] Seq=0 Ack=1 Win=65160 Len=0 MSS=1460 SACK_PERM=1 TSval=4084792131 TSecr=1577771076 WS=128"
"104","0.150734","192.168.123.45","192.168.123.23","TCP","66","59762  >  666 [ACK] Seq=1 Ack=1 Win=64256 Len=0 TSval=1577771077 TSecr=4084792131"
"105","0.151097","192.168.123.45","192.168.123.23","TLSv1.3","353","Client Hello"
"106","0.151185","192.168.123.23","192.168.123.45","TCP","66","666  >  59762 [ACK] Seq=1 Ack=288 Win=64896 Len=0 TSval=4084792131 TSecr=1577771077"
"107","0.151246","192.168.123.33","192.168.123.23","TLSv1.3","756","Change Cipher Spec, Application Data, Application Data, Application Data"
"108","0.151291","192.168.123.23","192.168.123.33","TCP","66","666  >  33278 [ACK] Seq=1399 Ack=978 Win=64256 Len=0 TSval=148708599 TSecr=3499726032"
"109","0.152150","192.168.123.23","192.168.123.33","TLSv1.3","769","Application Data"
"110","0.152184","192.168.123.33","192.168.123.23","TCP","66","33278  >  666 [ACK] Seq=978 Ack=2102 Win=64128 Len=0 TSval=3499726033 TSecr=148708599"
"111","0.152356","192.168.123.23","192.168.123.33","TLSv1.3","769","Application Data"
"112","0.152400","192.168.123.33","192.168.123.23","TCP","66","33278  >  666 [ACK] Seq=978 Ack=2805 Win=64128 Len=0 TSval=3499726033 TSecr=148708600"
"113","0.152411","192.168.123.23","192.168.123.45","TLSv1.3","1464","Server Hello, Change Cipher Spec, Application Data, Application Data, Application Data, Application Data, Application Data"
"114","0.152459","192.168.123.45","192.168.123.23","TCP","66","59762  >  666 [ACK] Seq=288 Ack=1399 Win=64128 Len=0 TSval=1577771079 TSecr=4084792133"
"115","0.156691","192.168.123.45","192.168.123.23","TLSv1.3","756","Change Cipher Spec, Application Data, Application Data, Application Data"
"116","0.156726","192.168.123.23","192.168.123.45","TCP","66","666  >  59762 [ACK] Seq=1399 Ack=978 Win=64256 Len=0 TSval=4084792137 TSecr=1577771083"
"117","0.157253","192.168.123.23","192.168.123.45","TLSv1.3","769","Application Data"
"118","0.157284","192.168.123.45","192.168.123.23","TCP","66","59762  >  666 [ACK] Seq=978 Ack=2102 Win=64128 Len=0 TSval=1577771084 TSecr=4084792138"
"119","0.157398","192.168.123.23","192.168.123.45","TLSv1.3","769","Application Data"
"120","0.157416","192.168.123.45","192.168.123.23","TCP","66","59762  >  666 [ACK] Seq=978 Ack=2805 Win=64128 Len=0 TSval=1577771084 TSecr=4084792138"
"125","0.165268","192.168.123.20","192.168.123.23","TCP","74","33052  >  666 [SYN] Seq=0 Win=64240 Len=0 MSS=1460 SACK_PERM=1 TSval=3856362693 TSecr=0 WS=128"
"126","0.165268","192.168.123.16","192.168.123.23","TCP","74","42760  >  666 [SYN] Seq=0 Win=64240 Len=0 MSS=1460 SACK_PERM=1 TSval=521380284 TSecr=0 WS=128"
"127","0.165301","192.168.123.23","192.168.123.16","TCP","74","666  >  42760 [SYN, ACK] Seq=0 Ack=1 Win=65160 Len=0 MSS=1460 SACK_PERM=1 TSval=2164824604 TSecr=521380284 WS=128"
"128","0.165302","192.168.123.23","192.168.123.20","TCP","74","666  >  33052 [SYN, ACK] Seq=0 Ack=1 Win=65160 Len=0 MSS=1460 SACK_PERM=1 TSval=756494297 TSecr=3856362693 WS=128"
"129","0.165328","192.168.123.16","192.168.123.23","TCP","66","42760  >  666 [ACK] Seq=1 Ack=1 Win=64256 Len=0 TSval=521380285 TSecr=2164824604"
"130","0.165329","192.168.123.20","192.168.123.23","TCP","66","33052  >  666 [ACK] Seq=1 Ack=1 Win=64256 Len=0 TSval=3856362694 TSecr=756494297"
"131","0.165635","192.168.123.16","192.168.123.23","TLSv1.3","353","Client Hello"
"132","0.165710","192.168.123.20","192.168.123.23","TLSv1.3","353","Client Hello"
"133","0.165722","192.168.123.23","192.168.123.16","TCP","66","666  >  42760 [ACK] Seq=1 Ack=288 Win=64896 Len=0 TSval=2164824604 TSecr=521380285"
"134","0.165783","192.168.123.23","192.168.123.20","TCP","66","666  >  33052 [ACK] Seq=1 Ack=288 Win=64896 Len=0 TSval=756494297 TSecr=3856362694"
"137","0.166430","192.168.123.4","192.168.123.23","TCP","74","36072  >  666 [SYN] Seq=0 Win=64240 Len=0 MSS=1460 SACK_PERM=1 TSval=3361480256 TSecr=0 WS=128"
"138","0.166460","192.168.123.23","192.168.123.4","TCP","74","666  >  36072 [SYN, ACK] Seq=0 Ack=1 Win=65160 Len=0 MSS=1460 SACK_PERM=1 TSval=2294730214 TSecr=3361480256 WS=128"
"139","0.166486","192.168.123.4","192.168.123.23","TCP","66","36072  >  666 [ACK] Seq=1 Ack=1 Win=64256 Len=0 TSval=3361480257 TSecr=2294730214"
"140","0.166664","192.168.123.23","192.168.123.16","TLSv1.3","1464","Server Hello, Change Cipher Spec, Application Data, Application Data, Application Data, Application Data, Application Data"
"141","0.166695","192.168.123.16","192.168.123.23","TCP","66","42760  >  666 [ACK] Seq=288 Ack=1399 Win=64128 Len=0 TSval=521380286 TSecr=2164824605"
"142","0.166772","192.168.123.4","192.168.123.23","TLSv1.3","353","Client Hello"
"143","0.166843","192.168.123.23","192.168.123.4","TCP","66","666  >  36072 [ACK] Seq=1 Ack=288 Win=64896 Len=0 TSval=2294730214 TSecr=3361480257"
"144","0.166945","192.168.123.23","192.168.123.20","TLSv1.3","1464","Server Hello, Change Cipher Spec, Application Data, Application Data, Application Data, Application Data, Application Data"
"145","0.166977","192.168.123.20","192.168.123.23","TCP","66","33052  >  666 [ACK] Seq=288 Ack=1399 Win=64128 Len=0 TSval=3856362695 TSecr=756494298"
"146","0.167871","192.168.123.23","192.168.123.4","TLSv1.3","1464","Server Hello, Change Cipher Spec, Application Data, Application Data, Application Data, Application Data, Application Data"
"147","0.167912","192.168.123.4","192.168.123.23","TCP","66","36072  >  666 [ACK] Seq=288 Ack=1399 Win=64128 Len=0 TSval=3361480258 TSecr=2294730215"
"148","0.169447","192.168.123.16","192.168.123.23","TLSv1.3","756","Change Cipher Spec, Application Data, Application Data, Application Data"
"149","0.169483","192.168.123.23","192.168.123.16","TCP","66","666  >  42760 [ACK] Seq=1399 Ack=978 Win=64256 Len=0 TSval=2164824608 TSecr=521380289"
"150","0.169960","192.168.123.23","192.168.123.16","TLSv1.3","769","Application Data"
"152","0.169989","192.168.123.16","192.168.123.23","TCP","66","42760  >  666 [ACK] Seq=978 Ack=2102 Win=64128 Len=0 TSval=521380289 TSecr=2164824608"
"153","0.170104","192.168.123.23","192.168.123.16","TLSv1.3","769","Application Data"
"154","0.170124","192.168.123.16","192.168.123.23","TCP","66","42760  >  666 [ACK] Seq=978 Ack=2805 Win=64128 Len=0 TSval=521380289 TSecr=2164824608"
"156","0.170183","192.168.123.2","192.168.123.23","TCP","74","34312  >  666 [SYN] Seq=0 Win=64240 Len=0 MSS=1460 SACK_PERM=1 TSval=4094980594 TSecr=0 WS=128"
"157","0.170211","192.168.123.23","192.168.123.2","TCP","74","666  >  34312 [SYN, ACK] Seq=0 Ack=1 Win=65160 Len=0 MSS=1460 SACK_PERM=1 TSval=17001817 TSecr=4094980594 WS=128"
"158","0.170237","192.168.123.2","192.168.123.23","TCP","66","34312  >  666 [ACK] Seq=1 Ack=1 Win=64256 Len=0 TSval=4094980595 TSecr=17001817"
"159","0.170456","192.168.123.2","192.168.123.23","TLSv1.3","353","Client Hello"
"160","0.170510","192.168.123.23","192.168.123.2","TCP","66","666  >  34312 [ACK] Seq=1 Ack=288 Win=64896 Len=0 TSval=17001817 TSecr=4094980595"
"161","0.171054","192.168.123.20","192.168.123.23","TLSv1.3","756","Change Cipher Spec, Application Data, Application Data, Application Data"
"162","0.171082","192.168.123.23","192.168.123.20","TCP","66","666  >  33052 [ACK] Seq=1399 Ack=978 Win=64256 Len=0 TSval=756494302 TSecr=3856362699"
"163","0.171486","192.168.123.23","192.168.123.20","TLSv1.3","769","Application Data"
"164","0.171594","192.168.123.23","192.168.123.20","TLSv1.3","769","Application Data"
"165","0.171699","192.168.123.20","192.168.123.23","TCP","66","33052  >  666 [ACK] Seq=978 Ack=2102 Win=63488 Len=0 TSval=3856362700 TSecr=756494303"
"166","0.171722","192.168.123.20","192.168.123.23","TCP","66","33052  >  666 [ACK] Seq=978 Ack=2805 Win=62848 Len=0 TSval=3856362700 TSecr=756494303"
"167","0.171734","192.168.123.23","192.168.123.2","TLSv1.3","1464","Server Hello, Change Cipher Spec, Application Data, Application Data, Application Data, Application Data, Application Data"
"168","0.171779","192.168.123.2","192.168.123.23","TCP","66","34312  >  666 [ACK] Seq=288 Ack=1399 Win=64128 Len=0 TSval=4094980596 TSecr=17001818"
"169","0.172130","192.168.123.4","192.168.123.23","TLSv1.3","756","Change Cipher Spec, Application Data, Application Data, Application Data"
"170","0.172172","192.168.123.23","192.168.123.4","TCP","66","666  >  36072 [ACK] Seq=1399 Ack=978 Win=64256 Len=0 TSval=2294730219 TSecr=3361480262"
"171","0.172743","192.168.123.23","192.168.123.4","TLSv1.3","769","Application Data"
"172","0.172862","192.168.123.23","192.168.123.4","TLSv1.3","769","Application Data"
"173","0.172967","192.168.123.4","192.168.123.23","TCP","66","36072  >  666 [ACK] Seq=978 Ack=2102 Win=63488 Len=0 TSval=3361480263 TSecr=2294730220"
"174","0.172994","192.168.123.4","192.168.123.23","TCP","66","36072  >  666 [ACK] Seq=978 Ack=2805 Win=62848 Len=0 TSval=3361480263 TSecr=2294730220"
"175","0.176468","192.168.123.2","192.168.123.23","TLSv1.3","756","Change Cipher Spec, Application Data, Application Data, Application Data"
"176","0.176496","192.168.123.23","192.168.123.2","TCP","66","666  >  34312 [ACK] Seq=1399 Ack=978 Win=64256 Len=0 TSval=17001823 TSecr=4094980601"
"177","0.176888","192.168.123.23","192.168.123.2","TLSv1.3","769","Application Data"
"178","0.176985","192.168.123.23","192.168.123.2","TLSv1.3","769","Application Data"
"179","0.177052","192.168.123.2","192.168.123.23","TCP","66","34312  >  666 [ACK] Seq=978 Ack=2102 Win=63488 Len=0 TSval=4094980601 TSecr=17001823"
"180","0.177072","192.168.123.2","192.168.123.23","TCP","66","34312  >  666 [ACK] Seq=978 Ack=2805 Win=62848 Len=0 TSval=4094980601 TSecr=17001823"
"183","0.179454","192.168.123.29","192.168.123.23","TCP","74","45148  >  666 [SYN] Seq=0 Win=64240 Len=0 MSS=1460 SACK_PERM=1 TSval=1833134570 TSecr=0 WS=128"
"184","0.179497","192.168.123.23","192.168.123.29","TCP","74","666  >  45148 [SYN, ACK] Seq=0 Ack=1 Win=65160 Len=0 MSS=1460 SACK_PERM=1 TSval=3025581936 TSecr=1833134570 WS=128"
"185","0.179521","192.168.123.29","192.168.123.23","TCP","66","45148  >  666 [ACK] Seq=1 Ack=1 Win=64256 Len=0 TSval=1833134571 TSecr=3025581936"
"186","0.179736","192.168.123.29","192.168.123.23","TLSv1.3","353","Client Hello"
"187","0.179811","192.168.123.23","192.168.123.29","TCP","66","666  >  45148 [ACK] Seq=1 Ack=288 Win=64896 Len=0 TSval=3025581936 TSecr=1833134571"
"188","0.180632","192.168.123.23","192.168.123.29","TLSv1.3","1464","Server Hello, Change Cipher Spec, Application Data, Application Data, Application Data, Application Data, Application Data"
"189","0.180677","192.168.123.29","192.168.123.23","TCP","66","45148  >  666 [ACK] Seq=288 Ack=1399 Win=64128 Len=0 TSval=1833134572 TSecr=3025581937"
"190","0.182547","192.168.123.29","192.168.123.23","TLSv1.3","756","Change Cipher Spec, Application Data, Application Data, Application Data"
"191","0.182576","192.168.123.23","192.168.123.29","TCP","66","666  >  45148 [ACK] Seq=1399 Ack=978 Win=64256 Len=0 TSval=3025581939 TSecr=1833134574"
"192","0.183193","192.168.123.23","192.168.123.29","TLSv1.3","769","Application Data"
"193","0.183221","192.168.123.29","192.168.123.23","TCP","66","45148  >  666 [ACK] Seq=978 Ack=2102 Win=64128 Len=0 TSval=1833134575 TSecr=3025581940"
"194","0.183333","192.168.123.23","192.168.123.29","TLSv1.3","769","Application Data"
"195","0.183353","192.168.123.29","192.168.123.23","TCP","66","45148  >  666 [ACK] Seq=978 Ack=2805 Win=64128 Len=0 TSval=1833134575 TSecr=3025581940"
"198","0.192780","192.168.123.25","192.168.123.23","TCP","74","50820  >  666 [SYN] Seq=0 Win=64240 Len=0 MSS=1460 SACK_PERM=1 TSval=3541525319 TSecr=0 WS=128"
"199","0.192816","192.168.123.23","192.168.123.25","TCP","74","666  >  50820 [SYN, ACK] Seq=0 Ack=1 Win=65160 Len=0 MSS=1460 SACK_PERM=1 TSval=3448966596 TSecr=3541525319 WS=128"
"200","0.192845","192.168.123.25","192.168.123.23","TCP","66","50820  >  666 [ACK] Seq=1 Ack=1 Win=64256 Len=0 TSval=3541525320 TSecr=3448966596"
"201","0.193111","192.168.123.25","192.168.123.23","TLSv1.3","353","Client Hello"
"202","0.193187","192.168.123.23","192.168.123.25","TCP","66","666  >  50820 [ACK] Seq=1 Ack=288 Win=64896 Len=0 TSval=3448966596 TSecr=3541525320"
"203","0.194231","192.168.123.23","192.168.123.25","TLSv1.3","1464","Server Hello, Change Cipher Spec, Application Data, Application Data, Application Data, Application Data, Application Data"
"204","0.194260","192.168.123.25","192.168.123.23","TCP","66","50820  >  666 [ACK] Seq=288 Ack=1399 Win=64128 Len=0 TSval=3541525322 TSecr=3448966598"
"205","0.195502","192.168.123.25","192.168.123.23","TLSv1.3","756","Change Cipher Spec, Application Data, Application Data, Application Data"
"206","0.195544","192.168.123.23","192.168.123.25","TCP","66","666  >  50820 [ACK] Seq=1399 Ack=978 Win=64256 Len=0 TSval=3448966599 TSecr=3541525323"
"207","0.196381","192.168.123.23","192.168.123.25","TLSv1.3","769","Application Data"
"208","0.196434","192.168.123.25","192.168.123.23","TCP","66","50820  >  666 [ACK] Seq=978 Ack=2102 Win=64128 Len=0 TSval=3541525324 TSecr=3448966600"
"209","0.196627","192.168.123.23","192.168.123.25","TLSv1.3","769","Application Data"
"210","0.196658","192.168.123.25","192.168.123.23","TCP","66","50820  >  666 [ACK] Seq=978 Ack=2805 Win=64128 Len=0 TSval=3541525324 TSecr=3448966600"
"213","0.202461","192.168.123.13","192.168.123.23","TCP","74","57678  >  666 [SYN] Seq=0 Win=64240 Len=0 MSS=1460 SACK_PERM=1 TSval=3137682306 TSecr=0 WS=128"
"214","0.202495","192.168.123.23","192.168.123.13","TCP","74","666  >  57678 [SYN, ACK] Seq=0 Ack=1 Win=65160 Len=0 MSS=1460 SACK_PERM=1 TSval=4037762677 TSecr=3137682306 WS=128"
"215","0.202540","192.168.123.13","192.168.123.23","TCP","66","57678  >  666 [ACK] Seq=1 Ack=1 Win=64256 Len=0 TSval=3137682307 TSecr=4037762677"
"216","0.202897","192.168.123.13","192.168.123.23","TLSv1.3","353","Client Hello"
"217","0.202970","192.168.123.23","192.168.123.13","TCP","66","666  >  57678 [ACK] Seq=1 Ack=288 Win=64896 Len=0 TSval=4037762677 TSecr=3137682307"
"218","0.203891","192.168.123.23","192.168.123.13","TLSv1.3","1464","Server Hello, Change Cipher Spec, Application Data, Application Data, Application Data, Application Data, Application Data"
"219","0.203942","192.168.123.13","192.168.123.23","TCP","66","57678  >  666 [ACK] Seq=288 Ack=1399 Win=64128 Len=0 TSval=3137682308 TSecr=4037762678"
"222","0.205053","192.168.123.37","192.168.123.23","TCP","74","48094  >  666 [SYN] Seq=0 Win=64240 Len=0 MSS=1460 SACK_PERM=1 TSval=266166553 TSecr=0 WS=128"
"223","0.205101","192.168.123.23","192.168.123.37","TCP","74","666  >  48094 [SYN, ACK] Seq=0 Ack=1 Win=65160 Len=0 MSS=1460 SACK_PERM=1 TSval=4243523030 TSecr=266166553 WS=128"
"224","0.205141","192.168.123.37","192.168.123.23","TCP","66","48094  >  666 [ACK] Seq=1 Ack=1 Win=64256 Len=0 TSval=266166553 TSecr=4243523030"
"225","0.205528","192.168.123.37","192.168.123.23","TLSv1.3","353","Client Hello"
"226","0.205636","192.168.123.23","192.168.123.37","TCP","66","666  >  48094 [ACK] Seq=1 Ack=288 Win=64896 Len=0 TSval=4243523031 TSecr=266166554"
"227","0.206719","192.168.123.23","192.168.123.37","TLSv1.3","1464","Server Hello, Change Cipher Spec, Application Data, Application Data, Application Data, Application Data, Application Data"
"228","0.206750","192.168.123.13","192.168.123.23","TLSv1.3","756","Change Cipher Spec, Application Data, Application Data, Application Data"
"229","0.206761","192.168.123.37","192.168.123.23","TCP","66","48094  >  666 [ACK] Seq=288 Ack=1399 Win=64128 Len=0 TSval=266166555 TSecr=4243523032"
"230","0.206792","192.168.123.23","192.168.123.13","TCP","66","666  >  57678 [ACK] Seq=1399 Ack=978 Win=64256 Len=0 TSval=4037762681 TSecr=3137682311"
"231","0.207427","192.168.123.23","192.168.123.13","TLSv1.3","769","Application Data"
"232","0.207461","192.168.123.13","192.168.123.23","TCP","66","57678  >  666 [ACK] Seq=978 Ack=2102 Win=64128 Len=0 TSval=3137682312 TSecr=4037762682"
"233","0.207583","192.168.123.23","192.168.123.13","TLSv1.3","769","Application Data"
"234","0.207602","192.168.123.13","192.168.123.23","TCP","66","57678  >  666 [ACK] Seq=978 Ack=2805 Win=64128 Len=0 TSval=3137682312 TSecr=4037762682"
"237","0.210145","192.168.123.42","192.168.123.23","TCP","74","57358  >  666 [SYN] Seq=0 Win=64240 Len=0 MSS=1460 SACK_PERM=1 TSval=3496168640 TSecr=0 WS=128"
"238","0.210177","192.168.123.23","192.168.123.42","TCP","74","666  >  57358 [SYN, ACK] Seq=0 Ack=1 Win=65160 Len=0 MSS=1460 SACK_PERM=1 TSval=1086824103 TSecr=3496168640 WS=128"
"239","0.210204","192.168.123.42","192.168.123.23","TCP","66","57358  >  666 [ACK] Seq=1 Ack=1 Win=64256 Len=0 TSval=3496168641 TSecr=1086824103"
"240","0.210434","192.168.123.42","192.168.123.23","TLSv1.3","353","Client Hello"
"241","0.210491","192.168.123.23","192.168.123.42","TCP","66","666  >  57358 [ACK] Seq=1 Ack=288 Win=64896 Len=0 TSval=1086824103 TSecr=3496168641"
"242","0.210552","192.168.123.37","192.168.123.23","TLSv1.3","756","Change Cipher Spec, Application Data, Application Data, Application Data"
"243","0.210584","192.168.123.23","192.168.123.37","TCP","66","666  >  48094 [ACK] Seq=1399 Ack=978 Win=64256 Len=0 TSval=4243523036 TSecr=266166559"
"244","0.211238","192.168.123.23","192.168.123.37","TLSv1.3","769","Application Data"
"245","0.211268","192.168.123.37","192.168.123.23","TCP","66","48094  >  666 [ACK] Seq=978 Ack=2102 Win=64128 Len=0 TSval=266166560 TSecr=4243523037"
"246","0.211434","192.168.123.23","192.168.123.37","TLSv1.3","769","Application Data"
"247","0.211462","192.168.123.37","192.168.123.23","TCP","66","48094  >  666 [ACK] Seq=978 Ack=2805 Win=64128 Len=0 TSval=266166560 TSecr=4243523037"
"248","0.211549","192.168.123.23","192.168.123.42","TLSv1.3","1464","Server Hello, Change Cipher Spec, Application Data, Application Data, Application Data, Application Data, Application Data"
"249","0.211592","192.168.123.42","192.168.123.23","TCP","66","57358  >  666 [ACK] Seq=288 Ack=1399 Win=64128 Len=0 TSval=3496168642 TSecr=1086824104"
"250","0.213103","192.168.123.42","192.168.123.23","TLSv1.3","756","Change Cipher Spec, Application Data, Application Data, Application Data"
"251","0.213167","192.168.123.23","192.168.123.42","TCP","66","666  >  57358 [ACK] Seq=1399 Ack=978 Win=64256 Len=0 TSval=1086824105 TSecr=3496168643"
"253","0.214231","192.168.123.23","192.168.123.42","TLSv1.3","769","Application Data"
"254","0.214279","192.168.123.42","192.168.123.23","TCP","66","57358  >  666 [ACK] Seq=978 Ack=2102 Win=64128 Len=0 TSval=3496168645 TSecr=1086824107"
"255","0.214484","192.168.123.23","192.168.123.42","TLSv1.3","769","Application Data"
"257","0.214515","192.168.123.42","192.168.123.23","TCP","66","57358  >  666 [ACK] Seq=978 Ack=2805 Win=64128 Len=0 TSval=3496168645 TSecr=1086824107"
"258","0.214563","192.168.123.41","192.168.123.23","TCP","74","60854  >  666 [SYN] Seq=0 Win=64240 Len=0 MSS=1460 SACK_PERM=1 TSval=1072229889 TSecr=0 WS=128"
"259","0.214615","192.168.123.23","192.168.123.41","TCP","74","666  >  60854 [SYN, ACK] Seq=0 Ack=1 Win=65160 Len=0 MSS=1460 SACK_PERM=1 TSval=845373786 TSecr=1072229889 WS=128"
"260","0.214659","192.168.123.41","192.168.123.23","TCP","66","60854  >  666 [ACK] Seq=1 Ack=1 Win=64256 Len=0 TSval=1072229890 TSecr=845373786"
"261","0.215029","192.168.123.41","192.168.123.23","TLSv1.3","353","Client Hello"
"262","0.215122","192.168.123.23","192.168.123.41","TCP","66","666  >  60854 [ACK] Seq=1 Ack=288 Win=64896 Len=0 TSval=845373786 TSecr=1072229890"
"263","0.216882","192.168.123.23","192.168.123.41","TLSv1.3","1464","Server Hello, Change Cipher Spec, Application Data, Application Data, Application Data, Application Data, Application Data"
"264","0.216950","192.168.123.41","192.168.123.23","TCP","66","60854  >  666 [ACK] Seq=288 Ack=1399 Win=64128 Len=0 TSval=1072229892 TSecr=845373788"
"265","0.218345","192.168.123.41","192.168.123.23","TLSv1.3","756","Change Cipher Spec, Application Data, Application Data, Application Data"
"266","0.218376","192.168.123.23","192.168.123.41","TCP","66","666  >  60854 [ACK] Seq=1399 Ack=978 Win=64256 Len=0 TSval=845373790 TSecr=1072229894"
"267","0.219308","192.168.123.23","192.168.123.41","TLSv1.3","769","Application Data"
"268","0.219367","192.168.123.41","192.168.123.23","TCP","66","60854  >  666 [ACK] Seq=978 Ack=2102 Win=64128 Len=0 TSval=1072229895 TSecr=845373791"
"269","0.219571","192.168.123.23","192.168.123.41","TLSv1.3","769","Application Data"
"270","0.219601","192.168.123.41","192.168.123.23","TCP","66","60854  >  666 [ACK] Seq=978 Ack=2805 Win=64128 Len=0 TSval=1072229895 TSecr=845373791"
"274","0.222600","192.168.123.6","192.168.123.23","TCP","74","54352  >  666 [SYN] Seq=0 Win=64240 Len=0 MSS=1460 SACK_PERM=1 TSval=4285870038 TSecr=0 WS=128"
"276","0.222632","192.168.123.39","192.168.123.23","TCP","74","38534  >  666 [SYN] Seq=0 Win=64240 Len=0 MSS=1460 SACK_PERM=1 TSval=3663868004 TSecr=0 WS=128"
"277","0.222648","192.168.123.23","192.168.123.6","TCP","74","666  >  54352 [SYN, ACK] Seq=0 Ack=1 Win=65160 Len=0 MSS=1460 SACK_PERM=1 TSval=2299422798 TSecr=4285870038 WS=128"
"278","0.222661","192.168.123.23","192.168.123.39","TCP","74","666  >  38534 [SYN, ACK] Seq=0 Ack=1 Win=65160 Len=0 MSS=1460 SACK_PERM=1 TSval=3973074120 TSecr=3663868004 WS=128"
"279","0.222687","192.168.123.6","192.168.123.23","TCP","66","54352  >  666 [ACK] Seq=1 Ack=1 Win=64256 Len=0 TSval=4285870039 TSecr=2299422798"
"280","0.222688","192.168.123.39","192.168.123.23","TCP","66","38534  >  666 [ACK] Seq=1 Ack=1 Win=64256 Len=0 TSval=3663868004 TSecr=3973074120"
"281","0.222950","192.168.123.39","192.168.123.23","TLSv1.3","353","Client Hello"
"282","0.223019","192.168.123.23","192.168.123.39","TCP","66","666  >  38534 [ACK] Seq=1 Ack=288 Win=64896 Len=0 TSval=3973074120 TSecr=3663868004"
"283","0.223037","192.168.123.6","192.168.123.23","TLSv1.3","353","Client Hello"
"284","0.223108","192.168.123.23","192.168.123.6","TCP","66","666  >  54352 [ACK] Seq=1 Ack=288 Win=64896 Len=0 TSval=2299422798 TSecr=4285870039"
"285","0.223911","192.168.123.23","192.168.123.6","TLSv1.3","1464","Server Hello, Change Cipher Spec, Application Data, Application Data, Application Data, Application Data, Application Data"
"286","0.223950","192.168.123.6","192.168.123.23","TCP","66","54352  >  666 [ACK] Seq=288 Ack=1399 Win=64128 Len=0 TSval=4285870040 TSecr=2299422799"
"287","0.224150","192.168.123.23","192.168.123.39","TLSv1.3","1464","Server Hello, Change Cipher Spec, Application Data, Application Data, Application Data, Application Data, Application Data"
"288","0.224194","192.168.123.39","192.168.123.23","TCP","66","38534  >  666 [ACK] Seq=288 Ack=1399 Win=64128 Len=0 TSval=3663868006 TSecr=3973074121"
"289","0.226181","192.168.123.39","192.168.123.23","TLSv1.3","756","Change Cipher Spec, Application Data, Application Data, Application Data"
"290","0.226228","192.168.123.23","192.168.123.39","TCP","66","666  >  38534 [ACK] Seq=1399 Ack=978 Win=64256 Len=0 TSval=3973074124 TSecr=3663868007"
"291","0.226744","192.168.123.23","192.168.123.39","TLSv1.3","769","Application Data"
"292","0.226776","192.168.123.39","192.168.123.23","TCP","66","38534  >  666 [ACK] Seq=978 Ack=2102 Win=64128 Len=0 TSval=3663868008 TSecr=3973074124"
"295","0.226908","192.168.123.23","192.168.123.39","TLSv1.3","769","Application Data"
"296","0.226925","192.168.123.39","192.168.123.23","TCP","66","38534  >  666 [ACK] Seq=978 Ack=2805 Win=64128 Len=0 TSval=3663868008 TSecr=3973074124"
"299","0.227132","192.168.123.14","192.168.123.23","TCP","74","57056  >  666 [SYN] Seq=0 Win=64240 Len=0 MSS=1460 SACK_PERM=1 TSval=2115494074 TSecr=0 WS=128"
"300","0.227132","192.168.123.21","192.168.123.23","TCP","74","56716  >  666 [SYN] Seq=0 Win=64240 Len=0 MSS=1460 SACK_PERM=1 TSval=1735859676 TSecr=0 WS=128"
"301","0.227172","192.168.123.23","192.168.123.14","TCP","74","666  >  57056 [SYN, ACK] Seq=0 Ack=1 Win=65160 Len=0 MSS=1460 SACK_PERM=1 TSval=595913630 TSecr=2115494074 WS=128"
"302","0.227172","192.168.123.23","192.168.123.21","TCP","74","666  >  56716 [SYN, ACK] Seq=0 Ack=1 Win=65160 Len=0 MSS=1460 SACK_PERM=1 TSval=3590957562 TSecr=1735859676 WS=128"
"303","0.227207","192.168.123.21","192.168.123.23","TCP","66","56716  >  666 [ACK] Seq=1 Ack=1 Win=64256 Len=0 TSval=1735859677 TSecr=3590957562"
"304","0.227207","192.168.123.14","192.168.123.23","TCP","66","57056  >  666 [ACK] Seq=1 Ack=1 Win=64256 Len=0 TSval=2115494075 TSecr=595913630"
"305","0.227380","192.168.123.6","192.168.123.23","TLSv1.3","756","Change Cipher Spec, Application Data, Application Data, Application Data"
"306","0.227425","192.168.123.23","192.168.123.6","TCP","66","666  >  54352 [ACK] Seq=1399 Ack=978 Win=64256 Len=0 TSval=2299422803 TSecr=4285870044"
"307","0.227532","192.168.123.21","192.168.123.23","TLSv1.3","353","Client Hello"
"308","0.227532","192.168.123.14","192.168.123.23","TLSv1.3","353","Client Hello"
"309","0.227616","192.168.123.23","192.168.123.21","TCP","66","666  >  56716 [ACK] Seq=1 Ack=288 Win=64896 Len=0 TSval=3590957562 TSecr=1735859677"
"310","0.227616","192.168.123.23","192.168.123.14","TCP","66","666  >  57056 [ACK] Seq=1 Ack=288 Win=64896 Len=0 TSval=595913630 TSecr=2115494075"
"311","0.228027","192.168.123.23","192.168.123.6","TLSv1.3","769","Application Data"
"312","0.228078","192.168.123.6","192.168.123.23","TCP","66","54352  >  666 [ACK] Seq=978 Ack=2102 Win=64128 Len=0 TSval=4285870044 TSecr=2299422803"
"313","0.228246","192.168.123.23","192.168.123.6","TLSv1.3","769","Application Data"
"314","0.228272","192.168.123.6","192.168.123.23","TCP","66","54352  >  666 [ACK] Seq=978 Ack=2805 Win=64128 Len=0 TSval=4285870045 TSecr=2299422804"
"315","0.228738","192.168.123.23","192.168.123.14","TLSv1.3","1464","Server Hello, Change Cipher Spec, Application Data, Application Data, Application Data, Application Data, Application Data"
"316","0.228789","192.168.123.14","192.168.123.23","TCP","66","57056  >  666 [ACK] Seq=288 Ack=1399 Win=64128 Len=0 TSval=2115494076 TSecr=595913631"
"317","0.228830","192.168.123.23","192.168.123.21","TLSv1.3","1464","Server Hello, Change Cipher Spec, Application Data, Application Data, Application Data, Application Data, Application Data"
"318","0.228876","192.168.123.21","192.168.123.23","TCP","66","56716  >  666 [ACK] Seq=288 Ack=1399 Win=64128 Len=0 TSval=1735859678 TSecr=3590957563"
"319","0.230626","192.168.123.14","192.168.123.23","TLSv1.3","756","Change Cipher Spec, Application Data, Application Data, Application Data"
"320","0.230654","192.168.123.23","192.168.123.14","TCP","66","666  >  57056 [ACK] Seq=1399 Ack=978 Win=64256 Len=0 TSval=595913633 TSecr=2115494078"
"321","0.231059","192.168.123.21","192.168.123.23","TLSv1.3","756","Change Cipher Spec, Application Data, Application Data, Application Data"
"322","0.231088","192.168.123.23","192.168.123.21","TCP","66","666  >  56716 [ACK] Seq=1399 Ack=978 Win=64256 Len=0 TSval=3590957565 TSecr=1735859680"
"323","0.231192","192.168.123.23","192.168.123.14","TLSv1.3","769","Application Data"
"324","0.231220","192.168.123.14","192.168.123.23","TCP","66","57056  >  666 [ACK] Seq=978 Ack=2102 Win=64128 Len=0 TSval=2115494079 TSecr=595913634"
"325","0.231330","192.168.123.23","192.168.123.14","TLSv1.3","769","Application Data"
"326","0.231349","192.168.123.14","192.168.123.23","TCP","66","57056  >  666 [ACK] Seq=978 Ack=2805 Win=64128 Len=0 TSval=2115494079 TSecr=595913634"
"327","0.231686","192.168.123.23","192.168.123.21","TLSv1.3","769","Application Data"
"328","0.231713","192.168.123.21","192.168.123.23","TCP","66","56716  >  666 [ACK] Seq=978 Ack=2102 Win=64128 Len=0 TSval=1735859681 TSecr=3590957566"
"329","0.231823","192.168.123.23","192.168.123.21","TLSv1.3","769","Application Data"
"330","0.231841","192.168.123.21","192.168.123.23","TCP","66","56716  >  666 [ACK] Seq=978 Ack=2805 Win=64128 Len=0 TSval=1735859681 TSecr=3590957566"
"333","0.233208","192.168.123.12","192.168.123.23","TCP","74","51950  >  666 [SYN] Seq=0 Win=64240 Len=0 MSS=1460 SACK_PERM=1 TSval=4046090349 TSecr=0 WS=128"
"334","0.233240","192.168.123.23","192.168.123.12","TCP","74","666  >  51950 [SYN, ACK] Seq=0 Ack=1 Win=65160 Len=0 MSS=1460 SACK_PERM=1 TSval=3713494662 TSecr=4046090349 WS=128"
"335","0.233267","192.168.123.12","192.168.123.23","TCP","66","51950  >  666 [ACK] Seq=1 Ack=1 Win=64256 Len=0 TSval=4046090350 TSecr=3713494662"
"336","0.233508","192.168.123.12","192.168.123.23","TLSv1.3","353","Client Hello"
"337","0.233586","192.168.123.23","192.168.123.12","TCP","66","666  >  51950 [ACK] Seq=1 Ack=288 Win=64896 Len=0 TSval=3713494662 TSecr=4046090350"
"340","0.234057","192.168.123.26","192.168.123.23","TCP","74","57260  >  666 [SYN] Seq=0 Win=64240 Len=0 MSS=1460 SACK_PERM=1 TSval=3223725962 TSecr=0 WS=128"
"341","0.234101","192.168.123.23","192.168.123.26","TCP","74","666  >  57260 [SYN, ACK] Seq=0 Ack=1 Win=65160 Len=0 MSS=1460 SACK_PERM=1 TSval=1028130437 TSecr=3223725962 WS=128"
"342","0.234152","192.168.123.26","192.168.123.23","TCP","66","57260  >  666 [ACK] Seq=1 Ack=1 Win=64256 Len=0 TSval=3223725962 TSecr=1028130437"
"343","0.234432","192.168.123.26","192.168.123.23","TLSv1.3","353","Client Hello"
"344","0.234494","192.168.123.23","192.168.123.26","TCP","66","666  >  57260 [ACK] Seq=1 Ack=288 Win=64896 Len=0 TSval=1028130438 TSecr=3223725963"
"345","0.234521","192.168.123.23","192.168.123.12","TLSv1.3","1464","Server Hello, Change Cipher Spec, Application Data, Application Data, Application Data, Application Data, Application Data"
"346","0.234566","192.168.123.12","192.168.123.23","TCP","66","51950  >  666 [ACK] Seq=288 Ack=1399 Win=64128 Len=0 TSval=4046090351 TSecr=3713494663"
"347","0.235397","192.168.123.23","192.168.123.26","TLSv1.3","1464","Server Hello, Change Cipher Spec, Application Data, Application Data, Application Data, Application Data, Application Data"
"348","0.235428","192.168.123.26","192.168.123.23","TCP","66","57260  >  666 [ACK] Seq=288 Ack=1399 Win=64128 Len=0 TSval=3223725964 TSecr=1028130439"
"349","0.238247","192.168.123.26","192.168.123.23","TLSv1.3","756","Change Cipher Spec, Application Data, Application Data, Application Data"
"350","0.238273","192.168.123.23","192.168.123.26","TCP","66","666  >  57260 [ACK] Seq=1399 Ack=978 Win=64256 Len=0 TSval=1028130442 TSecr=3223725967"
"351","0.238639","192.168.123.12","192.168.123.23","TLSv1.3","756","Change Cipher Spec, Application Data, Application Data, Application Data"
"352","0.238697","192.168.123.23","192.168.123.26","TLSv1.3","769","Application Data"
"353","0.238698","192.168.123.23","192.168.123.12","TCP","66","666  >  51950 [ACK] Seq=1399 Ack=978 Win=64256 Len=0 TSval=3713494667 TSecr=4046090355"
"354","0.238818","192.168.123.23","192.168.123.26","TLSv1.3","769","Application Data"
"355","0.238831","192.168.123.26","192.168.123.23","TCP","66","57260  >  666 [ACK] Seq=978 Ack=2102 Win=63488 Len=0 TSval=3223725967 TSecr=1028130442"
"356","0.238855","192.168.123.26","192.168.123.23","TCP","66","57260  >  666 [ACK] Seq=978 Ack=2805 Win=62848 Len=0 TSval=3223725967 TSecr=1028130442"
"357","0.239242","192.168.123.23","192.168.123.12","TLSv1.3","769","Application Data"
"358","0.239344","192.168.123.23","192.168.123.12","TLSv1.3","769","Application Data"
"359","0.239386","192.168.123.12","192.168.123.23","TCP","66","51950  >  666 [ACK] Seq=978 Ack=2102 Win=63488 Len=0 TSval=4046090356 TSecr=3713494668"
"360","0.239408","192.168.123.12","192.168.123.23","TCP","66","51950  >  666 [ACK] Seq=978 Ack=2805 Win=62848 Len=0 TSval=4046090356 TSecr=3713494668"
"363","0.241495","192.168.123.3","192.168.123.23","TCP","74","60470  >  666 [SYN] Seq=0 Win=64240 Len=0 MSS=1460 SACK_PERM=1 TSval=3753374681 TSecr=0 WS=128"
"364","0.241525","192.168.123.23","192.168.123.3","TCP","74","666  >  60470 [SYN, ACK] Seq=0 Ack=1 Win=65160 Len=0 MSS=1460 SACK_PERM=1 TSval=3593608908 TSecr=3753374681 WS=128"
"365","0.241552","192.168.123.3","192.168.123.23","TCP","66","60470  >  666 [ACK] Seq=1 Ack=1 Win=64256 Len=0 TSval=3753374682 TSecr=3593608908"
"366","0.241827","192.168.123.3","192.168.123.23","TLSv1.3","353","Client Hello"
"367","0.241889","192.168.123.23","192.168.123.3","TCP","66","666  >  60470 [ACK] Seq=1 Ack=288 Win=64896 Len=0 TSval=3593608908 TSecr=3753374682"
"368","0.242750","192.168.123.23","192.168.123.3","TLSv1.3","1464","Server Hello, Change Cipher Spec, Application Data, Application Data, Application Data, Application Data, Application Data"
"369","0.242776","192.168.123.3","192.168.123.23","TCP","66","60470  >  666 [ACK] Seq=288 Ack=1399 Win=64128 Len=0 TSval=3753374683 TSecr=3593608909"
"370","0.244412","192.168.123.3","192.168.123.23","TLSv1.3","756","Change Cipher Spec, Application Data, Application Data, Application Data"
"371","0.244439","192.168.123.23","192.168.123.3","TCP","66","666  >  60470 [ACK] Seq=1399 Ack=978 Win=64256 Len=0 TSval=3593608911 TSecr=3753374685"
"372","0.244859","192.168.123.23","192.168.123.3","TLSv1.3","769","Application Data"
"373","0.244961","192.168.123.23","192.168.123.3","TLSv1.3","769","Application Data"
"374","0.245049","192.168.123.3","192.168.123.23","TCP","66","60470  >  666 [ACK] Seq=978 Ack=2102 Win=63488 Len=0 TSval=3753374685 TSecr=3593608911"
"375","0.245071","192.168.123.3","192.168.123.23","TCP","66","60470  >  666 [ACK] Seq=978 Ack=2805 Win=62848 Len=0 TSval=3753374685 TSecr=3593608911"
"378","0.939328","192.168.123.34","192.168.123.23","TCP","74","56554  >  666 [SYN] Seq=0 Win=64240 Len=0 MSS=1460 SACK_PERM=1 TSval=3318830463 TSecr=0 WS=128"
"379","0.939361","192.168.123.23","192.168.123.34","TCP","74","666  >  56554 [SYN, ACK] Seq=0 Ack=1 Win=65160 Len=0 MSS=1460 SACK_PERM=1 TSval=3578021798 TSecr=3318830463 WS=128"
"380","0.939388","192.168.123.34","192.168.123.23","TCP","66","56554  >  666 [ACK] Seq=1 Ack=1 Win=64256 Len=0 TSval=3318830464 TSecr=3578021798"
"381","0.939627","192.168.123.34","192.168.123.23","TLSv1.3","353","Client Hello"
"382","0.939699","192.168.123.23","192.168.123.34","TCP","66","666  >  56554 [ACK] Seq=1 Ack=288 Win=64896 Len=0 TSval=3578021798 TSecr=3318830464"
"383","0.940551","192.168.123.23","192.168.123.34","TLSv1.3","1464","Server Hello, Change Cipher Spec, Application Data, Application Data, Application Data, Application Data, Application Data"
"384","0.940582","192.168.123.34","192.168.123.23","TCP","66","56554  >  666 [ACK] Seq=288 Ack=1399 Win=64128 Len=0 TSval=3318830465 TSecr=3578021799"
"385","0.943857","192.168.123.34","192.168.123.23","TLSv1.3","756","Change Cipher Spec, Application Data, Application Data, Application Data"
"386","0.943895","192.168.123.23","192.168.123.34","TCP","66","666  >  56554 [ACK] Seq=1399 Ack=978 Win=64256 Len=0 TSval=3578021802 TSecr=3318830468"
"387","0.944630","192.168.123.23","192.168.123.34","TLSv1.3","769","Application Data"
"388","0.944660","192.168.123.34","192.168.123.23","TCP","66","56554  >  666 [ACK] Seq=978 Ack=2102 Win=64128 Len=0 TSval=3318830469 TSecr=3578021803"
"389","0.944775","192.168.123.23","192.168.123.34","TLSv1.3","769","Application Data"
"390","0.944795","192.168.123.34","192.168.123.23","TCP","66","56554  >  666 [ACK] Seq=978 Ack=2805 Win=64128 Len=0 TSval=3318830469 TSecr=3578021803"
"393","1.567094","192.168.123.8","192.168.123.23","TCP","74","58876  >  666 [SYN] Seq=0 Win=64240 Len=0 MSS=1460 SACK_PERM=1 TSval=3761604734 TSecr=0 WS=128"
"394","1.567144","192.168.123.23","192.168.123.8","TCP","74","666  >  58876 [SYN, ACK] Seq=0 Ack=1 Win=65160 Len=0 MSS=1460 SACK_PERM=1 TSval=1496486739 TSecr=3761604734 WS=128"
"395","1.567183","192.168.123.8","192.168.123.23","TCP","66","58876  >  666 [ACK] Seq=1 Ack=1 Win=64256 Len=0 TSval=3761604735 TSecr=1496486739"
"396","1.567601","192.168.123.8","192.168.123.23","TLSv1.3","353","Client Hello"
"397","1.567689","192.168.123.23","192.168.123.8","TCP","66","666  >  58876 [ACK] Seq=1 Ack=288 Win=64896 Len=0 TSval=1496486740 TSecr=3761604735"
"398","1.568600","192.168.123.23","192.168.123.8","TLSv1.3","1464","Server Hello, Change Cipher Spec, Application Data, Application Data, Application Data, Application Data, Application Data"
"399","1.568631","192.168.123.8","192.168.123.23","TCP","66","58876  >  666 [ACK] Seq=288 Ack=1399 Win=64128 Len=0 TSval=3761604736 TSecr=1496486741"
"400","1.576461","192.168.123.8","192.168.123.23","TLSv1.3","756","Change Cipher Spec, Application Data, Application Data, Application Data"
"401","1.576500","192.168.123.23","192.168.123.8","TCP","66","666  >  58876 [ACK] Seq=1399 Ack=978 Win=64256 Len=0 TSval=1496486749 TSecr=3761604744"
"402","1.577100","192.168.123.23","192.168.123.8","TLSv1.3","769","Application Data"
"403","1.577166","192.168.123.8","192.168.123.23","TCP","66","58876  >  666 [ACK] Seq=978 Ack=2102 Win=63488 Len=0 TSval=3761604744 TSecr=1496486749"
"404","1.577247","192.168.123.23","192.168.123.8","TLSv1.3","769","Application Data"
"405","1.577272","192.168.123.8","192.168.123.23","TCP","66","58876  >  666 [ACK] Seq=978 Ack=2805 Win=64128 Len=0 TSval=3761604745 TSecr=1496486750"
"408","1.727728","192.168.123.32","192.168.123.23","TCP","74","43562  >  666 [SYN] Seq=0 Win=64240 Len=0 MSS=1460 SACK_PERM=1 TSval=2246071021 TSecr=0 WS=128"
"409","1.727761","192.168.123.23","192.168.123.32","TCP","74","666  >  43562 [SYN, ACK] Seq=0 Ack=1 Win=65160 Len=0 MSS=1460 SACK_PERM=1 TSval=4230177083 TSecr=2246071021 WS=128"
"410","1.727789","192.168.123.32","192.168.123.23","TCP","66","43562  >  666 [ACK] Seq=1 Ack=1 Win=64256 Len=0 TSval=2246071022 TSecr=4230177083"
"411","1.728052","192.168.123.32","192.168.123.23","TLSv1.3","353","Client Hello"
"412","1.728159","192.168.123.23","192.168.123.32","TCP","66","666  >  43562 [ACK] Seq=1 Ack=288 Win=64896 Len=0 TSval=4230177083 TSecr=2246071022"
"413","1.728993","192.168.123.23","192.168.123.32","TLSv1.3","1464","Server Hello, Change Cipher Spec, Application Data, Application Data, Application Data, Application Data, Application Data"
"414","1.729030","192.168.123.32","192.168.123.23","TCP","66","43562  >  666 [ACK] Seq=288 Ack=1399 Win=64128 Len=0 TSval=2246071023 TSecr=4230177084"
"415","1.730713","192.168.123.32","192.168.123.23","TLSv1.3","756","Change Cipher Spec, Application Data, Application Data, Application Data"
"416","1.730751","192.168.123.23","192.168.123.32","TCP","66","666  >  43562 [ACK] Seq=1399 Ack=978 Win=64256 Len=0 TSval=4230177086 TSecr=2246071025"
"417","1.731402","192.168.123.23","192.168.123.32","TLSv1.3","769","Application Data"
"418","1.731441","192.168.123.32","192.168.123.23","TCP","66","43562  >  666 [ACK] Seq=978 Ack=2102 Win=64128 Len=0 TSval=2246071026 TSecr=4230177087"
"419","1.731555","192.168.123.23","192.168.123.32","TLSv1.3","769","Application Data"
"420","1.731573","192.168.123.32","192.168.123.23","TCP","66","43562  >  666 [ACK] Seq=978 Ack=2805 Win=64128 Len=0 TSval=2246071026 TSecr=4230177087"
"423","1.744704","192.168.123.10","192.168.123.23","TCP","74","33564  >  666 [SYN] Seq=0 Win=64240 Len=0 MSS=1460 SACK_PERM=1 TSval=3191997609 TSecr=0 WS=128"
"424","1.744738","192.168.123.23","192.168.123.10","TCP","74","666  >  33564 [SYN, ACK] Seq=0 Ack=1 Win=65160 Len=0 MSS=1460 SACK_PERM=1 TSval=1882036079 TSecr=3191997609 WS=128"
"425","1.744765","192.168.123.10","192.168.123.23","TCP","66","33564  >  666 [ACK] Seq=1 Ack=1 Win=64256 Len=0 TSval=3191997610 TSecr=1882036079"
"426","1.745026","192.168.123.10","192.168.123.23","TLSv1.3","353","Client Hello"
"427","1.745116","192.168.123.23","192.168.123.10","TCP","66","666  >  33564 [ACK] Seq=1 Ack=288 Win=64896 Len=0 TSval=1882036079 TSecr=3191997610"
"428","1.746622","192.168.123.23","192.168.123.10","TLSv1.3","1464","Server Hello, Change Cipher Spec, Application Data, Application Data, Application Data, Application Data, Application Data"
"429","1.746664","192.168.123.10","192.168.123.23","TCP","66","33564  >  666 [ACK] Seq=288 Ack=1399 Win=64128 Len=0 TSval=3191997612 TSecr=1882036081"
"430","1.753824","192.168.123.10","192.168.123.23","TLSv1.3","756","Change Cipher Spec, Application Data, Application Data, Application Data"
"431","1.753872","192.168.123.23","192.168.123.10","TCP","66","666  >  33564 [ACK] Seq=1399 Ack=978 Win=64256 Len=0 TSval=1882036088 TSecr=3191997619"
"432","1.754471","192.168.123.23","192.168.123.10","TLSv1.3","769","Application Data"
"433","1.754502","192.168.123.10","192.168.123.23","TCP","66","33564  >  666 [ACK] Seq=978 Ack=2102 Win=64128 Len=0 TSval=3191997620 TSecr=1882036089"
"434","1.754635","192.168.123.23","192.168.123.10","TLSv1.3","769","Application Data"
"435","1.754653","192.168.123.10","192.168.123.23","TCP","66","33564  >  666 [ACK] Seq=978 Ack=2805 Win=64128 Len=0 TSval=3191997620 TSecr=1882036089"
"438","1.774017","192.168.123.27","192.168.123.23","TCP","74","49188  >  666 [SYN] Seq=0 Win=64240 Len=0 MSS=1460 SACK_PERM=1 TSval=4264170902 TSecr=0 WS=128"
"439","1.774051","192.168.123.23","192.168.123.27","TCP","74","666  >  49188 [SYN, ACK] Seq=0 Ack=1 Win=65160 Len=0 MSS=1460 SACK_PERM=1 TSval=1439084681 TSecr=4264170902 WS=128"
"440","1.774158","192.168.123.27","192.168.123.23","TCP","66","49188  >  666 [ACK] Seq=1 Ack=1 Win=64256 Len=0 TSval=4264170902 TSecr=1439084681"
"441","1.774467","192.168.123.27","192.168.123.23","TLSv1.3","353","Client Hello"
"442","1.774556","192.168.123.23","192.168.123.27","TCP","66","666  >  49188 [ACK] Seq=1 Ack=288 Win=64896 Len=0 TSval=1439084682 TSecr=4264170903"
"443","1.776456","192.168.123.23","192.168.123.27","TLSv1.3","1464","Server Hello, Change Cipher Spec, Application Data, Application Data, Application Data, Application Data, Application Data"
"444","1.776512","192.168.123.27","192.168.123.23","TCP","66","49188  >  666 [ACK] Seq=288 Ack=1399 Win=64128 Len=0 TSval=4264170905 TSecr=1439084684"
"445","1.778450","192.168.123.27","192.168.123.23","TLSv1.3","756","Change Cipher Spec, Application Data, Application Data, Application Data"
"446","1.778490","192.168.123.23","192.168.123.27","TCP","66","666  >  49188 [ACK] Seq=1399 Ack=978 Win=64256 Len=0 TSval=1439084686 TSecr=4264170907"
"447","1.779072","192.168.123.23","192.168.123.27","TLSv1.3","769","Application Data"
"448","1.779102","192.168.123.27","192.168.123.23","TCP","66","49188  >  666 [ACK] Seq=978 Ack=2102 Win=64128 Len=0 TSval=4264170907 TSecr=1439084686"
"449","1.779232","192.168.123.23","192.168.123.27","TLSv1.3","769","Application Data"
"450","1.779255","192.168.123.27","192.168.123.23","TCP","66","49188  >  666 [ACK] Seq=978 Ack=2805 Win=64128 Len=0 TSval=4264170908 TSecr=1439084687"
"453","1.795240","192.168.123.24","192.168.123.23","TCP","74","42620  >  666 [SYN] Seq=0 Win=64240 Len=0 MSS=1460 SACK_PERM=1 TSval=3041504364 TSecr=0 WS=128"
"454","1.795273","192.168.123.23","192.168.123.24","TCP","74","666  >  42620 [SYN, ACK] Seq=0 Ack=1 Win=65160 Len=0 MSS=1460 SACK_PERM=1 TSval=939607629 TSecr=3041504364 WS=128"
"455","1.795299","192.168.123.24","192.168.123.23","TCP","66","42620  >  666 [ACK] Seq=1 Ack=1 Win=64256 Len=0 TSval=3041504365 TSecr=939607629"
"456","1.795519","192.168.123.24","192.168.123.23","TLSv1.3","353","Client Hello"
"457","1.795593","192.168.123.23","192.168.123.24","TCP","66","666  >  42620 [ACK] Seq=1 Ack=288 Win=64896 Len=0 TSval=939607629 TSecr=3041504365"
"458","1.796947","192.168.123.23","192.168.123.24","TLSv1.3","1464","Server Hello, Change Cipher Spec, Application Data, Application Data, Application Data, Application Data, Application Data"
"459","1.796980","192.168.123.24","192.168.123.23","TCP","66","42620  >  666 [ACK] Seq=288 Ack=1399 Win=64128 Len=0 TSval=3041504366 TSecr=939607630"
"460","1.799112","192.168.123.24","192.168.123.23","TLSv1.3","756","Change Cipher Spec, Application Data, Application Data, Application Data"
"461","1.799189","192.168.123.23","192.168.123.24","TCP","66","666  >  42620 [ACK] Seq=1399 Ack=978 Win=64256 Len=0 TSval=939607632 TSecr=3041504368"
"462","1.799677","192.168.123.23","192.168.123.24","TLSv1.3","769","Application Data"
"463","1.799707","192.168.123.24","192.168.123.23","TCP","66","42620  >  666 [ACK] Seq=978 Ack=2102 Win=64128 Len=0 TSval=3041504369 TSecr=939607633"
"464","1.800049","192.168.123.23","192.168.123.24","TLSv1.3","769","Application Data"
"465","1.800084","192.168.123.24","192.168.123.23","TCP","66","42620  >  666 [ACK] Seq=978 Ack=2805 Win=64128 Len=0 TSval=3041504369 TSecr=939607633"
"468","1.830509","192.168.123.44","192.168.123.23","TCP","74","54566  >  666 [SYN] Seq=0 Win=64240 Len=0 MSS=1460 SACK_PERM=1 TSval=298503042 TSecr=0 WS=128"
"469","1.830578","192.168.123.23","192.168.123.44","TCP","74","666  >  54566 [SYN, ACK] Seq=0 Ack=1 Win=65160 Len=0 MSS=1460 SACK_PERM=1 TSval=2166981162 TSecr=298503042 WS=128"
"470","1.830622","192.168.123.44","192.168.123.23","TCP","66","54566  >  666 [ACK] Seq=1 Ack=1 Win=64256 Len=0 TSval=298503043 TSecr=2166981162"
"471","1.830998","192.168.123.44","192.168.123.23","TLSv1.3","353","Client Hello"
"472","1.831108","192.168.123.23","192.168.123.44","TCP","66","666  >  54566 [ACK] Seq=1 Ack=288 Win=64896 Len=0 TSval=2166981162 TSecr=298503043"
"475","1.832892","192.168.123.23","192.168.123.44","TLSv1.3","1464","Server Hello, Change Cipher Spec, Application Data, Application Data, Application Data, Application Data, Application Data"
"476","1.832899","192.168.123.7","192.168.123.23","TCP","74","54094  >  666 [SYN] Seq=0 Win=64240 Len=0 MSS=1460 SACK_PERM=1 TSval=9731184 TSecr=0 WS=128"
"477","1.832932","192.168.123.23","192.168.123.7","TCP","74","666  >  54094 [SYN, ACK] Seq=0 Ack=1 Win=65160 Len=0 MSS=1460 SACK_PERM=1 TSval=2291132847 TSecr=9731184 WS=128"
"478","1.832938","192.168.123.44","192.168.123.23","TCP","66","54566  >  666 [ACK] Seq=288 Ack=1399 Win=64128 Len=0 TSval=298503045 TSecr=2166981164"
"479","1.832975","192.168.123.7","192.168.123.23","TCP","66","54094  >  666 [ACK] Seq=1 Ack=1 Win=64256 Len=0 TSval=9731184 TSecr=2291132847"
"480","1.833304","192.168.123.7","192.168.123.23","TLSv1.3","353","Client Hello"
"481","1.833375","192.168.123.23","192.168.123.7","TCP","66","666  >  54094 [ACK] Seq=1 Ack=288 Win=64896 Len=0 TSval=2291132848 TSecr=9731185"
"482","1.834252","192.168.123.23","192.168.123.7","TLSv1.3","1464","Server Hello, Change Cipher Spec, Application Data, Application Data, Application Data, Application Data, Application Data"
"483","1.834283","192.168.123.7","192.168.123.23","TCP","66","54094  >  666 [ACK] Seq=288 Ack=1399 Win=64128 Len=0 TSval=9731186 TSecr=2291132849"
"484","1.834865","192.168.123.44","192.168.123.23","TLSv1.3","756","Change Cipher Spec, Application Data, Application Data, Application Data"
"485","1.834907","192.168.123.23","192.168.123.44","TCP","66","666  >  54566 [ACK] Seq=1399 Ack=978 Win=64256 Len=0 TSval=2166981166 TSecr=298503047"
"486","1.835783","192.168.123.23","192.168.123.44","TLSv1.3","769","Application Data"
"487","1.835833","192.168.123.44","192.168.123.23","TCP","66","54566  >  666 [ACK] Seq=978 Ack=2102 Win=64128 Len=0 TSval=298503048 TSecr=2166981167"
"488","1.836003","192.168.123.23","192.168.123.44","TLSv1.3","769","Application Data"
"489","1.836030","192.168.123.44","192.168.123.23","TCP","66","54566  >  666 [ACK] Seq=978 Ack=2805 Win=64128 Len=0 TSval=298503048 TSecr=2166981167"
"490","1.838463","192.168.123.7","192.168.123.23","TLSv1.3","756","Change Cipher Spec, Application Data, Application Data, Application Data"
"491","1.838528","192.168.123.23","192.168.123.7","TCP","66","666  >  54094 [ACK] Seq=1399 Ack=978 Win=64256 Len=0 TSval=2291132853 TSecr=9731190"
"492","1.840098","192.168.123.23","192.168.123.7","TLSv1.3","769","Application Data"
"493","1.840150","192.168.123.7","192.168.123.23","TCP","66","54094  >  666 [ACK] Seq=978 Ack=2102 Win=64128 Len=0 TSval=9731191 TSecr=2291132854"
"494","1.840339","192.168.123.23","192.168.123.7","TLSv1.3","769","Application Data"
"495","1.840366","192.168.123.7","192.168.123.23","TCP","66","54094  >  666 [ACK] Seq=978 Ack=2805 Win=64128 Len=0 TSval=9731192 TSecr=2291132855"
"498","1.845263","192.168.123.28","192.168.123.23","TCP","74","39296  >  666 [SYN] Seq=0 Win=64240 Len=0 MSS=1460 SACK_PERM=1 TSval=2947274979 TSecr=0 WS=128"
"499","1.845324","192.168.123.23","192.168.123.28","TCP","74","666  >  39296 [SYN, ACK] Seq=0 Ack=1 Win=65160 Len=0 MSS=1460 SACK_PERM=1 TSval=1075577710 TSecr=2947274979 WS=128"
"500","1.845373","192.168.123.28","192.168.123.23","TCP","66","39296  >  666 [ACK] Seq=1 Ack=1 Win=64256 Len=0 TSval=2947274980 TSecr=1075577710"
"501","1.845815","192.168.123.28","192.168.123.23","TLSv1.3","353","Client Hello"
"502","1.845922","192.168.123.23","192.168.123.28","TCP","66","666  >  39296 [ACK] Seq=1 Ack=288 Win=64896 Len=0 TSval=1075577710 TSecr=2947274980"
"503","1.847493","192.168.123.23","192.168.123.28","TLSv1.3","1464","Server Hello, Change Cipher Spec, Application Data, Application Data, Application Data, Application Data, Application Data"
"504","1.847553","192.168.123.28","192.168.123.23","TCP","66","39296  >  666 [ACK] Seq=288 Ack=1399 Win=64128 Len=0 TSval=2947274982 TSecr=1075577712"
"505","1.849521","192.168.123.28","192.168.123.23","TLSv1.3","756","Change Cipher Spec, Application Data, Application Data, Application Data"
"506","1.849563","192.168.123.23","192.168.123.28","TCP","66","666  >  39296 [ACK] Seq=1399 Ack=978 Win=64256 Len=0 TSval=1075577714 TSecr=2947274984"
"507","1.850442","192.168.123.23","192.168.123.28","TLSv1.3","769","Application Data"
"508","1.850482","192.168.123.28","192.168.123.23","TCP","66","39296  >  666 [ACK] Seq=978 Ack=2102 Win=64128 Len=0 TSval=2947274985 TSecr=1075577715"
"509","1.850639","192.168.123.23","192.168.123.28","TLSv1.3","769","Application Data"
"510","1.850658","192.168.123.28","192.168.123.23","TCP","66","39296  >  666 [ACK] Seq=978 Ack=2805 Win=64128 Len=0 TSval=2947274985 TSecr=1075577715"
"513","1.852444","192.168.123.9","192.168.123.23","TCP","74","60372  >  666 [SYN] Seq=0 Win=64240 Len=0 MSS=1460 SACK_PERM=1 TSval=2258495179 TSecr=0 WS=128"
"514","1.852491","192.168.123.23","192.168.123.9","TCP","74","666  >  60372 [SYN, ACK] Seq=0 Ack=1 Win=65160 Len=0 MSS=1460 SACK_PERM=1 TSval=1819774742 TSecr=2258495179 WS=128"
"515","1.852530","192.168.123.9","192.168.123.23","TCP","66","60372  >  666 [ACK] Seq=1 Ack=1 Win=64256 Len=0 TSval=2258495180 TSecr=1819774742"
"516","1.852970","192.168.123.9","192.168.123.23","TLSv1.3","353","Client Hello"
"517","1.853079","192.168.123.23","192.168.123.9","TCP","66","666  >  60372 [ACK] Seq=1 Ack=288 Win=64896 Len=0 TSval=1819774742 TSecr=2258495180"
"520","1.853702","192.168.123.40","192.168.123.23","TCP","74","41598  >  666 [SYN] Seq=0 Win=64240 Len=0 MSS=1460 SACK_PERM=1 TSval=1393193537 TSecr=0 WS=128"
"521","1.853744","192.168.123.23","192.168.123.40","TCP","74","666  >  41598 [SYN, ACK] Seq=0 Ack=1 Win=65160 Len=0 MSS=1460 SACK_PERM=1 TSval=1201948455 TSecr=1393193537 WS=128"
"522","1.853797","192.168.123.40","192.168.123.23","TCP","66","41598  >  666 [ACK] Seq=1 Ack=1 Win=64256 Len=0 TSval=1393193538 TSecr=1201948455"
"523","1.854146","192.168.123.40","192.168.123.23","TLSv1.3","353","Client Hello"
"524","1.854208","192.168.123.23","192.168.123.9","TLSv1.3","1464","Server Hello, Change Cipher Spec, Application Data, Application Data, Application Data, Application Data, Application Data"
"525","1.854235","192.168.123.23","192.168.123.40","TCP","66","666  >  41598 [ACK] Seq=1 Ack=288 Win=64896 Len=0 TSval=1201948456 TSecr=1393193538"
"526","1.854250","192.168.123.9","192.168.123.23","TCP","66","60372  >  666 [ACK] Seq=288 Ack=1399 Win=64128 Len=0 TSval=2258495182 TSecr=1819774744"
"527","1.854979","192.168.123.23","192.168.123.40","TLSv1.3","1464","Server Hello, Change Cipher Spec, Application Data, Application Data, Application Data, Application Data, Application Data"
"528","1.855012","192.168.123.40","192.168.123.23","TCP","66","41598  >  666 [ACK] Seq=288 Ack=1399 Win=64128 Len=0 TSval=1393193539 TSecr=1201948456"
"529","1.856132","192.168.123.40","192.168.123.23","TLSv1.3","756","Change Cipher Spec, Application Data, Application Data, Application Data"
"530","1.856159","192.168.123.23","192.168.123.40","TCP","66","666  >  41598 [ACK] Seq=1399 Ack=978 Win=64256 Len=0 TSval=1201948457 TSecr=1393193540"
"531","1.856792","192.168.123.23","192.168.123.40","TLSv1.3","769","Application Data"
"532","1.856844","192.168.123.40","192.168.123.23","TCP","66","41598  >  666 [ACK] Seq=978 Ack=2102 Win=64128 Len=0 TSval=1393193541 TSecr=1201948458"
"533","1.857046","192.168.123.23","192.168.123.40","TLSv1.3","769","Application Data"
"534","1.857071","192.168.123.40","192.168.123.23","TCP","66","41598  >  666 [ACK] Seq=978 Ack=2805 Win=64128 Len=0 TSval=1393193541 TSecr=1201948458"
"535","1.857471","192.168.123.9","192.168.123.23","TLSv1.3","756","Change Cipher Spec, Application Data, Application Data, Application Data"
"536","1.857513","192.168.123.23","192.168.123.9","TCP","66","666  >  60372 [ACK] Seq=1399 Ack=978 Win=64256 Len=0 TSval=1819774747 TSecr=2258495185"
"537","1.858107","192.168.123.23","192.168.123.9","TLSv1.3","769","Application Data"
"538","1.858136","192.168.123.9","192.168.123.23","TCP","66","60372  >  666 [ACK] Seq=978 Ack=2102 Win=64128 Len=0 TSval=2258495185 TSecr=1819774747"
"539","1.858247","192.168.123.23","192.168.123.9","TLSv1.3","769","Application Data"
"540","1.858266","192.168.123.9","192.168.123.23","TCP","66","60372  >  666 [ACK] Seq=978 Ack=2805 Win=64128 Len=0 TSval=2258495186 TSecr=1819774748"
"543","1.872727","192.168.123.50","192.168.123.23","TCP","74","59126  >  666 [SYN] Seq=0 Win=64240 Len=0 MSS=1460 SACK_PERM=1 TSval=2557274448 TSecr=0 WS=128"
"544","1.872762","192.168.123.23","192.168.123.50","TCP","74","666  >  59126 [SYN, ACK] Seq=0 Ack=1 Win=65160 Len=0 MSS=1460 SACK_PERM=1 TSval=2748392320 TSecr=2557274448 WS=128"
"545","1.872791","192.168.123.50","192.168.123.23","TCP","66","59126  >  666 [ACK] Seq=1 Ack=1 Win=64256 Len=0 TSval=2557274449 TSecr=2748392320"
"546","1.873092","192.168.123.50","192.168.123.23","TLSv1.3","353","Client Hello"
"547","1.873169","192.168.123.23","192.168.123.50","TCP","66","666  >  59126 [ACK] Seq=1 Ack=288 Win=64896 Len=0 TSval=2748392320 TSecr=2557274449"
"548","1.874586","192.168.123.23","192.168.123.50","TLSv1.3","1464","Server Hello, Change Cipher Spec, Application Data, Application Data, Application Data, Application Data, Application Data"
"549","1.874636","192.168.123.50","192.168.123.23","TCP","66","59126  >  666 [ACK] Seq=288 Ack=1399 Win=64128 Len=0 TSval=2557274451 TSecr=2748392322"
"550","1.876519","192.168.123.50","192.168.123.23","TLSv1.3","756","Change Cipher Spec, Application Data, Application Data, Application Data"
"551","1.876562","192.168.123.23","192.168.123.50","TCP","66","666  >  59126 [ACK] Seq=1399 Ack=978 Win=64256 Len=0 TSval=2748392324 TSecr=2557274453"
"552","1.877287","192.168.123.23","192.168.123.50","TLSv1.3","769","Application Data"
"553","1.877327","192.168.123.50","192.168.123.23","TCP","66","59126  >  666 [ACK] Seq=978 Ack=2102 Win=64128 Len=0 TSval=2557274454 TSecr=2748392325"
"554","1.877511","192.168.123.23","192.168.123.50","TLSv1.3","769","Application Data"
"555","1.877537","192.168.123.50","192.168.123.23","TCP","66","59126  >  666 [ACK] Seq=978 Ack=2805 Win=64128 Len=0 TSval=2557274454 TSecr=2748392325"
"558","1.887806","192.168.123.48","192.168.123.23","TCP","74","58806  >  666 [SYN] Seq=0 Win=64240 Len=0 MSS=1460 SACK_PERM=1 TSval=1215011387 TSecr=0 WS=128"
"559","1.887857","192.168.123.23","192.168.123.48","TCP","74","666  >  58806 [SYN, ACK] Seq=0 Ack=1 Win=65160 Len=0 MSS=1460 SACK_PERM=1 TSval=4092807276 TSecr=1215011387 WS=128"
"560","1.887898","192.168.123.48","192.168.123.23","TCP","66","58806  >  666 [ACK] Seq=1 Ack=1 Win=64256 Len=0 TSval=1215011388 TSecr=4092807276"
"561","1.888223","192.168.123.48","192.168.123.23","TLSv1.3","353","Client Hello"
"562","1.888343","192.168.123.23","192.168.123.48","TCP","66","666  >  58806 [ACK] Seq=1 Ack=288 Win=64896 Len=0 TSval=4092807277 TSecr=1215011389"
"563","1.889123","192.168.123.23","192.168.123.48","TLSv1.3","1464","Server Hello, Change Cipher Spec, Application Data, Application Data, Application Data, Application Data, Application Data"
"564","1.889154","192.168.123.48","192.168.123.23","TCP","66","58806  >  666 [ACK] Seq=288 Ack=1399 Win=64128 Len=0 TSval=1215011389 TSecr=4092807277"
"566","1.890480","192.168.123.48","192.168.123.23","TLSv1.3","756","Change Cipher Spec, Application Data, Application Data, Application Data"
"567","1.890508","192.168.123.23","192.168.123.48","TCP","66","666  >  58806 [ACK] Seq=1399 Ack=978 Win=64256 Len=0 TSval=4092807279 TSecr=1215011391"
"570","1.890601","192.168.123.31","192.168.123.23","TCP","74","37698  >  666 [SYN] Seq=0 Win=64240 Len=0 MSS=1460 SACK_PERM=1 TSval=517817589 TSecr=0 WS=128"
"571","1.890647","192.168.123.23","192.168.123.31","TCP","74","666  >  37698 [SYN, ACK] Seq=0 Ack=1 Win=65160 Len=0 MSS=1460 SACK_PERM=1 TSval=3717463714 TSecr=517817589 WS=128"
"572","1.890698","192.168.123.31","192.168.123.23","TCP","66","37698  >  666 [ACK] Seq=1 Ack=1 Win=64256 Len=0 TSval=517817590 TSecr=3717463714"
"574","1.890896","192.168.123.5","192.168.123.23","TCP","74","36570  >  666 [SYN] Seq=0 Win=64240 Len=0 MSS=1460 SACK_PERM=1 TSval=1956425822 TSecr=0 WS=128"
"575","1.890941","192.168.123.23","192.168.123.5","TCP","74","666  >  36570 [SYN, ACK] Seq=0 Ack=1 Win=65160 Len=0 MSS=1460 SACK_PERM=1 TSval=556014203 TSecr=1956425822 WS=128"
"576","1.890980","192.168.123.5","192.168.123.23","TCP","66","36570  >  666 [ACK] Seq=1 Ack=1 Win=64256 Len=0 TSval=1956425822 TSecr=556014203"
"577","1.891068","192.168.123.31","192.168.123.23","TLSv1.3","353","Client Hello"
"578","1.891158","192.168.123.23","192.168.123.31","TCP","66","666  >  37698 [ACK] Seq=1 Ack=288 Win=64896 Len=0 TSval=3717463714 TSecr=517817590"
"579","1.891245","192.168.123.5","192.168.123.23","TLSv1.3","353","Client Hello"
"580","1.891286","192.168.123.23","192.168.123.48","TLSv1.3","769","Application Data"
"581","1.891323","192.168.123.23","192.168.123.5","TCP","66","666  >  36570 [ACK] Seq=1 Ack=288 Win=64896 Len=0 TSval=556014204 TSecr=1956425823"
"582","1.891327","192.168.123.48","192.168.123.23","TCP","66","58806  >  666 [ACK] Seq=978 Ack=2102 Win=64128 Len=0 TSval=1215011392 TSecr=4092807280"
"583","1.891509","192.168.123.23","192.168.123.48","TLSv1.3","769","Application Data"
"584","1.891541","192.168.123.48","192.168.123.23","TCP","66","58806  >  666 [ACK] Seq=978 Ack=2805 Win=64128 Len=0 TSval=1215011392 TSecr=4092807280"
"585","1.892093","192.168.123.23","192.168.123.31","TLSv1.3","1464","Server Hello, Change Cipher Spec, Application Data, Application Data, Application Data, Application Data, Application Data"
"586","1.892135","192.168.123.31","192.168.123.23","TCP","66","37698  >  666 [ACK] Seq=288 Ack=1399 Win=64128 Len=0 TSval=517817591 TSecr=3717463715"
"587","1.892285","192.168.123.23","192.168.123.5","TLSv1.3","1464","Server Hello, Change Cipher Spec, Application Data, Application Data, Application Data, Application Data, Application Data"
"588","1.892319","192.168.123.5","192.168.123.23","TCP","66","36570  >  666 [ACK] Seq=288 Ack=1399 Win=64128 Len=0 TSval=1956425824 TSecr=556014205"
"589","1.893593","192.168.123.5","192.168.123.23","TLSv1.3","756","Change Cipher Spec, Application Data, Application Data, Application Data"
"590","1.893640","192.168.123.23","192.168.123.5","TCP","66","666  >  36570 [ACK] Seq=1399 Ack=978 Win=64256 Len=0 TSval=556014206 TSecr=1956425825"
"591","1.894180","192.168.123.23","192.168.123.5","TLSv1.3","769","Application Data"
"592","1.894214","192.168.123.5","192.168.123.23","TCP","66","36570  >  666 [ACK] Seq=978 Ack=2102 Win=64128 Len=0 TSval=1956425826 TSecr=556014207"
"594","1.894359","192.168.123.23","192.168.123.5","TLSv1.3","769","Application Data"
"595","1.894385","192.168.123.5","192.168.123.23","TCP","66","36570  >  666 [ACK] Seq=978 Ack=2805 Win=64128 Len=0 TSval=1956425826 TSecr=556014207"
"597","1.894868","192.168.123.31","192.168.123.23","TLSv1.3","756","Change Cipher Spec, Application Data, Application Data, Application Data"
"598","1.894907","192.168.123.51","192.168.123.23","TCP","74","53510  >  666 [SYN] Seq=0 Win=64240 Len=0 MSS=1460 SACK_PERM=1 TSval=4008973403 TSecr=0 WS=128"
"599","1.894911","192.168.123.23","192.168.123.31","TCP","66","666  >  37698 [ACK] Seq=1399 Ack=978 Win=64256 Len=0 TSval=3717463718 TSecr=517817594"
"600","1.894978","192.168.123.23","192.168.123.51","TCP","74","666  >  53510 [SYN, ACK] Seq=0 Ack=1 Win=65160 Len=0 MSS=1460 SACK_PERM=1 TSval=567249365 TSecr=4008973403 WS=128"
"601","1.895041","192.168.123.51","192.168.123.23","TCP","66","53510  >  666 [ACK] Seq=1 Ack=1 Win=64256 Len=0 TSval=4008973404 TSecr=567249365"
"602","1.895447","192.168.123.51","192.168.123.23","TLSv1.3","353","Client Hello"
"603","1.895560","192.168.123.23","192.168.123.51","TCP","66","666  >  53510 [ACK] Seq=1 Ack=288 Win=64896 Len=0 TSval=567249366 TSecr=4008973405"
"604","1.895612","192.168.123.23","192.168.123.31","TLSv1.3","769","Application Data"
"605","1.895651","192.168.123.31","192.168.123.23","TCP","66","37698  >  666 [ACK] Seq=978 Ack=2102 Win=64128 Len=0 TSval=517817595 TSecr=3717463719"
"606","1.895829","192.168.123.23","192.168.123.31","TLSv1.3","769","Application Data"
"607","1.895858","192.168.123.31","192.168.123.23","TCP","66","37698  >  666 [ACK] Seq=978 Ack=2805 Win=64128 Len=0 TSval=517817595 TSecr=3717463719"
"608","1.896390","192.168.123.23","192.168.123.51","TLSv1.3","1464","Server Hello, Change Cipher Spec, Application Data, Application Data, Application Data, Application Data, Application Data"
"609","1.896422","192.168.123.51","192.168.123.23","TCP","66","53510  >  666 [ACK] Seq=288 Ack=1399 Win=64128 Len=0 TSval=4008973406 TSecr=567249367"
"612","1.898333","192.168.123.19","192.168.123.23","TCP","74","50238  >  666 [SYN] Seq=0 Win=64240 Len=0 MSS=1460 SACK_PERM=1 TSval=735051003 TSecr=0 WS=128"
"613","1.898366","192.168.123.23","192.168.123.19","TCP","74","666  >  50238 [SYN, ACK] Seq=0 Ack=1 Win=65160 Len=0 MSS=1460 SACK_PERM=1 TSval=3446229884 TSecr=735051003 WS=128"
"614","1.898393","192.168.123.19","192.168.123.23","TCP","66","50238  >  666 [ACK] Seq=1 Ack=1 Win=64256 Len=0 TSval=735051004 TSecr=3446229884"
"615","1.898721","192.168.123.19","192.168.123.23","TLSv1.3","353","Client Hello"
"616","1.898809","192.168.123.23","192.168.123.19","TCP","66","666  >  50238 [ACK] Seq=1 Ack=288 Win=64896 Len=0 TSval=3446229884 TSecr=735051004"
"619","1.899430","192.168.123.30","192.168.123.23","TCP","74","46606  >  666 [SYN] Seq=0 Win=64240 Len=0 MSS=1460 SACK_PERM=1 TSval=3784626552 TSecr=0 WS=128"
"620","1.899458","192.168.123.23","192.168.123.30","TCP","74","666  >  46606 [SYN, ACK] Seq=0 Ack=1 Win=65160 Len=0 MSS=1460 SACK_PERM=1 TSval=3473515760 TSecr=3784626552 WS=128"
"621","1.899484","192.168.123.30","192.168.123.23","TCP","66","46606  >  666 [ACK] Seq=1 Ack=1 Win=64256 Len=0 TSval=3784626553 TSecr=3473515760"
"622","1.899600","192.168.123.23","192.168.123.19","TLSv1.3","1464","Server Hello, Change Cipher Spec, Application Data, Application Data, Application Data, Application Data, Application Data"
"623","1.899635","192.168.123.19","192.168.123.23","TCP","66","50238  >  666 [ACK] Seq=288 Ack=1399 Win=64128 Len=0 TSval=735051005 TSecr=3446229885"
"624","1.899765","192.168.123.30","192.168.123.23","TLSv1.3","353","Client Hello"
"625","1.899831","192.168.123.23","192.168.123.30","TCP","66","666  >  46606 [ACK] Seq=1 Ack=288 Win=64896 Len=0 TSval=3473515760 TSecr=3784626553"
"626","1.900577","192.168.123.51","192.168.123.23","TLSv1.3","756","Change Cipher Spec, Application Data, Application Data, Application Data"
"627","1.900605","192.168.123.23","192.168.123.51","TCP","66","666  >  53510 [ACK] Seq=1399 Ack=978 Win=64256 Len=0 TSval=567249371 TSecr=4008973410"
"628","1.900648","192.168.123.23","192.168.123.30","TLSv1.3","1464","Server Hello, Change Cipher Spec, Application Data, Application Data, Application Data, Application Data, Application Data"
"629","1.900679","192.168.123.30","192.168.123.23","TCP","66","46606  >  666 [ACK] Seq=288 Ack=1399 Win=64128 Len=0 TSval=3784626554 TSecr=3473515761"
"630","1.901170","192.168.123.23","192.168.123.51","TLSv1.3","769","Application Data"
"631","1.901196","192.168.123.51","192.168.123.23","TCP","66","53510  >  666 [ACK] Seq=978 Ack=2102 Win=64128 Len=0 TSval=4008973411 TSecr=567249371"
"632","1.901305","192.168.123.23","192.168.123.51","TLSv1.3","769","Application Data"
"633","1.901324","192.168.123.51","192.168.123.23","TCP","66","53510  >  666 [ACK] Seq=978 Ack=2805 Win=64128 Len=0 TSval=4008973411 TSecr=567249372"
"634","1.901410","192.168.123.19","192.168.123.23","TLSv1.3","756","Change Cipher Spec, Application Data, Application Data, Application Data"
"635","1.901438","192.168.123.23","192.168.123.19","TCP","66","666  >  50238 [ACK] Seq=1399 Ack=978 Win=64256 Len=0 TSval=3446229887 TSecr=735051007"
"636","1.902017","192.168.123.23","192.168.123.19","TLSv1.3","769","Application Data"
"637","1.902045","192.168.123.19","192.168.123.23","TCP","66","50238  >  666 [ACK] Seq=978 Ack=2102 Win=64128 Len=0 TSval=735051007 TSecr=3446229887"
"638","1.902156","192.168.123.23","192.168.123.19","TLSv1.3","769","Application Data"
"639","1.902174","192.168.123.19","192.168.123.23","TCP","66","50238  >  666 [ACK] Seq=978 Ack=2805 Win=64128 Len=0 TSval=735051008 TSecr=3446229887"
"640","1.902453","192.168.123.30","192.168.123.23","TLSv1.3","756","Change Cipher Spec, Application Data, Application Data, Application Data"
"641","1.902479","192.168.123.23","192.168.123.30","TCP","66","666  >  46606 [ACK] Seq=1399 Ack=978 Win=64256 Len=0 TSval=3473515763 TSecr=3784626556"
"642","1.902976","192.168.123.23","192.168.123.30","TLSv1.3","769","Application Data"
"643","1.903005","192.168.123.30","192.168.123.23","TCP","66","46606  >  666 [ACK] Seq=978 Ack=2102 Win=64128 Len=0 TSval=3784626556 TSecr=3473515763"
"644","1.903134","192.168.123.23","192.168.123.30","TLSv1.3","769","Application Data"
"645","1.903155","192.168.123.30","192.168.123.23","TCP","66","46606  >  666 [ACK] Seq=978 Ack=2805 Win=64128 Len=0 TSval=3784626556 TSecr=3473515763"
"648","1.914643","192.168.123.47","192.168.123.23","TCP","74","48512  >  666 [SYN] Seq=0 Win=64240 Len=0 MSS=1460 SACK_PERM=1 TSval=3166945565 TSecr=0 WS=128"
"649","1.914675","192.168.123.23","192.168.123.47","TCP","74","666  >  48512 [SYN, ACK] Seq=0 Ack=1 Win=65160 Len=0 MSS=1460 SACK_PERM=1 TSval=2190806227 TSecr=3166945565 WS=128"
"650","1.914703","192.168.123.47","192.168.123.23","TCP","66","48512  >  666 [ACK] Seq=1 Ack=1 Win=64256 Len=0 TSval=3166945566 TSecr=2190806227"
"651","1.914976","192.168.123.47","192.168.123.23","TLSv1.3","353","Client Hello"
"652","1.915054","192.168.123.23","192.168.123.47","TCP","66","666  >  48512 [ACK] Seq=1 Ack=288 Win=64896 Len=0 TSval=2190806227 TSecr=3166945566"
"653","1.916406","192.168.123.23","192.168.123.47","TLSv1.3","1464","Server Hello, Change Cipher Spec, Application Data, Application Data, Application Data, Application Data, Application Data"
"654","1.916449","192.168.123.47","192.168.123.23","TCP","66","48512  >  666 [ACK] Seq=288 Ack=1399 Win=64128 Len=0 TSval=3166945568 TSecr=2190806229"
"655","1.919027","192.168.123.47","192.168.123.23","TLSv1.3","756","Change Cipher Spec, Application Data, Application Data, Application Data"
"656","1.919068","192.168.123.23","192.168.123.47","TCP","66","666  >  48512 [ACK] Seq=1399 Ack=978 Win=64256 Len=0 TSval=2190806231 TSecr=3166945570"
"657","1.919877","192.168.123.23","192.168.123.47","TLSv1.3","769","Application Data"
"658","1.919910","192.168.123.47","192.168.123.23","TCP","66","48512  >  666 [ACK] Seq=978 Ack=2102 Win=64128 Len=0 TSval=3166945571 TSecr=2190806232"
"659","1.920081","192.168.123.23","192.168.123.47","TLSv1.3","769","Application Data"
"660","1.920111","192.168.123.47","192.168.123.23","TCP","66","48512  >  666 [ACK] Seq=978 Ack=2805 Win=64128 Len=0 TSval=3166945571 TSecr=2190806232"
"664","1.921649","192.168.123.46","192.168.123.23","TCP","74","53730  >  666 [SYN] Seq=0 Win=64240 Len=0 MSS=1460 SACK_PERM=1 TSval=2738297869 TSecr=0 WS=128"
"665","1.921686","192.168.123.23","192.168.123.46","TCP","74","666  >  53730 [SYN, ACK] Seq=0 Ack=1 Win=65160 Len=0 MSS=1460 SACK_PERM=1 TSval=3936205346 TSecr=2738297869 WS=128"
"667","1.921746","192.168.123.46","192.168.123.23","TCP","66","53730  >  666 [ACK] Seq=1 Ack=1 Win=64256 Len=0 TSval=2738297870 TSecr=3936205346"
"668","1.921758","192.168.123.18","192.168.123.23","TCP","74","44892  >  666 [SYN] Seq=0 Win=64240 Len=0 MSS=1460 SACK_PERM=1 TSval=3183512139 TSecr=0 WS=128"
"669","1.921796","192.168.123.23","192.168.123.18","TCP","74","666  >  44892 [SYN, ACK] Seq=0 Ack=1 Win=65160 Len=0 MSS=1460 SACK_PERM=1 TSval=2918831883 TSecr=3183512139 WS=128"
"670","1.921843","192.168.123.18","192.168.123.23","TCP","66","44892  >  666 [ACK] Seq=1 Ack=1 Win=64256 Len=0 TSval=3183512139 TSecr=2918831883"
"671","1.921983","192.168.123.46","192.168.123.23","TLSv1.3","353","Client Hello"
"672","1.922057","192.168.123.23","192.168.123.46","TCP","66","666  >  53730 [ACK] Seq=1 Ack=288 Win=64896 Len=0 TSval=3936205346 TSecr=2738297870"
"673","1.922238","192.168.123.18","192.168.123.23","TLSv1.3","353","Client Hello"
"674","1.922334","192.168.123.23","192.168.123.18","TCP","66","666  >  44892 [ACK] Seq=1 Ack=288 Win=64896 Len=0 TSval=2918831884 TSecr=3183512140"
"675","1.922877","192.168.123.23","192.168.123.46","TLSv1.3","1464","Server Hello, Change Cipher Spec, Application Data, Application Data, Application Data, Application Data, Application Data"
"676","1.922909","192.168.123.46","192.168.123.23","TCP","66","53730  >  666 [ACK] Seq=288 Ack=1399 Win=64128 Len=0 TSval=2738297871 TSecr=3936205347"
"677","1.923156","192.168.123.23","192.168.123.18","TLSv1.3","1464","Server Hello, Change Cipher Spec, Application Data, Application Data, Application Data, Application Data, Application Data"
"678","1.923199","192.168.123.18","192.168.123.23","TCP","66","44892  >  666 [ACK] Seq=288 Ack=1399 Win=64128 Len=0 TSval=3183512141 TSecr=2918831884"
"679","1.924151","192.168.123.46","192.168.123.23","TLSv1.3","756","Change Cipher Spec, Application Data, Application Data, Application Data"
"680","1.924194","192.168.123.23","192.168.123.46","TCP","66","666  >  53730 [ACK] Seq=1399 Ack=978 Win=64256 Len=0 TSval=3936205349 TSecr=2738297872"
"681","1.924648","192.168.123.23","192.168.123.46","TLSv1.3","769","Application Data"
"682","1.924677","192.168.123.46","192.168.123.23","TCP","66","53730  >  666 [ACK] Seq=978 Ack=2102 Win=64128 Len=0 TSval=2738297873 TSecr=3936205349"
"683","1.924789","192.168.123.23","192.168.123.46","TLSv1.3","769","Application Data"
"684","1.924807","192.168.123.46","192.168.123.23","TCP","66","53730  >  666 [ACK] Seq=978 Ack=2805 Win=64128 Len=0 TSval=2738297873 TSecr=3936205349"
"685","1.926753","192.168.123.18","192.168.123.23","TLSv1.3","756","Change Cipher Spec, Application Data, Application Data, Application Data"
"686","1.926781","192.168.123.23","192.168.123.18","TCP","66","666  >  44892 [ACK] Seq=1399 Ack=978 Win=64256 Len=0 TSval=2918831888 TSecr=3183512144"
"687","1.927219","192.168.123.23","192.168.123.18","TLSv1.3","769","Application Data"
"688","1.927335","192.168.123.23","192.168.123.18","TLSv1.3","769","Application Data"
"689","1.927416","192.168.123.18","192.168.123.23","TCP","66","44892  >  666 [ACK] Seq=978 Ack=2102 Win=63488 Len=0 TSval=3183512145 TSecr=2918831889"
"690","1.927454","192.168.123.18","192.168.123.23","TCP","66","44892  >  666 [ACK] Seq=978 Ack=2805 Win=62848 Len=0 TSval=3183512145 TSecr=2918831889"
"694","1.959028","192.168.123.35","192.168.123.23","TCP","74","49678  >  666 [SYN] Seq=0 Win=64240 Len=0 MSS=1460 SACK_PERM=1 TSval=3167881967 TSecr=0 WS=128"
"695","1.959059","192.168.123.23","192.168.123.35","TCP","74","666  >  49678 [SYN, ACK] Seq=0 Ack=1 Win=65160 Len=0 MSS=1460 SACK_PERM=1 TSval=3013849445 TSecr=3167881967 WS=128"
"696","1.959084","192.168.123.35","192.168.123.23","TCP","66","49678  >  666 [ACK] Seq=1 Ack=1 Win=64256 Len=0 TSval=3167881967 TSecr=3013849445"
"698","1.959264","192.168.123.49","192.168.123.23","TCP","74","53088  >  666 [SYN] Seq=0 Win=64240 Len=0 MSS=1460 SACK_PERM=1 TSval=1999747643 TSecr=0 WS=128"
"699","1.959292","192.168.123.23","192.168.123.49","TCP","74","666  >  53088 [SYN, ACK] Seq=0 Ack=1 Win=65160 Len=0 MSS=1460 SACK_PERM=1 TSval=1676268123 TSecr=1999747643 WS=128"
"700","1.959317","192.168.123.49","192.168.123.23","TCP","66","53088  >  666 [ACK] Seq=1 Ack=1 Win=64256 Len=0 TSval=1999747644 TSecr=1676268123"
"701","1.959355","192.168.123.35","192.168.123.23","TLSv1.3","353","Client Hello"
"702","1.959427","192.168.123.23","192.168.123.35","TCP","66","666  >  49678 [ACK] Seq=1 Ack=288 Win=64896 Len=0 TSval=3013849446 TSecr=3167881968"
"703","1.959559","192.168.123.49","192.168.123.23","TLSv1.3","353","Client Hello"
"704","1.959629","192.168.123.23","192.168.123.49","TCP","66","666  >  53088 [ACK] Seq=1 Ack=288 Win=64896 Len=0 TSval=1676268123 TSecr=1999747644"
"705","1.960371","192.168.123.23","192.168.123.49","TLSv1.3","1464","Server Hello, Change Cipher Spec, Application Data, Application Data, Application Data, Application Data, Application Data"
"706","1.960393","192.168.123.23","192.168.123.35","TLSv1.3","1464","Server Hello, Change Cipher Spec, Application Data, Application Data, Application Data, Application Data, Application Data"
"707","1.960414","192.168.123.49","192.168.123.23","TCP","66","53088  >  666 [ACK] Seq=288 Ack=1399 Win=64128 Len=0 TSval=1999747645 TSecr=1676268124"
"708","1.960425","192.168.123.35","192.168.123.23","TCP","66","49678  >  666 [ACK] Seq=288 Ack=1399 Win=64128 Len=0 TSval=3167881969 TSecr=3013849447"
"709","1.961980","192.168.123.35","192.168.123.23","TLSv1.3","756","Change Cipher Spec, Application Data, Application Data, Application Data"
"710","1.962008","192.168.123.23","192.168.123.35","TCP","66","666  >  49678 [ACK] Seq=1399 Ack=978 Win=64256 Len=0 TSval=3013849448 TSecr=3167881970"
"711","1.962608","192.168.123.23","192.168.123.35","TLSv1.3","769","Application Data"
"712","1.962642","192.168.123.35","192.168.123.23","TCP","66","49678  >  666 [ACK] Seq=978 Ack=2102 Win=64128 Len=0 TSval=3167881971 TSecr=3013849449"
"713","1.962755","192.168.123.23","192.168.123.35","TLSv1.3","769","Application Data"
"714","1.962773","192.168.123.35","192.168.123.23","TCP","66","49678  >  666 [ACK] Seq=978 Ack=2805 Win=64128 Len=0 TSval=3167881971 TSecr=3013849449"
"715","1.963757","192.168.123.49","192.168.123.23","TLSv1.3","756","Change Cipher Spec, Application Data, Application Data, Application Data"
"716","1.963797","192.168.123.23","192.168.123.49","TCP","66","666  >  53088 [ACK] Seq=1399 Ack=978 Win=64256 Len=0 TSval=1676268127 TSecr=1999747648"
"717","1.964343","192.168.123.23","192.168.123.49","TLSv1.3","769","Application Data"
"718","1.964450","192.168.123.23","192.168.123.49","TLSv1.3","769","Application Data"
"719","1.964470","192.168.123.49","192.168.123.23","TCP","66","53088  >  666 [ACK] Seq=978 Ack=2102 Win=63488 Len=0 TSval=1999747649 TSecr=1676268128"
"720","1.964506","192.168.123.49","192.168.123.23","TCP","66","53088  >  666 [ACK] Seq=978 Ack=2805 Win=62848 Len=0 TSval=1999747649 TSecr=1676268128"
