"No.","Time","Source","Destination","Protocol","Length","Info"
"3","0.000388","192.168.123.45","192.168.123.26","TCP","74","43388  >  666 [SYN] Seq=0 Win=64240 Len=0 MSS=1460 SACK_PERM=1 TSval=272649362 TSecr=0 WS=128"
"4","0.000422","192.168.123.26","192.168.123.45","TCP","74","666  >  43388 [SYN, ACK] Seq=0 Ack=1 Win=65160 Len=0 MSS=1460 SACK_PERM=1 TSval=3091446385 TSecr=272649362 WS=128"
"5","0.000451","192.168.123.45","192.168.123.26","TCP","66","43388  >  666 [ACK] Seq=1 Ack=1 Win=64256 Len=0 TSval=272649363 TSecr=3091446385"
"6","0.000675","192.168.123.45","192.168.123.26","TLSv1.3","353","Client Hello"
"7","0.000743","192.168.123.26","192.168.123.45","TCP","66","666  >  43388 [ACK] Seq=1 Ack=288 Win=64896 Len=0 TSval=3091446385 TSecr=272649363"
"8","0.002357","192.168.123.26","192.168.123.45","TLSv1.3","1464","Server Hello, Change Cipher Spec, Application Data, Application Data, Application Data, Application Data, Application Data"
"9","0.002410","192.168.123.45","192.168.123.26","TCP","66","43388  >  666 [ACK] Seq=288 Ack=1399 Win=64128 Len=0 TSval=272649365 TSecr=3091446386"
"10","0.004470","192.168.123.45","192.168.123.26","TLSv1.3","756","Change Cipher Spec, Application Data, Application Data, Application Data"
"11","0.004509","192.168.123.26","192.168.123.45","TCP","66","666  >  43388 [ACK] Seq=1399 Ack=978 Win=64256 Len=0 TSval=3091446389 TSecr=272649367"
"12","0.004965","192.168.123.26","192.168.123.45","TLSv1.3","769","Application Data"
"13","0.004994","192.168.123.45","192.168.123.26","TCP","66","43388  >  666 [ACK] Seq=978 Ack=2102 Win=64128 Len=0 TSval=272649367 TSecr=3091446389"
"14","0.005169","192.168.123.26","192.168.123.45","TLSv1.3","769","Application Data"
"15","0.005198","192.168.123.45","192.168.123.26","TCP","66","43388  >  666 [ACK] Seq=978 Ack=2805 Win=64128 Len=0 TSval=272649367 TSecr=3091446389"
"18","0.079379","192.168.123.47","192.168.123.26","TCP","74","60840  >  666 [SYN] Seq=0 Win=64240 Len=0 MSS=1460 SACK_PERM=1 TSval=3327238776 TSecr=0 WS=128"
"19","0.079430","192.168.123.26","192.168.123.47","TCP","74","666  >  60840 [SYN, ACK] Seq=0 Ack=1 Win=65160 Len=0 MSS=1460 SACK_PERM=1 TSval=3242335390 TSecr=3327238776 WS=128"
"20","0.079473","192.168.123.47","192.168.123.26","TCP","66","60840  >  666 [ACK] Seq=1 Ack=1 Win=64256 Len=0 TSval=3327238777 TSecr=3242335390"
"21","0.079805","192.168.123.47","192.168.123.26","TLSv1.3","353","Client Hello"
"22","0.079869","192.168.123.26","192.168.123.47","TCP","66","666  >  60840 [ACK] Seq=1 Ack=288 Win=64896 Len=0 TSval=3242335390 TSecr=3327238777"
"23","0.081269","192.168.123.26","192.168.123.47","TLSv1.3","1464","Server Hello, Change Cipher Spec, Application Data, Application Data, Application Data, Application Data, Application Data"
"24","0.081312","192.168.123.47","192.168.123.26","TCP","66","60840  >  666 [ACK] Seq=288 Ack=1399 Win=64128 Len=0 TSval=3327238778 TSecr=3242335391"
"25","0.083350","192.168.123.47","192.168.123.26","TLSv1.3","756","Change Cipher Spec, Application Data, Application Data, Application Data"
"26","0.083387","192.168.123.26","192.168.123.47","TCP","66","666  >  60840 [ACK] Seq=1399 Ack=978 Win=64256 Len=0 TSval=3242335393 TSecr=3327238780"
"27","0.084061","192.168.123.26","192.168.123.47","TLSv1.3","769","Application Data"
"28","0.084107","192.168.123.47","192.168.123.26","TCP","66","60840  >  666 [ACK] Seq=978 Ack=2102 Win=64128 Len=0 TSval=3327238781 TSecr=3242335394"
"29","0.084235","192.168.123.26","192.168.123.47","TLSv1.3","769","Application Data"
"30","0.084262","192.168.123.47","192.168.123.26","TCP","66","60840  >  666 [ACK] Seq=978 Ack=2805 Win=64128 Len=0 TSval=3327238781 TSecr=3242335394"
"33","0.093543","192.168.123.27","192.168.123.26","TCP","74","43700  >  666 [SYN] Seq=0 Win=64240 Len=0 MSS=1460 SACK_PERM=1 TSval=3691951211 TSecr=0 WS=128"
"34","0.093576","192.168.123.26","192.168.123.27","TCP","74","666  >  43700 [SYN, ACK] Seq=0 Ack=1 Win=65160 Len=0 MSS=1460 SACK_PERM=1 TSval=791158488 TSecr=3691951211 WS=128"
"35","0.093603","192.168.123.27","192.168.123.26","TCP","66","43700  >  666 [ACK] Seq=1 Ack=1 Win=64256 Len=0 TSval=3691951212 TSecr=791158488"
"36","0.093953","192.168.123.27","192.168.123.26","TLSv1.3","353","Client Hello"
"37","0.094041","192.168.123.26","192.168.123.27","TCP","66","666  >  43700 [ACK] Seq=1 Ack=288 Win=64896 Len=0 TSval=791158488 TSecr=3691951212"
"38","0.095404","192.168.123.26","192.168.123.27","TLSv1.3","1464","Server Hello, Change Cipher Spec, Application Data, Application Data, Application Data, Application Data, Application Data"
"39","0.095461","192.168.123.27","192.168.123.26","TCP","66","43700  >  666 [ACK] Seq=288 Ack=1399 Win=64128 Len=0 TSval=3691951214 TSecr=791158489"
"40","0.097252","192.168.123.27","192.168.123.26","TLSv1.3","756","Change Cipher Spec, Application Data, Application Data, Application Data"
"41","0.097280","192.168.123.26","192.168.123.27","TCP","66","666  >  43700 [ACK] Seq=1399 Ack=978 Win=64256 Len=0 TSval=791158491 TSecr=3691951215"
"42","0.097753","192.168.123.26","192.168.123.27","TLSv1.3","769","Application Data"
"43","0.097977","192.168.123.27","192.168.123.26","TCP","66","43700  >  666 [ACK] Seq=978 Ack=2102 Win=63488 Len=0 TSval=3691951216 TSecr=791158492"
"44","0.097995","192.168.123.26","192.168.123.27","TLSv1.3","769","Application Data"
"45","0.098016","192.168.123.27","192.168.123.26","TCP","66","43700  >  666 [ACK] Seq=978 Ack=2805 Win=63616 Len=0 TSval=3691951216 TSecr=791158492"
"48","0.111638","192.168.123.41","192.168.123.26","TCP","74","46832  >  666 [SYN] Seq=0 Win=64240 Len=0 MSS=1460 SACK_PERM=1 TSval=3905422017 TSecr=0 WS=128"
"49","0.111685","192.168.123.26","192.168.123.41","TCP","74","666  >  46832 [SYN, ACK] Seq=0 Ack=1 Win=65160 Len=0 MSS=1460 SACK_PERM=1 TSval=2832871286 TSecr=3905422017 WS=128"
"50","0.111709","192.168.123.41","192.168.123.26","TCP","66","46832  >  666 [ACK] Seq=1 Ack=1 Win=64256 Len=0 TSval=3905422018 TSecr=2832871286"
"51","0.111963","192.168.123.41","192.168.123.26","TLSv1.3","353","Client Hello"
"52","0.112020","192.168.123.26","192.168.123.41","TCP","66","666  >  46832 [ACK] Seq=1 Ack=288 Win=64896 Len=0 TSval=2832871286 TSecr=3905422018"
"53","0.113072","192.168.123.26","192.168.123.41","TLSv1.3","1464","Server Hello, Change Cipher Spec, Application Data, Application Data, Application Data, Application Data, Application Data"
"54","0.113124","192.168.123.41","192.168.123.26","TCP","66","46832  >  666 [ACK] Seq=288 Ack=1399 Win=64128 Len=0 TSval=3905422019 TSecr=2832871287"
"55","0.114683","192.168.123.41","192.168.123.26","TLSv1.3","756","Change Cipher Spec, Application Data, Application Data, Application Data"
"56","0.114724","192.168.123.26","192.168.123.41","TCP","66","666  >  46832 [ACK] Seq=1399 Ack=978 Win=64256 Len=0 TSval=2832871289 TSecr=3905422021"
"57","0.115202","192.168.123.26","192.168.123.41","TLSv1.3","769","Application Data"
"58","0.115300","192.168.123.26","192.168.123.41","TLSv1.3","769","Application Data"
"59","0.115305","192.168.123.41","192.168.123.26","TCP","66","46832  >  666 [ACK] Seq=978 Ack=2102 Win=63488 Len=0 TSval=3905422021 TSecr=2832871289"
"60","0.115329","192.168.123.41","192.168.123.26","TCP","66","46832  >  666 [ACK] Seq=978 Ack=2805 Win=62848 Len=0 TSval=3905422021 TSecr=2832871289"
"63","0.133389","192.168.123.20","192.168.123.26","TCP","74","51628  >  666 [SYN] Seq=0 Win=64240 Len=0 MSS=1460 SACK_PERM=1 TSval=2328605319 TSecr=0 WS=128"
"64","0.133421","192.168.123.26","192.168.123.20","TCP","74","666  >  51628 [SYN, ACK] Seq=0 Ack=1 Win=65160 Len=0 MSS=1460 SACK_PERM=1 TSval=1053854938 TSecr=2328605319 WS=128"
"65","0.133449","192.168.123.20","192.168.123.26","TCP","66","51628  >  666 [ACK] Seq=1 Ack=1 Win=64256 Len=0 TSval=2328605320 TSecr=1053854938"
"66","0.133655","192.168.123.20","192.168.123.26","TLSv1.3","353","Client Hello"
"67","0.133751","192.168.123.26","192.168.123.20","TCP","66","666  >  51628 [ACK] Seq=1 Ack=288 Win=64896 Len=0 TSval=1053854938 TSecr=2328605320"
"68","0.134805","192.168.123.26","192.168.123.20","TLSv1.3","1464","Server Hello, Change Cipher Spec, Application Data, Application Data, Application Data, Application Data, Application Data"
"69","0.134834","192.168.123.20","192.168.123.26","TCP","66","51628  >  666 [ACK] Seq=288 Ack=1399 Win=64128 Len=0 TSval=2328605321 TSecr=1053854939"
"70","0.136855","192.168.123.20","192.168.123.26","TLSv1.3","756","Change Cipher Spec, Application Data, Application Data, Application Data"
"71","0.136889","192.168.123.26","192.168.123.20","TCP","66","666  >  51628 [ACK] Seq=1399 Ack=978 Win=64256 Len=0 TSval=1053854941 TSecr=2328605323"
"72","0.137342","192.168.123.26","192.168.123.20","TLSv1.3","769","Application Data"
"73","0.137378","192.168.123.20","192.168.123.26","TCP","66","51628  >  666 [ACK] Seq=978 Ack=2102 Win=64128 Len=0 TSval=2328605323 TSecr=1053854941"
"74","0.137495","192.168.123.26","192.168.123.20","TLSv1.3","769","Application Data"
"75","0.137513","192.168.123.20","192.168.123.26","TCP","66","51628  >  666 [ACK] Seq=978 Ack=2805 Win=64128 Len=0 TSval=2328605324 TSecr=1053854942"
"78","0.146447","192.168.123.44","192.168.123.26","TCP","74","39438  >  666 [SYN] Seq=0 Win=64240 Len=0 MSS=1460 SACK_PERM=1 TSval=2905323100 TSecr=0 WS=128"
"79","0.146478","192.168.123.26","192.168.123.44","TCP","74","666  >  39438 [SYN, ACK] Seq=0 Ack=1 Win=65160 Len=0 MSS=1460 SACK_PERM=1 TSval=722067586 TSecr=2905323100 WS=128"
"80","0.146512","192.168.123.44","192.168.123.26","TCP","66","39438  >  666 [ACK] Seq=1 Ack=1 Win=64256 Len=0 TSval=2905323101 TSecr=722067586"
"81","0.146745","192.168.123.44","192.168.123.26","TLSv1.3","353","Client Hello"
"82","0.146803","192.168.123.26","192.168.123.44","TCP","66","666  >  39438 [ACK] Seq=1 Ack=288 Win=64896 Len=0 TSval=722067586 TSecr=2905323101"
"83","0.147564","192.168.123.26","192.168.123.44","TLSv1.3","1464","Server Hello, Change Cipher Spec, Application Data, Application Data, Application Data, Application Data, Application Data"
"84","0.147604","192.168.123.44","192.168.123.26","TCP","66","39438  >  666 [ACK] Seq=288 Ack=1399 Win=64128 Len=0 TSval=2905323102 TSecr=722067587"
"85","0.148881","192.168.123.44","192.168.123.26","TLSv1.3","756","Change Cipher Spec, Application Data, Application Data, Application Data"
"86","0.148912","192.168.123.26","192.168.123.44","TCP","66","666  >  39438 [ACK] Seq=1399 Ack=978 Win=64256 Len=0 TSval=722067588 TSecr=2905323103"
"87","0.149334","192.168.123.26","192.168.123.44","TLSv1.3","769","Application Data"
"88","0.149439","192.168.123.26","192.168.123.44","TLSv1.3","769","Application Data"
"89","0.149512","192.168.123.44","192.168.123.26","TCP","66","39438  >  666 [ACK] Seq=978 Ack=2102 Win=63488 Len=0 TSval=2905323104 TSecr=722067588"
"90","0.149535","192.168.123.44","192.168.123.26","TCP","66","39438  >  666 [ACK] Seq=978 Ack=2805 Win=62848 Len=0 TSval=2905323104 TSecr=722067589"
"93","0.152974","192.168.123.3","192.168.123.26","TCP","74","41330  >  666 [SYN] Seq=0 Win=64240 Len=0 MSS=1460 SACK_PERM=1 TSval=445624440 TSecr=0 WS=128"
"94","0.153008","192.168.123.26","192.168.123.3","TCP","74","666  >  41330 [SYN, ACK] Seq=0 Ack=1 Win=65160 Len=0 MSS=1460 SACK_PERM=1 TSval=3434786277 TSecr=445624440 WS=128"
"95","0.153035","192.168.123.3","192.168.123.26","TCP","66","41330  >  666 [ACK] Seq=1 Ack=1 Win=64256 Len=0 TSval=445624441 TSecr=3434786277"
"96","0.153245","192.168.123.3","192.168.123.26","TLSv1.3","353","Client Hello"
"97","0.153318","192.168.123.26","192.168.123.3","TCP","66","666  >  41330 [ACK] Seq=1 Ack=288 Win=64896 Len=0 TSval=3434786277 TSecr=445624441"
"98","0.154196","192.168.123.26","192.168.123.3","TLSv1.3","1464","Server Hello, Change Cipher Spec, Application Data, Application Data, Application Data, Application Data, Application Data"
"99","0.154230","192.168.123.3","192.168.123.26","TCP","66","41330  >  666 [ACK] Seq=288 Ack=1399 Win=64128 Len=0 TSval=445624442 TSecr=3434786278"
"100","0.155768","192.168.123.3","192.168.123.26","TLSv1.3","756","Change Cipher Spec, Application Data, Application Data, Application Data"
"101","0.155799","192.168.123.26","192.168.123.3","TCP","66","666  >  41330 [ACK] Seq=1399 Ack=978 Win=64256 Len=0 TSval=3434786280 TSecr=445624444"
"102","0.156264","192.168.123.26","192.168.123.3","TLSv1.3","769","Application Data"
"103","0.156371","192.168.123.26","192.168.123.3","TLSv1.3","769","Application Data"
"104","0.156447","192.168.123.3","192.168.123.26","TCP","66","41330  >  666 [ACK] Seq=978 Ack=2102 Win=63488 Len=0 TSval=445624445 TSecr=3434786280"
"105","0.156484","192.168.123.3","192.168.123.26","TCP","66","41330  >  666 [ACK] Seq=978 Ack=2805 Win=62848 Len=0 TSval=445624445 TSecr=3434786280"
"108","0.165830","192.168.123.35","192.168.123.26","TCP","74","34218  >  666 [SYN] Seq=0 Win=64240 Len=0 MSS=1460 SACK_PERM=1 TSval=4111253324 TSecr=0 WS=128"
"109","0.165881","192.168.123.26","192.168.123.35","TCP","74","666  >  34218 [SYN, ACK] Seq=0 Ack=1 Win=65160 Len=0 MSS=1460 SACK_PERM=1 TSval=1320736265 TSecr=4111253324 WS=128"
"110","0.165944","192.168.123.35","192.168.123.26","TCP","66","34218  >  666 [ACK] Seq=1 Ack=1 Win=64256 Len=0 TSval=4111253325 TSecr=1320736265"
"111","0.166315","192.168.123.35","192.168.123.26","TLSv1.3","353","Client Hello"
"112","0.166404","192.168.123.26","192.168.123.35","TCP","66","666  >  34218 [ACK] Seq=1 Ack=288 Win=64896 Len=0 TSval=1320736265 TSecr=4111253325"
"113","0.167520","192.168.123.26","192.168.123.35","TLSv1.3","1464","Server Hello, Change Cipher Spec, Application Data, Application Data, Application Data, Application Data, Application Data"
"114","0.167551","192.168.123.35","192.168.123.26","TCP","66","34218  >  666 [ACK] Seq=288 Ack=1399 Win=64128 Len=0 TSval=4111253327 TSecr=1320736267"
"115","0.170362","192.168.123.35","192.168.123.26","TLSv1.3","756","Change Cipher Spec, Application Data, Application Data, Application Data"
"116","0.170395","192.168.123.26","192.168.123.35","TCP","66","666  >  34218 [ACK] Seq=1399 Ack=978 Win=64256 Len=0 TSval=1320736269 TSecr=4111253329"
"118","0.171073","192.168.123.26","192.168.123.35","TLSv1.3","769","Application Data"
"119","0.171114","192.168.123.35","192.168.123.26","TCP","66","34218  >  666 [ACK] Seq=978 Ack=2102 Win=64128 Len=0 TSval=4111253330 TSecr=1320736270"
"121","0.171304","192.168.123.26","192.168.123.35","TLSv1.3","769","Application Data"
"122","0.171327","192.168.123.31","192.168.123.26","TCP","74","56386  >  666 [SYN] Seq=0 Win=64240 Len=0 MSS=1460 SACK_PERM=1 TSval=157576621 TSecr=0 WS=128"
"123","0.171330","192.168.123.35","192.168.123.26","TCP","66","34218  >  666 [ACK] Seq=978 Ack=2805 Win=64128 Len=0 TSval=4111253330 TSecr=1320736270"
"124","0.171371","192.168.123.26","192.168.123.31","TCP","74","666  >  56386 [SYN, ACK] Seq=0 Ack=1 Win=65160 Len=0 MSS=1460 SACK_PERM=1 TSval=892795575 TSecr=157576621 WS=128"
"125","0.171406","192.168.123.31","192.168.123.26","TCP","66","56386  >  666 [ACK] Seq=1 Ack=1 Win=64256 Len=0 TSval=157576622 TSecr=892795575"
"127","0.171701","192.168.123.31","192.168.123.26","TLSv1.3","353","Client Hello"
"129","0.171784","192.168.123.26","192.168.123.31","TCP","66","666  >  56386 [ACK] Seq=1 Ack=288 Win=64896 Len=0 TSval=892795576 TSecr=157576622"
"131","0.171912","192.168.123.10","192.168.123.26","TCP","74","47026  >  666 [SYN] Seq=0 Win=64240 Len=0 MSS=1460 SACK_PERM=1 TSval=2022374859 TSecr=0 WS=128"
"132","0.171952","192.168.123.26","192.168.123.10","TCP","74","666  >  47026 [SYN, ACK] Seq=0 Ack=1 Win=65160 Len=0 MSS=1460 SACK_PERM=1 TSval=414101947 TSecr=2022374859 WS=128"
"134","0.171989","192.168.123.10","192.168.123.26","TCP","66","47026  >  666 [ACK] Seq=1 Ack=1 Win=64256 Len=0 TSval=2022374860 TSecr=414101947"
"135","0.172012","192.168.123.49","192.168.123.26","TCP","74","55884  >  666 [SYN] Seq=0 Win=64240 Len=0 MSS=1460 SACK_PERM=1 TSval=3125075976 TSecr=0 WS=128"
"137","0.172052","192.168.123.26","192.168.123.49","TCP","74","666  >  55884 [SYN, ACK] Seq=0 Ack=1 Win=65160 Len=0 MSS=1460 SACK_PERM=1 TSval=3869703397 TSecr=3125075976 WS=128"
"138","0.172087","192.168.123.49","192.168.123.26","TCP","66","55884  >  666 [ACK] Seq=1 Ack=1 Win=64256 Len=0 TSval=3125075976 TSecr=3869703397"
"139","0.172278","192.168.123.10","192.168.123.26","TLSv1.3","353","Client Hello"
"141","0.172312","192.168.123.46","192.168.123.26","TCP","74","54706  >  666 [SYN] Seq=0 Win=64240 Len=0 MSS=1460 SACK_PERM=1 TSval=2211442677 TSecr=0 WS=128"
"142","0.172358","192.168.123.26","192.168.123.10","TCP","66","666  >  47026 [ACK] Seq=1 Ack=288 Win=64896 Len=0 TSval=414101947 TSecr=2022374860"
"143","0.172361","192.168.123.49","192.168.123.26","TLSv1.3","353","Client Hello"
"144","0.172363","192.168.123.26","192.168.123.46","TCP","74","666  >  54706 [SYN, ACK] Seq=0 Ack=1 Win=65160 Len=0 MSS=1460 SACK_PERM=1 TSval=1496686942 TSecr=2211442677 WS=128"
"145","0.172403","192.168.123.46","192.168.123.26","TCP","66","54706  >  666 [ACK] Seq=1 Ack=1 Win=64256 Len=0 TSval=2211442678 TSecr=1496686942"
"146","0.172419","192.168.123.26","192.168.123.49","TCP","66","666  >  55884 [ACK] Seq=1 Ack=288 Win=64896 Len=0 TSval=3869703398 TSecr=3125075976"
"147","0.172682","192.168.123.26","192.168.123.31","TLSv1.3","1464","Server Hello, Change Cipher Spec, Application Data, Application Data, Application Data, Application Data, Application Data"
"148","0.172722","192.168.123.31","192.168.123.26","TCP","66","56386  >  666 [ACK] Seq=288 Ack=1399 Win=64128 Len=0 TSval=157576623 TSecr=892795577"
"149","0.173503","192.168.123.26","192.168.123.10","TLSv1.3","1464","Server Hello, Change Cipher Spec, Application Data, Application Data, Application Data, Application Data, Application Data"
"150","0.173503","192.168.123.26","192.168.123.49","TLSv1.3","1464","Server Hello, Change Cipher Spec, Application Data, Application Data, Application Data, Application Data, Application Data"
"151","0.173552","192.168.123.10","192.168.123.26","TCP","66","47026  >  666 [ACK] Seq=288 Ack=1399 Win=64128 Len=0 TSval=2022374862 TSecr=414101949"
"152","0.173552","192.168.123.49","192.168.123.26","TCP","66","55884  >  666 [ACK] Seq=288 Ack=1399 Win=64128 Len=0 TSval=3125075978 TSecr=3869703399"
"153","0.173906","192.168.123.46","192.168.123.26","TLSv1.3","353","Client Hello"
"154","0.173973","192.168.123.26","192.168.123.46","TCP","66","666  >  54706 [ACK] Seq=1 Ack=288 Win=64896 Len=0 TSval=1496686944 TSecr=2211442679"
"155","0.174677","192.168.123.26","192.168.123.46","TLSv1.3","1464","Server Hello, Change Cipher Spec, Application Data, Application Data, Application Data, Application Data, Application Data"
"156","0.174708","192.168.123.46","192.168.123.26","TCP","66","54706  >  666 [ACK] Seq=288 Ack=1399 Win=64128 Len=0 TSval=2211442680 TSecr=1496686945"
"157","0.174767","192.168.123.31","192.168.123.26","TLSv1.3","756","Change Cipher Spec, Application Data, Application Data, Application Data"
"158","0.174807","192.168.123.26","192.168.123.31","TCP","66","666  >  56386 [ACK] Seq=1399 Ack=978 Win=64256 Len=0 TSval=892795579 TSecr=157576625"
"159","0.175351","192.168.123.49","192.168.123.26","TLSv1.3","756","Change Cipher Spec, Application Data, Application Data, Application Data"
"160","0.175397","192.168.123.26","192.168.123.49","TCP","66","666  >  55884 [ACK] Seq=1399 Ack=978 Win=64256 Len=0 TSval=3869703400 TSecr=3125075979"
"161","0.175554","192.168.123.26","192.168.123.31","TLSv1.3","769","Application Data"
"162","0.175582","192.168.123.31","192.168.123.26","TCP","66","56386  >  666 [ACK] Seq=978 Ack=2102 Win=64128 Len=0 TSval=157576626 TSecr=892795580"
"163","0.175692","192.168.123.26","192.168.123.31","TLSv1.3","769","Application Data"
"164","0.175712","192.168.123.31","192.168.123.26","TCP","66","56386  >  666 [ACK] Seq=978 Ack=2805 Win=64128 Len=0 TSval=157576626 TSecr=892795580"
"165","0.175899","192.168.123.26","192.168.123.49","TLSv1.3","769","Application Data"
"166","0.175930","192.168.123.49","192.168.123.26","TCP","66","55884  >  666 [ACK] Seq=978 Ack=2102 Win=64128 Len=0 TSval=3125075980 TSecr=3869703401"
"167","0.176049","192.168.123.10","192.168.123.26","TLSv1.3","756","Change Cipher Spec, Application Data, Application Data, Application Data"
"168","0.176063","192.168.123.26","192.168.123.49","TLSv1.3","769","Application Data"
"169","0.176083","192.168.123.49","192.168.123.26","TCP","66","55884  >  666 [ACK] Seq=978 Ack=2805 Win=64128 Len=0 TSval=3125075980 TSecr=3869703401"
"170","0.176092","192.168.123.26","192.168.123.10","TCP","66","666  >  47026 [ACK] Seq=1399 Ack=978 Win=64256 Len=0 TSval=414101951 TSecr=2022374864"
"171","0.176678","192.168.123.26","192.168.123.10","TLSv1.3","769","Application Data"
"172","0.176711","192.168.123.10","192.168.123.26","TCP","66","47026  >  666 [ACK] Seq=978 Ack=2102 Win=64128 Len=0 TSval=2022374865 TSecr=414101952"
"173","0.176889","192.168.123.26","192.168.123.10","TLSv1.3","769","Application Data"
"174","0.176920","192.168.123.10","192.168.123.26","TCP","66","47026  >  666 [ACK] Seq=978 Ack=2805 Win=64128 Len=0 TSval=2022374865 TSecr=414101952"
"175","0.178357","192.168.123.46","192.168.123.26","TLSv1.3","756","Change Cipher Spec, Application Data, Application Data, Application Data"
"176","0.178387","192.168.123.26","192.168.123.46","TCP","66","666  >  54706 [ACK] Seq=1399 Ack=978 Win=64256 Len=0 TSval=1496686948 TSecr=2211442683"
"177","0.178871","192.168.123.26","192.168.123.46","TLSv1.3","769","Application Data"
"178","0.178971","192.168.123.26","192.168.123.46","TLSv1.3","769","Application Data"
"179","0.179081","192.168.123.46","192.168.123.26","TCP","66","54706  >  666 [ACK] Seq=978 Ack=2102 Win=63488 Len=0 TSval=2211442684 TSecr=1496686949"
"180","0.179102","192.168.123.46","192.168.123.26","TCP","66","54706  >  666 [ACK] Seq=978 Ack=2805 Win=62848 Len=0 TSval=2211442684 TSecr=1496686949"
"183","0.207389","192.168.123.40","192.168.123.26","TCP","74","55416  >  666 [SYN] Seq=0 Win=64240 Len=0 MSS=1460 SACK_PERM=1 TSval=594728345 TSecr=0 WS=128"
"184","0.207423","192.168.123.26","192.168.123.40","TCP","74","666  >  55416 [SYN, ACK] Seq=0 Ack=1 Win=65160 Len=0 MSS=1460 SACK_PERM=1 TSval=4212530100 TSecr=594728345 WS=128"
"185","0.207451","192.168.123.40","192.168.123.26","TCP","66","55416  >  666 [ACK] Seq=1 Ack=1 Win=64256 Len=0 TSval=594728346 TSecr=4212530100"
"186","0.207665","192.168.123.40","192.168.123.26","TLSv1.3","353","Client Hello"
"187","0.207728","192.168.123.26","192.168.123.40","TCP","66","666  >  55416 [ACK] Seq=1 Ack=288 Win=64896 Len=0 TSval=4212530100 TSecr=594728346"
"188","0.208501","192.168.123.26","192.168.123.40","TLSv1.3","1464","Server Hello, Change Cipher Spec, Application Data, Application Data, Application Data, Application Data, Application Data"
"189","0.208540","192.168.123.40","192.168.123.26","TCP","66","55416  >  666 [ACK] Seq=288 Ack=1399 Win=64128 Len=0 TSval=594728347 TSecr=4212530101"
"192","0.211490","192.168.123.38","192.168.123.26","TCP","74","36584  >  666 [SYN] Seq=0 Win=64240 Len=0 MSS=1460 SACK_PERM=1 TSval=586491864 TSecr=0 WS=128"
"193","0.211522","192.168.123.26","192.168.123.38","TCP","74","666  >  36584 [SYN, ACK] Seq=0 Ack=1 Win=65160 Len=0 MSS=1460 SACK_PERM=1 TSval=2283539492 TSecr=586491864 WS=128"
"194","0.211550","192.168.123.38","192.168.123.26","TCP","66","36584  >  666 [ACK] Seq=1 Ack=1 Win=64256 Len=0 TSval=586491865 TSecr=2283539492"
"195","0.211766","192.168.123.38","192.168.123.26","TLSv1.3","353","Client Hello"
"196","0.211845","192.168.123.26","192.168.123.38","TCP","66","666  >  36584 [ACK] Seq=1 Ack=288 Win=64896 Len=0 TSval=2283539492 TSecr=586491865"
"197","0.212628","192.168.123.26","192.168.123.38","TLSv1.3","1464","Server Hello, Change Cipher Spec, Application Data, Application Data, Application Data, Application Data, Application Data"
"198","0.212661","192.168.123.38","192.168.123.26","TCP","66","36584  >  666 [ACK] Seq=288 Ack=1399 Win=64128 Len=0 TSval=586491866 TSecr=2283539493"
"199","0.214711","192.168.123.40","192.168.123.26","TLSv1.3","756","Change Cipher Spec, Application Data, Application Data, Application Data"
"200","0.214743","192.168.123.26","192.168.123.40","TCP","66","666  >  55416 [ACK] Seq=1399 Ack=978 Win=64256 Len=0 TSval=4212530107 TSecr=594728353"
"202","0.215202","192.168.123.26","192.168.123.40","TLSv1.3","769","Application Data"
"204","0.215258","192.168.123.25","192.168.123.26","TCP","74","59004  >  666 [SYN] Seq=0 Win=64240 Len=0 MSS=1460 SACK_PERM=1 TSval=3921325388 TSecr=0 WS=128"
"205","0.215288","192.168.123.26","192.168.123.25","TCP","74","666  >  59004 [SYN, ACK] Seq=0 Ack=1 Win=65160 Len=0 MSS=1460 SACK_PERM=1 TSval=904531498 TSecr=3921325388 WS=128"
"206","0.215306","192.168.123.26","192.168.123.40","TLSv1.3","769","Application Data"
"207","0.215314","192.168.123.25","192.168.123.26","TCP","66","59004  >  666 [ACK] Seq=1 Ack=1 Win=64256 Len=0 TSval=3921325388 TSecr=904531498"
"208","0.215377","192.168.123.40","192.168.123.26","TCP","66","55416  >  666 [ACK] Seq=978 Ack=2102 Win=63488 Len=0 TSval=594728353 TSecr=4212530107"
"209","0.215399","192.168.123.40","192.168.123.26","TCP","66","55416  >  666 [ACK] Seq=978 Ack=2805 Win=62848 Len=0 TSval=594728354 TSecr=4212530107"
"210","0.215470","192.168.123.38","192.168.123.26","TLSv1.3","756","Change Cipher Spec, Application Data, Application Data, Application Data"
"211","0.215517","192.168.123.26","192.168.123.38","TCP","66","666  >  36584 [ACK] Seq=1399 Ack=978 Win=64256 Len=0 TSval=2283539496 TSecr=586491869"
"212","0.215526","192.168.123.25","192.168.123.26","TLSv1.3","353","Client Hello"
"213","0.215586","192.168.123.26","192.168.123.25","TCP","66","666  >  59004 [ACK] Seq=1 Ack=288 Win=64896 Len=0 TSval=904531499 TSecr=3921325389"
"214","0.216019","192.168.123.26","192.168.123.38","TLSv1.3","769","Application Data"
"215","0.216118","192.168.123.26","192.168.123.38","TLSv1.3","769","Application Data"
"216","0.216189","192.168.123.38","192.168.123.26","TCP","66","36584  >  666 [ACK] Seq=978 Ack=2102 Win=63488 Len=0 TSval=586491869 TSecr=2283539496"
"217","0.216210","192.168.123.38","192.168.123.26","TCP","66","36584  >  666 [ACK] Seq=978 Ack=2805 Win=62848 Len=0 TSval=586491869 TSecr=2283539496"
"218","0.216455","192.168.123.26","192.168.123.25","TLSv1.3","1464","Server Hello, Change Cipher Spec, Application Data, Application Data, Application Data, Application Data, Application Data"
"219","0.216484","192.168.123.25","192.168.123.26","TCP","66","59004  >  666 [ACK] Seq=288 Ack=1399 Win=64128 Len=0 TSval=3921325390 TSecr=904531500"
"221","0.218288","192.168.123.25","192.168.123.26","TLSv1.3","756","Change Cipher Spec, Application Data, Application Data, Application Data"
"223","0.218315","192.168.123.14","192.168.123.26","TCP","74","35718  >  666 [SYN] Seq=0 Win=64240 Len=0 MSS=1460 SACK_PERM=1 TSval=1674640954 TSecr=0 WS=128"
"224","0.218342","192.168.123.26","192.168.123.25","TCP","66","666  >  59004 [ACK] Seq=1399 Ack=978 Win=64256 Len=0 TSval=904531501 TSecr=3921325391"
"225","0.218361","192.168.123.26","192.168.123.14","TCP","74","666  >  35718 [SYN, ACK] Seq=0 Ack=1 Win=65160 Len=0 MSS=1460 SACK_PERM=1 TSval=838934125 TSecr=1674640954 WS=128"
"226","0.218387","192.168.123.14","192.168.123.26","TCP","66","35718  >  666 [ACK] Seq=1 Ack=1 Win=64256 Len=0 TSval=1674640954 TSecr=838934125"
"227","0.218607","192.168.123.14","192.168.123.26","TLSv1.3","353","Client Hello"
"228","0.218682","192.168.123.26","192.168.123.14","TCP","66","666  >  35718 [ACK] Seq=1 Ack=288 Win=64896 Len=0 TSval=838934126 TSecr=1674640955"
"229","0.218844","192.168.123.26","192.168.123.25","TLSv1.3","769","Application Data"
"230","0.218882","192.168.123.25","192.168.123.26","TCP","66","59004  >  666 [ACK] Seq=978 Ack=2102 Win=64128 Len=0 TSval=3921325392 TSecr=904531502"
"231","0.219010","192.168.123.26","192.168.123.25","TLSv1.3","769","Application Data"
"232","0.219029","192.168.123.25","192.168.123.26","TCP","66","59004  >  666 [ACK] Seq=978 Ack=2805 Win=64128 Len=0 TSval=3921325392 TSecr=904531502"
"233","0.219538","192.168.123.26","192.168.123.14","TLSv1.3","1464","Server Hello, Change Cipher Spec, Application Data, Application Data, Application Data, Application Data, Application Data"
"234","0.219567","192.168.123.14","192.168.123.26","TCP","66","35718  >  666 [ACK] Seq=288 Ack=1399 Win=64128 Len=0 TSval=1674640956 TSecr=838934127"
"235","0.220893","192.168.123.14","192.168.123.26","TLSv1.3","756","Change Cipher Spec, Application Data, Application Data, Application Data"
"236","0.220920","192.168.123.26","192.168.123.14","TCP","66","666  >  35718 [ACK] Seq=1399 Ack=978 Win=64256 Len=0 TSval=838934128 TSecr=1674640957"
"237","0.221402","192.168.123.26","192.168.123.14","TLSv1.3","769","Application Data"
"238","0.221529","192.168.123.26","192.168.123.14","TLSv1.3","769","Application Data"
"239","0.221533","192.168.123.14","192.168.123.26","TCP","66","35718  >  666 [ACK] Seq=978 Ack=2102 Win=63488 Len=0 TSval=1674640958 TSecr=838934129"
"240","0.221558","192.168.123.14","192.168.123.26","TCP","66","35718  >  666 [ACK] Seq=978 Ack=2805 Win=62848 Len=0 TSval=1674640958 TSecr=838934129"
"243","0.227370","192.168.123.48","192.168.123.26","TCP","74","35278  >  666 [SYN] Seq=0 Win=64240 Len=0 MSS=1460 SACK_PERM=1 TSval=2730211928 TSecr=0 WS=128"
"244","0.227406","192.168.123.26","192.168.123.48","TCP","74","666  >  35278 [SYN, ACK] Seq=0 Ack=1 Win=65160 Len=0 MSS=1460 SACK_PERM=1 TSval=3013678931 TSecr=2730211928 WS=128"
"245","0.227446","192.168.123.48","192.168.123.26","TCP","66","35278  >  666 [ACK] Seq=1 Ack=1 Win=64256 Len=0 TSval=2730211929 TSecr=3013678931"
"246","0.227748","192.168.123.48","192.168.123.26","TLSv1.3","353","Client Hello"
"247","0.227807","192.168.123.26","192.168.123.48","TCP","66","666  >  35278 [ACK] Seq=1 Ack=288 Win=64896 Len=0 TSval=3013678931 TSecr=2730211929"
"248","0.228732","192.168.123.26","192.168.123.48","TLSv1.3","1464","Server Hello, Change Cipher Spec, Application Data, Application Data, Application Data, Application Data, Application Data"
"249","0.228771","192.168.123.48","192.168.123.26","TCP","66","35278  >  666 [ACK] Seq=288 Ack=1399 Win=64128 Len=0 TSval=2730211930 TSecr=3013678932"
"250","0.231490","192.168.123.48","192.168.123.26","TLSv1.3","756","Change Cipher Spec, Application Data, Application Data, Application Data"
"251","0.231518","192.168.123.26","192.168.123.48","TCP","66","666  >  35278 [ACK] Seq=1399 Ack=978 Win=64256 Len=0 TSval=3013678935 TSecr=2730211933"
"252","0.232148","192.168.123.26","192.168.123.48","TLSv1.3","769","Application Data"
"253","0.232179","192.168.123.48","192.168.123.26","TCP","66","35278  >  666 [ACK] Seq=978 Ack=2102 Win=64128 Len=0 TSval=2730211933 TSecr=3013678935"
"254","0.232352","192.168.123.26","192.168.123.48","TLSv1.3","769","Application Data"
"255","0.232379","192.168.123.48","192.168.123.26","TCP","66","35278  >  666 [ACK] Seq=978 Ack=2805 Win=64128 Len=0 TSval=2730211933 TSecr=3013678935"
"258","0.233654","192.168.123.7","192.168.123.26","TCP","74","45396  >  666 [SYN] Seq=0 Win=64240 Len=0 MSS=1460 SACK_PERM=1 TSval=1817355897 TSecr=0 WS=128"
"259","0.233686","192.168.123.26","192.168.123.7","TCP","74","666  >  45396 [SYN, ACK] Seq=0 Ack=1 Win=65160 Len=0 MSS=1460 SACK_PERM=1 TSval=3559737537 TSecr=1817355897 WS=128"
"260","0.233713","192.168.123.7","192.168.123.26","TCP","66","45396  >  666 [ACK] Seq=1 Ack=1 Win=64256 Len=0 TSval=1817355898 TSecr=3559737537"
"261","0.234020","192.168.123.7","192.168.123.26","TLSv1.3","353","Client Hello"
"262","0.234090","192.168.123.26","192.168.123.7","TCP","66","666  >  45396 [ACK] Seq=1 Ack=288 Win=64896 Len=0 TSval=3559737537 TSecr=1817355898"
"263","0.234973","192.168.123.26","192.168.123.7","TLSv1.3","1464","Server Hello, Change Cipher Spec, Application Data, Application Data, Application Data, Application Data, Application Data"
"264","0.235043","192.168.123.7","192.168.123.26","TCP","66","45396  >  666 [ACK] Seq=288 Ack=1399 Win=64128 Len=0 TSval=1817355899 TSecr=3559737538"
"267","0.235558","192.168.123.6","192.168.123.26","TCP","74","58162  >  666 [SYN] Seq=0 Win=64240 Len=0 MSS=1460 SACK_PERM=1 TSval=1792835795 TSecr=0 WS=128"
"268","0.235587","192.168.123.26","192.168.123.6","TCP","74","666  >  58162 [SYN, ACK] Seq=0 Ack=1 Win=65160 Len=0 MSS=1460 SACK_PERM=1 TSval=4005801241 TSecr=1792835795 WS=128"
"269","0.235614","192.168.123.6","192.168.123.26","TCP","66","58162  >  666 [ACK] Seq=1 Ack=1 Win=64256 Len=0 TSval=1792835796 TSecr=4005801241"
"270","0.235848","192.168.123.6","192.168.123.26","TLSv1.3","353","Client Hello"
"271","0.235914","192.168.123.26","192.168.123.6","TCP","66","666  >  58162 [ACK] Seq=1 Ack=288 Win=64896 Len=0 TSval=4005801241 TSecr=1792835796"
"274","0.236500","192.168.123.17","192.168.123.26","TCP","74","48512  >  666 [SYN] Seq=0 Win=64240 Len=0 MSS=1460 SACK_PERM=1 TSval=691008206 TSecr=0 WS=128"
"275","0.236526","192.168.123.26","192.168.123.17","TCP","74","666  >  48512 [SYN, ACK] Seq=0 Ack=1 Win=65160 Len=0 MSS=1460 SACK_PERM=1 TSval=2161731961 TSecr=691008206 WS=128"
"276","0.236551","192.168.123.17","192.168.123.26","TCP","66","48512  >  666 [ACK] Seq=1 Ack=1 Win=64256 Len=0 TSval=691008207 TSecr=2161731961"
"277","0.236667","192.168.123.26","192.168.123.6","TLSv1.3","1464","Server Hello, Change Cipher Spec, Application Data, Application Data, Application Data, Application Data, Application Data"
"278","0.236700","192.168.123.6","192.168.123.26","TCP","66","58162  >  666 [ACK] Seq=288 Ack=1399 Win=64128 Len=0 TSval=1792835797 TSecr=4005801242"
"279","0.236780","192.168.123.17","192.168.123.26","TLSv1.3","353","Client Hello"
"280","0.236828","192.168.123.26","192.168.123.17","TCP","66","666  >  48512 [ACK] Seq=1 Ack=288 Win=64896 Len=0 TSval=2161731961 TSecr=691008207"
"281","0.237530","192.168.123.26","192.168.123.17","TLSv1.3","1464","Server Hello, Change Cipher Spec, Application Data, Application Data, Application Data, Application Data, Application Data"
"282","0.237561","192.168.123.17","192.168.123.26","TCP","66","48512  >  666 [ACK] Seq=288 Ack=1399 Win=64128 Len=0 TSval=691008208 TSecr=2161731962"
"283","0.238746","192.168.123.7","192.168.123.26","TLSv1.3","756","Change Cipher Spec, Application Data, Application Data, Application Data"
"284","0.238787","192.168.123.26","192.168.123.7","TCP","66","666  >  45396 [ACK] Seq=1399 Ack=978 Win=64256 Len=0 TSval=3559737542 TSecr=1817355903"
"285","0.238826","192.168.123.17","192.168.123.26","TLSv1.3","756","Change Cipher Spec, Application Data, Application Data, Application Data"
"286","0.238854","192.168.123.26","192.168.123.17","TCP","66","666  >  48512 [ACK] Seq=1399 Ack=978 Win=64256 Len=0 TSval=2161731963 TSecr=691008209"
"287","0.239416","192.168.123.26","192.168.123.7","TLSv1.3","769","Application Data"
"288","0.239455","192.168.123.26","192.168.123.17","TLSv1.3","769","Application Data"
"289","0.239502","192.168.123.17","192.168.123.26","TCP","66","48512  >  666 [ACK] Seq=978 Ack=2102 Win=64128 Len=0 TSval=691008210 TSecr=2161731964"
"290","0.239638","192.168.123.26","192.168.123.17","TLSv1.3","769","Application Data"
"291","0.239639","192.168.123.26","192.168.123.7","TLSv1.3","769","Application Data"
"292","0.239664","192.168.123.17","192.168.123.26","TCP","66","48512  >  666 [ACK] Seq=978 Ack=2805 Win=64128 Len=0 TSval=691008210 TSecr=2161731964"
"293","0.239746","192.168.123.7","192.168.123.26","TCP","66","45396  >  666 [ACK] Seq=978 Ack=2102 Win=63488 Len=0 TSval=1817355904 TSecr=3559737543"
"294","0.239783","192.168.123.7","192.168.123.26","TCP","66","45396  >  666 [ACK] Seq=978 Ack=2805 Win=62848 Len=0 TSval=1817355904 TSecr=3559737543"
"295","0.241470","192.168.123.6","192.168.123.26","TLSv1.3","756","Change Cipher Spec, Application Data, Application Data, Application Data"
"296","0.241505","192.168.123.26","192.168.123.6","TCP","66","666  >  58162 [ACK] Seq=1399 Ack=978 Win=64256 Len=0 TSval=4005801247 TSecr=1792835802"
"297","0.241999","192.168.123.26","192.168.123.6","TLSv1.3","769","Application Data"
"298","0.242028","192.168.123.6","192.168.123.26","TCP","66","58162  >  666 [ACK] Seq=978 Ack=2102 Win=64128 Len=0 TSval=1792835802 TSecr=4005801247"
"299","0.242155","192.168.123.26","192.168.123.6","TLSv1.3","769","Application Data"
"300","0.242177","192.168.123.6","192.168.123.26","TCP","66","58162  >  666 [ACK] Seq=978 Ack=2805 Win=64128 Len=0 TSval=1792835802 TSecr=4005801247"
"303","0.248236","192.168.123.22","192.168.123.26","TCP","74","50552  >  666 [SYN] Seq=0 Win=64240 Len=0 MSS=1460 SACK_PERM=1 TSval=3569817133 TSecr=0 WS=128"
"304","0.248282","192.168.123.26","192.168.123.22","TCP","74","666  >  50552 [SYN, ACK] Seq=0 Ack=1 Win=65160 Len=0 MSS=1460 SACK_PERM=1 TSval=2318196392 TSecr=3569817133 WS=128"
"305","0.248325","192.168.123.22","192.168.123.26","TCP","66","50552  >  666 [ACK] Seq=1 Ack=1 Win=64256 Len=0 TSval=3569817134 TSecr=2318196392"
"306","0.248796","192.168.123.22","192.168.123.26","TLSv1.3","353","Client Hello"
"307","0.248892","192.168.123.26","192.168.123.22","TCP","66","666  >  50552 [ACK] Seq=1 Ack=288 Win=64896 Len=0 TSval=2318196393 TSecr=3569817135"
"310","0.249305","192.168.123.39","192.168.123.26","TCP","74","48444  >  666 [SYN] Seq=0 Win=64240 Len=0 MSS=1460 SACK_PERM=1 TSval=2980920893 TSecr=0 WS=128"
"311","0.249346","192.168.123.26","192.168.123.39","TCP","74","666  >  48444 [SYN, ACK] Seq=0 Ack=1 Win=65160 Len=0 MSS=1460 SACK_PERM=1 TSval=1489221474 TSecr=2980920893 WS=128"
"312","0.249402","192.168.123.39","192.168.123.26","TCP","66","48444  >  666 [ACK] Seq=1 Ack=1 Win=64256 Len=0 TSval=2980920893 TSecr=1489221474"
"313","0.249693","192.168.123.39","192.168.123.26","TLSv1.3","353","Client Hello"
"314","0.249775","192.168.123.26","192.168.123.39","TCP","66","666  >  48444 [ACK] Seq=1 Ack=288 Win=64896 Len=0 TSval=1489221475 TSecr=2980920894"
"315","0.249834","192.168.123.26","192.168.123.22","TLSv1.3","1464","Server Hello, Change Cipher Spec, Application Data, Application Data, Application Data, Application Data, Application Data"
"316","0.249916","192.168.123.22","192.168.123.26","TCP","66","50552  >  666 [ACK] Seq=288 Ack=1399 Win=64128 Len=0 TSval=3569817136 TSecr=2318196394"
"317","0.250689","192.168.123.26","192.168.123.39","TLSv1.3","1464","Server Hello, Change Cipher Spec, Application Data, Application Data, Application Data, Application Data, Application Data"
"318","0.250726","192.168.123.39","192.168.123.26","TCP","66","48444  >  666 [ACK] Seq=288 Ack=1399 Win=64128 Len=0 TSval=2980920895 TSecr=1489221476"
"319","0.252479","192.168.123.39","192.168.123.26","TLSv1.3","756","Change Cipher Spec, Application Data, Application Data, Application Data"
"320","0.252509","192.168.123.26","192.168.123.39","TCP","66","666  >  48444 [ACK] Seq=1399 Ack=978 Win=64256 Len=0 TSval=1489221478 TSecr=2980920897"
"321","0.252933","192.168.123.26","192.168.123.39","TLSv1.3","769","Application Data"
"322","0.253033","192.168.123.26","192.168.123.39","TLSv1.3","769","Application Data"
"323","0.253122","192.168.123.39","192.168.123.26","TCP","66","48444  >  666 [ACK] Seq=978 Ack=2102 Win=63488 Len=0 TSval=2980920897 TSecr=1489221478"
"324","0.253159","192.168.123.39","192.168.123.26","TCP","66","48444  >  666 [ACK] Seq=978 Ack=2805 Win=62848 Len=0 TSval=2980920897 TSecr=1489221478"
"325","0.253335","192.168.123.22","192.168.123.26","TLSv1.3","756","Change Cipher Spec, Application Data, Application Data, Application Data"
"326","0.253364","192.168.123.26","192.168.123.22","TCP","66","666  >  50552 [ACK] Seq=1399 Ack=978 Win=64256 Len=0 TSval=2318196397 TSecr=3569817139"
"327","0.253825","192.168.123.26","192.168.123.22","TLSv1.3","769","Application Data"
"328","0.253957","192.168.123.22","192.168.123.26","TCP","66","50552  >  666 [ACK] Seq=978 Ack=2102 Win=63488 Len=0 TSval=3569817140 TSecr=2318196398"
"329","0.253976","192.168.123.26","192.168.123.22","TLSv1.3","769","Application Data"
"330","0.253997","192.168.123.22","192.168.123.26","TCP","66","50552  >  666 [ACK] Seq=978 Ack=2805 Win=63616 Len=0 TSval=3569817140 TSecr=2318196398"
"333","0.873442","192.168.123.12","192.168.123.26","TCP","74","54592  >  666 [SYN] Seq=0 Win=64240 Len=0 MSS=1460 SACK_PERM=1 TSval=1007875086 TSecr=0 WS=128"
"334","0.873476","192.168.123.26","192.168.123.12","TCP","74","666  >  54592 [SYN, ACK] Seq=0 Ack=1 Win=65160 Len=0 MSS=1460 SACK_PERM=1 TSval=4106443644 TSecr=1007875086 WS=128"
"335","0.873504","192.168.123.12","192.168.123.26","TCP","66","54592  >  666 [ACK] Seq=1 Ack=1 Win=64256 Len=0 TSval=1007875087 TSecr=4106443644"
"336","0.873718","192.168.123.12","192.168.123.26","TLSv1.3","353","Client Hello"
"337","0.873793","192.168.123.26","192.168.123.12","TCP","66","666  >  54592 [ACK] Seq=1 Ack=288 Win=64896 Len=0 TSval=4106443644 TSecr=1007875087"
"338","0.874556","192.168.123.26","192.168.123.12","TLSv1.3","1464","Server Hello, Change Cipher Spec, Application Data, Application Data, Application Data, Application Data, Application Data"
"339","0.874588","192.168.123.12","192.168.123.26","TCP","66","54592  >  666 [ACK] Seq=288 Ack=1399 Win=64128 Len=0 TSval=1007875088 TSecr=4106443645"
"340","0.876238","192.168.123.12","192.168.123.26","TLSv1.3","756","Change Cipher Spec, Application Data, Application Data, Application Data"
"341","0.876266","192.168.123.26","192.168.123.12","TCP","66","666  >  54592 [ACK] Seq=1399 Ack=978 Win=64256 Len=0 TSval=4106443646 TSecr=1007875089"
"342","0.876704","192.168.123.26","192.168.123.12","TLSv1.3","769","Application Data"
"343","0.876808","192.168.123.26","192.168.123.12","TLSv1.3","769","Application Data"
"344","0.876880","192.168.123.12","192.168.123.26","TCP","66","54592  >  666 [ACK] Seq=978 Ack=2102 Win=63488 Len=0 TSval=1007875090 TSecr=4106443647"
"345","0.876902","192.168.123.12","192.168.123.26","TCP","66","54592  >  666 [ACK] Seq=978 Ack=2805 Win=62848 Len=0 TSval=1007875090 TSecr=4106443647"
"348","1.483929","192.168.123.32","192.168.123.26","TCP","74","37244  >  666 [SYN] Seq=0 Win=64240 Len=0 MSS=1460 SACK_PERM=1 TSval=486075263 TSecr=0 WS=128"
"349","1.483964","192.168.123.26","192.168.123.32","TCP","74","666  >  37244 [SYN, ACK] Seq=0 Ack=1 Win=65160 Len=0 MSS=1460 SACK_PERM=1 TSval=2071843964 TSecr=486075263 WS=128"
"350","1.483993","192.168.123.32","192.168.123.26","TCP","66","37244  >  666 [ACK] Seq=1 Ack=1 Win=64256 Len=0 TSval=486075264 TSecr=2071843964"
"351","1.484254","192.168.123.32","192.168.123.26","TLSv1.3","353","Client Hello"
"352","1.484338","192.168.123.26","192.168.123.32","TCP","66","666  >  37244 [ACK] Seq=1 Ack=288 Win=64896 Len=0 TSval=2071843964 TSecr=486075264"
"353","1.485397","192.168.123.26","192.168.123.32","TLSv1.3","1464","Server Hello, Change Cipher Spec, Application Data, Application Data, Application Data, Application Data, Application Data"
"354","1.485446","192.168.123.32","192.168.123.26","TCP","66","37244  >  666 [ACK] Seq=288 Ack=1399 Win=64128 Len=0 TSval=486075266 TSecr=2071843965"
"355","1.488792","192.168.123.32","192.168.123.26","TLSv1.3","756","Change Cipher Spec, Application Data, Application Data, Application Data"
"356","1.488838","192.168.123.26","192.168.123.32","TCP","66","666  >  37244 [ACK] Seq=1399 Ack=978 Win=64256 Len=0 TSval=2071843969 TSecr=486075269"
"357","1.489511","192.168.123.26","192.168.123.32","TLSv1.3","769","Application Data"
"358","1.489540","192.168.123.32","192.168.123.26","TCP","66","37244  >  666 [ACK] Seq=978 Ack=2102 Win=64128 Len=0 TSval=486075270 TSecr=2071843970"
"359","1.489721","192.168.123.26","192.168.123.32","TLSv1.3","769","Application Data"
"360","1.489749","192.168.123.32","192.168.123.26","TCP","66","37244  >  666 [ACK] Seq=978 Ack=2805 Win=64128 Len=0 TSval=486075270 TSecr=2071843970"
"363","1.602353","192.168.123.8","192.168.123.26","TCP","74","54628  >  666 [SYN] Seq=0 Win=64240 Len=0 MSS=1460 SACK_PERM=1 TSval=2426237441 TSecr=0 WS=128"
"364","1.602405","192.168.123.26","192.168.123.8","TCP","74","666  >  54628 [SYN, ACK] Seq=0 Ack=1 Win=65160 Len=0 MSS=1460 SACK_PERM=1 TSval=1893234056 TSecr=2426237441 WS=128"
"365","1.602441","192.168.123.8","192.168.123.26","TCP","66","54628  >  666 [ACK] Seq=1 Ack=1 Win=64256 Len=0 TSval=2426237442 TSecr=1893234056"
"366","1.602702","192.168.123.8","192.168.123.26","TLSv1.3","353","Client Hello"
"367","1.602767","192.168.123.26","192.168.123.8","TCP","66","666  >  54628 [ACK] Seq=1 Ack=288 Win=64896 Len=0 TSval=1893234056 TSecr=2426237442"
"368","1.604230","192.168.123.26","192.168.123.8","TLSv1.3","1464","Server Hello, Change Cipher Spec, Application Data, Application Data, Application Data, Application Data, Application Data"
"369","1.604262","192.168.123.8","192.168.123.26","TCP","66","54628  >  666 [ACK] Seq=288 Ack=1399 Win=64128 Len=0 TSval=2426237443 TSecr=1893234057"
"370","1.605431","192.168.123.8","192.168.123.26","TLSv1.3","756","Change Cipher Spec, Application Data, Application Data, Application Data"
"371","1.605460","192.168.123.26","192.168.123.8","TCP","66","666  >  54628 [ACK] Seq=1399 Ack=978 Win=64256 Len=0 TSval=1893234059 TSecr=2426237445"
"372","1.605983","192.168.123.26","192.168.123.8","TLSv1.3","769","Application Data"
"373","1.606090","192.168.123.8","192.168.123.26","TCP","66","54628  >  666 [ACK] Seq=978 Ack=2102 Win=63488 Len=0 TSval=2426237445 TSecr=1893234059"
"374","1.606144","192.168.123.26","192.168.123.8","TLSv1.3","769","Application Data"
"375","1.606172","192.168.123.8","192.168.123.26","TCP","66","54628  >  666 [ACK] Seq=978 Ack=2805 Win=64128 Len=0 TSval=2426237445 TSecr=1893234059"
"378","1.685280","192.168.123.34","192.168.123.26","TCP","74","53880  >  666 [SYN] Seq=0 Win=64240 Len=0 MSS=1460 SACK_PERM=1 TSval=2662711463 TSecr=0 WS=128"
"379","1.685330","192.168.123.26","192.168.123.34","TCP","74","666  >  53880 [SYN, ACK] Seq=0 Ack=1 Win=65160 Len=0 MSS=1460 SACK_PERM=1 TSval=2244050766 TSecr=2662711463 WS=128"
"380","1.685371","192.168.123.34","192.168.123.26","TCP","66","53880  >  666 [ACK] Seq=1 Ack=1 Win=64256 Len=0 TSval=2662711463 TSecr=2244050766"
"381","1.685769","192.168.123.34","192.168.123.26","TLSv1.3","353","Client Hello"
"382","1.685880","192.168.123.26","192.168.123.34","TCP","66","666  >  53880 [ACK] Seq=1 Ack=288 Win=64896 Len=0 TSval=2244050767 TSecr=2662711464"
"383","1.686942","192.168.123.26","192.168.123.34","TLSv1.3","1464","Server Hello, Change Cipher Spec, Application Data, Application Data, Application Data, Application Data, Application Data"
"384","1.686976","192.168.123.34","192.168.123.26","TCP","66","53880  >  666 [ACK] Seq=288 Ack=1399 Win=64128 Len=0 TSval=2662711465 TSecr=2244050768"
"385","1.688239","192.168.123.34","192.168.123.26","TLSv1.3","756","Change Cipher Spec, Application Data, Application Data, Application Data"
"386","1.688267","192.168.123.26","192.168.123.34","TCP","66","666  >  53880 [ACK] Seq=1399 Ack=978 Win=64256 Len=0 TSval=2244050769 TSecr=2662711466"
"387","1.688848","192.168.123.26","192.168.123.34","TLSv1.3","769","Application Data"
"388","1.688875","192.168.123.34","192.168.123.26","TCP","66","53880  >  666 [ACK] Seq=978 Ack=2102 Win=64128 Len=0 TSval=2662711467 TSecr=2244050770"
"389","1.688981","192.168.123.26","192.168.123.34","TLSv1.3","769","Application Data"
"390","1.689002","192.168.123.34","192.168.123.26","TCP","66","53880  >  666 [ACK] Seq=978 Ack=2805 Win=64128 Len=0 TSval=2662711467 TSecr=2244050770"
"393","1.695028","192.168.123.19","192.168.123.26","TCP","74","36412  >  666 [SYN] Seq=0 Win=64240 Len=0 MSS=1460 SACK_PERM=1 TSval=2337763859 TSecr=0 WS=128"
"394","1.695066","192.168.123.26","192.168.123.19","TCP","74","666  >  36412 [SYN, ACK] Seq=0 Ack=1 Win=65160 Len=0 MSS=1460 SACK_PERM=1 TSval=402433700 TSecr=2337763859 WS=128"
"395","1.695095","192.168.123.19","192.168.123.26","TCP","66","36412  >  666 [ACK] Seq=1 Ack=1 Win=64256 Len=0 TSval=2337763860 TSecr=402433700"
"396","1.695398","192.168.123.19","192.168.123.26","TLSv1.3","353","Client Hello"
"397","1.695475","192.168.123.26","192.168.123.19","TCP","66","666  >  36412 [ACK] Seq=1 Ack=288 Win=64896 Len=0 TSval=402433701 TSecr=2337763860"
"398","1.696591","192.168.123.26","192.168.123.19","TLSv1.3","1464","Server Hello, Change Cipher Spec, Application Data, Application Data, Application Data, Application Data, Application Data"
"399","1.696630","192.168.123.19","192.168.123.26","TCP","66","36412  >  666 [ACK] Seq=288 Ack=1399 Win=64128 Len=0 TSval=2337763862 TSecr=402433702"
"400","1.698821","192.168.123.19","192.168.123.26","TLSv1.3","756","Change Cipher Spec, Application Data, Application Data, Application Data"
"401","1.698874","192.168.123.26","192.168.123.19","TCP","66","666  >  36412 [ACK] Seq=1399 Ack=978 Win=64256 Len=0 TSval=402433704 TSecr=2337763864"
"402","1.699560","192.168.123.26","192.168.123.19","TLSv1.3","769","Application Data"
"403","1.699708","192.168.123.26","192.168.123.19","TLSv1.3","769","Application Data"
"404","1.699784","192.168.123.19","192.168.123.26","TCP","66","36412  >  666 [ACK] Seq=978 Ack=2102 Win=63488 Len=0 TSval=2337763865 TSecr=402433705"
"405","1.699814","192.168.123.19","192.168.123.26","TCP","66","36412  >  666 [ACK] Seq=978 Ack=2805 Win=62848 Len=0 TSval=2337763865 TSecr=402433705"
"408","1.789673","192.168.123.42","192.168.123.26","TCP","74","39382  >  666 [SYN] Seq=0 Win=64240 Len=0 MSS=1460 SACK_PERM=1 TSval=2679419126 TSecr=0 WS=128"
"409","1.789727","192.168.123.26","192.168.123.42","TCP","74","666  >  39382 [SYN, ACK] Seq=0 Ack=1 Win=65160 Len=0 MSS=1460 SACK_PERM=1 TSval=753115830 TSecr=2679419126 WS=128"
"410","1.789771","192.168.123.42","192.168.123.26","TCP","66","39382  >  666 [ACK] Seq=1 Ack=1 Win=64256 Len=0 TSval=2679419127 TSecr=753115830"
"411","1.790285","192.168.123.42","192.168.123.26","TLSv1.3","353","Client Hello"
"412","1.790373","192.168.123.26","192.168.123.42","TCP","66","666  >  39382 [ACK] Seq=1 Ack=288 Win=64896 Len=0 TSval=753115830 TSecr=2679419127"
"413","1.792002","192.168.123.26","192.168.123.42","TLSv1.3","1464","Server Hello, Change Cipher Spec, Application Data, Application Data, Application Data, Application Data, Application Data"
"414","1.792052","192.168.123.42","192.168.123.26","TCP","66","39382  >  666 [ACK] Seq=288 Ack=1399 Win=64128 Len=0 TSval=2679419129 TSecr=753115832"
"415","1.793878","192.168.123.42","192.168.123.26","TLSv1.3","756","Change Cipher Spec, Application Data, Application Data, Application Data"
"416","1.793908","192.168.123.26","192.168.123.42","TCP","66","666  >  39382 [ACK] Seq=1399 Ack=978 Win=64256 Len=0 TSval=753115834 TSecr=2679419131"
"417","1.794335","192.168.123.26","192.168.123.42","TLSv1.3","769","Application Data"
"418","1.794439","192.168.123.26","192.168.123.42","TLSv1.3","769","Application Data"
"419","1.794515","192.168.123.42","192.168.123.26","TCP","66","39382  >  666 [ACK] Seq=978 Ack=2102 Win=63488 Len=0 TSval=2679419132 TSecr=753115834"
"420","1.794538","192.168.123.42","192.168.123.26","TCP","66","39382  >  666 [ACK] Seq=978 Ack=2805 Win=62848 Len=0 TSval=2679419132 TSecr=753115835"
"425","1.833675","192.168.123.33","192.168.123.26","TCP","74","37000  >  666 [SYN] Seq=0 Win=64240 Len=0 MSS=1460 SACK_PERM=1 TSval=1657399568 TSecr=0 WS=128"
"426","1.833686","192.168.123.13","192.168.123.26","TCP","74","43808  >  666 [SYN] Seq=0 Win=64240 Len=0 MSS=1460 SACK_PERM=1 TSval=487733843 TSecr=0 WS=128"
"427","1.833711","192.168.123.26","192.168.123.33","TCP","74","666  >  37000 [SYN, ACK] Seq=0 Ack=1 Win=65160 Len=0 MSS=1460 SACK_PERM=1 TSval=691322240 TSecr=1657399568 WS=128"
"428","1.833730","192.168.123.26","192.168.123.13","TCP","74","666  >  43808 [SYN, ACK] Seq=0 Ack=1 Win=65160 Len=0 MSS=1460 SACK_PERM=1 TSval=2247186955 TSecr=487733843 WS=128"
"429","1.833741","192.168.123.33","192.168.123.26","TCP","66","37000  >  666 [ACK] Seq=1 Ack=1 Win=64256 Len=0 TSval=1657399569 TSecr=691322240"
"430","1.833768","192.168.123.13","192.168.123.26","TCP","66","43808  >  666 [ACK] Seq=1 Ack=1 Win=64256 Len=0 TSval=487733844 TSecr=2247186955"
"431","1.834076","192.168.123.13","192.168.123.26","TLSv1.3","353","Client Hello"
"432","1.834082","192.168.123.33","192.168.123.26","TLSv1.3","353","Client Hello"
"433","1.834155","192.168.123.26","192.168.123.33","TCP","66","666  >  37000 [ACK] Seq=1 Ack=288 Win=64896 Len=0 TSval=691322240 TSecr=1657399569"
"434","1.834156","192.168.123.26","192.168.123.13","TCP","66","666  >  43808 [ACK] Seq=1 Ack=288 Win=64896 Len=0 TSval=2247186955 TSecr=487733844"
"435","1.835465","192.168.123.26","192.168.123.13","TLSv1.3","1464","Server Hello, Change Cipher Spec, Application Data, Application Data, Application Data, Application Data, Application Data"
"436","1.835513","192.168.123.13","192.168.123.26","TCP","66","43808  >  666 [ACK] Seq=288 Ack=1399 Win=64128 Len=0 TSval=487733846 TSecr=2247186957"
"437","1.836609","192.168.123.26","192.168.123.33","TLSv1.3","1464","Server Hello, Change Cipher Spec, Application Data, Application Data, Application Data, Application Data, Application Data"
"438","1.836653","192.168.123.33","192.168.123.26","TCP","66","37000  >  666 [ACK] Seq=288 Ack=1399 Win=64128 Len=0 TSval=1657399572 TSecr=691322243"
"439","1.839298","192.168.123.13","192.168.123.26","TLSv1.3","756","Change Cipher Spec, Application Data, Application Data, Application Data"
"440","1.839340","192.168.123.26","192.168.123.13","TCP","66","666  >  43808 [ACK] Seq=1399 Ack=978 Win=64256 Len=0 TSval=2247186960 TSecr=487733849"
"443","1.839829","192.168.123.28","192.168.123.26","TCP","74","48104  >  666 [SYN] Seq=0 Win=64240 Len=0 MSS=1460 SACK_PERM=1 TSval=1998520162 TSecr=0 WS=128"
"444","1.839872","192.168.123.26","192.168.123.28","TCP","74","666  >  48104 [SYN, ACK] Seq=0 Ack=1 Win=65160 Len=0 MSS=1460 SACK_PERM=1 TSval=491214220 TSecr=1998520162 WS=128"
"445","1.839909","192.168.123.28","192.168.123.26","TCP","66","48104  >  666 [ACK] Seq=1 Ack=1 Win=64256 Len=0 TSval=1998520163 TSecr=491214220"
"446","1.839923","192.168.123.26","192.168.123.13","TLSv1.3","769","Application Data"
"447","1.840040","192.168.123.26","192.168.123.13","TLSv1.3","769","Application Data"
"448","1.840134","192.168.123.13","192.168.123.26","TCP","66","43808  >  666 [ACK] Seq=978 Ack=2102 Win=63488 Len=0 TSval=487733850 TSecr=2247186961"
"449","1.840158","192.168.123.13","192.168.123.26","TCP","66","43808  >  666 [ACK] Seq=978 Ack=2805 Win=62848 Len=0 TSval=487733850 TSecr=2247186961"
"450","1.840239","192.168.123.28","192.168.123.26","TLSv1.3","353","Client Hello"
"451","1.840320","192.168.123.26","192.168.123.28","TCP","66","666  >  48104 [ACK] Seq=1 Ack=288 Win=64896 Len=0 TSval=491214220 TSecr=1998520163"
"452","1.840480","192.168.123.33","192.168.123.26","TLSv1.3","756","Change Cipher Spec, Application Data, Application Data, Application Data"
"453","1.840510","192.168.123.26","192.168.123.33","TCP","66","666  >  37000 [ACK] Seq=1399 Ack=978 Win=64256 Len=0 TSval=691322247 TSecr=1657399576"
"454","1.840986","192.168.123.26","192.168.123.33","TLSv1.3","769","Application Data"
"455","1.841132","192.168.123.26","192.168.123.33","TLSv1.3","769","Application Data"
"456","1.841256","192.168.123.33","192.168.123.26","TCP","66","37000  >  666 [ACK] Seq=978 Ack=2102 Win=63488 Len=0 TSval=1657399576 TSecr=691322247"
"457","1.841281","192.168.123.26","192.168.123.28","TLSv1.3","1464","Server Hello, Change Cipher Spec, Application Data, Application Data, Application Data, Application Data, Application Data"
"458","1.841304","192.168.123.33","192.168.123.26","TCP","66","37000  >  666 [ACK] Seq=978 Ack=2805 Win=62848 Len=0 TSval=1657399576 TSecr=691322247"
"459","1.841330","192.168.123.28","192.168.123.26","TCP","66","48104  >  666 [ACK] Seq=288 Ack=1399 Win=64128 Len=0 TSval=1998520164 TSecr=491214221"
"460","1.842664","192.168.123.28","192.168.123.26","TLSv1.3","756","Change Cipher Spec, Application Data, Application Data, Application Data"
"461","1.842695","192.168.123.26","192.168.123.28","TCP","66","666  >  48104 [ACK] Seq=1399 Ack=978 Win=64256 Len=0 TSval=491214223 TSecr=1998520166"
"462","1.843284","192.168.123.26","192.168.123.28","TLSv1.3","769","Application Data"
"463","1.843333","192.168.123.28","192.168.123.26","TCP","66","48104  >  666 [ACK] Seq=978 Ack=2102 Win=64128 Len=0 TSval=1998520166 TSecr=491214223"
"464","1.843453","192.168.123.26","192.168.123.28","TLSv1.3","769","Application Data"
"465","1.843477","192.168.123.28","192.168.123.26","TCP","66","48104  >  666 [ACK] Seq=978 Ack=2805 Win=64128 Len=0 TSval=1998520167 TSecr=491214224"
"468","1.847849","192.168.123.30","192.168.123.26","TCP","74","35388  >  666 [SYN] Seq=0 Win=64240 Len=0 MSS=1460 SACK_PERM=1 TSval=3828790445 TSecr=0 WS=128"
"469","1.847899","192.168.123.26","192.168.123.30","TCP","74","666  >  35388 [SYN, ACK] Seq=0 Ack=1 Win=65160 Len=0 MSS=1460 SACK_PERM=1 TSval=2771180812 TSecr=3828790445 WS=128"
"470","1.847941","192.168.123.30","192.168.123.26","TCP","66","35388  >  666 [ACK] Seq=1 Ack=1 Win=64256 Len=0 TSval=3828790446 TSecr=2771180812"
"471","1.848315","192.168.123.30","192.168.123.26","TLSv1.3","353","Client Hello"
"472","1.848415","192.168.123.26","192.168.123.30","TCP","66","666  >  35388 [ACK] Seq=1 Ack=288 Win=64896 Len=0 TSval=2771180812 TSecr=3828790446"
"473","1.849557","192.168.123.26","192.168.123.30","TLSv1.3","1464","Server Hello, Change Cipher Spec, Application Data, Application Data, Application Data, Application Data, Application Data"
"474","1.849605","192.168.123.30","192.168.123.26","TCP","66","35388  >  666 [ACK] Seq=288 Ack=1399 Win=64128 Len=0 TSval=3828790448 TSecr=2771180814"
"475","1.853192","192.168.123.30","192.168.123.26","TLSv1.3","756","Change Cipher Spec, Application Data, Application Data, Application Data"
"476","1.853222","192.168.123.26","192.168.123.30","TCP","66","666  >  35388 [ACK] Seq=1399 Ack=978 Win=64256 Len=0 TSval=2771180817 TSecr=3828790451"
"477","1.853676","192.168.123.26","192.168.123.30","TLSv1.3","769","Application Data"
"478","1.853781","192.168.123.26","192.168.123.30","TLSv1.3","769","Application Data"
"479","1.853877","192.168.123.30","192.168.123.26","TCP","66","35388  >  666 [ACK] Seq=978 Ack=2102 Win=63488 Len=0 TSval=3828790452 TSecr=2771180818"
"480","1.853927","192.168.123.30","192.168.123.26","TCP","66","35388  >  666 [ACK] Seq=978 Ack=2805 Win=62848 Len=0 TSval=3828790452 TSecr=2771180818"
"483","1.859682","192.168.123.36","192.168.123.26","TCP","74","35226  >  666 [SYN] Seq=0 Win=64240 Len=0 MSS=1460 SACK_PERM=1 TSval=1459186306 TSecr=0 WS=128"
"484","1.859718","192.168.123.26","192.168.123.36","TCP","74","666  >  35226 [SYN, ACK] Seq=0 Ack=1 Win=65160 Len=0 MSS=1460 SACK_PERM=1 TSval=2917578753 TSecr=1459186306 WS=128"
"485","1.859747","192.168.123.36","192.168.123.26","TCP","66","35226  >  666 [ACK] Seq=1 Ack=1 Win=64256 Len=0 TSval=1459186307 TSecr=2917578753"
"486","1.860010","192.168.123.36","192.168.123.26","TLSv1.3","353","Client Hello"
"487","1.860098","192.168.123.26","192.168.123.36","TCP","66","666  >  35226 [ACK] Seq=1 Ack=288 Win=64896 Len=0 TSval=2917578753 TSecr=1459186307"
"488","1.860977","192.168.123.26","192.168.123.36","TLSv1.3","1464","Server Hello, Change Cipher Spec, Application Data, Application Data, Application Data, Application Data, Application Data"
"489","1.861008","192.168.123.36","192.168.123.26","TCP","66","35226  >  666 [ACK] Seq=288 Ack=1399 Win=64128 Len=0 TSval=1459186308 TSecr=2917578754"
"490","1.862776","192.168.123.36","192.168.123.26","TLSv1.3","756","Change Cipher Spec, Application Data, Application Data, Application Data"
"491","1.862805","192.168.123.26","192.168.123.36","TCP","66","666  >  35226 [ACK] Seq=1399 Ack=978 Win=64256 Len=0 TSval=2917578756 TSecr=1459186310"
"492","1.863292","192.168.123.26","192.168.123.36","TLSv1.3","769","Application Data"
"493","1.863401","192.168.123.26","192.168.123.36","TLSv1.3","769","Application Data"
"494","1.863478","192.168.123.36","192.168.123.26","TCP","66","35226  >  666 [ACK] Seq=978 Ack=2102 Win=63488 Len=0 TSval=1459186311 TSecr=2917578756"
"495","1.863502","192.168.123.36","192.168.123.26","TCP","66","35226  >  666 [ACK] Seq=978 Ack=2805 Win=62848 Len=0 TSval=1459186311 TSecr=2917578757"
"498","1.867905","192.168.123.11","192.168.123.26","TCP","74","35694  >  666 [SYN] Seq=0 Win=64240 Len=0 MSS=1460 SACK_PERM=1 TSval=2292003655 TSecr=0 WS=128"
"499","1.867960","192.168.123.26","192.168.123.11","TCP","74","666  >  35694 [SYN, ACK] Seq=0 Ack=1 Win=65160 Len=0 MSS=1460 SACK_PERM=1 TSval=1796161403 TSecr=2292003655 WS=128"
"500","1.868016","192.168.123.11","192.168.123.26","TCP","66","35694  >  666 [ACK] Seq=1 Ack=1 Win=64256 Len=0 TSval=2292003656 TSecr=1796161403"
"501","1.868399","192.168.123.11","192.168.123.26","TLSv1.3","353","Client Hello"
"502","1.868500","192.168.123.26","192.168.123.11","TCP","66","666  >  35694 [ACK] Seq=1 Ack=288 Win=64896 Len=0 TSval=1796161404 TSecr=2292003656"
"503","1.869854","192.168.123.26","192.168.123.11","TLSv1.3","1464","Server Hello, Change Cipher Spec, Application Data, Application Data, Application Data, Application Data, Application Data"
"504","1.869907","192.168.123.11","192.168.123.26","TCP","66","35694  >  666 [ACK] Seq=288 Ack=1399 Win=64128 Len=0 TSval=2292003658 TSecr=1796161405"
"505","1.871926","192.168.123.11","192.168.123.26","TLSv1.3","756","Change Cipher Spec, Application Data, Application Data, Application Data"
"506","1.871995","192.168.123.26","192.168.123.11","TCP","66","666  >  35694 [ACK] Seq=1399 Ack=978 Win=64256 Len=0 TSval=1796161407 TSecr=2292003660"
"507","1.872817","192.168.123.26","192.168.123.11","TLSv1.3","769","Application Data"
"508","1.873013","192.168.123.26","192.168.123.11","TLSv1.3","769","Application Data"
"509","1.873436","192.168.123.11","192.168.123.26","TCP","66","35694  >  666 [ACK] Seq=978 Ack=2102 Win=63488 Len=0 TSval=2292003662 TSecr=1796161408"
"510","1.873472","192.168.123.11","192.168.123.26","TCP","66","35694  >  666 [ACK] Seq=978 Ack=2805 Win=62848 Len=0 TSval=2292003662 TSecr=1796161408"
"513","1.874556","192.168.123.4","192.168.123.26","TCP","74","40546  >  666 [SYN] Seq=0 Win=64240 Len=0 MSS=1460 SACK_PERM=1 TSval=1657931360 TSecr=0 WS=128"
"514","1.874592","192.168.123.26","192.168.123.4","TCP","74","666  >  40546 [SYN, ACK] Seq=0 Ack=1 Win=65160 Len=0 MSS=1460 SACK_PERM=1 TSval=3193253508 TSecr=1657931360 WS=128"
"515","1.874621","192.168.123.4","192.168.123.26","TCP","66","40546  >  666 [ACK] Seq=1 Ack=1 Win=64256 Len=0 TSval=1657931361 TSecr=3193253508"
"516","1.875194","192.168.123.4","192.168.123.26","TLSv1.3","353","Client Hello"
"517","1.875275","192.168.123.26","192.168.123.4","TCP","66","666  >  40546 [ACK] Seq=1 Ack=288 Win=64896 Len=0 TSval=3193253508 TSecr=1657931361"
"518","1.876495","192.168.123.26","192.168.123.4","TLSv1.3","1464","Server Hello, Change Cipher Spec, Application Data, Application Data, Application Data, Application Data, Application Data"
"519","1.876557","192.168.123.4","192.168.123.26","TCP","66","40546  >  666 [ACK] Seq=288 Ack=1399 Win=64128 Len=0 TSval=1657931363 TSecr=3193253510"
"520","1.878593","192.168.123.4","192.168.123.26","TLSv1.3","756","Change Cipher Spec, Application Data, Application Data, Application Data"
"521","1.878632","192.168.123.26","192.168.123.4","TCP","66","666  >  40546 [ACK] Seq=1399 Ack=978 Win=64256 Len=0 TSval=3193253512 TSecr=1657931365"
"522","1.879216","192.168.123.26","192.168.123.4","TLSv1.3","769","Application Data"
"523","1.879253","192.168.123.4","192.168.123.26","TCP","66","40546  >  666 [ACK] Seq=978 Ack=2102 Win=64128 Len=0 TSval=1657931365 TSecr=3193253512"
"524","1.879371","192.168.123.26","192.168.123.4","TLSv1.3","769","Application Data"
"525","1.879391","192.168.123.4","192.168.123.26","TCP","66","40546  >  666 [ACK] Seq=978 Ack=2805 Win=64128 Len=0 TSval=1657931366 TSecr=3193253512"
"528","1.881655","192.168.123.29","192.168.123.26","TCP","74","60692  >  666 [SYN] Seq=0 Win=64240 Len=0 MSS=1460 SACK_PERM=1 TSval=3799851148 TSecr=0 WS=128"
"529","1.881705","192.168.123.26","192.168.123.29","TCP","74","666  >  60692 [SYN, ACK] Seq=0 Ack=1 Win=65160 Len=0 MSS=1460 SACK_PERM=1 TSval=2633055994 TSecr=3799851148 WS=128"
"530","1.881742","192.168.123.29","192.168.123.26","TCP","66","60692  >  666 [ACK] Seq=1 Ack=1 Win=64256 Len=0 TSval=3799851149 TSecr=2633055994"
"532","1.882056","192.168.123.29","192.168.123.26","TLSv1.3","353","Client Hello"
"533","1.882127","192.168.123.26","192.168.123.29","TCP","66","666  >  60692 [ACK] Seq=1 Ack=288 Win=64896 Len=0 TSval=2633055994 TSecr=3799851149"
"535","1.882374","192.168.123.37","192.168.123.26","TCP","74","56716  >  666 [SYN] Seq=0 Win=64240 Len=0 MSS=1460 SACK_PERM=1 TSval=1931785254 TSecr=0 WS=128"
"536","1.882418","192.168.123.26","192.168.123.37","TCP","74","666  >  56716 [SYN, ACK] Seq=0 Ack=1 Win=65160 Len=0 MSS=1460 SACK_PERM=1 TSval=3252522409 TSecr=1931785254 WS=128"
"537","1.882475","192.168.123.37","192.168.123.26","TCP","66","56716  >  666 [ACK] Seq=1 Ack=1 Win=64256 Len=0 TSval=1931785255 TSecr=3252522409"
"539","1.882822","192.168.123.37","192.168.123.26","TLSv1.3","353","Client Hello"
"541","1.882898","192.168.123.9","192.168.123.26","TCP","74","52938  >  666 [SYN] Seq=0 Win=64240 Len=0 MSS=1460 SACK_PERM=1 TSval=594359534 TSecr=0 WS=128"
"542","1.882912","192.168.123.26","192.168.123.37","TCP","66","666  >  56716 [ACK] Seq=1 Ack=288 Win=64896 Len=0 TSval=3252522409 TSecr=1931785255"
"543","1.882929","192.168.123.26","192.168.123.9","TCP","74","666  >  52938 [SYN, ACK] Seq=0 Ack=1 Win=65160 Len=0 MSS=1460 SACK_PERM=1 TSval=506495887 TSecr=594359534 WS=128"
"544","1.882957","192.168.123.9","192.168.123.26","TCP","66","52938  >  666 [ACK] Seq=1 Ack=1 Win=64256 Len=0 TSval=594359534 TSecr=506495887"
"545","1.883222","192.168.123.9","192.168.123.26","TLSv1.3","353","Client Hello"
"546","1.883285","192.168.123.26","192.168.123.29","TLSv1.3","1464","Server Hello, Change Cipher Spec, Application Data, Application Data, Application Data, Application Data, Application Data"
"547","1.883292","192.168.123.26","192.168.123.9","TCP","66","666  >  52938 [ACK] Seq=1 Ack=288 Win=64896 Len=0 TSval=506495887 TSecr=594359534"
"548","1.883319","192.168.123.29","192.168.123.26","TCP","66","60692  >  666 [ACK] Seq=288 Ack=1399 Win=64128 Len=0 TSval=3799851150 TSecr=2633055995"
"549","1.883808","192.168.123.26","192.168.123.37","TLSv1.3","1464","Server Hello, Change Cipher Spec, Application Data, Application Data, Application Data, Application Data, Application Data"
"550","1.883841","192.168.123.37","192.168.123.26","TCP","66","56716  >  666 [ACK] Seq=288 Ack=1399 Win=64128 Len=0 TSval=1931785256 TSecr=3252522410"
"551","1.884443","192.168.123.26","192.168.123.9","TLSv1.3","1464","Server Hello, Change Cipher Spec, Application Data, Application Data, Application Data, Application Data, Application Data"
"552","1.884492","192.168.123.9","192.168.123.26","TCP","66","52938  >  666 [ACK] Seq=288 Ack=1399 Win=64128 Len=0 TSval=594359536 TSecr=506495889"
"553","1.886136","192.168.123.37","192.168.123.26","TLSv1.3","756","Change Cipher Spec, Application Data, Application Data, Application Data"
"554","1.886169","192.168.123.26","192.168.123.37","TCP","66","666  >  56716 [ACK] Seq=1399 Ack=978 Win=64256 Len=0 TSval=3252522412 TSecr=1931785258"
"555","1.886295","192.168.123.9","192.168.123.26","TLSv1.3","756","Change Cipher Spec, Application Data, Application Data, Application Data"
"556","1.886335","192.168.123.26","192.168.123.9","TCP","66","666  >  52938 [ACK] Seq=1399 Ack=978 Win=64256 Len=0 TSval=506495890 TSecr=594359537"
"557","1.886684","192.168.123.26","192.168.123.37","TLSv1.3","769","Application Data"
"558","1.886690","192.168.123.29","192.168.123.26","TLSv1.3","756","Change Cipher Spec, Application Data, Application Data, Application Data"
"559","1.886719","192.168.123.26","192.168.123.29","TCP","66","666  >  60692 [ACK] Seq=1399 Ack=978 Win=64256 Len=0 TSval=2633055999 TSecr=3799851154"
"560","1.886838","192.168.123.26","192.168.123.37","TLSv1.3","769","Application Data"
"561","1.886937","192.168.123.37","192.168.123.26","TCP","66","56716  >  666 [ACK] Seq=978 Ack=2102 Win=63488 Len=0 TSval=1931785259 TSecr=3252522413"
"562","1.886966","192.168.123.37","192.168.123.26","TCP","66","56716  >  666 [ACK] Seq=978 Ack=2805 Win=62848 Len=0 TSval=1931785259 TSecr=3252522413"
"563","1.887187","192.168.123.26","192.168.123.29","TLSv1.3","769","Application Data"
"564","1.887292","192.168.123.26","192.168.123.29","TLSv1.3","769","Application Data"
"565","1.887363","192.168.123.29","192.168.123.26","TCP","66","60692  >  666 [ACK] Seq=978 Ack=2102 Win=63488 Len=0 TSval=3799851154 TSecr=2633055999"
"566","1.887386","192.168.123.29","192.168.123.26","TCP","66","60692  >  666 [ACK] Seq=978 Ack=2805 Win=62848 Len=0 TSval=3799851154 TSecr=2633055999"
"567","1.887575","192.168.123.26","192.168.123.9","TLSv1.3","769","Application Data"
"568","1.887615","192.168.123.9","192.168.123.26","TCP","66","52938  >  666 [ACK] Seq=978 Ack=2102 Win=64128 Len=0 TSval=594359539 TSecr=506495892"
"569","1.887811","192.168.123.26","192.168.123.9","TLSv1.3","769","Application Data"
"570","1.887863","192.168.123.9","192.168.123.26","TCP","66","52938  >  666 [ACK] Seq=978 Ack=2805 Win=64128 Len=0 TSval=594359539 TSecr=506495892"
"573","1.894834","192.168.123.2","192.168.123.26","TCP","74","39116  >  666 [SYN] Seq=0 Win=64240 Len=0 MSS=1460 SACK_PERM=1 TSval=1890268989 TSecr=0 WS=128"
"574","1.894905","192.168.123.26","192.168.123.2","TCP","74","666  >  39116 [SYN, ACK] Seq=0 Ack=1 Win=65160 Len=0 MSS=1460 SACK_PERM=1 TSval=2230221055 TSecr=1890268989 WS=128"
"575","1.894955","192.168.123.2","192.168.123.26","TCP","66","39116  >  666 [ACK] Seq=1 Ack=1 Win=64256 Len=0 TSval=1890268990 TSecr=2230221055"
"576","1.895380","192.168.123.2","192.168.123.26","TLSv1.3","353","Client Hello"
"577","1.895499","192.168.123.26","192.168.123.2","TCP","66","666  >  39116 [ACK] Seq=1 Ack=288 Win=64896 Len=0 TSval=2230221056 TSecr=1890268990"
"578","1.896884","192.168.123.26","192.168.123.2","TLSv1.3","1464","Server Hello, Change Cipher Spec, Application Data, Application Data, Application Data, Application Data, Application Data"
"579","1.896922","192.168.123.2","192.168.123.26","TCP","66","39116  >  666 [ACK] Seq=288 Ack=1399 Win=64128 Len=0 TSval=1890268992 TSecr=2230221057"
"580","1.898147","192.168.123.2","192.168.123.26","TLSv1.3","756","Change Cipher Spec, Application Data, Application Data, Application Data"
"581","1.898181","192.168.123.26","192.168.123.2","TCP","66","666  >  39116 [ACK] Seq=1399 Ack=978 Win=64256 Len=0 TSval=2230221058 TSecr=1890268993"
"582","1.898985","192.168.123.26","192.168.123.2","TLSv1.3","769","Application Data"
"583","1.899052","192.168.123.2","192.168.123.26","TCP","66","39116  >  666 [ACK] Seq=978 Ack=2102 Win=64128 Len=0 TSval=1890268994 TSecr=2230221059"
"584","1.899225","192.168.123.26","192.168.123.2","TLSv1.3","769","Application Data"
"585","1.899257","192.168.123.2","192.168.123.26","TCP","66","39116  >  666 [ACK] Seq=978 Ack=2805 Win=64128 Len=0 TSval=1890268994 TSecr=2230221059"
"588","1.902988","192.168.123.51","192.168.123.26","TCP","74","44336  >  666 [SYN] Seq=0 Win=64240 Len=0 MSS=1460 SACK_PERM=1 TSval=2135098548 TSecr=0 WS=128"
"589","1.903038","192.168.123.26","192.168.123.51","TCP","74","666  >  44336 [SYN, ACK] Seq=0 Ack=1 Win=65160 Len=0 MSS=1460 SACK_PERM=1 TSval=66259954 TSecr=2135098548 WS=128"
"590","1.903081","192.168.123.51","192.168.123.26","TCP","66","44336  >  666 [ACK] Seq=1 Ack=1 Win=64256 Len=0 TSval=2135098549 TSecr=66259954"
"591","1.903326","192.168.123.51","192.168.123.26","TLSv1.3","353","Client Hello"
"592","1.903408","192.168.123.26","192.168.123.51","TCP","66","666  >  44336 [ACK] Seq=1 Ack=288 Win=64896 Len=0 TSval=66259954 TSecr=2135098549"
"593","1.904681","192.168.123.26","192.168.123.51","TLSv1.3","1464","Server Hello, Change Cipher Spec, Application Data, Application Data, Application Data, Application Data, Application Data"
"594","1.904735","192.168.123.51","192.168.123.26","TCP","66","44336  >  666 [ACK] Seq=288 Ack=1399 Win=64128 Len=0 TSval=2135098551 TSecr=66259956"
"595","1.906479","192.168.123.51","192.168.123.26","TLSv1.3","756","Change Cipher Spec, Application Data, Application Data, Application Data"
"596","1.906528","192.168.123.26","192.168.123.51","TCP","66","666  >  44336 [ACK] Seq=1399 Ack=978 Win=64256 Len=0 TSval=66259958 TSecr=2135098553"
"597","1.907148","192.168.123.26","192.168.123.51","TLSv1.3","769","Application Data"
"598","1.907254","192.168.123.26","192.168.123.51","TLSv1.3","769","Application Data"
"599","1.907335","192.168.123.51","192.168.123.26","TCP","66","44336  >  666 [ACK] Seq=978 Ack=2102 Win=63488 Len=0 TSval=2135098553 TSecr=66259958"
"600","1.907359","192.168.123.51","192.168.123.26","TCP","66","44336  >  666 [ACK] Seq=978 Ack=2805 Win=62848 Len=0 TSval=2135098553 TSecr=66259958"
"603","1.926250","192.168.123.24","192.168.123.26","TCP","74","42650  >  666 [SYN] Seq=0 Win=64240 Len=0 MSS=1460 SACK_PERM=1 TSval=1805456653 TSecr=0 WS=128"
"604","1.926285","192.168.123.26","192.168.123.24","TCP","74","666  >  42650 [SYN, ACK] Seq=0 Ack=1 Win=65160 Len=0 MSS=1460 SACK_PERM=1 TSval=2951230175 TSecr=1805456653 WS=128"
"605","1.926314","192.168.123.24","192.168.123.26","TCP","66","42650  >  666 [ACK] Seq=1 Ack=1 Win=64256 Len=0 TSval=1805456654 TSecr=2951230175"
"606","1.928626","192.168.123.24","192.168.123.26","TLSv1.3","353","Client Hello"
"607","1.928714","192.168.123.26","192.168.123.24","TCP","66","666  >  42650 [ACK] Seq=1 Ack=288 Win=64896 Len=0 TSval=2951230178 TSecr=1805456657"
"608","1.930192","192.168.123.26","192.168.123.24","TLSv1.3","1464","Server Hello, Change Cipher Spec, Application Data, Application Data, Application Data, Application Data, Application Data"
"609","1.930228","192.168.123.24","192.168.123.26","TCP","66","42650  >  666 [ACK] Seq=288 Ack=1399 Win=64128 Len=0 TSval=1805456658 TSecr=2951230179"
"610","1.932447","192.168.123.24","192.168.123.26","TLSv1.3","756","Change Cipher Spec, Application Data, Application Data, Application Data"
"611","1.932512","192.168.123.26","192.168.123.24","TCP","66","666  >  42650 [ACK] Seq=1399 Ack=978 Win=64256 Len=0 TSval=2951230182 TSecr=1805456661"
"612","1.932955","192.168.123.26","192.168.123.24","TLSv1.3","769","Application Data"
"613","1.932984","192.168.123.24","192.168.123.26","TCP","66","42650  >  666 [ACK] Seq=978 Ack=2102 Win=64128 Len=0 TSval=1805456661 TSecr=2951230182"
"614","1.933089","192.168.123.26","192.168.123.24","TLSv1.3","769","Application Data"
"615","1.933106","192.168.123.24","192.168.123.26","TCP","66","42650  >  666 [ACK] Seq=978 Ack=2805 Win=64128 Len=0 TSval=1805456661 TSecr=2951230182"
"618","1.936311","192.168.123.43","192.168.123.26","TCP","74","59910  >  666 [SYN] Seq=0 Win=64240 Len=0 MSS=1460 SACK_PERM=1 TSval=3775983351 TSecr=0 WS=128"
"619","1.936345","192.168.123.26","192.168.123.43","TCP","74","666  >  59910 [SYN, ACK] Seq=0 Ack=1 Win=65160 Len=0 MSS=1460 SACK_PERM=1 TSval=130728084 TSecr=3775983351 WS=128"
"620","1.936373","192.168.123.43","192.168.123.26","TCP","66","59910  >  666 [ACK] Seq=1 Ack=1 Win=64256 Len=0 TSval=3775983351 TSecr=130728084"
"621","1.936607","192.168.123.43","192.168.123.26","TLSv1.3","353","Client Hello"
"622","1.936686","192.168.123.26","192.168.123.43","TCP","66","666  >  59910 [ACK] Seq=1 Ack=288 Win=64896 Len=0 TSval=130728085 TSecr=3775983352"
"623","1.937657","192.168.123.26","192.168.123.43","TLSv1.3","1464","Server Hello, Change Cipher Spec, Application Data, Application Data, Application Data, Application Data, Application Data"
"624","1.937695","192.168.123.43","192.168.123.26","TCP","66","59910  >  666 [ACK] Seq=288 Ack=1399 Win=64128 Len=0 TSval=3775983353 TSecr=130728086"
"625","1.939586","192.168.123.43","192.168.123.26","TLSv1.3","756","Change Cipher Spec, Application Data, Application Data, Application Data"
"626","1.939618","192.168.123.26","192.168.123.43","TCP","66","666  >  59910 [ACK] Seq=1399 Ack=978 Win=64256 Len=0 TSval=130728088 TSecr=3775983355"
"627","1.940276","192.168.123.26","192.168.123.43","TLSv1.3","769","Application Data"
"628","1.940316","192.168.123.43","192.168.123.26","TCP","66","59910  >  666 [ACK] Seq=978 Ack=2102 Win=64128 Len=0 TSval=3775983355 TSecr=130728088"
"629","1.940484","192.168.123.26","192.168.123.43","TLSv1.3","769","Application Data"
"630","1.940513","192.168.123.43","192.168.123.26","TCP","66","59910  >  666 [ACK] Seq=978 Ack=2805 Win=64128 Len=0 TSval=3775983356 TSecr=130728089"
"633","1.956905","192.168.123.21","192.168.123.26","TCP","74","55804  >  666 [SYN] Seq=0 Win=64240 Len=0 MSS=1460 SACK_PERM=1 TSval=3146506866 TSecr=0 WS=128"
"634","1.956937","192.168.123.26","192.168.123.21","TCP","74","666  >  55804 [SYN, ACK] Seq=0 Ack=1 Win=65160 Len=0 MSS=1460 SACK_PERM=1 TSval=382352733 TSecr=3146506866 WS=128"
"635","1.956964","192.168.123.21","192.168.123.26","TCP","66","55804  >  666 [ACK] Seq=1 Ack=1 Win=64256 Len=0 TSval=3146506867 TSecr=382352733"
"636","1.957235","192.168.123.21","192.168.123.26","TLSv1.3","353","Client Hello"
"637","1.957311","192.168.123.26","192.168.123.21","TCP","66","666  >  55804 [ACK] Seq=1 Ack=288 Win=64896 Len=0 TSval=382352733 TSecr=3146506867"
"638","1.958580","192.168.123.26","192.168.123.21","TLSv1.3","1464","Server Hello, Change Cipher Spec, Application Data, Application Data, Application Data, Application Data, Application Data"
"639","1.958627","192.168.123.21","192.168.123.26","TCP","66","55804  >  666 [ACK] Seq=288 Ack=1399 Win=64128 Len=0 TSval=3146506869 TSecr=382352735"
"640","1.959918","192.168.123.21","192.168.123.26","TLSv1.3","756","Change Cipher Spec, Application Data, Application Data, Application Data"
"641","1.959946","192.168.123.26","192.168.123.21","TCP","66","666  >  55804 [ACK] Seq=1399 Ack=978 Win=64256 Len=0 TSval=382352736 TSecr=3146506870"
"642","1.960547","192.168.123.26","192.168.123.21","TLSv1.3","769","Application Data"
"643","1.960574","192.168.123.21","192.168.123.26","TCP","66","55804  >  666 [ACK] Seq=978 Ack=2102 Win=64128 Len=0 TSval=3146506871 TSecr=382352737"
"644","1.960682","192.168.123.26","192.168.123.21","TLSv1.3","769","Application Data"
"645","1.960700","192.168.123.21","192.168.123.26","TCP","66","55804  >  666 [ACK] Seq=978 Ack=2805 Win=64128 Len=0 TSval=3146506871 TSecr=382352737"
"648","2.088021","192.168.123.15","192.168.123.26","TCP","74","44056  >  666 [SYN] Seq=0 Win=64240 Len=0 MSS=1460 SACK_PERM=1 TSval=155714349 TSecr=0 WS=128"
"649","2.088068","192.168.123.26","192.168.123.15","TCP","74","666  >  44056 [SYN, ACK] Seq=0 Ack=1 Win=65160 Len=0 MSS=1460 SACK_PERM=1 TSval=341492013 TSecr=155714349 WS=128"
"650","2.088111","192.168.123.15","192.168.123.26","TCP","66","44056  >  666 [ACK] Seq=1 Ack=1 Win=64256 Len=0 TSval=155714350 TSecr=341492013"
"651","2.088422","192.168.123.15","192.168.123.26","TLSv1.3","353","Client Hello"
"652","2.088500","192.168.123.26","192.168.123.15","TCP","66","666  >  44056 [ACK] Seq=1 Ack=288 Win=64896 Len=0 TSval=341492014 TSecr=155714351"
"653","2.089323","192.168.123.26","192.168.123.15","TLSv1.3","1464","Server Hello, Change Cipher Spec, Application Data, Application Data, Application Data, Application Data, Application Data"
"654","2.089361","192.168.123.15","192.168.123.26","TCP","66","44056  >  666 [ACK] Seq=288 Ack=1399 Win=64128 Len=0 TSval=155714351 TSecr=341492014"
"655","2.090478","192.168.123.15","192.168.123.26","TLSv1.3","756","Change Cipher Spec, Application Data, Application Data, Application Data"
"656","2.090511","192.168.123.26","192.168.123.15","TCP","66","666  >  44056 [ACK] Seq=1399 Ack=978 Win=64256 Len=0 TSval=341492016 TSecr=155714353"
"657","2.090949","192.168.123.26","192.168.123.15","TLSv1.3","769","Application Data"
"658","2.091077","192.168.123.26","192.168.123.15","TLSv1.3","769","Application Data"
"659","2.091156","192.168.123.15","192.168.123.26","TCP","66","44056  >  666 [ACK] Seq=978 Ack=2102 Win=63488 Len=0 TSval=155714353 TSecr=341492016"
"660","2.091179","192.168.123.15","192.168.123.26","TCP","66","44056  >  666 [ACK] Seq=978 Ack=2805 Win=62848 Len=0 TSval=155714353 TSecr=341492016"
"663","2.272507","192.168.123.23","192.168.123.26","TCP","74","46550  >  666 [SYN] Seq=0 Win=64240 Len=0 MSS=1460 SACK_PERM=1 TSval=1028237995 TSecr=0 WS=128"
"664","2.272541","192.168.123.26","192.168.123.23","TCP","74","666  >  46550 [SYN, ACK] Seq=0 Ack=1 Win=65160 Len=0 MSS=1460 SACK_PERM=1 TSval=3223833521 TSecr=1028237995 WS=128"
"665","2.272569","192.168.123.23","192.168.123.26","TCP","66","46550  >  666 [ACK] Seq=1 Ack=1 Win=64256 Len=0 TSval=1028237996 TSecr=3223833521"
"666","2.272785","192.168.123.23","192.168.123.26","TLSv1.3","353","Client Hello"
"667","2.272850","192.168.123.26","192.168.123.23","TCP","66","666  >  46550 [ACK] Seq=1 Ack=288 Win=64896 Len=0 TSval=3223833521 TSecr=1028237996"
"668","2.273790","192.168.123.26","192.168.123.23","TLSv1.3","1464","Server Hello, Change Cipher Spec, Application Data, Application Data, Application Data, Application Data, Application Data"
"669","2.273855","192.168.123.23","192.168.123.26","TCP","66","46550  >  666 [ACK] Seq=288 Ack=1399 Win=64128 Len=0 TSval=1028237997 TSecr=3223833522"
"670","2.275035","192.168.123.23","192.168.123.26","TLSv1.3","756","Change Cipher Spec, Application Data, Application Data, Application Data"
"671","2.275066","192.168.123.26","192.168.123.23","TCP","66","666  >  46550 [ACK] Seq=1399 Ack=978 Win=64256 Len=0 TSval=3223833523 TSecr=1028237998"
"672","2.275527","192.168.123.26","192.168.123.23","TLSv1.3","769","Application Data"
"673","2.275641","192.168.123.26","192.168.123.23","TLSv1.3","769","Application Data"
"674","2.275712","192.168.123.23","192.168.123.26","TCP","66","46550  >  666 [ACK] Seq=978 Ack=2102 Win=63488 Len=0 TSval=1028237999 TSecr=3223833524"
"675","2.275734","192.168.123.23","192.168.123.26","TCP","66","46550  >  666 [ACK] Seq=978 Ack=2805 Win=62848 Len=0 TSval=1028237999 TSecr=3223833524"
"678","2.407610","192.168.123.53","192.168.123.26","TCP","74","57056  >  666 [SYN] Seq=0 Win=64240 Len=0 MSS=1460 SACK_PERM=1 TSval=3350950272 TSecr=0 WS=128"
"679","2.407642","192.168.123.26","192.168.123.53","TCP","74","666  >  57056 [SYN, ACK] Seq=0 Ack=1 Win=65160 Len=0 MSS=1460 SACK_PERM=1 TSval=2171197797 TSecr=3350950272 WS=128"
"680","2.407670","192.168.123.53","192.168.123.26","TCP","66","57056  >  666 [ACK] Seq=1 Ack=1 Win=64256 Len=0 TSval=3350950273 TSecr=2171197797"
"681","2.407926","192.168.123.53","192.168.123.26","TLSv1.3","353","Client Hello"
"682","2.408007","192.168.123.26","192.168.123.53","TCP","66","666  >  57056 [ACK] Seq=1 Ack=288 Win=64896 Len=0 TSval=2171197797 TSecr=3350950273"
"683","2.408926","192.168.123.26","192.168.123.53","TLSv1.3","1464","Server Hello, Change Cipher Spec, Application Data, Application Data, Application Data, Application Data, Application Data"
"684","2.408966","192.168.123.53","192.168.123.26","TCP","66","57056  >  666 [ACK] Seq=288 Ack=1399 Win=64128 Len=0 TSval=3350950274 TSecr=2171197798"
"685","2.410208","192.168.123.53","192.168.123.26","TLSv1.3","756","Change Cipher Spec, Application Data, Application Data, Application Data"
"686","2.410240","192.168.123.26","192.168.123.53","TCP","66","666  >  57056 [ACK] Seq=1399 Ack=978 Win=64256 Len=0 TSval=2171197799 TSecr=3350950275"
"687","2.410699","192.168.123.26","192.168.123.53","TLSv1.3","769","Application Data"
"688","2.410820","192.168.123.26","192.168.123.53","TLSv1.3","769","Application Data"
"689","2.410858","192.168.123.53","192.168.123.26","TCP","66","57056  >  666 [ACK] Seq=978 Ack=2102 Win=63488 Len=0 TSval=3350950276 TSecr=2171197800"
"690","2.410881","192.168.123.53","192.168.123.26","TCP","66","57056  >  666 [ACK] Seq=978 Ack=2805 Win=62848 Len=0 TSval=3350950276 TSecr=2171197800"
"693","2.552071","192.168.123.55","192.168.123.26","TCP","74","53534  >  666 [SYN] Seq=0 Win=64240 Len=0 MSS=1460 SACK_PERM=1 TSval=642157250 TSecr=0 WS=128"
"694","2.552104","192.168.123.26","192.168.123.55","TCP","74","666  >  53534 [SYN, ACK] Seq=0 Ack=1 Win=65160 Len=0 MSS=1460 SACK_PERM=1 TSval=615418104 TSecr=642157250 WS=128"
"695","2.552131","192.168.123.55","192.168.123.26","TCP","66","53534  >  666 [ACK] Seq=1 Ack=1 Win=64256 Len=0 TSval=642157250 TSecr=615418104"
"696","2.552440","192.168.123.55","192.168.123.26","TLSv1.3","353","Client Hello"
"697","2.552523","192.168.123.26","192.168.123.55","TCP","66","666  >  53534 [ACK] Seq=1 Ack=288 Win=64896 Len=0 TSval=615418105 TSecr=642157251"
"698","2.553379","192.168.123.26","192.168.123.55","TLSv1.3","1464","Server Hello, Change Cipher Spec, Application Data, Application Data, Application Data, Application Data, Application Data"
"699","2.553411","192.168.123.55","192.168.123.26","TCP","66","53534  >  666 [ACK] Seq=288 Ack=1399 Win=64128 Len=0 TSval=642157252 TSecr=615418105"
"700","2.554620","192.168.123.55","192.168.123.26","TLSv1.3","756","Change Cipher Spec, Application Data, Application Data, Application Data"
"701","2.554666","192.168.123.26","192.168.123.55","TCP","66","666  >  53534 [ACK] Seq=1399 Ack=978 Win=64256 Len=0 TSval=615418107 TSecr=642157253"
"702","2.555321","192.168.123.26","192.168.123.55","TLSv1.3","769","Application Data"
"703","2.555352","192.168.123.55","192.168.123.26","TCP","66","53534  >  666 [ACK] Seq=978 Ack=2102 Win=64128 Len=0 TSval=642157253 TSecr=615418107"
"704","2.555465","192.168.123.26","192.168.123.55","TLSv1.3","769","Application Data"
"705","2.555483","192.168.123.55","192.168.123.26","TCP","66","53534  >  666 [ACK] Seq=978 Ack=2805 Win=64128 Len=0 TSval=642157254 TSecr=615418108"
"708","2.566502","192.168.123.56","192.168.123.26","TCP","74","40914  >  666 [SYN] Seq=0 Win=64240 Len=0 MSS=1460 SACK_PERM=1 TSval=2041638179 TSecr=0 WS=128"
"709","2.566535","192.168.123.26","192.168.123.56","TCP","74","666  >  40914 [SYN, ACK] Seq=0 Ack=1 Win=65160 Len=0 MSS=1460 SACK_PERM=1 TSval=684747048 TSecr=2041638179 WS=128"
"710","2.566571","192.168.123.56","192.168.123.26","TCP","66","40914  >  666 [ACK] Seq=1 Ack=1 Win=64256 Len=0 TSval=2041638180 TSecr=684747048"
"711","2.566882","192.168.123.56","192.168.123.26","TLSv1.3","353","Client Hello"
"712","2.566981","192.168.123.26","192.168.123.56","TCP","66","666  >  40914 [ACK] Seq=1 Ack=288 Win=64896 Len=0 TSval=684747048 TSecr=2041638180"
"713","2.567861","192.168.123.26","192.168.123.56","TLSv1.3","1464","Server Hello, Change Cipher Spec, Application Data, Application Data, Application Data, Application Data, Application Data"
"714","2.567897","192.168.123.56","192.168.123.26","TCP","66","40914  >  666 [ACK] Seq=288 Ack=1399 Win=64128 Len=0 TSval=2041638181 TSecr=684747049"
"715","2.569086","192.168.123.56","192.168.123.26","TLSv1.3","756","Change Cipher Spec, Application Data, Application Data, Application Data"
"716","2.569117","192.168.123.26","192.168.123.56","TCP","66","666  >  40914 [ACK] Seq=1399 Ack=978 Win=64256 Len=0 TSval=684747050 TSecr=2041638182"
"717","2.569698","192.168.123.26","192.168.123.56","TLSv1.3","769","Application Data"
"718","2.569725","192.168.123.56","192.168.123.26","TCP","66","40914  >  666 [ACK] Seq=978 Ack=2102 Win=64128 Len=0 TSval=2041638183 TSecr=684747051"
"719","2.569881","192.168.123.26","192.168.123.56","TLSv1.3","769","Application Data"
"720","2.569902","192.168.123.56","192.168.123.26","TCP","66","40914  >  666 [ACK] Seq=978 Ack=2805 Win=64128 Len=0 TSval=2041638183 TSecr=684747051"
"723","2.621133","192.168.123.52","192.168.123.26","TCP","74","56226  >  666 [SYN] Seq=0 Win=64240 Len=0 MSS=1460 SACK_PERM=1 TSval=392551758 TSecr=0 WS=128"
"724","2.621165","192.168.123.26","192.168.123.52","TCP","74","666  >  56226 [SYN, ACK] Seq=0 Ack=1 Win=65160 Len=0 MSS=1460 SACK_PERM=1 TSval=510326663 TSecr=392551758 WS=128"
"725","2.621192","192.168.123.52","192.168.123.26","TCP","66","56226  >  666 [ACK] Seq=1 Ack=1 Win=64256 Len=0 TSval=392551758 TSecr=510326663"
"726","2.621442","192.168.123.52","192.168.123.26","TLSv1.3","353","Client Hello"
"727","2.621522","192.168.123.26","192.168.123.52","TCP","66","666  >  56226 [ACK] Seq=1 Ack=288 Win=64896 Len=0 TSval=510326664 TSecr=392551759"
"728","2.623525","192.168.123.26","192.168.123.52","TLSv1.3","1464","Server Hello, Change Cipher Spec, Application Data, Application Data, Application Data, Application Data, Application Data"
"729","2.623571","192.168.123.52","192.168.123.26","TCP","66","56226  >  666 [ACK] Seq=288 Ack=1399 Win=64128 Len=0 TSval=392551761 TSecr=510326666"
"730","2.626764","192.168.123.52","192.168.123.26","TLSv1.3","756","Change Cipher Spec, Application Data, Application Data, Application Data"
"731","2.626830","192.168.123.26","192.168.123.52","TCP","66","666  >  56226 [ACK] Seq=1399 Ack=978 Win=64256 Len=0 TSval=510326669 TSecr=392551764"
"733","2.627363","192.168.123.26","192.168.123.52","TLSv1.3","769","Application Data"
"734","2.627394","192.168.123.52","192.168.123.26","TCP","66","56226  >  666 [ACK] Seq=978 Ack=2102 Win=64128 Len=0 TSval=392551764 TSecr=510326669"
"735","2.627504","192.168.123.26","192.168.123.52","TLSv1.3","769","Application Data"
"736","2.627523","192.168.123.52","192.168.123.26","TCP","66","56226  >  666 [ACK] Seq=978 Ack=2805 Win=64128 Len=0 TSval=392551765 TSecr=510326670"
"738","2.627672","192.168.123.54","192.168.123.26","TCP","74","40458  >  666 [SYN] Seq=0 Win=64240 Len=0 MSS=1460 SACK_PERM=1 TSval=2266296411 TSecr=0 WS=128"
"739","2.627704","192.168.123.26","192.168.123.54","TCP","74","666  >  40458 [SYN, ACK] Seq=0 Ack=1 Win=65160 Len=0 MSS=1460 SACK_PERM=1 TSval=3701391740 TSecr=2266296411 WS=128"
"740","2.627732","192.168.123.54","192.168.123.26","TCP","66","40458  >  666 [ACK] Seq=1 Ack=1 Win=64256 Len=0 TSval=2266296412 TSecr=3701391740"
"741","2.627984","192.168.123.54","192.168.123.26","TLSv1.3","353","Client Hello"
"742","2.628052","192.168.123.26","192.168.123.54","TCP","66","666  >  40458 [ACK] Seq=1 Ack=288 Win=64896 Len=0 TSval=3701391740 TSecr=2266296412"
"743","2.628885","192.168.123.26","192.168.123.54","TLSv1.3","1464","Server Hello, Change Cipher Spec, Application Data, Application Data, Application Data, Application Data, Application Data"
"744","2.628916","192.168.123.54","192.168.123.26","TCP","66","40458  >  666 [ACK] Seq=288 Ack=1399 Win=64128 Len=0 TSval=2266296413 TSecr=3701391741"
"745","2.630050","192.168.123.54","192.168.123.26","TLSv1.3","756","Change Cipher Spec, Application Data, Application Data, Application Data"
"746","2.630082","192.168.123.26","192.168.123.54","TCP","66","666  >  40458 [ACK] Seq=1399 Ack=978 Win=64256 Len=0 TSval=3701391742 TSecr=2266296414"
"747","2.630507","192.168.123.26","192.168.123.54","TLSv1.3","769","Application Data"
"748","2.630547","192.168.123.54","192.168.123.26","TCP","66","40458  >  666 [ACK] Seq=978 Ack=2102 Win=64128 Len=0 TSval=2266296415 TSecr=3701391743"
"749","2.630660","192.168.123.26","192.168.123.54","TLSv1.3","769","Application Data"
"750","2.630678","192.168.123.54","192.168.123.26","TCP","66","40458  >  666 [ACK] Seq=978 Ack=2805 Win=64128 Len=0 TSval=2266296415 TSecr=3701391743"
