"No.","Time","Source","Destination","Protocol","Length","Info"
"3","0.000586","192.168.123.43","192.168.123.46","TCP","74","35986  >  666 [SYN] Seq=0 Win=64240 Len=0 MSS=1460 SACK_PERM=1 TSval=3685512111 TSecr=0 WS=128"
"4","0.000626","192.168.123.46","192.168.123.43","TCP","74","666  >  35986 [SYN, ACK] Seq=0 Ack=1 Win=65160 Len=0 MSS=1460 SACK_PERM=1 TSval=4212714716 TSecr=3685512111 WS=128"
"5","0.000658","192.168.123.43","192.168.123.46","TCP","66","35986  >  666 [ACK] Seq=1 Ack=1 Win=64256 Len=0 TSval=3685512112 TSecr=4212714716"
"6","0.000909","192.168.123.43","192.168.123.46","TLSv1.3","353","Client Hello"
"7","0.000975","192.168.123.46","192.168.123.43","TCP","66","666  >  35986 [ACK] Seq=1 Ack=288 Win=64896 Len=0 TSval=4212714716 TSecr=3685512112"
"8","0.002622","192.168.123.46","192.168.123.43","TLSv1.3","1464","Server Hello, Change Cipher Spec, Application Data, Application Data, Application Data, Application Data, Application Data"
"9","0.002653","192.168.123.43","192.168.123.46","TCP","66","35986  >  666 [ACK] Seq=288 Ack=1399 Win=64128 Len=0 TSval=3685512114 TSecr=4212714718"
"10","0.006434","192.168.123.43","192.168.123.46","TLSv1.3","756","Change Cipher Spec, Application Data, Application Data, Application Data"
"11","0.006480","192.168.123.46","192.168.123.43","TCP","66","666  >  35986 [ACK] Seq=1399 Ack=978 Win=64256 Len=0 TSval=4212714721 TSecr=3685512117"
"12","0.007022","192.168.123.46","192.168.123.43","TLSv1.3","769","Application Data"
"13","0.007067","192.168.123.43","192.168.123.46","TCP","66","35986  >  666 [ACK] Seq=978 Ack=2102 Win=64128 Len=0 TSval=3685512118 TSecr=4212714722"
"14","0.007210","192.168.123.46","192.168.123.43","TLSv1.3","769","Application Data"
"15","0.007248","192.168.123.43","192.168.123.46","TCP","66","35986  >  666 [ACK] Seq=978 Ack=2805 Win=64128 Len=0 TSval=3685512118 TSecr=4212714722"
"18","0.013009","192.168.123.5","192.168.123.46","TCP","74","49452  >  666 [SYN] Seq=0 Win=64240 Len=0 MSS=1460 SACK_PERM=1 TSval=1496667711 TSecr=0 WS=128"
"19","0.013075","192.168.123.46","192.168.123.5","TCP","74","666  >  49452 [SYN, ACK] Seq=0 Ack=1 Win=65160 Len=0 MSS=1460 SACK_PERM=1 TSval=1503398920 TSecr=1496667711 WS=128"
"20","0.013109","192.168.123.5","192.168.123.46","TCP","66","49452  >  666 [ACK] Seq=1 Ack=1 Win=64256 Len=0 TSval=1496667712 TSecr=1503398920"
"21","0.013354","192.168.123.5","192.168.123.46","TLSv1.3","353","Client Hello"
"22","0.013419","192.168.123.46","192.168.123.5","TCP","66","666  >  49452 [ACK] Seq=1 Ack=288 Win=64896 Len=0 TSval=1503398920 TSecr=1496667712"
"23","0.014768","192.168.123.46","192.168.123.5","TLSv1.3","1464","Server Hello, Change Cipher Spec, Application Data, Application Data, Application Data, Application Data, Application Data"
"24","0.014802","192.168.123.5","192.168.123.46","TCP","66","49452  >  666 [ACK] Seq=288 Ack=1399 Win=64128 Len=0 TSval=1496667714 TSecr=1503398922"
"25","0.016793","192.168.123.5","192.168.123.46","TLSv1.3","756","Change Cipher Spec, Application Data, Application Data, Application Data"
"26","0.016841","192.168.123.46","192.168.123.5","TCP","66","666  >  49452 [ACK] Seq=1399 Ack=978 Win=64256 Len=0 TSval=1503398924 TSecr=1496667716"
"27","0.017641","192.168.123.46","192.168.123.5","TLSv1.3","769","Application Data"
"28","0.017688","192.168.123.5","192.168.123.46","TCP","66","49452  >  666 [ACK] Seq=978 Ack=2102 Win=64128 Len=0 TSval=1496667717 TSecr=1503398925"
"29","0.017869","192.168.123.46","192.168.123.5","TLSv1.3","769","Application Data"
"30","0.017904","192.168.123.5","192.168.123.46","TCP","66","49452  >  666 [ACK] Seq=978 Ack=2805 Win=64128 Len=0 TSval=1496667717 TSecr=1503398925"
"33","0.021747","192.168.123.15","192.168.123.46","TCP","74","42140  >  666 [SYN] Seq=0 Win=64240 Len=0 MSS=1460 SACK_PERM=1 TSval=1267895312 TSecr=0 WS=128"
"34","0.021783","192.168.123.46","192.168.123.15","TCP","74","666  >  42140 [SYN, ACK] Seq=0 Ack=1 Win=65160 Len=0 MSS=1460 SACK_PERM=1 TSval=1831719839 TSecr=1267895312 WS=128"
"35","0.021813","192.168.123.15","192.168.123.46","TCP","66","42140  >  666 [ACK] Seq=1 Ack=1 Win=64256 Len=0 TSval=1267895313 TSecr=1831719839"
"36","0.022080","192.168.123.15","192.168.123.46","TLSv1.3","353","Client Hello"
"37","0.022143","192.168.123.46","192.168.123.15","TCP","66","666  >  42140 [ACK] Seq=1 Ack=288 Win=64896 Len=0 TSval=1831719839 TSecr=1267895313"
"38","0.024091","192.168.123.46","192.168.123.15","TLSv1.3","1464","Server Hello, Change Cipher Spec, Application Data, Application Data, Application Data, Application Data, Application Data"
"39","0.024139","192.168.123.15","192.168.123.46","TCP","66","42140  >  666 [ACK] Seq=288 Ack=1399 Win=64128 Len=0 TSval=1267895315 TSecr=1831719841"
"40","0.031840","192.168.123.15","192.168.123.46","TLSv1.3","756","Change Cipher Spec, Application Data, Application Data, Application Data"
"41","0.031877","192.168.123.46","192.168.123.15","TCP","66","666  >  42140 [ACK] Seq=1399 Ack=978 Win=64256 Len=0 TSval=1831719849 TSecr=1267895323"
"42","0.032368","192.168.123.46","192.168.123.15","TLSv1.3","769","Application Data"
"43","0.032479","192.168.123.46","192.168.123.15","TLSv1.3","769","Application Data"
"44","0.032480","192.168.123.15","192.168.123.46","TCP","66","42140  >  666 [ACK] Seq=978 Ack=2102 Win=63488 Len=0 TSval=1267895323 TSecr=1831719849"
"45","0.032510","192.168.123.15","192.168.123.46","TCP","66","42140  >  666 [ACK] Seq=978 Ack=2805 Win=62848 Len=0 TSval=1267895323 TSecr=1831719849"
"50","0.039257","192.168.123.64","192.168.123.46","TCP","74","53308  >  666 [SYN] Seq=0 Win=64240 Len=0 MSS=1460 SACK_PERM=1 TSval=2361221024 TSecr=0 WS=128"
"51","0.039268","192.168.123.32","192.168.123.46","TCP","74","35208  >  666 [SYN] Seq=0 Win=64240 Len=0 MSS=1460 SACK_PERM=1 TSval=412865969 TSecr=0 WS=128"
"52","0.039294","192.168.123.46","192.168.123.64","TCP","74","666  >  53308 [SYN, ACK] Seq=0 Ack=1 Win=65160 Len=0 MSS=1460 SACK_PERM=1 TSval=1728735409 TSecr=2361221024 WS=128"
"53","0.039316","192.168.123.46","192.168.123.32","TCP","74","666  >  35208 [SYN, ACK] Seq=0 Ack=1 Win=65160 Len=0 MSS=1460 SACK_PERM=1 TSval=3383682123 TSecr=412865969 WS=128"
"54","0.039324","192.168.123.64","192.168.123.46","TCP","66","53308  >  666 [ACK] Seq=1 Ack=1 Win=64256 Len=0 TSval=2361221025 TSecr=1728735409"
"55","0.039347","192.168.123.32","192.168.123.46","TCP","66","35208  >  666 [ACK] Seq=1 Ack=1 Win=64256 Len=0 TSval=412865970 TSecr=3383682123"
"56","0.039538","192.168.123.64","192.168.123.46","TLSv1.3","353","Client Hello"
"57","0.039552","192.168.123.32","192.168.123.46","TLSv1.3","353","Client Hello"
"58","0.039594","192.168.123.46","192.168.123.64","TCP","66","666  >  53308 [ACK] Seq=1 Ack=288 Win=64896 Len=0 TSval=1728735410 TSecr=2361221025"
"59","0.039598","192.168.123.46","192.168.123.32","TCP","66","666  >  35208 [ACK] Seq=1 Ack=288 Win=64896 Len=0 TSval=3383682124 TSecr=412865971"
"60","0.040619","192.168.123.46","192.168.123.64","TLSv1.3","1464","Server Hello, Change Cipher Spec, Application Data, Application Data, Application Data, Application Data, Application Data"
"61","0.040652","192.168.123.64","192.168.123.46","TCP","66","53308  >  666 [ACK] Seq=288 Ack=1399 Win=64128 Len=0 TSval=2361221027 TSecr=1728735411"
"62","0.040689","192.168.123.46","192.168.123.32","TLSv1.3","1464","Server Hello, Change Cipher Spec, Application Data, Application Data, Application Data, Application Data, Application Data"
"63","0.040723","192.168.123.32","192.168.123.46","TCP","66","35208  >  666 [ACK] Seq=288 Ack=1399 Win=64128 Len=0 TSval=412865972 TSecr=3383682125"
"64","0.043538","192.168.123.32","192.168.123.46","TLSv1.3","756","Change Cipher Spec, Application Data, Application Data, Application Data"
"65","0.043568","192.168.123.46","192.168.123.32","TCP","66","666  >  35208 [ACK] Seq=1399 Ack=978 Win=64256 Len=0 TSval=3383682128 TSecr=412865974"
"66","0.044061","192.168.123.46","192.168.123.32","TLSv1.3","769","Application Data"
"67","0.044177","192.168.123.46","192.168.123.32","TLSv1.3","769","Application Data"
"68","0.044248","192.168.123.32","192.168.123.46","TCP","66","35208  >  666 [ACK] Seq=978 Ack=2102 Win=63488 Len=0 TSval=412865975 TSecr=3383682128"
"69","0.044253","192.168.123.64","192.168.123.46","TLSv1.3","756","Change Cipher Spec, Application Data, Application Data, Application Data"
"70","0.044271","192.168.123.32","192.168.123.46","TCP","66","35208  >  666 [ACK] Seq=978 Ack=2805 Win=62848 Len=0 TSval=412865975 TSecr=3383682128"
"71","0.044282","192.168.123.46","192.168.123.64","TCP","66","666  >  53308 [ACK] Seq=1399 Ack=978 Win=64256 Len=0 TSval=1728735414 TSecr=2361221030"
"72","0.044787","192.168.123.46","192.168.123.64","TLSv1.3","769","Application Data"
"73","0.044891","192.168.123.46","192.168.123.64","TLSv1.3","769","Application Data"
"74","0.044961","192.168.123.64","192.168.123.46","TCP","66","53308  >  666 [ACK] Seq=978 Ack=2102 Win=63488 Len=0 TSval=2361221031 TSecr=1728735415"
"75","0.044985","192.168.123.64","192.168.123.46","TCP","66","53308  >  666 [ACK] Seq=978 Ack=2805 Win=62848 Len=0 TSval=2361221031 TSecr=1728735415"
"78","0.046719","192.168.123.21","192.168.123.46","TCP","74","35442  >  666 [SYN] Seq=0 Win=64240 Len=0 MSS=1460 SACK_PERM=1 TSval=2892470585 TSecr=0 WS=128"
"79","0.046761","192.168.123.46","192.168.123.21","TCP","74","666  >  35442 [SYN, ACK] Seq=0 Ack=1 Win=65160 Len=0 MSS=1460 SACK_PERM=1 TSval=911501761 TSecr=2892470585 WS=128"
"80","0.046786","192.168.123.21","192.168.123.46","TCP","66","35442  >  666 [ACK] Seq=1 Ack=1 Win=64256 Len=0 TSval=2892470586 TSecr=911501761"
"81","0.046959","192.168.123.21","192.168.123.46","TLSv1.3","353","Client Hello"
"82","0.047052","192.168.123.46","192.168.123.21","TCP","66","666  >  35442 [ACK] Seq=1 Ack=288 Win=64896 Len=0 TSval=911501761 TSecr=2892470586"
"83","0.048146","192.168.123.46","192.168.123.21","TLSv1.3","1464","Server Hello, Change Cipher Spec, Application Data, Application Data, Application Data, Application Data, Application Data"
"84","0.048174","192.168.123.21","192.168.123.46","TCP","66","35442  >  666 [ACK] Seq=288 Ack=1399 Win=64128 Len=0 TSval=2892470587 TSecr=911501762"
"85","0.050965","192.168.123.21","192.168.123.46","TLSv1.3","756","Change Cipher Spec, Application Data, Application Data, Application Data"
"86","0.050995","192.168.123.46","192.168.123.21","TCP","66","666  >  35442 [ACK] Seq=1399 Ack=978 Win=64256 Len=0 TSval=911501765 TSecr=2892470590"
"87","0.051579","192.168.123.46","192.168.123.21","TLSv1.3","769","Application Data"
"88","0.051610","192.168.123.21","192.168.123.46","TCP","66","35442  >  666 [ACK] Seq=978 Ack=2102 Win=64128 Len=0 TSval=2892470591 TSecr=911501766"
"89","0.051750","192.168.123.46","192.168.123.21","TLSv1.3","769","Application Data"
"90","0.051780","192.168.123.21","192.168.123.46","TCP","66","35442  >  666 [ACK] Seq=978 Ack=2805 Win=64128 Len=0 TSval=2892470591 TSecr=911501766"
"93","0.063844","192.168.123.59","192.168.123.46","TCP","74","35508  >  666 [SYN] Seq=0 Win=64240 Len=0 MSS=1460 SACK_PERM=1 TSval=4242393336 TSecr=0 WS=128"
"94","0.063879","192.168.123.46","192.168.123.59","TCP","74","666  >  35508 [SYN, ACK] Seq=0 Ack=1 Win=65160 Len=0 MSS=1460 SACK_PERM=1 TSval=2088276857 TSecr=4242393336 WS=128"
"95","0.063908","192.168.123.59","192.168.123.46","TCP","66","35508  >  666 [ACK] Seq=1 Ack=1 Win=64256 Len=0 TSval=4242393337 TSecr=2088276857"
"96","0.064190","192.168.123.59","192.168.123.46","TLSv1.3","353","Client Hello"
"97","0.064265","192.168.123.46","192.168.123.59","TCP","66","666  >  35508 [ACK] Seq=1 Ack=288 Win=64896 Len=0 TSval=2088276857 TSecr=4242393337"
"98","0.065167","192.168.123.46","192.168.123.59","TLSv1.3","1464","Server Hello, Change Cipher Spec, Application Data, Application Data, Application Data, Application Data, Application Data"
"99","0.065206","192.168.123.59","192.168.123.46","TCP","66","35508  >  666 [ACK] Seq=288 Ack=1399 Win=64128 Len=0 TSval=4242393338 TSecr=2088276858"
"100","0.067164","192.168.123.59","192.168.123.46","TLSv1.3","756","Change Cipher Spec, Application Data, Application Data, Application Data"
"101","0.067209","192.168.123.46","192.168.123.59","TCP","66","666  >  35508 [ACK] Seq=1399 Ack=978 Win=64256 Len=0 TSval=2088276860 TSecr=4242393340"
"102","0.067708","192.168.123.46","192.168.123.59","TLSv1.3","769","Application Data"
"103","0.067821","192.168.123.46","192.168.123.59","TLSv1.3","769","Application Data"
"104","0.067902","192.168.123.59","192.168.123.46","TCP","66","35508  >  666 [ACK] Seq=978 Ack=2102 Win=63488 Len=0 TSval=4242393341 TSecr=2088276861"
"105","0.067925","192.168.123.59","192.168.123.46","TCP","66","35508  >  666 [ACK] Seq=978 Ack=2805 Win=62848 Len=0 TSval=4242393341 TSecr=2088276861"
"108","0.070002","192.168.123.39","192.168.123.46","TCP","74","53848  >  666 [SYN] Seq=0 Win=64240 Len=0 MSS=1460 SACK_PERM=1 TSval=3581445173 TSecr=0 WS=128"
"109","0.070038","192.168.123.46","192.168.123.39","TCP","74","666  >  53848 [SYN, ACK] Seq=0 Ack=1 Win=65160 Len=0 MSS=1460 SACK_PERM=1 TSval=3070183253 TSecr=3581445173 WS=128"
"110","0.070067","192.168.123.39","192.168.123.46","TCP","66","53848  >  666 [ACK] Seq=1 Ack=1 Win=64256 Len=0 TSval=3581445174 TSecr=3070183253"
"111","0.070327","192.168.123.39","192.168.123.46","TLSv1.3","353","Client Hello"
"112","0.070390","192.168.123.46","192.168.123.39","TCP","66","666  >  53848 [ACK] Seq=1 Ack=288 Win=64896 Len=0 TSval=3070183253 TSecr=3581445174"
"113","0.071134","192.168.123.46","192.168.123.39","TLSv1.3","1464","Server Hello, Change Cipher Spec, Application Data, Application Data, Application Data, Application Data, Application Data"
"114","0.071163","192.168.123.39","192.168.123.46","TCP","66","53848  >  666 [ACK] Seq=288 Ack=1399 Win=64128 Len=0 TSval=3581445175 TSecr=3070183254"
"115","0.072406","192.168.123.39","192.168.123.46","TLSv1.3","756","Change Cipher Spec, Application Data, Application Data, Application Data"
"116","0.072436","192.168.123.46","192.168.123.39","TCP","66","666  >  53848 [ACK] Seq=1399 Ack=978 Win=64256 Len=0 TSval=3070183255 TSecr=3581445176"
"117","0.072976","192.168.123.46","192.168.123.39","TLSv1.3","769","Application Data"
"118","0.073009","192.168.123.39","192.168.123.46","TCP","66","53848  >  666 [ACK] Seq=978 Ack=2102 Win=64128 Len=0 TSval=3581445177 TSecr=3070183256"
"119","0.073135","192.168.123.46","192.168.123.39","TLSv1.3","769","Application Data"
"120","0.073157","192.168.123.39","192.168.123.46","TCP","66","53848  >  666 [ACK] Seq=978 Ack=2805 Win=64128 Len=0 TSval=3581445177 TSecr=3070183256"
"123","0.081227","192.168.123.27","192.168.123.46","TCP","74","34394  >  666 [SYN] Seq=0 Win=64240 Len=0 MSS=1460 SACK_PERM=1 TSval=3048200743 TSecr=0 WS=128"
"124","0.081285","192.168.123.46","192.168.123.27","TCP","74","666  >  34394 [SYN, ACK] Seq=0 Ack=1 Win=65160 Len=0 MSS=1460 SACK_PERM=1 TSval=1228699822 TSecr=3048200743 WS=128"
"125","0.081332","192.168.123.27","192.168.123.46","TCP","66","34394  >  666 [ACK] Seq=1 Ack=1 Win=64256 Len=0 TSval=3048200744 TSecr=1228699822"
"126","0.081577","192.168.123.27","192.168.123.46","TLSv1.3","353","Client Hello"
"127","0.081640","192.168.123.46","192.168.123.27","TCP","66","666  >  34394 [ACK] Seq=1 Ack=288 Win=64896 Len=0 TSval=1228699823 TSecr=3048200745"
"128","0.082492","192.168.123.46","192.168.123.27","TLSv1.3","1464","Server Hello, Change Cipher Spec, Application Data, Application Data, Application Data, Application Data, Application Data"
"129","0.082530","192.168.123.27","192.168.123.46","TCP","66","34394  >  666 [ACK] Seq=288 Ack=1399 Win=64128 Len=0 TSval=3048200745 TSecr=1228699823"
"130","0.084485","192.168.123.27","192.168.123.46","TLSv1.3","756","Change Cipher Spec, Application Data, Application Data, Application Data"
"131","0.084536","192.168.123.46","192.168.123.27","TCP","66","666  >  34394 [ACK] Seq=1399 Ack=978 Win=64256 Len=0 TSval=1228699825 TSecr=3048200747"
"132","0.085016","192.168.123.46","192.168.123.27","TLSv1.3","769","Application Data"
"133","0.085057","192.168.123.27","192.168.123.46","TCP","66","34394  >  666 [ACK] Seq=978 Ack=2102 Win=64128 Len=0 TSval=3048200748 TSecr=1228699826"
"134","0.085189","192.168.123.46","192.168.123.27","TLSv1.3","769","Application Data"
"135","0.085222","192.168.123.27","192.168.123.46","TCP","66","34394  >  666 [ACK] Seq=978 Ack=2805 Win=64128 Len=0 TSval=3048200748 TSecr=1228699826"
"138","0.086140","192.168.123.18","192.168.123.46","TCP","74","45158  >  666 [SYN] Seq=0 Win=64240 Len=0 MSS=1460 SACK_PERM=1 TSval=4166840293 TSecr=0 WS=128"
"139","0.086181","192.168.123.46","192.168.123.18","TCP","74","666  >  45158 [SYN, ACK] Seq=0 Ack=1 Win=65160 Len=0 MSS=1460 SACK_PERM=1 TSval=2097234685 TSecr=4166840293 WS=128"
"140","0.086229","192.168.123.18","192.168.123.46","TCP","66","45158  >  666 [ACK] Seq=1 Ack=1 Win=64256 Len=0 TSval=4166840294 TSecr=2097234685"
"141","0.086495","192.168.123.18","192.168.123.46","TLSv1.3","353","Client Hello"
"142","0.086559","192.168.123.46","192.168.123.18","TCP","66","666  >  45158 [ACK] Seq=1 Ack=288 Win=64896 Len=0 TSval=2097234685 TSecr=4166840294"
"143","0.087363","192.168.123.46","192.168.123.18","TLSv1.3","1464","Server Hello, Change Cipher Spec, Application Data, Application Data, Application Data, Application Data, Application Data"
"144","0.087432","192.168.123.18","192.168.123.46","TCP","66","45158  >  666 [ACK] Seq=288 Ack=1399 Win=64128 Len=0 TSval=4166840295 TSecr=2097234686"
"145","0.090757","192.168.123.18","192.168.123.46","TLSv1.3","756","Change Cipher Spec, Application Data, Application Data, Application Data"
"146","0.090786","192.168.123.46","192.168.123.18","TCP","66","666  >  45158 [ACK] Seq=1399 Ack=978 Win=64256 Len=0 TSval=2097234690 TSecr=4166840299"
"147","0.091278","192.168.123.46","192.168.123.18","TLSv1.3","769","Application Data"
"148","0.091417","192.168.123.46","192.168.123.18","TLSv1.3","769","Application Data"
"149","0.091523","192.168.123.18","192.168.123.46","TCP","66","45158  >  666 [ACK] Seq=978 Ack=2102 Win=63488 Len=0 TSval=4166840299 TSecr=2097234690"
"150","0.091545","192.168.123.18","192.168.123.46","TCP","66","45158  >  666 [ACK] Seq=978 Ack=2805 Win=62848 Len=0 TSval=4166840300 TSecr=2097234690"
"153","0.104105","192.168.123.66","192.168.123.46","TCP","74","53364  >  666 [SYN] Seq=0 Win=64240 Len=0 MSS=1460 SACK_PERM=1 TSval=258079747 TSecr=0 WS=128"
"154","0.104136","192.168.123.46","192.168.123.66","TCP","74","666  >  53364 [SYN, ACK] Seq=0 Ack=1 Win=65160 Len=0 MSS=1460 SACK_PERM=1 TSval=1597365401 TSecr=258079747 WS=128"
"155","0.104163","192.168.123.66","192.168.123.46","TCP","66","53364  >  666 [ACK] Seq=1 Ack=1 Win=64256 Len=0 TSval=258079748 TSecr=1597365401"
"156","0.104393","192.168.123.66","192.168.123.46","TLSv1.3","353","Client Hello"
"157","0.104470","192.168.123.46","192.168.123.66","TCP","66","666  >  53364 [ACK] Seq=1 Ack=288 Win=64896 Len=0 TSval=1597365401 TSecr=258079748"
"158","0.105214","192.168.123.46","192.168.123.66","TLSv1.3","1464","Server Hello, Change Cipher Spec, Application Data, Application Data, Application Data, Application Data, Application Data"
"159","0.105245","192.168.123.66","192.168.123.46","TCP","66","53364  >  666 [ACK] Seq=288 Ack=1399 Win=64128 Len=0 TSval=258079749 TSecr=1597365402"
"160","0.107763","192.168.123.66","192.168.123.46","TLSv1.3","756","Change Cipher Spec, Application Data, Application Data, Application Data"
"161","0.107792","192.168.123.46","192.168.123.66","TCP","66","666  >  53364 [ACK] Seq=1399 Ack=978 Win=64256 Len=0 TSval=1597365405 TSecr=258079752"
"162","0.108231","192.168.123.46","192.168.123.66","TLSv1.3","769","Application Data"
"163","0.108260","192.168.123.66","192.168.123.46","TCP","66","53364  >  666 [ACK] Seq=978 Ack=2102 Win=64128 Len=0 TSval=258079752 TSecr=1597365405"
"164","0.108379","192.168.123.46","192.168.123.66","TLSv1.3","769","Application Data"
"165","0.108398","192.168.123.66","192.168.123.46","TCP","66","53364  >  666 [ACK] Seq=978 Ack=2805 Win=64128 Len=0 TSval=258079752 TSecr=1597365405"
"168","0.131355","192.168.123.47","192.168.123.46","TCP","74","41496  >  666 [SYN] Seq=0 Win=64240 Len=0 MSS=1460 SACK_PERM=1 TSval=285581850 TSecr=0 WS=128"
"169","0.131392","192.168.123.46","192.168.123.47","TCP","74","666  >  41496 [SYN, ACK] Seq=0 Ack=1 Win=65160 Len=0 MSS=1460 SACK_PERM=1 TSval=265819234 TSecr=285581850 WS=128"
"170","0.131421","192.168.123.47","192.168.123.46","TCP","66","41496  >  666 [ACK] Seq=1 Ack=1 Win=64256 Len=0 TSval=285581851 TSecr=265819234"
"171","0.131647","192.168.123.47","192.168.123.46","TLSv1.3","353","Client Hello"
"172","0.131713","192.168.123.46","192.168.123.47","TCP","66","666  >  41496 [ACK] Seq=1 Ack=288 Win=64896 Len=0 TSval=265819235 TSecr=285581852"
"173","0.132573","192.168.123.46","192.168.123.47","TLSv1.3","1464","Server Hello, Change Cipher Spec, Application Data, Application Data, Application Data, Application Data, Application Data"
"174","0.132605","192.168.123.47","192.168.123.46","TCP","66","41496  >  666 [ACK] Seq=288 Ack=1399 Win=64128 Len=0 TSval=285581853 TSecr=265819236"
"175","0.134033","192.168.123.47","192.168.123.46","TLSv1.3","756","Change Cipher Spec, Application Data, Application Data, Application Data"
"176","0.134078","192.168.123.46","192.168.123.47","TCP","66","666  >  41496 [ACK] Seq=1399 Ack=978 Win=64256 Len=0 TSval=265819237 TSecr=285581854"
"177","0.134606","192.168.123.46","192.168.123.47","TLSv1.3","769","Application Data"
"178","0.134640","192.168.123.47","192.168.123.46","TCP","66","41496  >  666 [ACK] Seq=978 Ack=2102 Win=64128 Len=0 TSval=285581855 TSecr=265819238"
"179","0.134772","192.168.123.46","192.168.123.47","TLSv1.3","769","Application Data"
"180","0.134793","192.168.123.47","192.168.123.46","TCP","66","41496  >  666 [ACK] Seq=978 Ack=2805 Win=64128 Len=0 TSval=285581855 TSecr=265819238"
"183","0.136925","192.168.123.33","192.168.123.46","TCP","74","36878  >  666 [SYN] Seq=0 Win=64240 Len=0 MSS=1460 SACK_PERM=1 TSval=3941373140 TSecr=0 WS=128"
"184","0.136966","192.168.123.46","192.168.123.33","TCP","74","666  >  36878 [SYN, ACK] Seq=0 Ack=1 Win=65160 Len=0 MSS=1460 SACK_PERM=1 TSval=2855541457 TSecr=3941373140 WS=128"
"185","0.136997","192.168.123.33","192.168.123.46","TCP","66","36878  >  666 [ACK] Seq=1 Ack=1 Win=64256 Len=0 TSval=3941373141 TSecr=2855541457"
"186","0.137262","192.168.123.33","192.168.123.46","TLSv1.3","353","Client Hello"
"187","0.137325","192.168.123.46","192.168.123.33","TCP","66","666  >  36878 [ACK] Seq=1 Ack=288 Win=64896 Len=0 TSval=2855541457 TSecr=3941373141"
"188","0.138651","192.168.123.46","192.168.123.33","TLSv1.3","1464","Server Hello, Change Cipher Spec, Application Data, Application Data, Application Data, Application Data, Application Data"
"189","0.138711","192.168.123.33","192.168.123.46","TCP","66","36878  >  666 [ACK] Seq=288 Ack=1399 Win=64128 Len=0 TSval=3941373143 TSecr=2855541459"
"192","0.139616","192.168.123.49","192.168.123.46","TCP","74","57128  >  666 [SYN] Seq=0 Win=64240 Len=0 MSS=1460 SACK_PERM=1 TSval=512040432 TSecr=0 WS=128"
"193","0.139663","192.168.123.46","192.168.123.49","TCP","74","666  >  57128 [SYN, ACK] Seq=0 Ack=1 Win=65160 Len=0 MSS=1460 SACK_PERM=1 TSval=3172278413 TSecr=512040432 WS=128"
"194","0.139705","192.168.123.49","192.168.123.46","TCP","66","57128  >  666 [ACK] Seq=1 Ack=1 Win=64256 Len=0 TSval=512040433 TSecr=3172278413"
"195","0.140023","192.168.123.49","192.168.123.46","TLSv1.3","353","Client Hello"
"196","0.140115","192.168.123.46","192.168.123.49","TCP","66","666  >  57128 [ACK] Seq=1 Ack=288 Win=64896 Len=0 TSval=3172278413 TSecr=512040433"
"197","0.140617","192.168.123.33","192.168.123.46","TLSv1.3","756","Change Cipher Spec, Application Data, Application Data, Application Data"
"198","0.140667","192.168.123.46","192.168.123.33","TCP","66","666  >  36878 [ACK] Seq=1399 Ack=978 Win=64256 Len=0 TSval=2855541461 TSecr=3941373145"
"199","0.140926","192.168.123.46","192.168.123.49","TLSv1.3","1464","Server Hello, Change Cipher Spec, Application Data, Application Data, Application Data, Application Data, Application Data"
"200","0.140975","192.168.123.49","192.168.123.46","TCP","66","57128  >  666 [ACK] Seq=288 Ack=1399 Win=64128 Len=0 TSval=512040434 TSecr=3172278414"
"201","0.141281","192.168.123.46","192.168.123.33","TLSv1.3","769","Application Data"
"202","0.141316","192.168.123.33","192.168.123.46","TCP","66","36878  >  666 [ACK] Seq=978 Ack=2102 Win=64128 Len=0 TSval=3941373145 TSecr=2855541461"
"203","0.141492","192.168.123.46","192.168.123.33","TLSv1.3","769","Application Data"
"204","0.141524","192.168.123.33","192.168.123.46","TCP","66","36878  >  666 [ACK] Seq=978 Ack=2805 Win=64128 Len=0 TSval=3941373145 TSecr=2855541461"
"208","0.143203","192.168.123.49","192.168.123.46","TLSv1.3","756","Change Cipher Spec, Application Data, Application Data, Application Data"
"209","0.143236","192.168.123.46","192.168.123.49","TCP","66","666  >  57128 [ACK] Seq=1399 Ack=978 Win=64256 Len=0 TSval=3172278416 TSecr=512040436"
"213","0.143383","192.168.123.37","192.168.123.46","TCP","74","35718  >  666 [SYN] Seq=0 Win=64240 Len=0 MSS=1460 SACK_PERM=1 TSval=2669908132 TSecr=0 WS=128"
"214","0.143413","192.168.123.14","192.168.123.46","TCP","74","58674  >  666 [SYN] Seq=0 Win=64240 Len=0 MSS=1460 SACK_PERM=1 TSval=2244860792 TSecr=0 WS=128"
"215","0.143417","192.168.123.46","192.168.123.37","TCP","74","666  >  35718 [SYN, ACK] Seq=0 Ack=1 Win=65160 Len=0 MSS=1460 SACK_PERM=1 TSval=465030774 TSecr=2669908132 WS=128"
"217","0.143446","192.168.123.46","192.168.123.14","TCP","74","666  >  58674 [SYN, ACK] Seq=0 Ack=1 Win=65160 Len=0 MSS=1460 SACK_PERM=1 TSval=3470673504 TSecr=2244860792 WS=128"
"218","0.143448","192.168.123.37","192.168.123.46","TCP","66","35718  >  666 [ACK] Seq=1 Ack=1 Win=64256 Len=0 TSval=2669908132 TSecr=465030774"
"219","0.143474","192.168.123.16","192.168.123.46","TCP","74","35424  >  666 [SYN] Seq=0 Win=64240 Len=0 MSS=1460 SACK_PERM=1 TSval=964187972 TSecr=0 WS=128"
"220","0.143476","192.168.123.14","192.168.123.46","TCP","66","58674  >  666 [ACK] Seq=1 Ack=1 Win=64256 Len=0 TSval=2244860792 TSecr=3470673504"
"221","0.143510","192.168.123.46","192.168.123.16","TCP","74","666  >  35424 [SYN, ACK] Seq=0 Ack=1 Win=65160 Len=0 MSS=1460 SACK_PERM=1 TSval=430692645 TSecr=964187972 WS=128"
"222","0.143543","192.168.123.16","192.168.123.46","TCP","66","35424  >  666 [ACK] Seq=1 Ack=1 Win=64256 Len=0 TSval=964187973 TSecr=430692645"
"223","0.143654","192.168.123.37","192.168.123.46","TLSv1.3","353","Client Hello"
"224","0.143657","192.168.123.46","192.168.123.49","TLSv1.3","769","Application Data"
"226","0.143691","192.168.123.49","192.168.123.46","TCP","66","57128  >  666 [ACK] Seq=978 Ack=2102 Win=64128 Len=0 TSval=512040437 TSecr=3172278417"
"227","0.143715","192.168.123.46","192.168.123.37","TCP","66","666  >  35718 [ACK] Seq=1 Ack=288 Win=64896 Len=0 TSval=465030775 TSecr=2669908133"
"228","0.143721","192.168.123.17","192.168.123.46","TCP","74","53938  >  666 [SYN] Seq=0 Win=64240 Len=0 MSS=1460 SACK_PERM=1 TSval=179272478 TSecr=0 WS=128"
"229","0.143772","192.168.123.14","192.168.123.46","TLSv1.3","353","Client Hello"
"230","0.143773","192.168.123.46","192.168.123.17","TCP","74","666  >  53938 [SYN, ACK] Seq=0 Ack=1 Win=65160 Len=0 MSS=1460 SACK_PERM=1 TSval=1638962088 TSecr=179272478 WS=128"
"231","0.143805","192.168.123.46","192.168.123.49","TLSv1.3","769","Application Data"
"232","0.143820","192.168.123.17","192.168.123.46","TCP","66","53938  >  666 [ACK] Seq=1 Ack=1 Win=64256 Len=0 TSval=179272479 TSecr=1638962088"
"233","0.143825","192.168.123.49","192.168.123.46","TCP","66","57128  >  666 [ACK] Seq=978 Ack=2805 Win=64128 Len=0 TSval=512040437 TSecr=3172278417"
"234","0.143829","192.168.123.16","192.168.123.46","TLSv1.3","353","Client Hello"
"235","0.143848","192.168.123.46","192.168.123.14","TCP","66","666  >  58674 [ACK] Seq=1 Ack=288 Win=64896 Len=0 TSval=3470673505 TSecr=2244860793"
"236","0.143893","192.168.123.46","192.168.123.16","TCP","66","666  >  35424 [ACK] Seq=1 Ack=288 Win=64896 Len=0 TSval=430692646 TSecr=964187973"
"237","0.144079","192.168.123.17","192.168.123.46","TLSv1.3","353","Client Hello"
"238","0.144156","192.168.123.46","192.168.123.17","TCP","66","666  >  53938 [ACK] Seq=1 Ack=288 Win=64896 Len=0 TSval=1638962088 TSecr=179272479"
"239","0.144543","192.168.123.46","192.168.123.14","TLSv1.3","1464","Server Hello, Change Cipher Spec, Application Data, Application Data, Application Data, Application Data, Application Data"
"240","0.144578","192.168.123.14","192.168.123.46","TCP","66","58674  >  666 [ACK] Seq=288 Ack=1399 Win=64128 Len=0 TSval=2244860794 TSecr=3470673505"
"241","0.144791","192.168.123.46","192.168.123.37","TLSv1.3","1464","Server Hello, Change Cipher Spec, Application Data, Application Data, Application Data, Application Data, Application Data"
"242","0.144836","192.168.123.37","192.168.123.46","TCP","66","35718  >  666 [ACK] Seq=288 Ack=1399 Win=64128 Len=0 TSval=2669908134 TSecr=465030776"
"243","0.144903","192.168.123.46","192.168.123.17","TLSv1.3","1464","Server Hello, Change Cipher Spec, Application Data, Application Data, Application Data, Application Data, Application Data"
"244","0.144905","192.168.123.46","192.168.123.16","TLSv1.3","1464","Server Hello, Change Cipher Spec, Application Data, Application Data, Application Data, Application Data, Application Data"
"245","0.144938","192.168.123.17","192.168.123.46","TCP","66","53938  >  666 [ACK] Seq=288 Ack=1399 Win=64128 Len=0 TSval=179272480 TSecr=1638962089"
"246","0.144945","192.168.123.16","192.168.123.46","TCP","66","35424  >  666 [ACK] Seq=288 Ack=1399 Win=64128 Len=0 TSval=964187974 TSecr=430692647"
"249","0.146189","192.168.123.16","192.168.123.46","TLSv1.3","756","Change Cipher Spec, Application Data, Application Data, Application Data"
"250","0.146194","192.168.123.44","192.168.123.46","TCP","74","46236  >  666 [SYN] Seq=0 Win=64240 Len=0 MSS=1460 SACK_PERM=1 TSval=3229392483 TSecr=0 WS=128"
"251","0.146220","192.168.123.46","192.168.123.16","TCP","66","666  >  35424 [ACK] Seq=1399 Ack=978 Win=64256 Len=0 TSval=430692648 TSecr=964187975"
"252","0.146244","192.168.123.46","192.168.123.44","TCP","74","666  >  46236 [SYN, ACK] Seq=0 Ack=1 Win=65160 Len=0 MSS=1460 SACK_PERM=1 TSval=3944650818 TSecr=3229392483 WS=128"
"253","0.146256","192.168.123.17","192.168.123.46","TLSv1.3","756","Change Cipher Spec, Application Data, Application Data, Application Data"
"254","0.146288","192.168.123.46","192.168.123.17","TCP","66","666  >  53938 [ACK] Seq=1399 Ack=978 Win=64256 Len=0 TSval=1638962090 TSecr=179272481"
"255","0.146293","192.168.123.44","192.168.123.46","TCP","66","46236  >  666 [ACK] Seq=1 Ack=1 Win=64256 Len=0 TSval=3229392484 TSecr=3944650818"
"256","0.146603","192.168.123.44","192.168.123.46","TLSv1.3","353","Client Hello"
"257","0.146645","192.168.123.46","192.168.123.16","TLSv1.3","769","Application Data"
"258","0.146685","192.168.123.46","192.168.123.44","TCP","66","666  >  46236 [ACK] Seq=1 Ack=288 Win=64896 Len=0 TSval=3944650819 TSecr=3229392485"
"259","0.146687","192.168.123.16","192.168.123.46","TCP","66","35424  >  666 [ACK] Seq=978 Ack=2102 Win=64128 Len=0 TSval=964187976 TSecr=430692649"
"260","0.146828","192.168.123.14","192.168.123.46","TLSv1.3","756","Change Cipher Spec, Application Data, Application Data, Application Data"
"261","0.146868","192.168.123.46","192.168.123.16","TLSv1.3","769","Application Data"
"262","0.146876","192.168.123.46","192.168.123.14","TCP","66","666  >  58674 [ACK] Seq=1399 Ack=978 Win=64256 Len=0 TSval=3470673508 TSecr=2244860796"
"263","0.146902","192.168.123.16","192.168.123.46","TCP","66","35424  >  666 [ACK] Seq=978 Ack=2805 Win=64128 Len=0 TSval=964187976 TSecr=430692649"
"264","0.146903","192.168.123.46","192.168.123.17","TLSv1.3","769","Application Data"
"265","0.146938","192.168.123.17","192.168.123.46","TCP","66","53938  >  666 [ACK] Seq=978 Ack=2102 Win=64128 Len=0 TSval=179272482 TSecr=1638962091"
"266","0.147058","192.168.123.46","192.168.123.17","TLSv1.3","769","Application Data"
"267","0.147081","192.168.123.17","192.168.123.46","TCP","66","53938  >  666 [ACK] Seq=978 Ack=2805 Win=64128 Len=0 TSval=179272482 TSecr=1638962091"
"268","0.147358","192.168.123.46","192.168.123.14","TLSv1.3","769","Application Data"
"269","0.147498","192.168.123.46","192.168.123.14","TLSv1.3","769","Application Data"
"270","0.147575","192.168.123.14","192.168.123.46","TCP","66","58674  >  666 [ACK] Seq=978 Ack=2102 Win=63488 Len=0 TSval=2244860797 TSecr=3470673508"
"271","0.147580","192.168.123.37","192.168.123.46","TLSv1.3","756","Change Cipher Spec, Application Data, Application Data, Application Data"
"272","0.147600","192.168.123.14","192.168.123.46","TCP","66","58674  >  666 [ACK] Seq=978 Ack=2805 Win=62848 Len=0 TSval=2244860797 TSecr=3470673508"
"273","0.147614","192.168.123.46","192.168.123.37","TCP","66","666  >  35718 [ACK] Seq=1399 Ack=978 Win=64256 Len=0 TSval=465030779 TSecr=2669908137"
"274","0.147760","192.168.123.46","192.168.123.44","TLSv1.3","1464","Server Hello, Change Cipher Spec, Application Data, Application Data, Application Data, Application Data, Application Data"
"275","0.147793","192.168.123.44","192.168.123.46","TCP","66","46236  >  666 [ACK] Seq=288 Ack=1399 Win=64128 Len=0 TSval=3229392486 TSecr=3944650820"
"276","0.148137","192.168.123.46","192.168.123.37","TLSv1.3","769","Application Data"
"277","0.148366","192.168.123.46","192.168.123.37","TLSv1.3","769","Application Data"
"278","0.148477","192.168.123.37","192.168.123.46","TCP","66","35718  >  666 [ACK] Seq=978 Ack=2102 Win=63488 Len=0 TSval=2669908137 TSecr=465030779"
"279","0.148517","192.168.123.37","192.168.123.46","TCP","66","35718  >  666 [ACK] Seq=978 Ack=2805 Win=62848 Len=0 TSval=2669908137 TSecr=465030779"
"282","0.149260","192.168.123.22","192.168.123.46","TCP","74","36810  >  666 [SYN] Seq=0 Win=64240 Len=0 MSS=1460 SACK_PERM=1 TSval=142709094 TSecr=0 WS=128"
"283","0.149331","192.168.123.46","192.168.123.22","TCP","74","666  >  36810 [SYN, ACK] Seq=0 Ack=1 Win=65160 Len=0 MSS=1460 SACK_PERM=1 TSval=1603164409 TSecr=142709094 WS=128"
"284","0.149375","192.168.123.44","192.168.123.46","TLSv1.3","756","Change Cipher Spec, Application Data, Application Data, Application Data"
"285","0.149378","192.168.123.22","192.168.123.46","TCP","66","36810  >  666 [ACK] Seq=1 Ack=1 Win=64256 Len=0 TSval=142709095 TSecr=1603164409"
"286","0.149408","192.168.123.46","192.168.123.44","TCP","66","666  >  46236 [ACK] Seq=1399 Ack=978 Win=64256 Len=0 TSval=3944650821 TSecr=3229392487"
"287","0.149633","192.168.123.22","192.168.123.46","TLSv1.3","353","Client Hello"
"288","0.149696","192.168.123.46","192.168.123.22","TCP","66","666  >  36810 [ACK] Seq=1 Ack=288 Win=64896 Len=0 TSval=1603164410 TSecr=142709096"
"289","0.150129","192.168.123.46","192.168.123.44","TLSv1.3","769","Application Data"
"290","0.150171","192.168.123.44","192.168.123.46","TCP","66","46236  >  666 [ACK] Seq=978 Ack=2102 Win=64128 Len=0 TSval=3229392488 TSecr=3944650822"
"291","0.150346","192.168.123.46","192.168.123.44","TLSv1.3","769","Application Data"
"292","0.150379","192.168.123.44","192.168.123.46","TCP","66","46236  >  666 [ACK] Seq=978 Ack=2805 Win=64128 Len=0 TSval=3229392488 TSecr=3944650822"
"293","0.150723","192.168.123.46","192.168.123.22","TLSv1.3","1464","Server Hello, Change Cipher Spec, Application Data, Application Data, Application Data, Application Data, Application Data"
"294","0.150766","192.168.123.22","192.168.123.46","TCP","66","36810  >  666 [ACK] Seq=288 Ack=1399 Win=64128 Len=0 TSval=142709097 TSecr=1603164411"
"295","0.151853","192.168.123.22","192.168.123.46","TLSv1.3","756","Change Cipher Spec, Application Data, Application Data, Application Data"
"296","0.151884","192.168.123.46","192.168.123.22","TCP","66","666  >  36810 [ACK] Seq=1399 Ack=978 Win=64256 Len=0 TSval=1603164412 TSecr=142709098"
"297","0.152400","192.168.123.46","192.168.123.22","TLSv1.3","769","Application Data"
"298","0.152434","192.168.123.22","192.168.123.46","TCP","66","36810  >  666 [ACK] Seq=978 Ack=2102 Win=64128 Len=0 TSval=142709098 TSecr=1603164412"
"299","0.152549","192.168.123.46","192.168.123.22","TLSv1.3","769","Application Data"
"300","0.152570","192.168.123.22","192.168.123.46","TCP","66","36810  >  666 [ACK] Seq=978 Ack=2805 Win=64128 Len=0 TSval=142709099 TSecr=1603164413"
"303","0.157225","192.168.123.4","192.168.123.46","TCP","74","49260  >  666 [SYN] Seq=0 Win=64240 Len=0 MSS=1460 SACK_PERM=1 TSval=2148825115 TSecr=0 WS=128"
"304","0.157277","192.168.123.46","192.168.123.4","TCP","74","666  >  49260 [SYN, ACK] Seq=0 Ack=1 Win=65160 Len=0 MSS=1460 SACK_PERM=1 TSval=1493974742 TSecr=2148825115 WS=128"
"305","0.157322","192.168.123.4","192.168.123.46","TCP","66","49260  >  666 [ACK] Seq=1 Ack=1 Win=64256 Len=0 TSval=2148825116 TSecr=1493974742"
"306","0.157613","192.168.123.4","192.168.123.46","TLSv1.3","353","Client Hello"
"307","0.157698","192.168.123.46","192.168.123.4","TCP","66","666  >  49260 [ACK] Seq=1 Ack=288 Win=64896 Len=0 TSval=1493974743 TSecr=2148825117"
"308","0.158506","192.168.123.46","192.168.123.4","TLSv1.3","1464","Server Hello, Change Cipher Spec, Application Data, Application Data, Application Data, Application Data, Application Data"
"309","0.158553","192.168.123.4","192.168.123.46","TCP","66","49260  >  666 [ACK] Seq=288 Ack=1399 Win=64128 Len=0 TSval=2148825118 TSecr=1493974743"
"310","0.159649","192.168.123.4","192.168.123.46","TLSv1.3","756","Change Cipher Spec, Application Data, Application Data, Application Data"
"311","0.159679","192.168.123.46","192.168.123.4","TCP","66","666  >  49260 [ACK] Seq=1399 Ack=978 Win=64256 Len=0 TSval=1493974745 TSecr=2148825119"
"312","0.160297","192.168.123.46","192.168.123.4","TLSv1.3","769","Application Data"
"313","0.160363","192.168.123.4","192.168.123.46","TCP","66","49260  >  666 [ACK] Seq=978 Ack=2102 Win=64128 Len=0 TSval=2148825119 TSecr=1493974745"
"314","0.160533","192.168.123.46","192.168.123.4","TLSv1.3","769","Application Data"
"315","0.160567","192.168.123.4","192.168.123.46","TCP","66","49260  >  666 [ACK] Seq=978 Ack=2805 Win=64128 Len=0 TSval=2148825120 TSecr=1493974745"
"318","0.176611","192.168.123.8","192.168.123.46","TCP","74","53856  >  666 [SYN] Seq=0 Win=64240 Len=0 MSS=1460 SACK_PERM=1 TSval=2879529391 TSecr=0 WS=128"
"319","0.176647","192.168.123.46","192.168.123.8","TCP","74","666  >  53856 [SYN, ACK] Seq=0 Ack=1 Win=65160 Len=0 MSS=1460 SACK_PERM=1 TSval=1264303730 TSecr=2879529391 WS=128"
"320","0.176677","192.168.123.8","192.168.123.46","TCP","66","53856  >  666 [ACK] Seq=1 Ack=1 Win=64256 Len=0 TSval=2879529392 TSecr=1264303730"
"321","0.176963","192.168.123.8","192.168.123.46","TLSv1.3","353","Client Hello"
"322","0.177019","192.168.123.46","192.168.123.8","TCP","66","666  >  53856 [ACK] Seq=1 Ack=288 Win=64896 Len=0 TSval=1264303730 TSecr=2879529392"
"323","0.177933","192.168.123.46","192.168.123.8","TLSv1.3","1464","Server Hello, Change Cipher Spec, Application Data, Application Data, Application Data, Application Data, Application Data"
"324","0.178019","192.168.123.8","192.168.123.46","TCP","66","53856  >  666 [ACK] Seq=288 Ack=1399 Win=64128 Len=0 TSval=2879529393 TSecr=1264303731"
"327","0.178659","192.168.123.62","192.168.123.46","TCP","74","50738  >  666 [SYN] Seq=0 Win=64240 Len=0 MSS=1460 SACK_PERM=1 TSval=1150151543 TSecr=0 WS=128"
"328","0.178705","192.168.123.46","192.168.123.62","TCP","74","666  >  50738 [SYN, ACK] Seq=0 Ack=1 Win=65160 Len=0 MSS=1460 SACK_PERM=1 TSval=398779025 TSecr=1150151543 WS=128"
"329","0.178793","192.168.123.62","192.168.123.46","TCP","66","50738  >  666 [ACK] Seq=1 Ack=1 Win=64256 Len=0 TSval=1150151544 TSecr=398779025"
"330","0.179226","192.168.123.62","192.168.123.46","TLSv1.3","353","Client Hello"
"331","0.179358","192.168.123.46","192.168.123.62","TCP","66","666  >  50738 [ACK] Seq=1 Ack=288 Win=64896 Len=0 TSval=398779025 TSecr=1150151544"
