"No.","Time","Source","Destination","Protocol","Length","Info"
"5","3.301858","192.168.123.65","192.168.123.48","TCP","74","55072  >  666 [SYN] Seq=0 Win=64240 Len=0 MSS=1460 SACK_PERM=1 TSval=2425039665 TSecr=0 WS=128"
"6","3.301912","192.168.123.48","192.168.123.65","TCP","74","666  >  55072 [SYN, ACK] Seq=0 Ack=1 Win=65160 Len=0 MSS=1460 SACK_PERM=1 TSval=2232786518 TSecr=2425039665 WS=128"
"7","3.301958","192.168.123.65","192.168.123.48","TCP","66","55072  >  666 [ACK] Seq=1 Ack=1 Win=64256 Len=0 TSval=2425039666 TSecr=2232786518"
"8","3.302294","192.168.123.65","192.168.123.48","TLSv1.3","353","Client Hello"
"9","3.302384","192.168.123.48","192.168.123.65","TCP","66","666  >  55072 [ACK] Seq=1 Ack=288 Win=64896 Len=0 TSval=2232786519 TSecr=2425039666"
"10","3.304059","192.168.123.48","192.168.123.65","TLSv1.3","1464","Server Hello, Change Cipher Spec, Application Data, Application Data, Application Data, Application Data, Application Data"
"11","3.304119","192.168.123.65","192.168.123.48","TCP","66","55072  >  666 [ACK] Seq=288 Ack=1399 Win=64128 Len=0 TSval=2425039668 TSecr=2232786520"
"12","3.308355","192.168.123.65","192.168.123.48","TLSv1.3","756","Change Cipher Spec, Application Data, Application Data, Application Data"
"13","3.308403","192.168.123.48","192.168.123.65","TCP","66","666  >  55072 [ACK] Seq=1399 Ack=978 Win=64256 Len=0 TSval=2232786525 TSecr=2425039673"
"14","3.308900","192.168.123.48","192.168.123.65","TLSv1.3","769","Application Data"
"15","3.308934","192.168.123.65","192.168.123.48","TCP","66","55072  >  666 [ACK] Seq=978 Ack=2102 Win=64128 Len=0 TSval=2425039673 TSecr=2232786525"
"16","3.309067","192.168.123.48","192.168.123.65","TLSv1.3","769","Application Data"
"17","3.309091","192.168.123.65","192.168.123.48","TCP","66","55072  >  666 [ACK] Seq=978 Ack=2805 Win=64128 Len=0 TSval=2425039673 TSecr=2232786525"
"20","3.332768","192.168.123.11","192.168.123.48","TCP","74","56164  >  666 [SYN] Seq=0 Win=64240 Len=0 MSS=1460 SACK_PERM=1 TSval=4226042094 TSecr=0 WS=128"
"21","3.332815","192.168.123.48","192.168.123.11","TCP","74","666  >  56164 [SYN, ACK] Seq=0 Ack=1 Win=65160 Len=0 MSS=1460 SACK_PERM=1 TSval=3400124287 TSecr=4226042094 WS=128"
"22","3.332862","192.168.123.11","192.168.123.48","TCP","66","56164  >  666 [ACK] Seq=1 Ack=1 Win=64256 Len=0 TSval=4226042095 TSecr=3400124287"
"23","3.333125","192.168.123.11","192.168.123.48","TLSv1.3","353","Client Hello"
"24","3.333211","192.168.123.48","192.168.123.11","TCP","66","666  >  56164 [ACK] Seq=1 Ack=288 Win=64896 Len=0 TSval=3400124287 TSecr=4226042095"
"25","3.334574","192.168.123.48","192.168.123.11","TLSv1.3","1464","Server Hello, Change Cipher Spec, Application Data, Application Data, Application Data, Application Data, Application Data"
"26","3.334613","192.168.123.11","192.168.123.48","TCP","66","56164  >  666 [ACK] Seq=288 Ack=1399 Win=64128 Len=0 TSval=4226042097 TSecr=3400124289"
"27","3.336664","192.168.123.11","192.168.123.48","TLSv1.3","756","Change Cipher Spec, Application Data, Application Data, Application Data"
"28","3.336705","192.168.123.48","192.168.123.11","TCP","66","666  >  56164 [ACK] Seq=1399 Ack=978 Win=64256 Len=0 TSval=3400124291 TSecr=4226042099"
"29","3.337243","192.168.123.48","192.168.123.11","TLSv1.3","769","Application Data"
"30","3.337278","192.168.123.11","192.168.123.48","TCP","66","56164  >  666 [ACK] Seq=978 Ack=2102 Win=64128 Len=0 TSval=4226042099 TSecr=3400124291"
"31","3.337391","192.168.123.48","192.168.123.11","TLSv1.3","769","Application Data"
"32","3.337415","192.168.123.11","192.168.123.48","TCP","66","56164  >  666 [ACK] Seq=978 Ack=2805 Win=64128 Len=0 TSval=4226042100 TSecr=3400124292"
"35","3.339110","192.168.123.23","192.168.123.48","TCP","74","35876  >  666 [SYN] Seq=0 Win=64240 Len=0 MSS=1460 SACK_PERM=1 TSval=4093382330 TSecr=0 WS=128"
"36","3.339166","192.168.123.48","192.168.123.23","TCP","74","666  >  35876 [SYN, ACK] Seq=0 Ack=1 Win=65160 Len=0 MSS=1460 SACK_PERM=1 TSval=1215586443 TSecr=4093382330 WS=128"
"37","3.339202","192.168.123.23","192.168.123.48","TCP","66","35876  >  666 [ACK] Seq=1 Ack=1 Win=64256 Len=0 TSval=4093382331 TSecr=1215586443"
"38","3.339417","192.168.123.23","192.168.123.48","TLSv1.3","353","Client Hello"
"39","3.339484","192.168.123.48","192.168.123.23","TCP","66","666  >  35876 [ACK] Seq=1 Ack=288 Win=64896 Len=0 TSval=1215586444 TSecr=4093382332"
"40","3.340659","192.168.123.48","192.168.123.23","TLSv1.3","1464","Server Hello, Change Cipher Spec, Application Data, Application Data, Application Data, Application Data, Application Data"
"41","3.340698","192.168.123.23","192.168.123.48","TCP","66","35876  >  666 [ACK] Seq=288 Ack=1399 Win=64128 Len=0 TSval=4093382333 TSecr=1215586445"
"42","3.341988","192.168.123.23","192.168.123.48","TLSv1.3","756","Change Cipher Spec, Application Data, Application Data, Application Data"
"43","3.342027","192.168.123.48","192.168.123.23","TCP","66","666  >  35876 [ACK] Seq=1399 Ack=978 Win=64256 Len=0 TSval=1215586446 TSecr=4093382334"
"44","3.342627","192.168.123.48","192.168.123.23","TLSv1.3","769","Application Data"
"45","3.342665","192.168.123.23","192.168.123.48","TCP","66","35876  >  666 [ACK] Seq=978 Ack=2102 Win=64128 Len=0 TSval=4093382335 TSecr=1215586447"
"46","3.342836","192.168.123.48","192.168.123.23","TLSv1.3","769","Application Data"
"47","3.342862","192.168.123.23","192.168.123.48","TCP","66","35876  >  666 [ACK] Seq=978 Ack=2805 Win=64128 Len=0 TSval=4093382335 TSecr=1215586447"
"50","3.345249","192.168.123.51","192.168.123.48","TCP","74","41314  >  666 [SYN] Seq=0 Win=64240 Len=0 MSS=1460 SACK_PERM=1 TSval=206330622 TSecr=0 WS=128"
"51","3.345285","192.168.123.48","192.168.123.51","TCP","74","666  >  41314 [SYN, ACK] Seq=0 Ack=1 Win=65160 Len=0 MSS=1460 SACK_PERM=1 TSval=1810628797 TSecr=206330622 WS=128"
"52","3.345317","192.168.123.51","192.168.123.48","TCP","66","41314  >  666 [ACK] Seq=1 Ack=1 Win=64256 Len=0 TSval=206330623 TSecr=1810628797"
"53","3.345522","192.168.123.51","192.168.123.48","TLSv1.3","353","Client Hello"
"54","3.345585","192.168.123.48","192.168.123.51","TCP","66","666  >  41314 [ACK] Seq=1 Ack=288 Win=64896 Len=0 TSval=1810628797 TSecr=206330623"
"55","3.346965","192.168.123.48","192.168.123.51","TLSv1.3","1464","Server Hello, Change Cipher Spec, Application Data, Application Data, Application Data, Application Data, Application Data"
"56","3.347013","192.168.123.51","192.168.123.48","TCP","66","41314  >  666 [ACK] Seq=288 Ack=1399 Win=64128 Len=0 TSval=206330624 TSecr=1810628798"
"57","3.348424","192.168.123.51","192.168.123.48","TLSv1.3","756","Change Cipher Spec, Application Data, Application Data, Application Data"
"58","3.348457","192.168.123.48","192.168.123.51","TCP","66","666  >  41314 [ACK] Seq=1399 Ack=978 Win=64256 Len=0 TSval=1810628800 TSecr=206330626"
"59","3.348942","192.168.123.48","192.168.123.51","TLSv1.3","769","Application Data"
"60","3.349064","192.168.123.51","192.168.123.48","TCP","66","41314  >  666 [ACK] Seq=978 Ack=2102 Win=63488 Len=0 TSval=206330626 TSecr=1810628800"
"61","3.349080","192.168.123.48","192.168.123.51","TLSv1.3","769","Application Data"
"62","3.349104","192.168.123.51","192.168.123.48","TCP","66","41314  >  666 [ACK] Seq=978 Ack=2805 Win=63616 Len=0 TSval=206330626 TSecr=1810628800"
"65","3.361483","192.168.123.7","192.168.123.48","TCP","74","55574  >  666 [SYN] Seq=0 Win=64240 Len=0 MSS=1460 SACK_PERM=1 TSval=1844548122 TSecr=0 WS=128"
"66","3.361522","192.168.123.48","192.168.123.7","TCP","74","666  >  55574 [SYN, ACK] Seq=0 Ack=1 Win=65160 Len=0 MSS=1460 SACK_PERM=1 TSval=3802409218 TSecr=1844548122 WS=128"
"67","3.361559","192.168.123.7","192.168.123.48","TCP","66","55574  >  666 [ACK] Seq=1 Ack=1 Win=64256 Len=0 TSval=1844548123 TSecr=3802409218"
"68","3.361856","192.168.123.7","192.168.123.48","TLSv1.3","353","Client Hello"
"69","3.361921","192.168.123.48","192.168.123.7","TCP","66","666  >  55574 [ACK] Seq=1 Ack=288 Win=64896 Len=0 TSval=3802409218 TSecr=1844548123"
"70","3.363134","192.168.123.48","192.168.123.7","TLSv1.3","1464","Server Hello, Change Cipher Spec, Application Data, Application Data, Application Data, Application Data, Application Data"
"71","3.363184","192.168.123.7","192.168.123.48","TCP","66","55574  >  666 [ACK] Seq=288 Ack=1399 Win=64128 Len=0 TSval=1844548124 TSecr=3802409219"
"74","3.365290","192.168.123.55","192.168.123.48","TCP","74","54698  >  666 [SYN] Seq=0 Win=64240 Len=0 MSS=1460 SACK_PERM=1 TSval=1613299241 TSecr=0 WS=128"
"75","3.365356","192.168.123.48","192.168.123.55","TCP","74","666  >  54698 [SYN, ACK] Seq=0 Ack=1 Win=65160 Len=0 MSS=1460 SACK_PERM=1 TSval=1425653925 TSecr=1613299241 WS=128"
"76","3.365413","192.168.123.55","192.168.123.48","TCP","66","54698  >  666 [ACK] Seq=1 Ack=1 Win=64256 Len=0 TSval=1613299243 TSecr=1425653925"
"77","3.365749","192.168.123.55","192.168.123.48","TLSv1.3","353","Client Hello"
"78","3.365856","192.168.123.48","192.168.123.55","TCP","66","666  >  54698 [ACK] Seq=1 Ack=288 Win=64896 Len=0 TSval=1425653925 TSecr=1613299243"
"79","3.366687","192.168.123.7","192.168.123.48","TLSv1.3","756","Change Cipher Spec, Application Data, Application Data, Application Data"
"80","3.366736","192.168.123.48","192.168.123.7","TCP","66","666  >  55574 [ACK] Seq=1399 Ack=978 Win=64256 Len=0 TSval=3802409223 TSecr=1844548128"
"81","3.366864","192.168.123.48","192.168.123.55","TLSv1.3","1464","Server Hello, Change Cipher Spec, Application Data, Application Data, Application Data, Application Data, Application Data"
"82","3.366919","192.168.123.55","192.168.123.48","TCP","66","54698  >  666 [ACK] Seq=288 Ack=1399 Win=64128 Len=0 TSval=1613299244 TSecr=1425653926"
"83","3.367425","192.168.123.48","192.168.123.7","TLSv1.3","769","Application Data"
"84","3.367448","192.168.123.7","192.168.123.48","TCP","66","55574  >  666 [ACK] Seq=978 Ack=2102 Win=64128 Len=0 TSval=1844548129 TSecr=3802409224"
"85","3.367592","192.168.123.48","192.168.123.7","TLSv1.3","769","Application Data"
"86","3.367613","192.168.123.7","192.168.123.48","TCP","66","55574  >  666 [ACK] Seq=978 Ack=2805 Win=64128 Len=0 TSval=1844548129 TSecr=3802409224"
"87","3.369239","192.168.123.55","192.168.123.48","TLSv1.3","756","Change Cipher Spec, Application Data, Application Data, Application Data"
"88","3.369273","192.168.123.48","192.168.123.55","TCP","66","666  >  54698 [ACK] Seq=1399 Ack=978 Win=64256 Len=0 TSval=1425653928 TSecr=1613299246"
"89","3.369771","192.168.123.48","192.168.123.55","TLSv1.3","769","Application Data"
"90","3.369808","192.168.123.55","192.168.123.48","TCP","66","54698  >  666 [ACK] Seq=978 Ack=2102 Win=64128 Len=0 TSval=1613299247 TSecr=1425653929"
"91","3.369929","192.168.123.48","192.168.123.55","TLSv1.3","769","Application Data"
"92","3.369954","192.168.123.55","192.168.123.48","TCP","66","54698  >  666 [ACK] Seq=978 Ack=2805 Win=64128 Len=0 TSval=1613299247 TSecr=1425653929"
"95","3.382592","192.168.123.44","192.168.123.48","TCP","74","51038  >  666 [SYN] Seq=0 Win=64240 Len=0 MSS=1460 SACK_PERM=1 TSval=941124016 TSecr=0 WS=128"
"96","3.382648","192.168.123.48","192.168.123.44","TCP","74","666  >  51038 [SYN, ACK] Seq=0 Ack=1 Win=65160 Len=0 MSS=1460 SACK_PERM=1 TSval=3235240085 TSecr=941124016 WS=128"
"97","3.382684","192.168.123.44","192.168.123.48","TCP","66","51038  >  666 [ACK] Seq=1 Ack=1 Win=64256 Len=0 TSval=941124017 TSecr=3235240085"
"98","3.382940","192.168.123.44","192.168.123.48","TLSv1.3","353","Client Hello"
"99","3.383007","192.168.123.48","192.168.123.44","TCP","66","666  >  51038 [ACK] Seq=1 Ack=288 Win=64896 Len=0 TSval=3235240085 TSecr=941124017"
"100","3.384003","192.168.123.48","192.168.123.44","TLSv1.3","1464","Server Hello, Change Cipher Spec, Application Data, Application Data, Application Data, Application Data, Application Data"
"101","3.384036","192.168.123.44","192.168.123.48","TCP","66","51038  >  666 [ACK] Seq=288 Ack=1399 Win=64128 Len=0 TSval=941124018 TSecr=3235240086"
"102","3.385280","192.168.123.44","192.168.123.48","TLSv1.3","756","Change Cipher Spec, Application Data, Application Data, Application Data"
"103","3.385310","192.168.123.48","192.168.123.44","TCP","66","666  >  51038 [ACK] Seq=1399 Ack=978 Win=64256 Len=0 TSval=3235240088 TSecr=941124019"
"104","3.386012","192.168.123.48","192.168.123.44","TLSv1.3","769","Application Data"
"105","3.386072","192.168.123.44","192.168.123.48","TCP","66","51038  >  666 [ACK] Seq=978 Ack=2102 Win=64128 Len=0 TSval=941124020 TSecr=3235240088"
"106","3.386254","192.168.123.48","192.168.123.44","TLSv1.3","769","Application Data"
"107","3.386288","192.168.123.44","192.168.123.48","TCP","66","51038  >  666 [ACK] Seq=978 Ack=2805 Win=64128 Len=0 TSval=941124021 TSecr=3235240088"
"110","3.390938","192.168.123.60","192.168.123.48","TCP","74","49434  >  666 [SYN] Seq=0 Win=64240 Len=0 MSS=1460 SACK_PERM=1 TSval=3731681743 TSecr=0 WS=128"
"111","3.390971","192.168.123.48","192.168.123.60","TCP","74","666  >  49434 [SYN, ACK] Seq=0 Ack=1 Win=65160 Len=0 MSS=1460 SACK_PERM=1 TSval=4106342621 TSecr=3731681743 WS=128"
"112","3.391018","192.168.123.60","192.168.123.48","TCP","66","49434  >  666 [ACK] Seq=1 Ack=1 Win=64256 Len=0 TSval=3731681744 TSecr=4106342621"
"113","3.391249","192.168.123.60","192.168.123.48","TLSv1.3","353","Client Hello"
"114","3.391326","192.168.123.48","192.168.123.60","TCP","66","666  >  49434 [ACK] Seq=1 Ack=288 Win=64896 Len=0 TSval=4106342622 TSecr=3731681744"
"115","3.392275","192.168.123.48","192.168.123.60","TLSv1.3","1464","Server Hello, Change Cipher Spec, Application Data, Application Data, Application Data, Application Data, Application Data"
"116","3.392329","192.168.123.60","192.168.123.48","TCP","66","49434  >  666 [ACK] Seq=288 Ack=1399 Win=64128 Len=0 TSval=3731681746 TSecr=4106342622"
"119","3.392879","192.168.123.33","192.168.123.48","TCP","74","58310  >  666 [SYN] Seq=0 Win=64240 Len=0 MSS=1460 SACK_PERM=1 TSval=4046275521 TSecr=0 WS=128"
"120","3.392910","192.168.123.48","192.168.123.33","TCP","74","666  >  58310 [SYN, ACK] Seq=0 Ack=1 Win=65160 Len=0 MSS=1460 SACK_PERM=1 TSval=2953988102 TSecr=4046275521 WS=128"
"121","3.392938","192.168.123.33","192.168.123.48","TCP","66","58310  >  666 [ACK] Seq=1 Ack=1 Win=64256 Len=0 TSval=4046275522 TSecr=2953988102"
"122","3.393132","192.168.123.33","192.168.123.48","TLSv1.3","353","Client Hello"
"123","3.393214","192.168.123.48","192.168.123.33","TCP","66","666  >  58310 [ACK] Seq=1 Ack=288 Win=64896 Len=0 TSval=2953988102 TSecr=4046275522"
"124","3.393968","192.168.123.48","192.168.123.33","TLSv1.3","1464","Server Hello, Change Cipher Spec, Application Data, Application Data, Application Data, Application Data, Application Data"
"125","3.394071","192.168.123.33","192.168.123.48","TCP","66","58310  >  666 [ACK] Seq=288 Ack=1399 Win=62976 Len=0 TSval=4046275523 TSecr=2953988103"
"126","3.394329","192.168.123.60","192.168.123.48","TLSv1.3","756","Change Cipher Spec, Application Data, Application Data, Application Data"
"127","3.394368","192.168.123.48","192.168.123.60","TCP","66","666  >  49434 [ACK] Seq=1399 Ack=978 Win=64256 Len=0 TSval=4106342625 TSecr=3731681748"
"128","3.395079","192.168.123.48","192.168.123.60","TLSv1.3","769","Application Data"
"129","3.395111","192.168.123.60","192.168.123.48","TCP","66","49434  >  666 [ACK] Seq=978 Ack=2102 Win=64128 Len=0 TSval=3731681748 TSecr=4106342625"
"130","3.395216","192.168.123.48","192.168.123.60","TLSv1.3","769","Application Data"
"131","3.395238","192.168.123.60","192.168.123.48","TCP","66","49434  >  666 [ACK] Seq=978 Ack=2805 Win=64128 Len=0 TSval=3731681748 TSecr=4106342625"
"132","3.398479","192.168.123.33","192.168.123.48","TLSv1.3","756","Change Cipher Spec, Application Data, Application Data, Application Data"
"133","3.398529","192.168.123.48","192.168.123.33","TCP","66","666  >  58310 [ACK] Seq=1399 Ack=978 Win=64256 Len=0 TSval=2953988108 TSecr=4046275528"
"134","3.398953","192.168.123.48","192.168.123.33","TLSv1.3","769","Application Data"
"135","3.399069","192.168.123.33","192.168.123.48","TCP","66","58310  >  666 [ACK] Seq=978 Ack=2102 Win=63488 Len=0 TSval=4046275528 TSecr=2953988108"
"136","3.399093","192.168.123.48","192.168.123.33","TLSv1.3","769","Application Data"
"137","3.399119","192.168.123.33","192.168.123.48","TCP","66","58310  >  666 [ACK] Seq=978 Ack=2805 Win=63616 Len=0 TSval=4046275528 TSecr=2953988108"
"140","3.406196","192.168.123.13","192.168.123.48","TCP","74","33334  >  666 [SYN] Seq=0 Win=64240 Len=0 MSS=1460 SACK_PERM=1 TSval=2790357377 TSecr=0 WS=128"
"141","3.406235","192.168.123.48","192.168.123.13","TCP","74","666  >  33334 [SYN, ACK] Seq=0 Ack=1 Win=65160 Len=0 MSS=1460 SACK_PERM=1 TSval=3294029638 TSecr=2790357377 WS=128"
"142","3.406271","192.168.123.13","192.168.123.48","TCP","66","33334  >  666 [ACK] Seq=1 Ack=1 Win=64256 Len=0 TSval=2790357378 TSecr=3294029638"
"143","3.406501","192.168.123.13","192.168.123.48","TLSv1.3","353","Client Hello"
"144","3.406561","192.168.123.48","192.168.123.13","TCP","66","666  >  33334 [ACK] Seq=1 Ack=288 Win=64896 Len=0 TSval=3294029639 TSecr=2790357379"
"145","3.407725","192.168.123.48","192.168.123.13","TLSv1.3","1464","Server Hello, Change Cipher Spec, Application Data, Application Data, Application Data, Application Data, Application Data"
"146","3.407775","192.168.123.13","192.168.123.48","TCP","66","33334  >  666 [ACK] Seq=288 Ack=1399 Win=64128 Len=0 TSval=2790357380 TSecr=3294029640"
"147","3.410294","192.168.123.13","192.168.123.48","TLSv1.3","756","Change Cipher Spec, Application Data, Application Data, Application Data"
"148","3.410343","192.168.123.48","192.168.123.13","TCP","66","666  >  33334 [ACK] Seq=1399 Ack=978 Win=64256 Len=0 TSval=3294029643 TSecr=2790357382"
"149","3.411450","192.168.123.48","192.168.123.13","TLSv1.3","769","Application Data"
"150","3.411492","192.168.123.13","192.168.123.48","TCP","66","33334  >  666 [ACK] Seq=978 Ack=2102 Win=64128 Len=0 TSval=2790357384 TSecr=3294029644"
"151","3.411658","192.168.123.48","192.168.123.13","TLSv1.3","769","Application Data"
"152","3.411692","192.168.123.13","192.168.123.48","TCP","66","33334  >  666 [ACK] Seq=978 Ack=2805 Win=64128 Len=0 TSval=2790357384 TSecr=3294029644"
"155","3.415676","192.168.123.17","192.168.123.48","TCP","74","60746  >  666 [SYN] Seq=0 Win=64240 Len=0 MSS=1460 SACK_PERM=1 TSval=646408049 TSecr=0 WS=128"
"156","3.415730","192.168.123.48","192.168.123.17","TCP","74","666  >  60746 [SYN, ACK] Seq=0 Ack=1 Win=65160 Len=0 MSS=1460 SACK_PERM=1 TSval=572003214 TSecr=646408049 WS=128"
"157","3.415776","192.168.123.17","192.168.123.48","TCP","66","60746  >  666 [ACK] Seq=1 Ack=1 Win=64256 Len=0 TSval=646408051 TSecr=572003214"
"158","3.416119","192.168.123.17","192.168.123.48","TLSv1.3","353","Client Hello"
"159","3.416223","192.168.123.48","192.168.123.17","TCP","66","666  >  60746 [ACK] Seq=1 Ack=288 Win=64896 Len=0 TSval=572003214 TSecr=646408051"
"160","3.417086","192.168.123.48","192.168.123.17","TLSv1.3","1464","Server Hello, Change Cipher Spec, Application Data, Application Data, Application Data, Application Data, Application Data"
"161","3.417123","192.168.123.17","192.168.123.48","TCP","66","60746  >  666 [ACK] Seq=288 Ack=1399 Win=64128 Len=0 TSval=646408052 TSecr=572003215"
"164","3.417959","192.168.123.10","192.168.123.48","TCP","74","60222  >  666 [SYN] Seq=0 Win=64240 Len=0 MSS=1460 SACK_PERM=1 TSval=4155688242 TSecr=0 WS=128"
"165","3.417996","192.168.123.48","192.168.123.10","TCP","74","666  >  60222 [SYN, ACK] Seq=0 Ack=1 Win=65160 Len=0 MSS=1460 SACK_PERM=1 TSval=4120173851 TSecr=4155688242 WS=128"
"166","3.418031","192.168.123.10","192.168.123.48","TCP","66","60222  >  666 [ACK] Seq=1 Ack=1 Win=64256 Len=0 TSval=4155688243 TSecr=4120173851"
"167","3.418236","192.168.123.10","192.168.123.48","TLSv1.3","353","Client Hello"
"168","3.418302","192.168.123.48","192.168.123.10","TCP","66","666  >  60222 [ACK] Seq=1 Ack=288 Win=64896 Len=0 TSval=4120173851 TSecr=4155688243"
"170","3.419038","192.168.123.48","192.168.123.10","TLSv1.3","1464","Server Hello, Change Cipher Spec, Application Data, Application Data, Application Data, Application Data, Application Data"
"171","3.419071","192.168.123.10","192.168.123.48","TCP","66","60222  >  666 [ACK] Seq=288 Ack=1399 Win=64128 Len=0 TSval=4155688244 TSecr=4120173852"
"173","3.419164","192.168.123.43","192.168.123.48","TCP","74","60526  >  666 [SYN] Seq=0 Win=64240 Len=0 MSS=1460 SACK_PERM=1 TSval=3932473968 TSecr=0 WS=128"
"174","3.419198","192.168.123.48","192.168.123.43","TCP","74","666  >  60526 [SYN, ACK] Seq=0 Ack=1 Win=65160 Len=0 MSS=1460 SACK_PERM=1 TSval=408846117 TSecr=3932473968 WS=128"
"175","3.419249","192.168.123.43","192.168.123.48","TCP","66","60526  >  666 [ACK] Seq=1 Ack=1 Win=64256 Len=0 TSval=3932473968 TSecr=408846117"
"176","3.419454","192.168.123.43","192.168.123.48","TLSv1.3","353","Client Hello"
"177","3.419526","192.168.123.48","192.168.123.43","TCP","66","666  >  60526 [ACK] Seq=1 Ack=288 Win=64896 Len=0 TSval=408846118 TSecr=3932473969"
"178","3.419643","192.168.123.17","192.168.123.48","TLSv1.3","756","Change Cipher Spec, Application Data, Application Data, Application Data"
"179","3.419678","192.168.123.48","192.168.123.17","TCP","66","666  >  60746 [ACK] Seq=1399 Ack=978 Win=64256 Len=0 TSval=572003218 TSecr=646408055"
"180","3.420247","192.168.123.48","192.168.123.17","TLSv1.3","769","Application Data"
"181","3.420281","192.168.123.17","192.168.123.48","TCP","66","60746  >  666 [ACK] Seq=978 Ack=2102 Win=64128 Len=0 TSval=646408055 TSecr=572003218"
"182","3.420326","192.168.123.48","192.168.123.43","TLSv1.3","1464","Server Hello, Change Cipher Spec, Application Data, Application Data, Application Data, Application Data, Application Data"
"183","3.420362","192.168.123.43","192.168.123.48","TCP","66","60526  >  666 [ACK] Seq=288 Ack=1399 Win=64128 Len=0 TSval=3932473970 TSecr=408846119"
"184","3.420662","192.168.123.48","192.168.123.17","TLSv1.3","769","Application Data"
"185","3.420693","192.168.123.17","192.168.123.48","TCP","66","60746  >  666 [ACK] Seq=978 Ack=2805 Win=64128 Len=0 TSval=646408056 TSecr=572003219"
"186","3.422131","192.168.123.10","192.168.123.48","TLSv1.3","756","Change Cipher Spec, Application Data, Application Data, Application Data"
"187","3.422167","192.168.123.48","192.168.123.10","TCP","66","666  >  60222 [ACK] Seq=1399 Ack=978 Win=64256 Len=0 TSval=4120173855 TSecr=4155688247"
"188","3.422265","192.168.123.43","192.168.123.48","TLSv1.3","756","Change Cipher Spec, Application Data, Application Data, Application Data"
"189","3.422310","192.168.123.48","192.168.123.43","TCP","66","666  >  60526 [ACK] Seq=1399 Ack=978 Win=64256 Len=0 TSval=408846121 TSecr=3932473971"
"190","3.422921","192.168.123.48","192.168.123.43","TLSv1.3","769","Application Data"
"191","3.422948","192.168.123.48","192.168.123.10","TLSv1.3","769","Application Data"
"192","3.422953","192.168.123.43","192.168.123.48","TCP","66","60526  >  666 [ACK] Seq=978 Ack=2102 Win=64128 Len=0 TSval=3932473972 TSecr=408846121"
"193","3.422983","192.168.123.10","192.168.123.48","TCP","66","60222  >  666 [ACK] Seq=978 Ack=2102 Win=64128 Len=0 TSval=4155688248 TSecr=4120173856"
"194","3.423066","192.168.123.48","192.168.123.43","TLSv1.3","769","Application Data"
"195","3.423089","192.168.123.43","192.168.123.48","TCP","66","60526  >  666 [ACK] Seq=978 Ack=2805 Win=64128 Len=0 TSval=3932473972 TSecr=408846121"
"196","3.423097","192.168.123.48","192.168.123.10","TLSv1.3","769","Application Data"
"197","3.423122","192.168.123.10","192.168.123.48","TCP","66","60222  >  666 [ACK] Seq=978 Ack=2805 Win=64128 Len=0 TSval=4155688248 TSecr=4120173856"
"200","3.442547","192.168.123.35","192.168.123.48","TCP","74","40248  >  666 [SYN] Seq=0 Win=64240 Len=0 MSS=1460 SACK_PERM=1 TSval=3557766012 TSecr=0 WS=128"
"201","3.442586","192.168.123.48","192.168.123.35","TCP","74","666  >  40248 [SYN, ACK] Seq=0 Ack=1 Win=65160 Len=0 MSS=1460 SACK_PERM=1 TSval=696767800 TSecr=3557766012 WS=128"
"202","3.442621","192.168.123.35","192.168.123.48","TCP","66","40248  >  666 [ACK] Seq=1 Ack=1 Win=64256 Len=0 TSval=3557766013 TSecr=696767800"
"203","3.442874","192.168.123.35","192.168.123.48","TLSv1.3","353","Client Hello"
"204","3.442944","192.168.123.48","192.168.123.35","TCP","66","666  >  40248 [ACK] Seq=1 Ack=288 Win=64896 Len=0 TSval=696767800 TSecr=3557766013"
"205","3.443790","192.168.123.48","192.168.123.35","TLSv1.3","1464","Server Hello, Change Cipher Spec, Application Data, Application Data, Application Data, Application Data, Application Data"
"206","3.443847","192.168.123.35","192.168.123.48","TCP","66","40248  >  666 [ACK] Seq=288 Ack=1399 Win=64128 Len=0 TSval=3557766014 TSecr=696767801"
"207","3.447080","192.168.123.35","192.168.123.48","TLSv1.3","756","Change Cipher Spec, Application Data, Application Data, Application Data"
"208","3.447144","192.168.123.48","192.168.123.35","TCP","66","666  >  40248 [ACK] Seq=1399 Ack=978 Win=64256 Len=0 TSval=696767804 TSecr=3557766017"
"209","3.448891","192.168.123.48","192.168.123.35","TLSv1.3","769","Application Data"
"210","3.448924","192.168.123.35","192.168.123.48","TCP","66","40248  >  666 [ACK] Seq=978 Ack=2102 Win=64128 Len=0 TSval=3557766019 TSecr=696767806"
"211","3.449039","192.168.123.48","192.168.123.35","TLSv1.3","769","Application Data"
"212","3.449063","192.168.123.35","192.168.123.48","TCP","66","40248  >  666 [ACK] Seq=978 Ack=2805 Win=64128 Len=0 TSval=3557766019 TSecr=696767806"
"215","3.452644","192.168.123.56","192.168.123.48","TCP","74","34782  >  666 [SYN] Seq=0 Win=64240 Len=0 MSS=1460 SACK_PERM=1 TSval=4021415230 TSecr=0 WS=128"
"216","3.452684","192.168.123.48","192.168.123.56","TCP","74","666  >  34782 [SYN, ACK] Seq=0 Ack=1 Win=65160 Len=0 MSS=1460 SACK_PERM=1 TSval=2452308314 TSecr=4021415230 WS=128"
"217","3.452734","192.168.123.56","192.168.123.48","TCP","66","34782  >  666 [ACK] Seq=1 Ack=1 Win=64256 Len=0 TSval=4021415231 TSecr=2452308314"
"218","3.453058","192.168.123.56","192.168.123.48","TLSv1.3","353","Client Hello"
"219","3.453151","192.168.123.48","192.168.123.56","TCP","66","666  >  34782 [ACK] Seq=1 Ack=288 Win=64896 Len=0 TSval=2452308314 TSecr=4021415231"
"220","3.453995","192.168.123.48","192.168.123.56","TLSv1.3","1464","Server Hello, Change Cipher Spec, Application Data, Application Data, Application Data, Application Data, Application Data"
"221","3.454035","192.168.123.56","192.168.123.48","TCP","66","34782  >  666 [ACK] Seq=288 Ack=1399 Win=64128 Len=0 TSval=4021415232 TSecr=2452308315"
"222","3.455160","192.168.123.56","192.168.123.48","TLSv1.3","756","Change Cipher Spec, Application Data, Application Data, Application Data"
"223","3.455195","192.168.123.48","192.168.123.56","TCP","66","666  >  34782 [ACK] Seq=1399 Ack=978 Win=64256 Len=0 TSval=2452308316 TSecr=4021415233"
"224","3.455807","192.168.123.48","192.168.123.56","TLSv1.3","769","Application Data"
"225","3.455871","192.168.123.56","192.168.123.48","TCP","66","34782  >  666 [ACK] Seq=978 Ack=2102 Win=64128 Len=0 TSval=4021415234 TSecr=2452308317"
"226","3.456055","192.168.123.48","192.168.123.56","TLSv1.3","769","Application Data"
"227","3.456089","192.168.123.56","192.168.123.48","TCP","66","34782  >  666 [ACK] Seq=978 Ack=2805 Win=64128 Len=0 TSval=4021415234 TSecr=2452308317"
"230","3.457952","192.168.123.66","192.168.123.48","TCP","74","46950  >  666 [SYN] Seq=0 Win=64240 Len=0 MSS=1460 SACK_PERM=1 TSval=3633334062 TSecr=0 WS=128"
"231","3.457992","192.168.123.48","192.168.123.66","TCP","74","666  >  46950 [SYN, ACK] Seq=0 Ack=1 Win=65160 Len=0 MSS=1460 SACK_PERM=1 TSval=202488733 TSecr=3633334062 WS=128"
"232","3.458028","192.168.123.66","192.168.123.48","TCP","66","46950  >  666 [ACK] Seq=1 Ack=1 Win=64256 Len=0 TSval=3633334063 TSecr=202488733"
"234","3.458241","192.168.123.66","192.168.123.48","TLSv1.3","353","Client Hello"
"235","3.458307","192.168.123.48","192.168.123.66","TCP","66","666  >  46950 [ACK] Seq=1 Ack=288 Win=64896 Len=0 TSval=202488733 TSecr=3633334063"
"237","3.458700","192.168.123.63","192.168.123.48","TCP","74","52124  >  666 [SYN] Seq=0 Win=64240 Len=0 MSS=1460 SACK_PERM=1 TSval=1760607922 TSecr=0 WS=128"
"238","3.458749","192.168.123.48","192.168.123.63","TCP","74","666  >  52124 [SYN, ACK] Seq=0 Ack=1 Win=65160 Len=0 MSS=1460 SACK_PERM=1 TSval=61935179 TSecr=1760607922 WS=128"
"239","3.458797","192.168.123.63","192.168.123.48","TCP","66","52124  >  666 [ACK] Seq=1 Ack=1 Win=64256 Len=0 TSval=1760607923 TSecr=61935179"
"240","3.459062","192.168.123.48","192.168.123.66","TLSv1.3","1464","Server Hello, Change Cipher Spec, Application Data, Application Data, Application Data, Application Data, Application Data"
"241","3.459098","192.168.123.66","192.168.123.48","TCP","66","46950  >  666 [ACK] Seq=288 Ack=1399 Win=64128 Len=0 TSval=3633334064 TSecr=202488734"
"242","3.459123","192.168.123.63","192.168.123.48","TLSv1.3","353","Client Hello"
"243","3.459204","192.168.123.48","192.168.123.63","TCP","66","666  >  52124 [ACK] Seq=1 Ack=288 Win=64896 Len=0 TSval=61935179 TSecr=1760607923"
"246","3.459885","192.168.123.22","192.168.123.48","TCP","74","49578  >  666 [SYN] Seq=0 Win=64240 Len=0 MSS=1460 SACK_PERM=1 TSval=3117013689 TSecr=0 WS=128"
"247","3.459918","192.168.123.48","192.168.123.63","TLSv1.3","1464","Server Hello, Change Cipher Spec, Application Data, Application Data, Application Data, Application Data, Application Data"
"248","3.459920","192.168.123.48","192.168.123.22","TCP","74","666  >  49578 [SYN, ACK] Seq=0 Ack=1 Win=65160 Len=0 MSS=1460 SACK_PERM=1 TSval=4174423978 TSecr=3117013689 WS=128"
"249","3.459952","192.168.123.22","192.168.123.48","TCP","66","49578  >  666 [ACK] Seq=1 Ack=1 Win=64256 Len=0 TSval=3117013690 TSecr=4174423978"
"250","3.459953","192.168.123.63","192.168.123.48","TCP","66","52124  >  666 [ACK] Seq=288 Ack=1399 Win=64128 Len=0 TSval=1760607924 TSecr=61935180"
"251","3.460160","192.168.123.22","192.168.123.48","TLSv1.3","353","Client Hello"
"252","3.460218","192.168.123.66","192.168.123.48","TLSv1.3","756","Change Cipher Spec, Application Data, Application Data, Application Data"
"253","3.460239","192.168.123.48","192.168.123.22","TCP","66","666  >  49578 [ACK] Seq=1 Ack=288 Win=64896 Len=0 TSval=4174423978 TSecr=3117013690"
"254","3.460253","192.168.123.48","192.168.123.66","TCP","66","666  >  46950 [ACK] Seq=1399 Ack=978 Win=64256 Len=0 TSval=202488735 TSecr=3633334065"
"256","3.461085","192.168.123.48","192.168.123.22","TLSv1.3","1464","Server Hello, Change Cipher Spec, Application Data, Application Data, Application Data, Application Data, Application Data"
"257","3.461096","192.168.123.48","192.168.123.66","TLSv1.3","769","Application Data"
"258","3.461128","192.168.123.66","192.168.123.48","TCP","66","46950  >  666 [ACK] Seq=978 Ack=2102 Win=64128 Len=0 TSval=3633334066 TSecr=202488736"
"259","3.461129","192.168.123.63","192.168.123.48","TLSv1.3","756","Change Cipher Spec, Application Data, Application Data, Application Data"
"260","3.461131","192.168.123.22","192.168.123.48","TCP","66","49578  >  666 [ACK] Seq=288 Ack=1399 Win=64128 Len=0 TSval=3117013691 TSecr=4174423979"
"261","3.461172","192.168.123.48","192.168.123.63","TCP","66","666  >  52124 [ACK] Seq=1399 Ack=978 Win=64256 Len=0 TSval=61935181 TSecr=1760607925"
"262","3.461238","192.168.123.48","192.168.123.66","TLSv1.3","769","Application Data"
"263","3.461261","192.168.123.66","192.168.123.48","TCP","66","46950  >  666 [ACK] Seq=978 Ack=2805 Win=64128 Len=0 TSval=3633334066 TSecr=202488736"
"265","3.461473","192.168.123.73","192.168.123.48","TCP","74","34638  >  666 [SYN] Seq=0 Win=64240 Len=0 MSS=1460 SACK_PERM=1 TSval=2271767199 TSecr=0 WS=128"
"266","3.461508","192.168.123.48","192.168.123.73","TCP","74","666  >  34638 [SYN, ACK] Seq=0 Ack=1 Win=65160 Len=0 MSS=1460 SACK_PERM=1 TSval=337437379 TSecr=2271767199 WS=128"
"267","3.461539","192.168.123.73","192.168.123.48","TCP","66","34638  >  666 [ACK] Seq=1 Ack=1 Win=64256 Len=0 TSval=2271767200 TSecr=337437379"
"268","3.461783","192.168.123.73","192.168.123.48","TLSv1.3","353","Client Hello"
"269","3.461807","192.168.123.48","192.168.123.63","TLSv1.3","769","Application Data"
"270","3.461843","192.168.123.48","192.168.123.73","TCP","66","666  >  34638 [ACK] Seq=1 Ack=288 Win=64896 Len=0 TSval=337437379 TSecr=2271767200"
"271","3.461845","192.168.123.63","192.168.123.48","TCP","66","52124  >  666 [ACK] Seq=978 Ack=2102 Win=64128 Len=0 TSval=1760607926 TSecr=61935182"
"272","3.462190","192.168.123.48","192.168.123.63","TLSv1.3","769","Application Data"
"273","3.462221","192.168.123.63","192.168.123.48","TCP","66","52124  >  666 [ACK] Seq=978 Ack=2805 Win=64128 Len=0 TSval=1760607926 TSecr=61935182"
"274","3.462542","192.168.123.48","192.168.123.73","TLSv1.3","1464","Server Hello, Change Cipher Spec, Application Data, Application Data, Application Data, Application Data, Application Data"
"275","3.462577","192.168.123.73","192.168.123.48","TCP","66","34638  >  666 [ACK] Seq=288 Ack=1399 Win=64128 Len=0 TSval=2271767201 TSecr=337437380"
"276","3.465054","192.168.123.73","192.168.123.48","TLSv1.3","756","Change Cipher Spec, Application Data, Application Data, Application Data"
"277","3.465090","192.168.123.48","192.168.123.73","TCP","66","666  >  34638 [ACK] Seq=1399 Ack=978 Win=64256 Len=0 TSval=337437382 TSecr=2271767203"
"278","3.465554","192.168.123.22","192.168.123.48","TLSv1.3","756","Change Cipher Spec, Application Data, Application Data, Application Data"
"279","3.465559","192.168.123.48","192.168.123.73","TLSv1.3","769","Application Data"
"280","3.465591","192.168.123.48","192.168.123.22","TCP","66","666  >  49578 [ACK] Seq=1399 Ack=978 Win=64256 Len=0 TSval=4174423984 TSecr=3117013696"
"281","3.465594","192.168.123.73","192.168.123.48","TCP","66","34638  >  666 [ACK] Seq=978 Ack=2102 Win=64128 Len=0 TSval=2271767204 TSecr=337437383"
"282","3.465736","192.168.123.48","192.168.123.73","TLSv1.3","769","Application Data"
"283","3.465763","192.168.123.73","192.168.123.48","TCP","66","34638  >  666 [ACK] Seq=978 Ack=2805 Win=64128 Len=0 TSval=2271767204 TSecr=337437383"
"284","3.466139","192.168.123.48","192.168.123.22","TLSv1.3","769","Application Data"
"285","3.466175","192.168.123.22","192.168.123.48","TCP","66","49578  >  666 [ACK] Seq=978 Ack=2102 Win=64128 Len=0 TSval=3117013696 TSecr=4174423984"
"286","3.466286","192.168.123.48","192.168.123.22","TLSv1.3","769","Application Data"
"287","3.466311","192.168.123.22","192.168.123.48","TCP","66","49578  >  666 [ACK] Seq=978 Ack=2805 Win=64128 Len=0 TSval=3117013697 TSecr=4174423985"
"292","3.475141","192.168.123.30","192.168.123.48","TCP","74","51544  >  666 [SYN] Seq=0 Win=64240 Len=0 MSS=1460 SACK_PERM=1 TSval=3583332285 TSecr=0 WS=128"
"293","3.475166","192.168.123.46","192.168.123.48","TCP","74","54436  >  666 [SYN] Seq=0 Win=64240 Len=0 MSS=1460 SACK_PERM=1 TSval=2734082758 TSecr=0 WS=128"
"294","3.475180","192.168.123.48","192.168.123.30","TCP","74","666  >  51544 [SYN, ACK] Seq=0 Ack=1 Win=65160 Len=0 MSS=1460 SACK_PERM=1 TSval=3963117375 TSecr=3583332285 WS=128"
"295","3.475218","192.168.123.30","192.168.123.48","TCP","66","51544  >  666 [ACK] Seq=1 Ack=1 Win=64256 Len=0 TSval=3583332286 TSecr=3963117375"
"296","3.475218","192.168.123.48","192.168.123.46","TCP","74","666  >  54436 [SYN, ACK] Seq=0 Ack=1 Win=65160 Len=0 MSS=1460 SACK_PERM=1 TSval=4112918237 TSecr=2734082758 WS=128"
"297","3.475267","192.168.123.46","192.168.123.48","TCP","66","54436  >  666 [ACK] Seq=1 Ack=1 Win=64256 Len=0 TSval=2734082759 TSecr=4112918237"
"298","3.475452","192.168.123.30","192.168.123.48","TLSv1.3","353","Client Hello"
"299","3.475518","192.168.123.48","192.168.123.30","TCP","66","666  >  51544 [ACK] Seq=1 Ack=288 Win=64896 Len=0 TSval=3963117376 TSecr=3583332287"
"300","3.475579","192.168.123.46","192.168.123.48","TLSv1.3","353","Client Hello"
"301","3.475644","192.168.123.48","192.168.123.46","TCP","66","666  >  54436 [ACK] Seq=1 Ack=288 Win=64896 Len=0 TSval=4112918238 TSecr=2734082760"
"302","3.476374","192.168.123.48","192.168.123.30","TLSv1.3","1464","Server Hello, Change Cipher Spec, Application Data, Application Data, Application Data, Application Data, Application Data"
"303","3.476410","192.168.123.30","192.168.123.48","TCP","66","51544  >  666 [ACK] Seq=288 Ack=1399 Win=64128 Len=0 TSval=3583332288 TSecr=3963117377"
"304","3.476414","192.168.123.48","192.168.123.46","TLSv1.3","1464","Server Hello, Change Cipher Spec, Application Data, Application Data, Application Data, Application Data, Application Data"
"305","3.476453","192.168.123.46","192.168.123.48","TCP","66","54436  >  666 [ACK] Seq=288 Ack=1399 Win=64128 Len=0 TSval=2734082761 TSecr=4112918239"
"306","3.477644","192.168.123.30","192.168.123.48","TLSv1.3","756","Change Cipher Spec, Application Data, Application Data, Application Data"
"307","3.477717","192.168.123.48","192.168.123.30","TCP","66","666  >  51544 [ACK] Seq=1399 Ack=978 Win=64256 Len=0 TSval=3963117378 TSecr=3583332289"
"308","3.477865","192.168.123.46","192.168.123.48","TLSv1.3","756","Change Cipher Spec, Application Data, Application Data, Application Data"
"309","3.477900","192.168.123.48","192.168.123.46","TCP","66","666  >  54436 [ACK] Seq=1399 Ack=978 Win=64256 Len=0 TSval=4112918240 TSecr=2734082762"
"310","3.478185","192.168.123.48","192.168.123.30","TLSv1.3","769","Application Data"
"311","3.478219","192.168.123.30","192.168.123.48","TCP","66","51544  >  666 [ACK] Seq=978 Ack=2102 Win=64128 Len=0 TSval=3583332289 TSecr=3963117378"
"312","3.478331","192.168.123.48","192.168.123.30","TLSv1.3","769","Application Data"
"313","3.478344","192.168.123.48","192.168.123.46","TLSv1.3","769","Application Data"
"314","3.478354","192.168.123.30","192.168.123.48","TCP","66","51544  >  666 [ACK] Seq=978 Ack=2805 Win=64128 Len=0 TSval=3583332290 TSecr=3963117379"
"315","3.478399","192.168.123.46","192.168.123.48","TCP","66","54436  >  666 [ACK] Seq=978 Ack=2102 Win=64128 Len=0 TSval=2734082763 TSecr=4112918241"
"316","3.478519","192.168.123.48","192.168.123.46","TLSv1.3","769","Application Data"
"317","3.478543","192.168.123.46","192.168.123.48","TCP","66","54436  >  666 [ACK] Seq=978 Ack=2805 Win=64128 Len=0 TSval=2734082763 TSecr=4112918241"
"321","3.479564","192.168.123.19","192.168.123.48","TCP","74","40130  >  666 [SYN] Seq=0 Win=64240 Len=0 MSS=1460 SACK_PERM=1 TSval=2653603038 TSecr=0 WS=128"
"322","3.479616","192.168.123.48","192.168.123.19","TCP","74","666  >  40130 [SYN, ACK] Seq=0 Ack=1 Win=65160 Len=0 MSS=1460 SACK_PERM=1 TSval=1049847111 TSecr=2653603038 WS=128"
"323","3.479662","192.168.123.19","192.168.123.48","TCP","66","40130  >  666 [ACK] Seq=1 Ack=1 Win=64256 Len=0 TSval=2653603039 TSecr=1049847111"
"325","3.479891","192.168.123.26","192.168.123.48","TCP","74","35320  >  666 [SYN] Seq=0 Win=64240 Len=0 MSS=1460 SACK_PERM=1 TSval=3014150266 TSecr=0 WS=128"
"326","3.479943","192.168.123.48","192.168.123.26","TCP","74","666  >  35320 [SYN, ACK] Seq=0 Ack=1 Win=65160 Len=0 MSS=1460 SACK_PERM=1 TSval=2730683265 TSecr=3014150266 WS=128"
"327","3.479961","192.168.123.19","192.168.123.48","TLSv1.3","353","Client Hello"
"328","3.479988","192.168.123.26","192.168.123.48","TCP","66","35320  >  666 [ACK] Seq=1 Ack=1 Win=64256 Len=0 TSval=3014150267 TSecr=2730683265"
"329","3.480048","192.168.123.48","192.168.123.19","TCP","66","666  >  40130 [ACK] Seq=1 Ack=288 Win=64896 Len=0 TSval=1049847111 TSecr=2653603039"
"330","3.480297","192.168.123.26","192.168.123.48","TLSv1.3","353","Client Hello"
"331","3.480386","192.168.123.48","192.168.123.26","TCP","66","666  >  35320 [ACK] Seq=1 Ack=288 Win=64896 Len=0 TSval=2730683266 TSecr=3014150267"
"332","3.480904","192.168.123.48","192.168.123.19","TLSv1.3","1464","Server Hello, Change Cipher Spec, Application Data, Application Data, Application Data, Application Data, Application Data"
"333","3.480940","192.168.123.19","192.168.123.48","TCP","66","40130  >  666 [ACK] Seq=288 Ack=1399 Win=64128 Len=0 TSval=2653603040 TSecr=1049847112"
