"No.","Time","Source","Destination","Protocol","Length","Info"
"2129","37.141235","10.0.1.200","10.0.1.20","TCP","74","59268  >  830 [SYN] Seq=0 Win=64240 Len=0 MSS=1460 SACK_PERM=1 TSval=4132063647 TSecr=0 WS=128"
"2130","37.141329","10.0.1.20","10.0.1.200","TCP","74","830  >  59268 [SYN, ACK] Seq=0 Ack=1 Win=65160 Len=0 MSS=1460 SACK_PERM=1 TSval=3449638746 TSecr=4132063647 WS=128"
"2131","37.141347","10.0.1.200","10.0.1.20","TCP","66","59268  >  830 [ACK] Seq=1 Ack=1 Win=64256 Len=0 TSval=4132063647 TSecr=3449638746"
"2132","37.142385","10.0.1.20","10.0.1.200","TCP","88","830  >  59268 [PSH, ACK] Seq=1 Ack=1 Win=65280 Len=22 TSval=3449638747 TSecr=4132063647"
"2133","37.142405","10.0.1.200","10.0.1.20","TCP","66","59268  >  830 [ACK] Seq=1 Ack=23 Win=64256 Len=0 TSval=4132063648 TSecr=3449638747"
"2134","37.152667","10.0.1.200","10.0.1.79","TCP","74","38996  >  830 [SYN] Seq=0 Win=64240 Len=0 MSS=1460 SACK_PERM=1 TSval=954349361 TSecr=0 WS=128"
"2135","37.152741","10.0.1.79","10.0.1.200","TCP","74","830  >  38996 [SYN, ACK] Seq=0 Ack=1 Win=65160 Len=0 MSS=1460 SACK_PERM=1 TSval=2327388369 TSecr=954349361 WS=128"
"2136","37.152756","10.0.1.200","10.0.1.79","TCP","66","38996  >  830 [ACK] Seq=1 Ack=1 Win=64256 Len=0 TSval=954349362 TSecr=2327388369"
"2137","37.153603","10.0.1.79","10.0.1.200","TCP","88","830  >  38996 [PSH, ACK] Seq=1 Ack=1 Win=65280 Len=22 TSval=2327388369 TSecr=954349362"
"2138","37.153617","10.0.1.200","10.0.1.79","TCP","66","38996  >  830 [ACK] Seq=1 Ack=23 Win=64256 Len=0 TSval=954349362 TSecr=2327388369"
"2139","37.165527","10.0.1.200","10.0.1.20","TCP","90","59268  >  830 [PSH, ACK] Seq=1 Ack=23 Win=64256 Len=24 TSval=4132063671 TSecr=3449638747"
"2140","37.165595","10.0.1.20","10.0.1.200","TCP","66","830  >  59268 [ACK] Seq=23 Ack=25 Win=65280 Len=0 TSval=3449638770 TSecr=4132063671"
"2141","37.166555","10.0.1.20","10.0.1.200","TCP","578","830  >  59268 [PSH, ACK] Seq=23 Ack=25 Win=65280 Len=512 TSval=3449638771 TSecr=4132063671"
"2142","37.166571","10.0.1.200","10.0.1.20","TCP","66","59268  >  830 [ACK] Seq=25 Ack=535 Win=64128 Len=0 TSval=4132063672 TSecr=3449638771"
"2143","37.166847","10.0.1.200","10.0.1.33","TCP","74","41736  >  830 [SYN] Seq=0 Win=64240 Len=0 MSS=1460 SACK_PERM=1 TSval=4252880909 TSecr=0 WS=128"
"2144","37.166950","10.0.1.33","10.0.1.200","TCP","74","830  >  41736 [SYN, ACK] Seq=0 Ack=1 Win=65160 Len=0 MSS=1460 SACK_PERM=1 TSval=3967324968 TSecr=4252880909 WS=128"
"2145","37.166973","10.0.1.200","10.0.1.33","TCP","66","41736  >  830 [ACK] Seq=1 Ack=1 Win=64256 Len=0 TSval=4252880909 TSecr=3967324968"
"2146","37.167669","10.0.1.33","10.0.1.200","TCP","88","830  >  41736 [PSH, ACK] Seq=1 Ack=1 Win=65280 Len=22 TSval=3967324968 TSecr=4252880909"
"2147","37.167687","10.0.1.200","10.0.1.33","TCP","66","41736  >  830 [ACK] Seq=1 Ack=23 Win=64256 Len=0 TSval=4252880909 TSecr=3967324968"
"2148","37.178146","10.0.1.200","10.0.1.20","TCP","866","59268  >  830 [PSH, ACK] Seq=25 Ack=535 Win=64128 Len=800 TSval=4132063684 TSecr=3449638771"
"2149","37.178254","10.0.1.20","10.0.1.200","TCP","66","830  >  59268 [ACK] Seq=535 Ack=825 Win=64512 Len=0 TSval=3449638783 TSecr=4132063684"
"2150","37.178937","10.0.1.200","10.0.1.79","TCP","90","38996  >  830 [PSH, ACK] Seq=1 Ack=23 Win=64256 Len=24 TSval=954349388 TSecr=2327388369"
"2151","37.179022","10.0.1.79","10.0.1.200","TCP","66","830  >  38996 [ACK] Seq=23 Ack=25 Win=65280 Len=0 TSval=2327388395 TSecr=954349388"
"2152","37.179202","10.0.1.79","10.0.1.200","TCP","578","830  >  38996 [PSH, ACK] Seq=23 Ack=25 Win=65280 Len=512 TSval=2327388395 TSecr=954349388"
"2153","37.179212","10.0.1.200","10.0.1.79","TCP","66","38996  >  830 [ACK] Seq=25 Ack=535 Win=64128 Len=0 TSval=954349388 TSecr=2327388395"
"2154","37.187565","10.0.1.200","10.0.1.79","TCP","866","38996  >  830 [PSH, ACK] Seq=25 Ack=535 Win=64128 Len=800 TSval=954349396 TSecr=2327388395"
"2155","37.187641","10.0.1.79","10.0.1.200","TCP","66","830  >  38996 [ACK] Seq=535 Ack=825 Win=64512 Len=0 TSval=2327388403 TSecr=954349396"
"2156","37.188882","10.0.1.200","10.0.1.33","TCP","90","41736  >  830 [PSH, ACK] Seq=1 Ack=23 Win=64256 Len=24 TSval=4252880931 TSecr=3967324968"
"2157","37.188941","10.0.1.33","10.0.1.200","TCP","66","830  >  41736 [ACK] Seq=23 Ack=25 Win=65280 Len=0 TSval=3967324990 TSecr=4252880931"
"2158","37.189173","10.0.1.33","10.0.1.200","TCP","578","830  >  41736 [PSH, ACK] Seq=23 Ack=25 Win=65280 Len=512 TSval=3967324990 TSecr=4252880931"
"2159","37.189189","10.0.1.200","10.0.1.33","TCP","66","41736  >  830 [ACK] Seq=25 Ack=535 Win=64128 Len=0 TSval=4252880931 TSecr=3967324990"
"2160","37.195016","10.0.1.200","10.0.1.20","TCP","114","59268  >  830 [PSH, ACK] Seq=825 Ack=535 Win=64128 Len=48 TSval=4132063701 TSecr=3449638783"
"2161","37.195088","10.0.1.20","10.0.1.200","TCP","66","830  >  59268 [ACK] Seq=535 Ack=873 Win=64512 Len=0 TSval=3449638800 TSecr=4132063701"
"2162","37.198627","10.0.1.200","10.0.1.21","TCP","74","37572  >  830 [SYN] Seq=0 Win=64240 Len=0 MSS=1460 SACK_PERM=1 TSval=2075093060 TSecr=0 WS=128"
"2163","37.198705","10.0.1.21","10.0.1.200","TCP","74","830  >  37572 [SYN, ACK] Seq=0 Ack=1 Win=65160 Len=0 MSS=1460 SACK_PERM=1 TSval=683643929 TSecr=2075093060 WS=128"
"2164","37.198722","10.0.1.200","10.0.1.21","TCP","66","37572  >  830 [ACK] Seq=1 Ack=1 Win=64256 Len=0 TSval=2075093061 TSecr=683643929"
"2165","37.199283","10.0.1.21","10.0.1.200","TCP","88","830  >  37572 [PSH, ACK] Seq=1 Ack=1 Win=65280 Len=22 TSval=683643930 TSecr=2075093061"
"2166","37.199299","10.0.1.200","10.0.1.21","TCP","66","37572  >  830 [ACK] Seq=1 Ack=23 Win=64256 Len=0 TSval=2075093061 TSecr=683643930"
"2167","37.200207","10.0.1.200","10.0.1.12","TCP","74","34398  >  830 [SYN] Seq=0 Win=64240 Len=0 MSS=1460 SACK_PERM=1 TSval=1696580589 TSecr=0 WS=128"
"2168","37.200299","10.0.1.12","10.0.1.200","TCP","74","830  >  34398 [SYN, ACK] Seq=0 Ack=1 Win=65160 Len=0 MSS=1460 SACK_PERM=1 TSval=2458146492 TSecr=1696580589 WS=128"
"2169","37.200319","10.0.1.200","10.0.1.12","TCP","66","34398  >  830 [ACK] Seq=1 Ack=1 Win=64256 Len=0 TSval=1696580589 TSecr=2458146492"
"2170","37.201132","10.0.1.12","10.0.1.200","TCP","88","830  >  34398 [PSH, ACK] Seq=1 Ack=1 Win=65280 Len=22 TSval=2458146493 TSecr=1696580589"
"2171","37.201145","10.0.1.200","10.0.1.12","TCP","66","34398  >  830 [ACK] Seq=1 Ack=23 Win=64256 Len=0 TSval=1696580590 TSecr=2458146493"
"2172","37.202351","10.0.1.200","10.0.1.79","TCP","114","38996  >  830 [PSH, ACK] Seq=825 Ack=535 Win=64128 Len=48 TSval=954349411 TSecr=2327388403"
"2173","37.202409","10.0.1.79","10.0.1.200","TCP","66","830  >  38996 [ACK] Seq=535 Ack=873 Win=64512 Len=0 TSval=2327388418 TSecr=954349411"
"2174","37.203963","10.0.1.200","10.0.1.33","TCP","866","41736  >  830 [PSH, ACK] Seq=25 Ack=535 Win=64128 Len=800 TSval=4252880946 TSecr=3967324990"
"2175","37.204050","10.0.1.33","10.0.1.200","TCP","66","830  >  41736 [ACK] Seq=535 Ack=825 Win=64512 Len=0 TSval=3967325005 TSecr=4252880946"
"2176","37.213934","10.0.1.200","10.0.1.33","TCP","114","41736  >  830 [PSH, ACK] Seq=825 Ack=535 Win=64128 Len=48 TSval=4252880956 TSecr=3967325005"
"2177","37.214002","10.0.1.33","10.0.1.200","TCP","66","830  >  41736 [ACK] Seq=535 Ack=873 Win=64512 Len=0 TSval=3967325015 TSecr=4252880956"
"2178","37.220694","10.0.1.200","10.0.1.21","TCP","90","37572  >  830 [PSH, ACK] Seq=1 Ack=23 Win=64256 Len=24 TSval=2075093082 TSecr=683643930"
"2179","37.220775","10.0.1.21","10.0.1.200","TCP","66","830  >  37572 [ACK] Seq=23 Ack=25 Win=65280 Len=0 TSval=683643952 TSecr=2075093082"
"2180","37.221009","10.0.1.21","10.0.1.200","TCP","578","830  >  37572 [PSH, ACK] Seq=23 Ack=25 Win=65280 Len=512 TSval=683643952 TSecr=2075093082"
"2181","37.221021","10.0.1.200","10.0.1.21","TCP","66","37572  >  830 [ACK] Seq=25 Ack=535 Win=64128 Len=0 TSval=2075093083 TSecr=683643952"
"2182","37.222441","10.0.1.200","10.0.1.12","TCP","90","34398  >  830 [PSH, ACK] Seq=1 Ack=23 Win=64256 Len=24 TSval=1696580611 TSecr=2458146493"
"2183","37.222507","10.0.1.12","10.0.1.200","TCP","66","830  >  34398 [ACK] Seq=23 Ack=25 Win=65280 Len=0 TSval=2458146514 TSecr=1696580611"
"2184","37.222972","10.0.1.12","10.0.1.200","TCP","578","830  >  34398 [PSH, ACK] Seq=23 Ack=25 Win=65280 Len=512 TSval=2458146515 TSecr=1696580611"
"2185","37.222987","10.0.1.200","10.0.1.12","TCP","66","34398  >  830 [ACK] Seq=25 Ack=535 Win=64128 Len=0 TSval=1696580612 TSecr=2458146515"
"2186","37.224585","10.0.1.20","10.0.1.200","TCP","1186","830  >  59268 [PSH, ACK] Seq=535 Ack=873 Win=64512 Len=1120 TSval=3449638829 TSecr=4132063701"
"2187","37.224598","10.0.1.200","10.0.1.20","TCP","66","59268  >  830 [ACK] Seq=873 Ack=1655 Win=64128 Len=0 TSval=4132063730 TSecr=3449638829"
"2188","37.225206","10.0.1.20","10.0.1.200","TCP","82","830  >  59268 [PSH, ACK] Seq=1655 Ack=873 Win=64512 Len=16 TSval=3449638830 TSecr=4132063730"
"2189","37.225215","10.0.1.200","10.0.1.20","TCP","66","59268  >  830 [ACK] Seq=873 Ack=1671 Win=64128 Len=0 TSval=4132063731 TSecr=3449638830"
"2190","37.226234","10.0.1.200","10.0.1.21","TCP","866","37572  >  830 [PSH, ACK] Seq=25 Ack=535 Win=64128 Len=800 TSval=2075093088 TSecr=683643952"
"2191","37.226282","10.0.1.21","10.0.1.200","TCP","66","830  >  37572 [ACK] Seq=535 Ack=825 Win=64512 Len=0 TSval=683643957 TSecr=2075093088"
"2192","37.227522","10.0.1.200","10.0.1.41","TCP","74","36624  >  830 [SYN] Seq=0 Win=64240 Len=0 MSS=1460 SACK_PERM=1 TSval=2746457000 TSecr=0 WS=128"
"2193","37.227623","10.0.1.41","10.0.1.200","TCP","74","830  >  36624 [SYN, ACK] Seq=0 Ack=1 Win=65160 Len=0 MSS=1460 SACK_PERM=1 TSval=3055514803 TSecr=2746457000 WS=128"
"2194","37.227646","10.0.1.200","10.0.1.41","TCP","66","36624  >  830 [ACK] Seq=1 Ack=1 Win=64256 Len=0 TSval=2746457000 TSecr=3055514803"
"2195","37.228167","10.0.1.41","10.0.1.200","TCP","88","830  >  36624 [PSH, ACK] Seq=1 Ack=1 Win=65280 Len=22 TSval=3055514804 TSecr=2746457000"
"2196","37.228180","10.0.1.200","10.0.1.41","TCP","66","36624  >  830 [ACK] Seq=1 Ack=23 Win=64256 Len=0 TSval=2746457001 TSecr=3055514804"
"2197","37.231058","10.0.1.200","10.0.1.12","TCP","866","34398  >  830 [PSH, ACK] Seq=25 Ack=535 Win=64128 Len=800 TSval=1696580620 TSecr=2458146515"
"2198","37.231120","10.0.1.12","10.0.1.200","TCP","66","830  >  34398 [ACK] Seq=535 Ack=825 Win=64512 Len=0 TSval=2458146523 TSecr=1696580620"
"2199","37.233030","10.0.1.79","10.0.1.200","TCP","1186","830  >  38996 [PSH, ACK] Seq=535 Ack=873 Win=64512 Len=1120 TSval=2327388449 TSecr=954349411"
"2200","37.233042","10.0.1.200","10.0.1.79","TCP","66","38996  >  830 [ACK] Seq=873 Ack=1655 Win=64128 Len=0 TSval=954349442 TSecr=2327388449"
"2201","37.233813","10.0.1.79","10.0.1.200","TCP","82","830  >  38996 [PSH, ACK] Seq=1655 Ack=873 Win=64512 Len=16 TSval=2327388450 TSecr=954349442"
"2202","37.233823","10.0.1.200","10.0.1.79","TCP","66","38996  >  830 [ACK] Seq=873 Ack=1671 Win=64128 Len=0 TSval=954349443 TSecr=2327388450"
"2203","37.239327","02:42:0a:00:01:c8","02:42:0a:00:01:48","ARP","42","Who has 10.0.1.72? Tell 10.0.1.200"
"2204","37.239384","02:42:0a:00:01:48","02:42:0a:00:01:c8","ARP","42","10.0.1.72 is at 02:42:0a:00:01:48"
"2205","37.243311","02:42:0a:00:01:c8","02:42:0a:00:01:41","ARP","42","Who has 10.0.1.65? Tell 10.0.1.200"
"2206","37.243380","02:42:0a:00:01:41","02:42:0a:00:01:c8","ARP","42","10.0.1.65 is at 02:42:0a:00:01:41"
"2207","37.244638","10.0.1.200","10.0.1.21","TCP","114","37572  >  830 [PSH, ACK] Seq=825 Ack=535 Win=64128 Len=48 TSval=2075093106 TSecr=683643957"
"2208","37.244709","10.0.1.21","10.0.1.200","TCP","66","830  >  37572 [ACK] Seq=535 Ack=873 Win=64512 Len=0 TSval=683643975 TSecr=2075093106"
"2209","37.247425","10.0.1.200","10.0.1.12","TCP","114","34398  >  830 [PSH, ACK] Seq=825 Ack=535 Win=64128 Len=48 TSval=1696580636 TSecr=2458146523"
"2210","37.247544","10.0.1.12","10.0.1.200","TCP","66","830  >  34398 [ACK] Seq=535 Ack=873 Win=64512 Len=0 TSval=2458146539 TSecr=1696580636"
"2211","37.250570","10.0.1.200","10.0.1.20","TCP","82","59268  >  830 [PSH, ACK] Seq=873 Ack=1671 Win=64128 Len=16 TSval=4132063756 TSecr=3449638830"
"2212","37.250664","10.0.1.20","10.0.1.200","TCP","66","830  >  59268 [ACK] Seq=1671 Ack=889 Win=64512 Len=0 TSval=3449638855 TSecr=4132063756"
"2213","37.250807","10.0.1.200","10.0.1.22","TCP","74","32980  >  830 [SYN] Seq=0 Win=64240 Len=0 MSS=1460 SACK_PERM=1 TSval=951775282 TSecr=0 WS=128"
"2214","37.250910","10.0.1.22","10.0.1.200","TCP","74","830  >  32980 [SYN, ACK] Seq=0 Ack=1 Win=65160 Len=0 MSS=1460 SACK_PERM=1 TSval=4126624165 TSecr=951775282 WS=128"
"2215","37.250932","10.0.1.200","10.0.1.22","TCP","66","32980  >  830 [ACK] Seq=1 Ack=1 Win=64256 Len=0 TSval=951775282 TSecr=4126624165"
"2216","37.251607","10.0.1.22","10.0.1.200","TCP","88","830  >  32980 [PSH, ACK] Seq=1 Ack=1 Win=65280 Len=22 TSval=4126624165 TSecr=951775282"
"2217","37.251624","10.0.1.200","10.0.1.22","TCP","66","32980  >  830 [ACK] Seq=1 Ack=23 Win=64256 Len=0 TSval=951775282 TSecr=4126624165"
"2218","37.254016","10.0.1.33","10.0.1.200","TCP","1186","830  >  41736 [PSH, ACK] Seq=535 Ack=873 Win=64512 Len=1120 TSval=3967325055 TSecr=4252880956"
"2219","37.254032","10.0.1.200","10.0.1.33","TCP","66","41736  >  830 [ACK] Seq=873 Ack=1655 Win=64128 Len=0 TSval=4252880996 TSecr=3967325055"
"2220","37.254067","10.0.1.200","10.0.1.41","TCP","90","36624  >  830 [PSH, ACK] Seq=1 Ack=23 Win=64256 Len=24 TSval=2746457027 TSecr=3055514804"
"2221","37.254131","10.0.1.41","10.0.1.200","TCP","66","830  >  36624 [ACK] Seq=23 Ack=25 Win=65280 Len=0 TSval=3055514830 TSecr=2746457027"
"2222","37.254225","10.0.1.33","10.0.1.200","TCP","82","830  >  41736 [PSH, ACK] Seq=1655 Ack=873 Win=64512 Len=16 TSval=3967325055 TSecr=4252880996"
"2223","37.254238","10.0.1.200","10.0.1.33","TCP","66","41736  >  830 [ACK] Seq=873 Ack=1671 Win=64128 Len=0 TSval=4252880996 TSecr=3967325055"
"2224","37.254313","10.0.1.41","10.0.1.200","TCP","578","830  >  36624 [PSH, ACK] Seq=23 Ack=25 Win=65280 Len=512 TSval=3055514830 TSecr=2746457027"
"2225","37.254328","10.0.1.200","10.0.1.41","TCP","66","36624  >  830 [ACK] Seq=25 Ack=535 Win=64128 Len=0 TSval=2746457027 TSecr=3055514830"
"2226","37.255088","10.0.1.200","10.0.1.2","TCP","74","44840  >  830 [SYN] Seq=0 Win=64240 Len=0 MSS=1460 SACK_PERM=1 TSval=1131985424 TSecr=0 WS=128"
"2227","37.255202","10.0.1.2","10.0.1.200","TCP","74","830  >  44840 [SYN, ACK] Seq=0 Ack=1 Win=65160 Len=0 MSS=1460 SACK_PERM=1 TSval=597506499 TSecr=1131985424 WS=128"
"2228","37.255214","10.0.1.200","10.0.1.2","TCP","66","44840  >  830 [ACK] Seq=1 Ack=1 Win=64256 Len=0 TSval=1131985424 TSecr=597506499"
"2229","37.256134","10.0.1.2","10.0.1.200","TCP","88","830  >  44840 [PSH, ACK] Seq=1 Ack=1 Win=65280 Len=22 TSval=597506500 TSecr=1131985424"
"2230","37.256152","10.0.1.200","10.0.1.2","TCP","66","44840  >  830 [ACK] Seq=1 Ack=23 Win=64256 Len=0 TSval=1131985425 TSecr=597506500"
"2231","37.258390","10.0.1.200","10.0.1.64","TCP","74","45924  >  830 [SYN] Seq=0 Win=64240 Len=0 MSS=1460 SACK_PERM=1 TSval=2257652713 TSecr=0 WS=128"
"2232","37.258496","10.0.1.64","10.0.1.200","TCP","74","830  >  45924 [SYN, ACK] Seq=0 Ack=1 Win=65160 Len=0 MSS=1460 SACK_PERM=1 TSval=634582189 TSecr=2257652713 WS=128"
"2233","37.258512","10.0.1.200","10.0.1.64","TCP","66","45924  >  830 [ACK] Seq=1 Ack=1 Win=64256 Len=0 TSval=2257652713 TSecr=634582189"
"2234","37.258569","10.0.1.200","10.0.1.42","TCP","74","45182  >  830 [SYN] Seq=0 Win=64240 Len=0 MSS=1460 SACK_PERM=1 TSval=3370746702 TSecr=0 WS=128"
"2235","37.258661","10.0.1.42","10.0.1.200","TCP","74","830  >  45182 [SYN, ACK] Seq=0 Ack=1 Win=65160 Len=0 MSS=1460 SACK_PERM=1 TSval=675333897 TSecr=3370746702 WS=128"
"2236","37.258679","10.0.1.200","10.0.1.42","TCP","66","45182  >  830 [ACK] Seq=1 Ack=1 Win=64256 Len=0 TSval=3370746702 TSecr=675333897"
"2237","37.259115","10.0.1.64","10.0.1.200","TCP","88","830  >  45924 [PSH, ACK] Seq=1 Ack=1 Win=65280 Len=22 TSval=634582190 TSecr=2257652713"
"2238","37.259132","10.0.1.200","10.0.1.64","TCP","66","45924  >  830 [ACK] Seq=1 Ack=23 Win=64256 Len=0 TSval=2257652714 TSecr=634582190"
"2239","37.259229","10.0.1.42","10.0.1.200","TCP","88","830  >  45182 [PSH, ACK] Seq=1 Ack=1 Win=65280 Len=22 TSval=675333898 TSecr=3370746702"
"2240","37.259334","10.0.1.200","10.0.1.42","TCP","66","45182  >  830 [ACK] Seq=1 Ack=23 Win=64256 Len=0 TSval=3370746703 TSecr=675333898"
"2241","37.259730","10.0.1.200","10.0.1.49","TCP","74","40914  >  830 [SYN] Seq=0 Win=64240 Len=0 MSS=1460 SACK_PERM=1 TSval=92548204 TSecr=0 WS=128"
"2242","37.259797","10.0.1.49","10.0.1.200","TCP","74","830  >  40914 [SYN, ACK] Seq=0 Ack=1 Win=65160 Len=0 MSS=1460 SACK_PERM=1 TSval=3346768866 TSecr=92548204 WS=128"
"2243","37.259811","10.0.1.200","10.0.1.49","TCP","66","40914  >  830 [ACK] Seq=1 Ack=1 Win=64256 Len=0 TSval=92548205 TSecr=3346768866"
"2244","37.260281","10.0.1.49","10.0.1.200","TCP","88","830  >  40914 [PSH, ACK] Seq=1 Ack=1 Win=65280 Len=22 TSval=3346768866 TSecr=92548205"
"2245","37.260298","10.0.1.200","10.0.1.49","TCP","66","40914  >  830 [ACK] Seq=1 Ack=23 Win=64256 Len=0 TSval=92548205 TSecr=3346768866"
"2246","37.261429","10.0.1.200","10.0.1.56","TCP","74","60796  >  830 [SYN] Seq=0 Win=64240 Len=0 MSS=1460 SACK_PERM=1 TSval=1346307304 TSecr=0 WS=128"
"2247","37.261515","10.0.1.56","10.0.1.200","TCP","74","830  >  60796 [SYN, ACK] Seq=0 Ack=1 Win=65160 Len=0 MSS=1460 SACK_PERM=1 TSval=1412969881 TSecr=1346307304 WS=128"
"2248","37.261533","10.0.1.200","10.0.1.56","TCP","66","60796  >  830 [ACK] Seq=1 Ack=1 Win=64256 Len=0 TSval=1346307304 TSecr=1412969881"
"2249","37.262027","10.0.1.56","10.0.1.200","TCP","88","830  >  60796 [PSH, ACK] Seq=1 Ack=1 Win=65280 Len=22 TSval=1412969882 TSecr=1346307304"
"2250","37.262040","10.0.1.200","10.0.1.56","TCP","66","60796  >  830 [ACK] Seq=1 Ack=23 Win=64256 Len=0 TSval=1346307305 TSecr=1412969882"
"2251","37.262532","10.0.1.200","10.0.1.47","TCP","74","37882  >  830 [SYN] Seq=0 Win=64240 Len=0 MSS=1460 SACK_PERM=1 TSval=4160178430 TSecr=0 WS=128"
"2252","37.262612","10.0.1.47","10.0.1.200","TCP","74","830  >  37882 [SYN, ACK] Seq=0 Ack=1 Win=65160 Len=0 MSS=1460 SACK_PERM=1 TSval=1465424342 TSecr=4160178430 WS=128"
"2253","37.262629","10.0.1.200","10.0.1.47","TCP","66","37882  >  830 [ACK] Seq=1 Ack=1 Win=64256 Len=0 TSval=4160178430 TSecr=1465424342"
"2254","37.263171","10.0.1.47","10.0.1.200","TCP","88","830  >  37882 [PSH, ACK] Seq=1 Ack=1 Win=65280 Len=22 TSval=1465424343 TSecr=4160178430"
"2255","37.263185","10.0.1.200","10.0.1.47","TCP","66","37882  >  830 [ACK] Seq=1 Ack=23 Win=64256 Len=0 TSval=4160178431 TSecr=1465424343"
"2256","37.263432","10.0.1.200","10.0.1.31","TCP","74","39470  >  830 [SYN] Seq=0 Win=64240 Len=0 MSS=1460 SACK_PERM=1 TSval=2954768409 TSecr=0 WS=128"
"2257","37.263525","10.0.1.31","10.0.1.200","TCP","74","830  >  39470 [SYN, ACK] Seq=0 Ack=1 Win=65160 Len=0 MSS=1460 SACK_PERM=1 TSval=3619158593 TSecr=2954768409 WS=128"
"2258","37.263545","10.0.1.200","10.0.1.31","TCP","66","39470  >  830 [ACK] Seq=1 Ack=1 Win=64256 Len=0 TSval=2954768409 TSecr=3619158593"
"2259","37.263861","10.0.1.200","10.0.1.45","TCP","74","34896  >  830 [SYN] Seq=0 Win=64240 Len=0 MSS=1460 SACK_PERM=1 TSval=2782540686 TSecr=0 WS=128"
"2260","37.263933","10.0.1.45","10.0.1.200","TCP","74","830  >  34896 [SYN, ACK] Seq=0 Ack=1 Win=65160 Len=0 MSS=1460 SACK_PERM=1 TSval=2745544808 TSecr=2782540686 WS=128"
"2261","37.263952","10.0.1.200","10.0.1.45","TCP","66","34896  >  830 [ACK] Seq=1 Ack=1 Win=64256 Len=0 TSval=2782540686 TSecr=2745544808"
"2262","37.264099","10.0.1.31","10.0.1.200","TCP","88","830  >  39470 [PSH, ACK] Seq=1 Ack=1 Win=65280 Len=22 TSval=3619158594 TSecr=2954768409"
"2263","37.264111","10.0.1.200","10.0.1.31","TCP","66","39470  >  830 [ACK] Seq=1 Ack=23 Win=64256 Len=0 TSval=2954768410 TSecr=3619158594"
"2264","37.264512","10.0.1.45","10.0.1.200","TCP","88","830  >  34896 [PSH, ACK] Seq=1 Ack=1 Win=65280 Len=22 TSval=2745544808 TSecr=2782540686"
"2265","37.264528","10.0.1.200","10.0.1.45","TCP","66","34896  >  830 [ACK] Seq=1 Ack=23 Win=64256 Len=0 TSval=2782540686 TSecr=2745544808"
"2266","37.268403","10.0.1.200","10.0.1.41","TCP","866","36624  >  830 [PSH, ACK] Seq=25 Ack=535 Win=64128 Len=800 TSval=2746457041 TSecr=3055514830"
"2267","37.268464","10.0.1.41","10.0.1.200","TCP","66","830  >  36624 [ACK] Seq=535 Ack=825 Win=64512 Len=0 TSval=3055514844 TSecr=2746457041"
"2268","37.269392","10.0.1.200","10.0.1.60","TCP","74","54334  >  830 [SYN] Seq=0 Win=64240 Len=0 MSS=1460 SACK_PERM=1 TSval=1429217618 TSecr=0 WS=128"
"2269","37.269457","10.0.1.60","10.0.1.200","TCP","74","830  >  54334 [SYN, ACK] Seq=0 Ack=1 Win=65160 Len=0 MSS=1460 SACK_PERM=1 TSval=2599692269 TSecr=1429217618 WS=128"
"2270","37.269470","10.0.1.200","10.0.1.60","TCP","66","54334  >  830 [ACK] Seq=1 Ack=1 Win=64256 Len=0 TSval=1429217618 TSecr=2599692269"
"2271","37.269974","10.0.1.60","10.0.1.200","TCP","88","830  >  54334 [PSH, ACK] Seq=1 Ack=1 Win=65280 Len=22 TSval=2599692270 TSecr=1429217618"
"2272","37.270091","10.0.1.200","10.0.1.60","TCP","66","54334  >  830 [ACK] Seq=1 Ack=23 Win=64256 Len=0 TSval=1429217619 TSecr=2599692270"
"2273","37.270319","10.0.1.200","10.0.1.79","TCP","82","38996  >  830 [PSH, ACK] Seq=873 Ack=1671 Win=64128 Len=16 TSval=954349479 TSecr=2327388450"
"2274","37.270401","10.0.1.79","10.0.1.200","TCP","66","830  >  38996 [ACK] Seq=1671 Ack=889 Win=64512 Len=0 TSval=2327388486 TSecr=954349479"
"2275","37.276199","10.0.1.21","10.0.1.200","TCP","1186","830  >  37572 [PSH, ACK] Seq=535 Ack=873 Win=64512 Len=1120 TSval=683644007 TSecr=2075093106"
"2276","37.276210","10.0.1.200","10.0.1.21","TCP","66","37572  >  830 [ACK] Seq=873 Ack=1655 Win=64128 Len=0 TSval=2075093138 TSecr=683644007"
"2277","37.276826","10.0.1.200","10.0.1.2","TCP","90","44840  >  830 [PSH, ACK] Seq=1 Ack=23 Win=64256 Len=24 TSval=1131985446 TSecr=597506500"
"2278","37.276894","10.0.1.2","10.0.1.200","TCP","66","830  >  44840 [ACK] Seq=23 Ack=25 Win=65280 Len=0 TSval=597506521 TSecr=1131985446"
"2279","37.276970","10.0.1.21","10.0.1.200","TCP","82","830  >  37572 [PSH, ACK] Seq=1655 Ack=873 Win=64512 Len=16 TSval=683644008 TSecr=2075093138"
"2280","37.276979","10.0.1.200","10.0.1.21","TCP","66","37572  >  830 [ACK] Seq=873 Ack=1671 Win=64128 Len=0 TSval=2075093139 TSecr=683644008"
"2281","37.277369","10.0.1.2","10.0.1.200","TCP","578","830  >  44840 [PSH, ACK] Seq=23 Ack=25 Win=65280 Len=512 TSval=597506521 TSecr=1131985446"
"2282","37.277383","10.0.1.200","10.0.1.2","TCP","66","44840  >  830 [ACK] Seq=25 Ack=535 Win=64128 Len=0 TSval=1131985446 TSecr=597506521"
"2283","37.278752","10.0.1.12","10.0.1.200","TCP","1186","830  >  34398 [PSH, ACK] Seq=535 Ack=873 Win=64512 Len=1120 TSval=2458146570 TSecr=1696580636"
"2284","37.278763","10.0.1.200","10.0.1.12","TCP","66","34398  >  830 [ACK] Seq=873 Ack=1655 Win=64128 Len=0 TSval=1696580668 TSecr=2458146570"
"2285","37.278898","10.0.1.12","10.0.1.200","TCP","82","830  >  34398 [PSH, ACK] Seq=1655 Ack=873 Win=64512 Len=16 TSval=2458146571 TSecr=1696580668"
"2286","37.278906","10.0.1.200","10.0.1.12","TCP","66","34398  >  830 [ACK] Seq=873 Ack=1671 Win=64128 Len=0 TSval=1696580668 TSecr=2458146571"
"2287","37.280195","10.0.1.200","10.0.1.22","TCP","90","32980  >  830 [PSH, ACK] Seq=1 Ack=23 Win=64256 Len=24 TSval=951775311 TSecr=4126624165"
"2288","37.280262","10.0.1.22","10.0.1.200","TCP","66","830  >  32980 [ACK] Seq=23 Ack=25 Win=65280 Len=0 TSval=4126624194 TSecr=951775311"
"2289","37.280784","10.0.1.200","10.0.1.41","TCP","114","36624  >  830 [PSH, ACK] Seq=825 Ack=535 Win=64128 Len=48 TSval=2746457054 TSecr=3055514844"
"2290","37.280869","10.0.1.41","10.0.1.200","TCP","66","830  >  36624 [ACK] Seq=535 Ack=873 Win=64512 Len=0 TSval=3055514857 TSecr=2746457054"
"2291","37.280993","10.0.1.22","10.0.1.200","TCP","578","830  >  32980 [PSH, ACK] Seq=23 Ack=25 Win=65280 Len=512 TSval=4126624195 TSecr=951775311"
"2292","37.281003","10.0.1.200","10.0.1.22","TCP","66","32980  >  830 [ACK] Seq=25 Ack=535 Win=64128 Len=0 TSval=951775312 TSecr=4126624195"
"2293","37.281719","10.0.1.200","10.0.1.64","TCP","90","45924  >  830 [PSH, ACK] Seq=1 Ack=23 Win=64256 Len=24 TSval=2257652736 TSecr=634582190"
"2294","37.281793","10.0.1.64","10.0.1.200","TCP","66","830  >  45924 [ACK] Seq=23 Ack=25 Win=65280 Len=0 TSval=634582213 TSecr=2257652736"
"2295","37.282762","10.0.1.64","10.0.1.200","TCP","578","830  >  45924 [PSH, ACK] Seq=23 Ack=25 Win=65280 Len=512 TSval=634582213 TSecr=2257652736"
"2296","37.282777","10.0.1.200","10.0.1.64","TCP","66","45924  >  830 [ACK] Seq=25 Ack=535 Win=64128 Len=0 TSval=2257652738 TSecr=634582213"
"2297","37.284601","10.0.1.200","10.0.1.47","TCP","90","37882  >  830 [PSH, ACK] Seq=1 Ack=23 Win=64256 Len=24 TSval=4160178452 TSecr=1465424343"
"2298","37.284669","10.0.1.47","10.0.1.200","TCP","66","830  >  37882 [ACK] Seq=23 Ack=25 Win=65280 Len=0 TSval=1465424364 TSecr=4160178452"
"2299","37.284845","10.0.1.47","10.0.1.200","TCP","578","830  >  37882 [PSH, ACK] Seq=23 Ack=25 Win=65280 Len=512 TSval=1465424365 TSecr=4160178452"
"2300","37.284856","10.0.1.200","10.0.1.47","TCP","66","37882  >  830 [ACK] Seq=25 Ack=535 Win=64128 Len=0 TSval=4160178453 TSecr=1465424365"
"2301","37.285591","10.0.1.200","10.0.1.2","TCP","866","44840  >  830 [PSH, ACK] Seq=25 Ack=535 Win=64128 Len=800 TSval=1131985454 TSecr=597506521"
"2302","37.285645","10.0.1.2","10.0.1.200","TCP","66","830  >  44840 [ACK] Seq=535 Ack=825 Win=64512 Len=0 TSval=597506529 TSecr=1131985454"
"2303","37.292505","10.0.1.200","10.0.1.33","TCP","82","41736  >  830 [PSH, ACK] Seq=873 Ack=1671 Win=64128 Len=16 TSval=4252881034 TSecr=3967325055"
"2304","37.292601","10.0.1.33","10.0.1.200","TCP","66","830  >  41736 [ACK] Seq=1671 Ack=889 Win=64512 Len=0 TSval=3967325093 TSecr=4252881034"
"2305","37.292909","10.0.1.200","10.0.1.22","TCP","866","32980  >  830 [PSH, ACK] Seq=25 Ack=535 Win=64128 Len=800 TSval=951775324 TSecr=4126624195"
"2306","37.292987","10.0.1.22","10.0.1.200","TCP","66","830  >  32980 [ACK] Seq=535 Ack=825 Win=64512 Len=0 TSval=4126624207 TSecr=951775324"
"2307","37.293545","10.0.1.200","10.0.1.42","TCP","90","45182  >  830 [PSH, ACK] Seq=1 Ack=23 Win=64256 Len=24 TSval=3370746737 TSecr=675333898"
"2308","37.293617","10.0.1.42","10.0.1.200","TCP","66","830  >  45182 [ACK] Seq=23 Ack=25 Win=65280 Len=0 TSval=675333932 TSecr=3370746737"
"2309","37.293790","10.0.1.42","10.0.1.200","TCP","578","830  >  45182 [PSH, ACK] Seq=23 Ack=25 Win=65280 Len=512 TSval=675333933 TSecr=3370746737"
"2310","37.293807","10.0.1.200","10.0.1.42","TCP","66","45182  >  830 [ACK] Seq=25 Ack=535 Win=64128 Len=0 TSval=3370746738 TSecr=675333933"
"2311","37.296284","10.0.1.200","10.0.1.56","TCP","90","60796  >  830 [PSH, ACK] Seq=1 Ack=23 Win=64256 Len=24 TSval=1346307339 TSecr=1412969882"
"2312","37.296361","10.0.1.56","10.0.1.200","TCP","66","830  >  60796 [ACK] Seq=23 Ack=25 Win=65280 Len=0 TSval=1412969916 TSecr=1346307339"
"2313","37.296585","10.0.1.56","10.0.1.200","TCP","578","830  >  60796 [PSH, ACK] Seq=23 Ack=25 Win=65280 Len=512 TSval=1412969916 TSecr=1346307339"
"2314","37.296600","10.0.1.200","10.0.1.56","TCP","66","60796  >  830 [ACK] Seq=25 Ack=535 Win=64128 Len=0 TSval=1346307339 TSecr=1412969916"
"2315","37.298875","10.0.1.200","10.0.1.64","TCP","866","45924  >  830 [PSH, ACK] Seq=25 Ack=535 Win=64128 Len=800 TSval=2257652754 TSecr=634582213"
"2316","37.298930","10.0.1.64","10.0.1.200","TCP","66","830  >  45924 [ACK] Seq=535 Ack=825 Win=64512 Len=0 TSval=634582230 TSecr=2257652754"
"2317","37.299506","10.0.1.200","10.0.1.68","TCP","74","48416  >  830 [SYN] Seq=0 Win=64240 Len=0 MSS=1460 SACK_PERM=1 TSval=1807393479 TSecr=0 WS=128"
"2318","37.299588","10.0.1.68","10.0.1.200","TCP","74","830  >  48416 [SYN, ACK] Seq=0 Ack=1 Win=65160 Len=0 MSS=1460 SACK_PERM=1 TSval=928499847 TSecr=1807393479 WS=128"
"2319","37.299603","10.0.1.200","10.0.1.68","TCP","66","48416  >  830 [ACK] Seq=1 Ack=1 Win=64256 Len=0 TSval=1807393479 TSecr=928499847"
"2320","37.300169","10.0.1.68","10.0.1.200","TCP","88","830  >  48416 [PSH, ACK] Seq=1 Ack=1 Win=65280 Len=22 TSval=928499848 TSecr=1807393479"
"2321","37.300180","10.0.1.200","10.0.1.68","TCP","66","48416  >  830 [ACK] Seq=1 Ack=23 Win=64256 Len=0 TSval=1807393480 TSecr=928499848"
"2322","37.302332","10.0.1.200","10.0.1.45","TCP","90","34896  >  830 [PSH, ACK] Seq=1 Ack=23 Win=64256 Len=24 TSval=2782540724 TSecr=2745544808"
"2323","37.302399","10.0.1.45","10.0.1.200","TCP","66","830  >  34896 [ACK] Seq=23 Ack=25 Win=65280 Len=0 TSval=2745544846 TSecr=2782540724"
"2324","37.302786","10.0.1.200","10.0.1.12","TCP","82","34398  >  830 [PSH, ACK] Seq=873 Ack=1671 Win=64128 Len=16 TSval=1696580692 TSecr=2458146571"
"2325","37.302846","10.0.1.200","10.0.1.49","TCP","90","40914  >  830 [PSH, ACK] Seq=1 Ack=23 Win=64256 Len=24 TSval=92548248 TSecr=3346768866"
"2326","37.302852","10.0.1.12","10.0.1.200","TCP","66","830  >  34398 [ACK] Seq=1671 Ack=889 Win=64512 Len=0 TSval=2458146595 TSecr=1696580692"
"2327","37.302909","10.0.1.49","10.0.1.200","TCP","66","830  >  40914 [ACK] Seq=23 Ack=25 Win=65280 Len=0 TSval=3346768909 TSecr=92548248"
"2328","37.303024","10.0.1.45","10.0.1.200","TCP","578","830  >  34896 [PSH, ACK] Seq=23 Ack=25 Win=65280 Len=512 TSval=2745544847 TSecr=2782540724"
"2329","37.303038","10.0.1.200","10.0.1.45","TCP","66","34896  >  830 [ACK] Seq=25 Ack=535 Win=64128 Len=0 TSval=2782540725 TSecr=2745544847"
"2330","37.303089","10.0.1.49","10.0.1.200","TCP","578","830  >  40914 [PSH, ACK] Seq=23 Ack=25 Win=65280 Len=512 TSval=3346768909 TSecr=92548248"
"2331","37.303099","10.0.1.200","10.0.1.49","TCP","66","40914  >  830 [ACK] Seq=25 Ack=535 Win=64128 Len=0 TSval=92548248 TSecr=3346768909"
"2332","37.306506","10.0.1.200","10.0.1.2","TCP","114","44840  >  830 [PSH, ACK] Seq=825 Ack=535 Win=64128 Len=48 TSval=1131985475 TSecr=597506529"
"2333","37.306577","10.0.1.2","10.0.1.200","TCP","66","830  >  44840 [ACK] Seq=535 Ack=873 Win=64512 Len=0 TSval=597506550 TSecr=1131985475"
"2334","37.307114","10.0.1.200","10.0.1.47","TCP","866","37882  >  830 [PSH, ACK] Seq=25 Ack=535 Win=64128 Len=800 TSval=4160178475 TSecr=1465424365"
"2335","37.307187","10.0.1.47","10.0.1.200","TCP","66","830  >  37882 [ACK] Seq=535 Ack=825 Win=64512 Len=0 TSval=1465424387 TSecr=4160178475"
"2336","37.309837","10.0.1.200","10.0.1.31","TCP","90","39470  >  830 [PSH, ACK] Seq=1 Ack=23 Win=64256 Len=24 TSval=2954768456 TSecr=3619158594"
"2337","37.309897","10.0.1.31","10.0.1.200","TCP","66","830  >  39470 [ACK] Seq=23 Ack=25 Win=65280 Len=0 TSval=3619158640 TSecr=2954768456"
"2338","37.310088","10.0.1.31","10.0.1.200","TCP","578","830  >  39470 [PSH, ACK] Seq=23 Ack=25 Win=65280 Len=512 TSval=3619158640 TSecr=2954768456"
"2339","37.310148","10.0.1.200","10.0.1.31","TCP","66","39470  >  830 [ACK] Seq=25 Ack=535 Win=63744 Len=0 TSval=2954768456 TSecr=3619158640"
"2340","37.311306","10.0.1.200","10.0.1.15","TCP","74","45716  >  830 [SYN] Seq=0 Win=64240 Len=0 MSS=1460 SACK_PERM=1 TSval=255260231 TSecr=0 WS=128"
"2341","37.311395","10.0.1.15","10.0.1.200","TCP","74","830  >  45716 [SYN, ACK] Seq=0 Ack=1 Win=65160 Len=0 MSS=1460 SACK_PERM=1 TSval=3802045454 TSecr=255260231 WS=128"
"2342","37.311413","10.0.1.200","10.0.1.15","TCP","66","45716  >  830 [ACK] Seq=1 Ack=1 Win=64256 Len=0 TSval=255260231 TSecr=3802045454"
"2343","37.311891","10.0.1.15","10.0.1.200","TCP","88","830  >  45716 [PSH, ACK] Seq=1 Ack=1 Win=65280 Len=22 TSval=3802045455 TSecr=255260231"
"2344","37.311903","10.0.1.200","10.0.1.15","TCP","66","45716  >  830 [ACK] Seq=1 Ack=23 Win=64256 Len=0 TSval=255260232 TSecr=3802045455"
"2345","37.312610","10.0.1.200","10.0.1.21","TCP","82","37572  >  830 [PSH, ACK] Seq=873 Ack=1671 Win=64128 Len=16 TSval=2075093174 TSecr=683644008"
"2346","37.312667","10.0.1.21","10.0.1.200","TCP","66","830  >  37572 [ACK] Seq=1671 Ack=889 Win=64512 Len=0 TSval=683644043 TSecr=2075093174"
"2347","37.312905","10.0.1.41","10.0.1.200","TCP","1186","830  >  36624 [PSH, ACK] Seq=535 Ack=873 Win=64512 Len=1120 TSval=3055514889 TSecr=2746457054"
"2348","37.312916","10.0.1.200","10.0.1.41","TCP","66","36624  >  830 [ACK] Seq=873 Ack=1655 Win=64128 Len=0 TSval=2746457086 TSecr=3055514889"
"2349","37.313717","10.0.1.41","10.0.1.200","TCP","82","830  >  36624 [PSH, ACK] Seq=1655 Ack=873 Win=64512 Len=16 TSval=3055514889 TSecr=2746457086"
"2350","37.313729","10.0.1.200","10.0.1.41","TCP","66","36624  >  830 [ACK] Seq=873 Ack=1671 Win=64128 Len=0 TSval=2746457087 TSecr=3055514889"
"2351","37.315392","10.0.1.200","10.0.1.56","TCP","866","60796  >  830 [PSH, ACK] Seq=25 Ack=535 Win=64128 Len=800 TSval=1346307358 TSecr=1412969916"
"2352","37.315426","10.0.1.200","10.0.1.59","TCP","74","34600  >  830 [SYN] Seq=0 Win=64240 Len=0 MSS=1460 SACK_PERM=1 TSval=4247706919 TSecr=0 WS=128"
"2353","37.315471","10.0.1.56","10.0.1.200","TCP","66","830  >  60796 [ACK] Seq=535 Ack=825 Win=64512 Len=0 TSval=1412969935 TSecr=1346307358"
"2354","37.315496","10.0.1.59","10.0.1.200","TCP","74","830  >  34600 [SYN, ACK] Seq=0 Ack=1 Win=65160 Len=0 MSS=1460 SACK_PERM=1 TSval=2475833494 TSecr=4247706919 WS=128"
"2355","37.315509","10.0.1.200","10.0.1.59","TCP","66","34600  >  830 [ACK] Seq=1 Ack=1 Win=64256 Len=0 TSval=4247706919 TSecr=2475833494"
"2356","37.315925","10.0.1.200","10.0.1.22","TCP","114","32980  >  830 [PSH, ACK] Seq=825 Ack=535 Win=64128 Len=48 TSval=951775347 TSecr=4126624207"
"2357","37.315993","10.0.1.22","10.0.1.200","TCP","66","830  >  32980 [ACK] Seq=535 Ack=873 Win=64512 Len=0 TSval=4126624230 TSecr=951775347"
"2358","37.316407","10.0.1.59","10.0.1.200","TCP","88","830  >  34600 [PSH, ACK] Seq=1 Ack=1 Win=65280 Len=22 TSval=2475833495 TSecr=4247706919"
"2359","37.316426","10.0.1.200","10.0.1.59","TCP","66","34600  >  830 [ACK] Seq=1 Ack=23 Win=64256 Len=0 TSval=4247706920 TSecr=2475833495"
"2360","37.316725","10.0.1.200","10.0.1.42","TCP","866","45182  >  830 [PSH, ACK] Seq=25 Ack=535 Win=64128 Len=800 TSval=3370746760 TSecr=675333933"
"2361","37.316785","10.0.1.42","10.0.1.200","TCP","66","830  >  45182 [ACK] Seq=535 Ack=825 Win=64512 Len=0 TSval=675333956 TSecr=3370746760"
"2362","37.317256","10.0.1.200","10.0.1.5","TCP","74","40200  >  830 [SYN] Seq=0 Win=64240 Len=0 MSS=1460 SACK_PERM=1 TSval=2872081435 TSecr=0 WS=128"
"2363","37.317346","10.0.1.5","10.0.1.200","TCP","74","830  >  40200 [SYN, ACK] Seq=0 Ack=1 Win=65160 Len=0 MSS=1460 SACK_PERM=1 TSval=2400317079 TSecr=2872081435 WS=128"
"2364","37.317364","10.0.1.200","10.0.1.5","TCP","66","40200  >  830 [ACK] Seq=1 Ack=1 Win=64256 Len=0 TSval=2872081435 TSecr=2400317079"
"2365","37.318279","10.0.1.5","10.0.1.200","TCP","88","830  >  40200 [PSH, ACK] Seq=1 Ack=1 Win=65280 Len=22 TSval=2400317080 TSecr=2872081435"
"2366","37.318294","10.0.1.200","10.0.1.5","TCP","66","40200  >  830 [ACK] Seq=1 Ack=23 Win=64256 Len=0 TSval=2872081436 TSecr=2400317080"
"2367","37.321712","10.0.1.200","10.0.1.60","TCP","90","54334  >  830 [PSH, ACK] Seq=1 Ack=23 Win=64256 Len=24 TSval=1429217670 TSecr=2599692270"
"2368","37.321801","10.0.1.60","10.0.1.200","TCP","66","830  >  54334 [ACK] Seq=23 Ack=25 Win=65280 Len=0 TSval=2599692322 TSecr=1429217670"
"2369","37.322035","10.0.1.60","10.0.1.200","TCP","578","830  >  54334 [PSH, ACK] Seq=23 Ack=25 Win=65280 Len=512 TSval=2599692322 TSecr=1429217670"
"2370","37.322078","10.0.1.200","10.0.1.60","TCP","66","54334  >  830 [ACK] Seq=25 Ack=535 Win=64128 Len=0 TSval=1429217671 TSecr=2599692322"
"2371","37.323715","10.0.1.200","10.0.1.34","TCP","74","51124  >  830 [SYN] Seq=0 Win=64240 Len=0 MSS=1460 SACK_PERM=1 TSval=621453462 TSecr=0 WS=128"
"2372","37.323782","10.0.1.34","10.0.1.200","TCP","74","830  >  51124 [SYN, ACK] Seq=0 Ack=1 Win=65160 Len=0 MSS=1460 SACK_PERM=1 TSval=3828240113 TSecr=621453462 WS=128"
"2373","37.323812","10.0.1.200","10.0.1.34","TCP","66","51124  >  830 [ACK] Seq=1 Ack=1 Win=64256 Len=0 TSval=621453463 TSecr=3828240113"
"2374","37.324338","10.0.1.34","10.0.1.200","TCP","88","830  >  51124 [PSH, ACK] Seq=1 Ack=1 Win=65280 Len=22 TSval=3828240113 TSecr=621453463"
"2375","37.324356","10.0.1.200","10.0.1.34","TCP","66","51124  >  830 [ACK] Seq=1 Ack=23 Win=64256 Len=0 TSval=621453463 TSecr=3828240113"
"2376","37.325220","10.0.1.200","10.0.1.31","TCP","866","39470  >  830 [PSH, ACK] Seq=25 Ack=535 Win=64128 Len=800 TSval=2954768471 TSecr=3619158640"
"2377","37.325275","10.0.1.31","10.0.1.200","TCP","66","830  >  39470 [ACK] Seq=535 Ack=825 Win=64512 Len=0 TSval=3619158655 TSecr=2954768471"
"2378","37.326081","10.0.1.200","10.0.1.68","TCP","90","48416  >  830 [PSH, ACK] Seq=1 Ack=23 Win=64256 Len=24 TSval=1807393506 TSecr=928499848"
"2379","37.326148","10.0.1.68","10.0.1.200","TCP","66","830  >  48416 [ACK] Seq=23 Ack=25 Win=65280 Len=0 TSval=928499874 TSecr=1807393506"
"2380","37.326340","10.0.1.68","10.0.1.200","TCP","578","830  >  48416 [PSH, ACK] Seq=23 Ack=25 Win=65280 Len=512 TSval=928499874 TSecr=1807393506"
"2381","37.326356","10.0.1.200","10.0.1.68","TCP","66","48416  >  830 [ACK] Seq=25 Ack=535 Win=64128 Len=0 TSval=1807393506 TSecr=928499874"
"2382","37.326820","10.0.1.200","10.0.1.45","TCP","866","34896  >  830 [PSH, ACK] Seq=25 Ack=535 Win=64128 Len=800 TSval=2782540749 TSecr=2745544847"
"2383","37.326880","10.0.1.45","10.0.1.200","TCP","66","830  >  34896 [ACK] Seq=535 Ack=825 Win=64512 Len=0 TSval=2745544871 TSecr=2782540749"
"2384","37.328078","10.0.1.200","10.0.1.46","TCP","74","51874  >  830 [SYN] Seq=0 Win=64240 Len=0 MSS=1460 SACK_PERM=1 TSval=1756596557 TSecr=0 WS=128"
"2385","37.328155","10.0.1.46","10.0.1.200","TCP","74","830  >  51874 [SYN, ACK] Seq=0 Ack=1 Win=65160 Len=0 MSS=1460 SACK_PERM=1 TSval=4106199404 TSecr=1756596557 WS=128"
"2386","37.328169","10.0.1.200","10.0.1.46","TCP","66","51874  >  830 [ACK] Seq=1 Ack=1 Win=64256 Len=0 TSval=1756596557 TSecr=4106199404"
"2387","37.328617","10.0.1.46","10.0.1.200","TCP","88","830  >  51874 [PSH, ACK] Seq=1 Ack=1 Win=65280 Len=22 TSval=4106199404 TSecr=1756596557"
"2388","37.328645","10.0.1.200","10.0.1.46","TCP","66","51874  >  830 [ACK] Seq=1 Ack=23 Win=64256 Len=0 TSval=1756596557 TSecr=4106199404"
"2389","37.329860","10.0.1.200","10.0.1.49","TCP","866","40914  >  830 [PSH, ACK] Seq=25 Ack=535 Win=64128 Len=800 TSval=92548275 TSecr=3346768909"
"2390","37.329925","10.0.1.49","10.0.1.200","TCP","66","830  >  40914 [ACK] Seq=535 Ack=825 Win=64512 Len=0 TSval=3346768936 TSecr=92548275"
"2391","37.329975","10.0.1.200","10.0.1.42","TCP","114","45182  >  830 [PSH, ACK] Seq=825 Ack=535 Win=64128 Len=48 TSval=3370746774 TSecr=675333956"
"2392","37.330035","10.0.1.42","10.0.1.200","TCP","66","830  >  45182 [ACK] Seq=535 Ack=873 Win=64512 Len=0 TSval=675333969 TSecr=3370746774"
"2393","37.334179","10.0.1.200","10.0.1.47","TCP","114","37882  >  830 [PSH, ACK] Seq=825 Ack=535 Win=64128 Len=48 TSval=4160178502 TSecr=1465424387"
"2394","37.334251","10.0.1.47","10.0.1.200","TCP","66","830  >  37882 [ACK] Seq=535 Ack=873 Win=64512 Len=0 TSval=1465424414 TSecr=4160178502"
"2395","37.335045","10.0.1.200","10.0.1.64","TCP","114","45924  >  830 [PSH, ACK] Seq=825 Ack=535 Win=64128 Len=48 TSval=2257652790 TSecr=634582230"
"2396","37.335110","10.0.1.64","10.0.1.200","TCP","66","830  >  45924 [ACK] Seq=535 Ack=873 Win=64512 Len=0 TSval=634582266 TSecr=2257652790"
"2397","37.336579","10.0.1.200","10.0.1.68","TCP","866","48416  >  830 [PSH, ACK] Seq=25 Ack=535 Win=64128 Len=800 TSval=1807393516 TSecr=928499874"
"2398","37.336588","10.0.1.2","10.0.1.200","TCP","1186","830  >  44840 [PSH, ACK] Seq=535 Ack=873 Win=64512 Len=1120 TSval=597506580 TSecr=1131985475"
"2399","37.336599","10.0.1.200","10.0.1.2","TCP","66","44840  >  830 [ACK] Seq=873 Ack=1655 Win=64128 Len=0 TSval=1131985505 TSecr=597506580"
"2400","37.336632","10.0.1.68","10.0.1.200","TCP","66","830  >  48416 [ACK] Seq=535 Ack=825 Win=64512 Len=0 TSval=928499884 TSecr=1807393516"
"2401","37.336711","10.0.1.2","10.0.1.200","TCP","82","830  >  44840 [PSH, ACK] Seq=1655 Ack=873 Win=64512 Len=16 TSval=597506580 TSecr=1131985505"
